1;fr;Qui incarne sans conteste la figure emblématique du groupe The Cure ?;Robert Smith;Roger O'Donnell;Simon Gallup;Reeves Gabrels;Débutant;À l'âge de cinq ans, Lol Tolhurst deviendra l'ami de Robert Smith et c'est avec lui qu'il créera plus tard la première mouture de The Cure.;https://fr.wikipedia.org/wiki/Robert_Smith_(musicien)
2;fr;À quel mouvement musical le groupe The Cure est-il encore associé aujourd'hui ?;New wave;Rock;Pop;Dance;Débutant;Au début des années 1980, de nombreux groupes new wave importants ont émergé des villes provinciales du sud de l'Angleterre.;https://fr.wikipedia.org/wiki/New_wave
3;fr;Comment peut-on qualifier la coiffure du chanteur Robert Smith ?;Arachnéenne;Lisse;Au carré;Brushingée;Débutant;De nombreux fans copient alors les tenues vestimentaires amples et sombres des musiciens du groupe.;https://fr.wikipedia.org/wiki/Robert_Smith_(musicien)
4;fr;Quel titre de The Cure sera détourné à l'époque de la guerre du Golfe ?;Killing an Arab;It's Not You;Grinding Halt;Accuracy;Débutant;Ceci se fera au grand dam de Robert Smith qui devra rappeler dans des conférences de presse le texte qui l'a inspiré.;https://fr.wikipedia.org/wiki/Killing_an_Arab
5;fr;Qui est le seul membre présent depuis l'origine du groupe The Cure ?;Robert Smith;Roger O'Donnell;Simon Gallup;Reeves Gabrels;Débutant;Robert Smith a également été à plusieurs reprises membre du jury de l'International Songwriting Competition (ISC).;https://fr.wikipedia.org/wiki/Robert_Smith_(musicien)
6;fr;Quel album est considéré comme le plus noir du groupe The Cure ?;Pornography;Bloodflowers;Wish;Disintegration;Débutant;Malgré son atmosphère oppressante et gothique, cet album atteindra le Top 10 en Angleterre ainsi qu'en Nouvelle-Zélande.;https://fr.wikipedia.org/wiki/Pornography
7;fr;De quelle ville du comté du Sussex est originaire le groupe The Cure ?;Crawley;Basildon;Chichester;Littlehampton;Débutant;Crawley est fortement tirée par l'influence de l'aéroport de London Gatwick qui occupe toute la partie Nord de la ville.;https://fr.wikipedia.org/wiki/The_Cure
8;fr;Quel instrument d'accompagnement est mis en avant chez The Cure ?;Basse;Saxophone;Piano;Trompette;Débutant;La basse est, notamment en raison du jeu particulier de Simon Gallup, une composante essentielle de la musique de The Cure.;https://fr.wikipedia.org/wiki/The_Cure
9;fr;À quel label musical The Cure restera-t-il fidèle jusqu'en 2001 ?;Fiction Records;Geffen Records;City Slang;Too Pure;Débutant;Chris Parry, ex-manager des Jam et directeur artistique chez Polydor, désirait fonder son propre label indépendant.;https://fr.wikipedia.org/wiki/Fiction_Records
10;fr;Qui a pour ainsi dire écrit les textes de toutes les chansons de The Cure ?;Robert Smith;Simon Gallup;Reeves Gabrels;Jason Cooper;Débutant;Selon Thierry Desaules, les paroles de l'album Pornography sont tout bonnement sublimes et d'une grande poésie.;https://fr.wikipedia.org/wiki/The_Cure
11;fr;Quel est le titre du premier 45 tours de The Cure sorti en décembre 1978 ?;Killing an Arab;Another Day;So What;Fire in Cairo;Confirmé;Cette chanson, inspirée du roman L'Étranger de Camus, assure un début de notoriété grâce aux fanzines alternatifs.;https://fr.wikipedia.org/wiki/Killing_an_Arab
12;fr;En quelle année est sorti Three Imaginary Boys de The Cure ?;1979;1981;1983;1985;Confirmé;Le Melody Maker titrera à propos de cet album: The Eighties Start Here (Les années 80 commencent ici).;https://fr.wikipedia.org/wiki/Three_Imaginary_Boys
13;fr;Quel deuxième album de The Cure est plus sombre et glacial que le premier ?;Seventeen Seconds;Pornography;Faith;The Top;Confirmé;En 2000, le magazine Q a placé Seventeen Seconds au n° 65 dans sa liste des 100 meilleurs albums britanniques.;https://fr.wikipedia.org/wiki/Seventeen_Seconds
14;fr;Qui deviendra le réalisateur de clips attitré du groupe The Cure ?;Tim Pope;Vincent Moon;Jonathan Glazer;Spike Jonze;Confirmé;Tim Pope a également réalisé des spots publicitaires, des épisodes de série télévisée, des documentaires ainsi qu'un court métrage.;https://fr.wikipedia.org/wiki/Tim_Pope
15;fr;Quel morceau fut composé en 1986 pour l'émission télévisée Les Enfants du rock ?;Just Like Heaven;Lullaby;Pictures of You;Never Enough;Confirmé;Le morceau a été introduit dans le double album Kiss Me, Kiss Me, Kiss Me, certifié disque de platine.;https://fr.wikipedia.org/wiki/Just_Like_Heaven_(chanson)
16;fr;Quel membre du groupe The Cure a dû être hospitalisé suite à une pleurésie ?;Simon Gallup;Reeves Gabrels;Jason Cooper;Roger O'Donnell;Confirmé;C'est Roberto Soave, bassiste de Shelley-an Orphan, qui assurera l'intérim pour le Wish Tour lors de concerts en novembre 1992.;https://fr.wikipedia.org/wiki/Simon_Gallup
17;fr;À quelle bande originale de film The Cure a-t-il participé avec le titre inédit Burn ?;The Crow;Steel;Spawn;Hellboy;Confirmé;Il s'agit du dernier film dans lequel joue l'acteur Brandon Lee, mort pendant le tournage lors d'une scène de tir.;https://fr.wikipedia.org/wiki/The_Crow_(film)
18;fr;Après Fiction Records, avec quel label The Cure a-t-il signé en 2003 ?;Geffen Records;Epic Records;Lava Records;Pablo Records;Confirmé;À l'occasion de la fin du contrat avec Fiction Records paraît la compilation Greatest Hits incluant deux titres inédits.;https://fr.wikipedia.org/wiki/Geffen_Records
19;fr;De quel autre groupe Robert Smith est-il une idole pour son chanteur ?;Placebo;The Libertines;Captain Phoenix;Lush;Confirmé;Les membres de cette formation ont collaboré avec Robert Smith, le leader de Placebo ayant même l'occasion d'interviewer son idole.;https://fr.wikipedia.org/wiki/The_Cure
20;fr;Combien d'albums le groupe The Cure avait-il vendu dans le monde fin 2018 ?;30 millions;40 millions;20 millions;10 millions;Confirmé;Outre les enregistrements officiels, sur disque ou en vidéo, il existe un nombre important de bootlegs recherchés par les fans.;https://fr.wikipedia.org/wiki/The_Cure
21;fr;Laquelle de ces propositions ne désigne pas un album live de The Cure ?;Dublin;Paris;Entreat;Concert;Expert;En 2018, The Cure a officiellement sorti 5 albums live, 12 albums studios et 11 VHS/DVD, sans compter de nombreuses compilations.;https://fr.wikipedia.org/wiki/Discographie_de_The_Cure
22;fr;Dans quel pays The Cure a-t-il très vite remporté un succès important en 1980-81 ?;Nouvelle-zélande;Brésil;Russie;Allemagne;Expert;Ce phénomène devança de plusieurs années la Curemania qui touchera le continent européen, et notamment la France.;https://fr.wikipedia.org/wiki/The_Cure
23;fr;Quel était le précédent nom du groupe Easy Cure formé en 1976 ?;Malice;The Libertines;Spunge;The Membranes;Expert;Les membres changeront le nom du groupe (Easy Cure) en janvier 1977, pour finalement opter pour The Cure en avril 1978.;https://fr.wikipedia.org/wiki/Malice_(groupe)
24;fr;En quelle année The Cure s'est-il produit pour la première fois en Amérique du Sud ?;1987;1989;1985;1983;Expert;À cette époque, The Cure se voit décerné le titre de meilleur groupe étranger de l'année au Brésil après huit concerts.;https://fr.wikipedia.org/wiki/The_Cure
25;fr;Qui a rejoint The Cure juste avant la tournée mondiale Kissing Tour ?;Roger O'Donnell;Tim Kingsbury;Chris Pitman;Andy Bown;Expert;En introduction, un court métrage de cinq minutes montre des gros plans de la bouche et des yeux de Robert Smith.;https://fr.wikipedia.org/wiki/Roger_O'Donnell
26;fr;Quel groupe a assuré la première partie du Prayer Tour de The Cure ?;Shelleyan Orphan;Cult Hero;Prefab Sprout;Fiction Plane;Expert;Comme témoignage de cette tournée, l'album live Entreat enregistré en juillet à la Wembley Arena sortira l'année suivante.;https://fr.wikipedia.org/wiki/Shelleyan_Orphan
27;fr;Quelle radio éphémère est apparue sur la bande FM anglaise en 1990 ?;Cure FM;Smith FM;Wish FM;Day FM;Expert;Cette station, animée par les membres de Cure eux-mêmes, était destinée à promouvoir Mixed Up, un disque de remixes.;https://fr.wikipedia.org/wiki/The_Cure
28;fr;Qui a remis au groupe The Cure le prix de Godlike Genius en 2009 ?;Tim Burton;Robert De Niro;Sean Penn;Stephen Frears;Expert;The Cure a reçu pour l'ensemble de sa carrière ce prix aux NME Awards des mains de Tim Burton qui s'est dit inspiré par le groupe.;https://fr.wikipedia.org/wiki/The_Cure
29;fr;Quel groupe néerlandais est un véritable groupe-clone de The Cure ?;The Essence;The Diesel;The Butane;The Propane;Expert;Le groupe des années 1980 reproduit les arrangements des britanniques et copiant la voix et le phrasé de Robert Smith.;https://fr.wikipedia.org/wiki/The_Cure
30;fr;En quelle année The Cure a-t-il reçu le Brit Awards du meilleur groupe britannique ?;1991;1993;1995;1997;Expert;The Cure a également reçu un MTV Video Music Award, un Juno Award, un NME Award ainsi que plusieurs Grammy Awards.;https://fr.wikipedia.org/wiki/The_Cure
31;en;Who embodies without question the emblematic figure of the group The Cure ?;Robert Smith;Roger O Donnell;Simon Gallup;Reeves Gabrels;Beginner;At the age of five, Lol Tolhurst will become Robert Smith's friend and he will later create the first version of The Cure.;https://en.wikipedia.org/wiki/Robert_Smith_(singer)
32;en;What musical movement is The Cure still associated with today ?;New wave;Rock;Pop;Dance;Beginner;In the early 1980s, many important new wave bands sprang up from provincial towns in southern England.;https://en.wikipedia.org/wiki/New_wave_music
33;en;How can we describe the hairstyle of singer Robert Smith ?;Arachne;Smooth;In the square;Brushede;Beginner;Many fans then copy the loose and dark clothing of the band's musicians.;https://en.wikipedia.org/wiki/Robert_Smith_(singer)
34;en;What title of The Cure will be removed at the time of the Gulf War ?;Killing an Arab;It's Not You;Grinding Halt;Accuracy;Beginner;This will be to the chagrin of Robert Smith who will recall in press conferences the text that inspired him.;https://en.wikipedia.org/wiki/Killing_an_Arab
35;en;Who is the only member present since the origin of The Cure group ?;Robert Smith;Roger O Donnell;Simon Gallup;Reeves Gabrels;Beginner;Robert Smith has also been a jury member of the International Songwriting Competition (ISC).;https://en.wikipedia.org/wiki/Robert_Smith_(singer)
36;en;Which album is considered the blackest band in The Cure ?;Pornography;Bloodflowers;Wish;Disintegration;Beginner;Despite its oppressive and gothic atmosphere, this album will reach the Top 10 in England as well as in New Zealand.;https://en.wikipedia.org/wiki/Pornography (album)
37;en;Which city in Sussex County is home to The Cure ?;Crawley;Basildon;Chichester;Littlehampton;Beginner;Crawley is strongly influenced by the influence of London Gatwick Airport which occupies the entire northern part of the city.;https://en.wikipedia.org/wiki/The_Cure
38;en;What accompaniment instrument is featured at The Cure ?;Low;Saxophone;Piano;Trumpet;Beginner;The bass is, especially because of Simon Gallup's particular play, an essential component of The Cure's music.;https://en.wikipedia.org/wiki/The_Cure
39;en;To which musical label will The Cure remain faithful until 2001 ?;Fiction Records;Geffen Records;City Slang;Too Pure;Beginner;Chris Parry, former Jam manager and Artistic Director at Polydor, wanted to establish his own independent label.;https://en.wikipedia.org/wiki/Fiction_Records
40;en;Who, so to speak, writes the lyrics of all The Cure songs ?;Robert Smith;Simon Gallup;Reeves Gabrels;Jason Cooper;Beginner;According to Thierry Desaules, the lyrics of the album Pornography are simply sublime and of great poetry.;
41;en;What is the title of the first single of The Cure released in December 1978 ?;Killing an Arab;Another Day;So What;Fire in Cairo;Confirmed;This song, inspired by Camus's novel The Foreign, ensures a start of notoriety thanks to alternative fanzines.;https://en.wikipedia.org/wiki/Killing_an_Arab
42;en;What year did the Cure release Three Imaginary Boys ?;1979;1981;1983;1985;Confirmed;The Melody Maker will titrera about this album: The Eighties Start Here (The 80's start here).;https://en.wikipedia.org/wiki/Three_Imaginary_Boys
43;en;Which second album of The Cure is darker and icy than the first ?;Seventeen Seconds;Pornography;Faith;The Top;Confirmed;In 2000, Q magazine placed Seventeen Seconds at No. 65 in its list of the 100 best British albums.;https://en.wikipedia.org/wiki/Seventeen_Seconds
44;en;Who will become the director of clips of The Cure ?;Tim Pope;Vincent Moon;Jonathan Glazer;Spike Jonze;Confirmed;Tim Pope has also produced commercials, episodes of television series, documentaries and a short film.;https://en.wikipedia.org/wiki/Tim_Pope
45;en;What song was composed in 1986 for the TV show The Children of Rock ?;Just Like Heaven;Lullaby;Pictures of You;Never Enough;Confirmed;The song was introduced in the double album Kiss Me, Kiss Me, Kiss Me, certified platinum disc.;https://en.wikipedia.org/wiki/Just_Like_Heaven_(song)
46;en;Which member of The Cure group had to be hospitalized following a mourning ?;Simon Gallup;Reeves Gabrels;Jason Cooper;Roger O'Donnell;Confirmed;Roberto Soave, Shelley-an Orphan's bassist, will be in charge of the Wish Tour during concerts in November 1992.;https://en.wikipedia.org/wiki/Simon_Gallup
47;en;What movie soundtrack did The Cure take part in with the untitled Burn ?;The Crow;Steel;Spawn;Hellboy;Confirmed;This is the latest film in which actor Brandon Lee, who died during the shooting at a shooting scene, plays.;https://en.wikipedia.org/wiki/The_Crow_(1994_film)
48;en;After Fiction Records, with which label did The Cure sign in 2003 ?;Geffen Records;Epic Records;Lava Records;Pablo Records;Confirmed;On the occasion of the end of the contract with Fiction Records comes the compilation Greatest Hits including two new titles.;https://en.wikipedia.org/wiki/Geffen_Records
49;en;What other group is Robert Smith an idol for his singer ?;Placebo;The Libertines;Captain Phoenix;Lush;Confirmed;The members of this formation collaborated with Robert Smith, the leader of Placebo even having the opportunity to interview his idol.;https://en.wikipedia.org/wiki/The_Cure
50;en;How many albums did The Cure have sold around the world at the end of 2018 ?;30 million;40 million;20 million;10 million;Confirmed;In addition to official recordings, on record or in video, there are a large number of bootlegs sought by fans.;https://en.wikipedia.org/wiki/The_Cure
51;en;Which of these proposals does not mean a live album from The Cure ?;Dublin;Paris;Entreat;Concert;Expert;In 2018, The Cure officially released 5 live albums, 12 studio albums and 11 VHS / DVDs, not counting numerous compilations.;https://en.wikipedia.org/wiki/The_Cure_discography
52;en;In which country did The Cure very quickly win a major success in 1980-81 ?;New Zealand;Brazil;Russia;Germany;Expert;This phenomenon devolved from several years to Curemania, which will affect the European continent, and in particular France.;https://en.wikipedia.org/wiki/The_Cure
53;en;What was the previous name of the Easy Cure group formed in 1976 ?;Malice;The Libertines;Spunge;The Membranes;Expert;Members will change the name of the group (Easy Cure) in January 1977, and finally opt for The Cure in April 1978.;https://en.wikipedia.org/wiki/Malice_(British_band)
54;en;In which year did The Cure first appear in South America ?;1987;1989;1985;1983;Expert;At this time, The Cure was awarded the title of best foreign group of the year in Brazil after eight concerts.;https://en.wikipedia.org/wiki/The_Cure
55;en;Who joined The Cure just before the world tour Kissing Tour ?;Roger O'Donnell;Tim Kingsbury;Chris Pitman;Andy Bown;Expert;In the introduction, a short film of five minutes shows close-ups of Robert Smith's mouth and eyes.;https://en.wikipedia.org/wiki/Roger_O'Donnell
56;en;Which group did the first part of The Cure's Prayer Tour ?;Shelleyan Orphan;Cult Hero;Prefab Sprout;Plane Fiction;Expert;As a testimony to this tour, the live album Entreat recorded in July at the Wembley Arena will be released the following year.;https://en.wikipedia.org/wiki/Shelleyan_Orphan
57;en;Which radio emitter appeared on the English FM band in 1990 ?;Cure FM;Smith FM;Wish FM;Day FM;Expert;This station, hosted by members of Cure themselves, was intended to promote Mixed Up, a remixes disc.;https://en.wikipedia.org/wiki/The_Cure
58;en;Who gave The Cure the Godlike Genius Award in 2009 ?;Tim Burton;Robert De Niro;Sean Penn;Stephen Frears;Expert;The Cure has received this award for the entire NME Awards at the hands of Tim Burton, who was inspired by the group.;https://en.wikipedia.org/wiki/The_Cure
59;en;Which Dutch group is a true clone group of The Cure ?;The Essence;The Diesel;The Butane;The Propane;Expert;The group of the 1980s reproduces the arrangements of the British and copying the voice and phrasing of Robert Smith.;https://en.wikipedia.org/wiki/The_Cure
60;en;In which year did The Cure receive the Brit Award for Best British Band ?;1991;1993;1995;1997;Expert;The Cure has also received an MTV Video Music Award, a Juno Award, a NME Award and several Grammy Awards.;https://en.wikipedia.org/wiki/The_Cure
61;de;Wer verkörpert ohne Frage die emblematische Figur der Gruppe The Cure ?;Robert Smith;Roger O Donnell;Simon Gallup;Reeves Gabrels;Newbie;Im Alter von fünf Jahren wird Lol Tolhurst Robert Smiths Freund und er wird später die erste Version von The Cure kreieren.;https://de.wikipedia.org/wiki/Robert_Smith_(Musiker)
62;de;Mit welcher musikalischen Bewegung verbindet sich The Cure heute noch ?;Neue Welle;Rock;Pop;Tanz;Newbie;In den frühen 1980er Jahren entstanden viele wichtige New-Wave-Bands aus Provinzstädten in Südengland.;https://de.wikipedia.org/wiki/New_Wave
63;de;Wie können wir die Frisur von Sänger Robert Smith beschreiben ?;Arachne;Glatt;Auf dem Platz;Brushede;Newbie;Viele Fans kopieren dann die lockere und dunkle Kleidung der Musiker der Band.;https://de.wikipedia.org/wiki/Robert_Smith_(Musiker)
64;de;Welcher Titel von The Cure wird zum Zeitpunkt des Golfkriegs gestrichen ?;Töte einen Araber;Du bist es nicht;Halt schleifen;Genauigkeit;Newbie;Dies wird zum Leidwesen von Robert Smith geschehen, der sich in Pressekonferenzen an den Text erinnern wird, der ihn inspiriert hat.;
65;de;Wer ist das einzige Mitglied, das seit der Gründung von The Cure anwesend ist ?;Robert Smith;Roger O Donnell;Simon Gallup;Reeves Gabrels;Newbie;Robert Smith war außerdem Jurymitglied des International Songwriting Competition (ISC).;https://de.wikipedia.org/wiki/Robert_Smith_(Musiker)
66;de;Welches Album gilt als die schwärzeste Band in The Cure ?;Pornografie;Blutblumen;Wish;Desintegration;Newbie;Trotz seiner bedrückenden und gotischen Atmosphäre wird dieses Album sowohl in England als auch in Neuseeland die Top 10 erreichen.;
67;de;In welcher Stadt in Sussex County befindet sich The Cure ?;Crawley;Basildon;Chichester;Littlehampton;Newbie;Crawley ist stark vom Einfluss des Flughafens London Gatwick beeinflusst, der den gesamten nördlichen Teil der Stadt einnimmt.;https://de.wikipedia.org/wiki/The_Cure
68;de;Welches Begleitinstrument gibt es bei The Cure ?;Niedrig;Saxophon;Klavier;Trompete;Newbie;Der Bass ist, besonders wegen Simon Gallups besonderem Spiel, ein wesentlicher Bestandteil von The Cures Musik.;https://de.wikipedia.org/wiki/The_Cure
69;de;Welchem Musiklabel wird The Cure bis 2001 treu bleiben ?;Fiction Records;Geffen Records;City Slang;Too Pure;Newbie;Chris Parry, ehemaliger Jam Manager und Artistic Director bei Polydor, wollte sein eigenes unabhängiges Label gründen.;
70;de;Wer schreibt sozusagen die Texte aller The Cure-Songs ?;Robert Smith;Simon Gallup;Reeves Gabrels;Jason Cooper;Newbie;Laut Thierry Desaules sind die Texte des Albums Pornography einfach erhaben und von großartiger Poesie.;
71;de;Was ist der Titel der ersten Single von The Cure, die im Dezember 1978 veröffentlicht wurde ?;Töte einen Araber;Noch ein Tag;Also was;Feuer in Kairo;Bestätigt;Dieser Song, der von Camus 'Roman The Foreign inspiriert wurde, sorgt dank alternativer Fanzines für einen gewissen Bekanntheitsgrad.;
72;de;In welchem Jahr veröffentlichte Cure Three Imaginary Boys ?;1979;1981;1983;1985;Bestätigt;The Melody Maker wird über dieses Album titrieren: Die Achtziger beginnen hier (Die Achtziger beginnen hier).;https://de.wikipedia.org/wiki/Three_Imaginary_Boys
73;de;Welches zweite Album von The Cure ist dunkler und eisiger als das erste ?;Siebzehn Sekunden;Pornografie;Glaube;Die Besten;Bestätigt;Im Jahr 2000 platzierte das Q-Magazin Seventeen Seconds auf Platz 65 seiner Liste der 100 besten britischen Alben.;https://de.wikipedia.org/wiki/Seventeen_Seconds
74;de;Wer wird der Regisseur von Clips von The Cure ?;Tim Pope;Vincent Moon;Jonathan Glazer;Spike Jonze;Bestätigt;Tim Pope hat auch Werbespots, Folgen von Fernsehserien, Dokumentationen und einen Kurzfilm produziert.;
75;de;Welcher Song wurde 1986 für die TV-Show The Children of Rock komponiert ?;Genau wie der Himmel;Wiegenlied;Bilder von dir;Nie genug;Bestätigt;Das Lied wurde im Doppelalbum Kiss Me, Kiss Me, Kiss Me, zertifizierte Platin-Scheibe, vorgestellt.;
76;de;Welches Mitglied der The Cure-Gruppe musste nach einer Trauer ins Krankenhaus eingeliefert werden ?;Simon Gallup;Reeves Gabrels;Jason Cooper;Roger O'Donnell;Bestätigt;Roberto Soave, Bassist von Shelley-an Orphan, wird während der Konzerte im November 1992 als Interim für die Wish Tour auftreten.;https://de.wikipedia.org/wiki/Simon_Gallup
77;de;An welchem Soundtrack des Films hat The Cure mit dem unbenannten Burn teilgenommen ?;Die Krähe;Stahl;Spawn;Hellboy;Bestätigt;Dies ist der neueste Film, in dem der Schauspieler Brandon Lee, der während der Dreharbeiten zu einer Aufnahmeszene gestorben ist, spielt.;https://de.wikipedia.org/wiki/The_Crow_?_Die_Krähe
78;de;Mit welchem Label hat The Cure 2003 nach Fiction Records unterschrieben ?;Geffen Records;Epic Records;Lava Records;Pablo Records;Bestätigt;Anlässlich des Vertragsabschlusses mit Fiction Records erscheint die Compilation Greatest Hits mit zwei neuen Titeln.;https://de.wikipedia.org/wiki/Geffen_Records
79;de;Welche andere Gruppe ist Robert Smith ein Idol für seinen Sänger ?;Placebo;Die Libertines;Kapitän Phönix;Üppige;Bestätigt;Die Mitglieder dieser Formation arbeiteten mit Robert Smith zusammen, dem Anführer von Placebo, der sogar die Gelegenheit hatte, sein Idol zu interviewen.;https://de.wikipedia.org/wiki/The_Cure
80;de;Wie viele Alben hat The Cure Ende 2018 weltweit verkauft ?;30 Millionen;40 Millionen;20 Millionen;10 Millionen;Bestätigt;Zusätzlich zu offiziellen Aufnahmen, die auf Aufzeichnung oder in Video aufgezeichnet sind, gibt es eine große Anzahl von Bootlegs, die von Fans gesucht werden.;https://de.wikipedia.org/wiki/The_Cure
81;de;Welcher dieser Vorschläge bedeutet kein Live-Album von The Cure ?;Dublin;Paris;Bitte;Konzert;Expert;Im Jahr 2018 veröffentlichte The Cure offiziell 5 Live-Alben, 12 Studioalben und 11 VHS / DVDs, wobei zahlreiche Zusammenstellungen nicht berücksichtigt wurden.;https://de.wikipedia.org/wiki/The_Cure/Diskografie
82;de;In welchem Land hatte The Cure 1980-81 sehr schnell einen großen Erfolg ?;Neuseeland;Brasilien;Russland;Deutschland;Expert;Dieses Phänomen hat sich von mehreren Jahren auf Curemania ausgewirkt, das den europäischen Kontinent und insbesondere Frankreich betreffen wird.;https://de.wikipedia.org/wiki/The_Cure
83;de;Wie hieß die 1976 gegründete Easy Cure-Gruppe früher ?;Bosheit;Die Libertines;Spunge;Die Membranen;Expert;Die Mitglieder werden den Namen der Gruppe (Easy Cure) im Januar 1977 ändern und sich schließlich im April 1978 für The Cure entscheiden.;
84;de;In welchem Jahr erschien The Cure zum ersten Mal in Südamerika ?;1987;1989;1985;1983;Expert;Zu dieser Zeit wurde The Cure nach acht Konzerten als beste ausländische Gruppe des Jahres in Brasilien ausgezeichnet.;https://de.wikipedia.org/wiki/The_Cure
85;de;Wer hat sich The Cure kurz vor der Welttournee Kissing Tour angeschlossen ?;Roger O'Donnell;Tim Kingsbury;Chris Pitman;Andy Bown;Expert;In der Einleitung zeigt ein fünfminütiger Kurzfilm Nahaufnahmen von Robert Smiths Mund und Augen.;
86;de;Welche Gruppe hat den ersten Teil von The Cure's Prayer Tour gemacht ?;Shelleyan Orphan;Kult-Held;Fertighaus Sprout;Flugzeug Fiktion;Expert;Als Zeugnis dieser Tournee erscheint im folgenden Jahr das im Juli in der Wembley Arena aufgenommene Live-Album Entreat.;
87;de;Welcher Radiosender ist 1990 in der englischen FM-Band aufgetreten ?;Cure FM;Smith FM;Wish FM;Day FM;Expert;Diese Station, die von Mitgliedern von Cure selbst gehostet wurde, sollte für Mixed Up werben, eine Remix-CD.;https://de.wikipedia.org/wiki/The_Cure
88;de;Wer hat The Cure 2009 mit dem Godlike Genius Award ausgezeichnet ?;Tim Burton;Robert De Niro;Sean Penn;Stephen Frears;Expert;The Cure hat diese Auszeichnung für die gesamten NME Awards von Tim Burton erhalten, der von der Gruppe inspiriert wurde.;https://de.wikipedia.org/wiki/The_Cure
89;de;Welche holländische Gruppe ist eine echte Klongruppe von The Cure ?;Die Essenz;Der Diesel;Das Butan;Das Propan;Expert;Die Gruppe der 1980er Jahre reproduziert die Arrangements der Briten und kopiert die Stimme und Phrasierung von Robert Smith.;https://de.wikipedia.org/wiki/The_Cure
90;de;In welchem Jahr erhielt The Cure den Brit Award für die beste britische Band ?;1991;1993;1995;1997;Expert;The Cure wurde außerdem mit einem MTV Video Music Award, einem Juno Award, einem NME Award und mehreren Grammy Awards ausgezeichnet.;https://de.wikipedia.org/wiki/The_Cure
