1;fr;Quel humoriste français est connu pour ses sketches de la chaîne Canal+ ?;Albert Algoud;Albert Spaggiari;Albert Préjean;Albert Ferrasse;Débutant;Dans « Nulle part ailleurs », il est apparu dans la bande de comédiens qui participèrent aux tournages des sketches de Karl Zéro.;https://fr.wikipedia.org/wiki/Albert_Algoud
2;fr;Quel Albert a écrit pièces de théâtre, romans, nouvelles et poèmes ?;Albert Camus;Albert Uderzo;Albert Ducrocq;Albert Samain;Débutant;Prix Nobel, Albert Camus a développé un humanisme fondé sur la prise de conscience de l'absurde de la condition humaine.;https://fr.wikipedia.org/wiki/Albert_Camus
3;fr;Quel prince de Monaco a épousé la nageuse Charlène Wittstock ?;Albert II;Albert Ier;Albert III;Albert IV;Débutant;Le prince Albert II est le fils du prince Rainier III (1923-2005) et de Grace Kelly (1929-1982), actrice américaine internationale.;https://fr.wikipedia.org/wiki/Albert_II_(prince_de_Monaco)
4;fr;Qui fut successivement allemand, apatride, suisse et helvético-américain ?;Albert Einstein;Albert Schweitzer;Albert Batteux;Albert Fratellini;Débutant;Albert Einstein a publié sa théorie de la relativité restreinte en 1905 et sa théorie de la gravitation dite relativité générale en 1915.;https://fr.wikipedia.org/wiki/Albert_Einstein
5;fr;Qui est devenu le troisième roi des Belges le 23 décembre 1909 ?;Albert Ier;Albert II;Albert III;Albert IV;Débutant;Passionné d'alpinisme et auteur d'ascensions importantes, il meurt en 1934 dans un accident d'escalade à Marche-les-Dames.;https://fr.wikipedia.org/wiki/Albert_Ier_(roi_des_Belges)
6;fr;Qui est le créateur, avec le scénariste René Goscinny, de la série « Astérix » ?;Albert Uderzo;Albert Calmette;Albert Ferrasse;Albert Ducrocq;Débutant;Albert Uderzo étant daltonien, la mise en couleurs des albums d'« Astérix » fut longtemps assurée par son frère Marcel Uderzo.;https://fr.wikipedia.org/wiki/Albert_Uderzo
7;fr;Qui fut avec ses deux frères un clown mondialement célèbre ?;Albert Fratellini;Albert Ferrasse;Albert Dieudonné;Albert Dupontel;Débutant;Albert s'est marié à Amalia di Palma. Ils ont eu une fille Alberta-Luisa, mariée au directeur de cirque néerlandais Ernest Carré.;https://fr.wikipedia.org/wiki/Famille_Fratellini
8;fr;Quel Albert a proposé des sketchs cultes comme « Le Bac » ou « Rambo » ?;Albert Dupontel;Albert Algoud;Alberto Contador;Albert Canet;Débutant;Souhaitant préserver sa famille et particulièrement son père, Philippe Guillaume a choisi Albert Dupontel comme nom de scène.;https://fr.wikipedia.org/wiki/Albert_Dupontel
9;fr;Quel biologiste est un fin spécialiste de génétique des populations ?;Albert Jacquard;Albert Samain;Albert Schweitzer;Albert Algoud;Débutant;Il est aussi membre du comité de parrainage de la Coordination française pour la décennie de la culture de paix et de non-violence.;https://fr.wikipedia.org/wiki/Albert_Jacquard
10;fr;Qui a été président de la République française de 1932 à 1940 ?;Albert Lebrun;Albert Decourtray;Albert Batteux;Albert Londres;Débutant;Persuadé d'être un recours face aux périls éminents, il acceptera en 1939 de présenter sa candidature à un second mandat.;https://fr.wikipedia.org/wiki/Albert_Lebrun
11;fr;Quel médecin et pasteur a reçu le prix Nobel de la paix en 1952 ?;Albert Schweitzer;Albert Costa;Albert Lamorisse;Albert Finney;Confirmé;L'hôpital qu'il développa dans la forêt équatoriale au bord de l'Ogooué à partir de 1913 le fit connaître dans le monde entier.;https://fr.wikipedia.org/wiki/Albert_Schweitzer
12;fr;Qui est connu pour avoir été le cerveau du casse du siècle en 1976 ?;Albert Spaggiari;Albert Costa;Albert Jacquard;Albert Canet;Confirmé;Partisan de l'OAS, écrivain et photographe, il a échappé à la police française durant sa cavale qui a duré jusqu'à sa mort.;https://fr.wikipedia.org/wiki/Albert_Spaggiari
13;fr;Laquelle de ces propositions ne désigne pas un roman d'Albert Cohen ?;« Mission »;« Solal »;« Mangeclous »;« Les Valeureux »;Confirmé;D'abord diplomate, il publie son premier roman en 1930 mais ce n'est qu'en 1968 qu'il devient célèbre avec « Belle du Seigneur ».;https://fr.wikipedia.org/wiki/Albert_Cohen
14;fr;Quel joueur de tennis espagnol fut vainqueur à Roland Garros en 2002 ?;Albert Costa;Albert Préjean;Albert Samain;Albert DeSalvo;Confirmé;Spécialiste de terre battue, il a remporté 12 tournois ATP, tous sur cette surface, battant Juan Carlos Ferrero en finale en 2002.;https://fr.wikipedia.org/wiki/Albert_Costa
15;fr;À qui doit-on la vaccination contre la tuberculose grâce au BCG ?;Albert Calmette;Albert Spaggiari;Albert Schweitzer;Albert Einstein;Confirmé;Il était le frère d'Émile Calmette, médecin inspecteur général des Armées, et de Gaston Calmette, directeur du Figaro.;https://fr.wikipedia.org/wiki/Albert_Calmette
16;fr;Quel animateur télé est associé à « Âge Tendre et Tête de Bois » ?;Albert Raisner;Albert Préjean;Albert Londres;Albert Algoud;Confirmé;Il a été une figure emblématique du paysage audiovisuel français dans les années 1960 et un pionnier de l'époque des yé-yés.;https://fr.wikipedia.org/wiki/Albert_Raisner
17;fr;Qui a interprété Ernest Hemingway et Winston Churchill à la télévision ?;Albert Finney;Albert Algoud;Albert Canet;Albert Samain;Confirmé;Comédien, réalisateur, producteur et chanteur, il a été nommé à deux reprises aux Tony Awards pour le rôle de Martin Luther.;https://fr.wikipedia.org/wiki/Albert_Finney
18;fr;Qui est l'acteur principal de « Napoléon », un film d'Abel Gance ?;Albert Dieudonné;Albert Calmette;Albert Dupontel;Albert Algoud;Confirmé;Selon Jean Tulard, il aurait été si marqué par son rôle qu'il en serait arrivé avec les années à se prendre pour l'empereur lui-même.;https://fr.wikipedia.org/wiki/Albert_Dieudonné
19;fr;Quel Albert a été président de la Fédération française de tennis ?;Albert Canet;Albert Jacquard;Albert Lebrun;Albert Decourtray;Confirmé;Fils de l'ingénieur Gustave Canet, concepteur du célèbre canon Canet, Albert Canet a été président de la FFT de 1925 à 1930.;https://fr.wikipedia.org/wiki/Albert_Canet
20;fr;Dans quel art s'est illustré le français Albert Marquet avec ses couleurs vives ?;Peinture;Photographie;Sculpture;Cinéma;Confirmé;L'oeuvre d'Albert Marquet est fait de plans simplifiés, de couleurs vives et dégradées, avec un art accompli du cadrage.;https://fr.wikipedia.org/wiki/Albert_Marquet
21;fr;Qui a rassemblé un fonds iconographique intitulé « Archives de la Planète » ?;Albert Kahn;Albert Calmette;Albert Jacquard;Albert Lamorisse;Expert;Cette collection constituée d'autochromes (photographies en couleurs sur plaques de verre) est la plus importante au monde.;https://fr.wikipedia.org/wiki/Albert_Kahn_(banquier)
22;fr;Quel cardinal fut aussi archevêque de Lyon et académicien français ?;Albert Decourtray;Albert Raisner;Albert Londres;Albert Ducrocq;Expert;If lut créé cardinal par Jean-Paul II lors du consistoire du 25 mai 1985 avec le titre de cardinal-prêtre de la Trinité-des-Monts.;https://fr.wikipedia.org/wiki/Albert_Decourtray
23;fr;Qui est l'un des trois meilleurs entraîneurs de foot français du XXe siècle ?;Albert Batteux;Albert Finney;Albert Dieudonné;Albert Lebrun;Expert;Lorsque Batteux devint entraîneur du Stade de Reims, il mit en place un style de jeu qu'on appellera jeu à la rémoise.;https://fr.wikipedia.org/wiki/Albert_Batteux
24;fr;Qui fut Monsieur Loyal dans le premier cirque Jean Richard ?;Albert Préjean;Albert Ducrocq;Albert Costa;Albert Kahn;Expert;Il a confié ses souvenirs à son fils Patrick Préjean, dans un livre paru en 1979. Sa dernière épouse est décédée en 1986.;https://fr.wikipedia.org/wiki/Albert_Préjean
25;fr;Quel prix récompense les meilleurs journalistes francophones depuis 1933 ?;Albert Londres;Albert Finney;Albert Decourtray;Albert Spaggiari;Expert;Albert Londres dira : Notre métier n'est pas de faire plaisir, non plus de faire du tort, il est de porter la plume dans la plaie.;https://fr.wikipedia.org/wiki/Albert_Londres
26;fr;Qui est l'inventeur d'un système de prises de vues aériennes, l'Hélivision ?;Albert Lamorisse;Albert Decourtray;Albert Calmette;Albert Lebrun;Expert;Cette technique pionnière des systèmes antivibratoires de prises de vue aériennes fut utilisée dans les premiers « James Bond ».;https://fr.wikipedia.org/wiki/Albert_Lamorisse
27;fr;Quel Albert a été champion de France de rugby à XV en 1945 ?;Albert Ferrasse;Albert Samain;Albert Batteux;Albert Calmette;Expert;Ayant joué en seconde ligne gauche au SU Agen, Albert Ferrasse était un excellent relanceur de touche du fait de sa détente.;https://fr.wikipedia.org/wiki/Albert_Ferrasse
28;fr;À quel cybernéticien doit-on, entre autres, le « renard électronique » ?;Albert Ducrocq;Albert Jacquard;Albert Spaggiari;Albert Kahn;Expert;Ducrocq l'avait doté d'un sens capacitif par le moyen d'un dispositif de détection de masse récupéré d'un détecteur de mines.;https://fr.wikipedia.org/wiki/Albert_Ducrocq
29;fr;Quel poète symboliste français utilisait des sonnets à quinze vers ?;Albert Samain;Albert Londres;Albert Spaggiari;Albert Jacquard;Expert;De nombreux musiciens composent des mélodies sur ses textes, comme « Arpège » de Gabriel Fauré ou « La Maison du matin ».;https://fr.wikipedia.org/wiki/Albert_Samain
30;fr;Quel tueur en série a étranglé treize femmes entre 1962 et 1964 ?;Albert DeSalvo;Albert Ducrocq;Albert Dieudonné;Albert Kahn;Expert;Il a également été surnommé l'Homme en Vert en référence à la couleur de sa tenue d'ouvrier chargé d'effectuer des réparations.;https://fr.wikipedia.org/wiki/Albert_DeSalvo
1;en;Which French humorist is known for his sketches on the Canal + channel ?;Albert Algoud;Albert Spaggiari;Albert Préjean;Albert Ferrasse;Débutant;In « Nulle part ailleurs », he appeared in the gang of actors who took part in the filming of Karl Zero's sketches.;
2;en;Which Albert wrote plays, novels, short stories and poems ?;Albert Camus;Albert Uderzo;Albert Ducrocq;Albert Samain;Débutant;Nobel Prize winner Albert Camus developed a humanism based on the awareness of the absurdity of the human condition.;https://en.wikipedia.org/wiki/Albert_Camus
3;en;Which Prince of Monaco married swimmer Charlène Wittstock ?;Albert II;Albert I;Albert III;Albert IV;Débutant;Prince Albert II is the son of Prince Rainier III (1923-2005) and Grace Kelly (1929-1982), an international American actress.;https://en.wikipedia.org/wiki/Albert_II,_Prince_of_Monaco
4;en;Who was successively German, stateless, Swiss and Swiss-American ?;Albert Einstein;Albert Schweitzer;Albert Batteux;Albert Fratellini;Débutant;Albert Einstein published his theory of special relativity in 1905 and his theory of gravity known as general relativity in 1915.;https://en.wikipedia.org/wiki/Albert_Einstein
5;en;Who became the third King of the Belgians on December 23, 1909 ?;Albert I;Albert II;Albert III;Albert IV;Débutant;Passionate about mountaineering and author of major climbs, he died in 1934 in a climbing accident in Marche-les-Dames.;https://en.wikipedia.org/wiki/Albert_I_of_Belgium
6;en;Who is the creator, with screenwriter René Goscinny, of the « Asterix » series ?;Albert Uderzo;Albert Calmette;Albert Ferrasse;Albert Ducrocq;Débutant;Albert Uderzo being color blind, the coloring of « Asterix » albums was provided for a long time by his brother Marcel Uderzo.;https://en.wikipedia.org/wiki/Albert_Uderzo
7;en;Who was with his two brothers a world famous clown ?;Albert Fratellini;Albert Ferrasse;Albert Dieudonné;Albert Dupontel;Débutant;Albert got married to Amalia di Palma. They had a daughter Alberta-Luisa, married to Dutch circus director Ernest Carré.;https://en.wikipedia.org/wiki/Fratellini_family
8;en;Which Albert has proposed cult sketches like « Le Bac » or « Rambo » ?;Albert Dupontel;Albert Algoud;Alberto Contador;Albert Canet;Débutant;Wishing to preserve his family and particularly his father, Philippe Guillaume chose Albert Dupontel as his stage name.;https://en.wikipedia.org/wiki/Albert_Dupontel
9;en;Which biologist is a specialist in population genetics ?;Albert Jacquard;Albert Samain;Albert Schweitzer;Albert Algoud;Débutant;He is also a member of the sponsorship committee of the French Coordination for the Decade of the Culture of Peace and Non-violence.;https://en.wikipedia.org/wiki/Albert_Jacquard
10;en;Who was President of the French Republic from 1932 to 1940 ?;Albert Lebrun;Albert Decourtray;Albert Batteux;Albert London;Débutant;Persuaded to be a recourse in the face of eminent perils, he accepted in 1939 to present his candidacy for a second term.;https://en.wikipedia.org/wiki/Albert_Lebrun
11;en;Which doctor and pastor received the Nobel Peace Prize in 1952 ?;Albert Schweitzer;Albert Costa;Albert Lamorisse;Albert Finney;Confirmé;The hospital he developed in the equatorial forest on the edge of the Ogooué from 1913 made him known throughout the world.;https://en.wikipedia.org/wiki/Albert_Schweitzer
12;en;Who is known to have been the mastermind of the heist of the century in 1976 ?;Albert Spaggiari;Albert Costa;Albert Jacquard;Albert Canet;Confirmé;A supporter of the OAS, writer and photographer, he escaped the French police during his run which lasted until his death.;https://en.wikipedia.org/wiki/Albert_Spaggiari
13;en;Which of these propositions does not designate an Albert Cohen novel ?;« Mission »;« Solal »;« Mangeclous »;« Les Valeureux »;Confirmé;At first a diplomat, he published his first novel in 1930 but it was not until 1968 that he became famous with « Belle du Seigneur ».;https://en.wikipedia.org/wiki/Albert_Cohen_(novelist)
14;en;Which Spanish tennis player was the winner at Roland Garros in 2002 ?;Albert Costa;Albert Préjean;Albert Samain;Albert DeSalvo;Confirmé;A clay court specialist, he won 12 ATP tournaments, all on this surface, beating Juan Carlos Ferrero in the final in 2002.;https://en.wikipedia.org/wiki/Albert_Costa
15;en;To whom do we owe the tuberculosis vaccination with BCG ?;Albert Calmette;Albert Spaggiari;Albert Schweitzer;Albert Einstein;Confirmé;He was the brother of Émile Calmette, medical inspector general of the armed forces, and Gaston Calmette, director of Le Figaro.;https://en.wikipedia.org/wiki/Albert_Calmette
16;en;Which TV host is associated with « Tender Age and Wood Head » ?;Albert Raisner;Albert Préjean;Albert London;Albert Algoud;Confirmé;He was an emblematic figure of the French audiovisual landscape in the 1960s and a pioneer of the yé-yés era.;https://en.wikipedia.org/wiki/Albert_Raisner
17;en;Who played Ernest Hemingway and Winston Churchill on television ?;Albert Finney;Albert Algoud;Albert Canet;Albert Samain;Confirmé;An actor, director, producer and singer, he has been nominated twice for the Tony Awards for the role of Martin Luther.;https://en.wikipedia.org/wiki/Albert_Finney
18;en;Who is the main actor in « Napoleon », an Abel Gance film ?;Albert Dieudonné;Albert Calmette;Albert Dupontel;Albert Algoud;Confirmé;According to Jean Tulard, he would have been so marked by his role that over the years he would have come to think of himself as the emperor.;
19;en;Which Albert was president of the French Tennis Federation ?;Albert Canet;Albert Jacquard;Albert Lebrun;Albert Decourtray;Confirmé;Son of the engineer Gustave Canet, designer of the famous Canet cannon, Albert Canet was president of the FFT from 1925 to 1930.;https://en.wikipedia.org/wiki/Albert_Canet
20;en;In what art is the French Albert Marquet illustrated with his bright colors ?;Painting;Photography;Sculpture;Cinema;Confirmé;Albert Marquet's work is made up of simplified plans, bright and degraded colors, with an accomplished art of framing.;https://en.wikipedia.org/wiki/Albert_Marquet
21;en;Who collected an iconographic collection entitled « Archives of the Planet » ?;Albert Kahn;Albert Calmette;Albert Jacquard;Albert Lamorisse;Expert;This collection made up of autochromes (color photographs on glass plates) is the largest in the world.;https://en.wikipedia.org/wiki/Albert_Kahn_(banker)
22;en;Which cardinal was also archbishop of Lyon and a French academician ?;Albert Decourtray;Albert Raisner;Albert London;Albert Ducrocq;Expert;If he was created cardinal by John Paul II during the consistory of May 25, 1985 with the title of cardinal-priest of Trinité-des-Monts.;https://en.wikipedia.org/wiki/Albert_Decourtray
23;en;Who is one of the three best French football coaches of the 20th century ?;Albert Batteux;Albert Finney;Albert Dieudonné;Albert Lebrun;Expert;When Batteux became the coach of the Stade de Reims, he set up a style of play that would be called rémoise game.;https://en.wikipedia.org/wiki/Albert_Batteux
24;en;Who was Monsieur Loyal in the first Jean Richard circus ?;Albert Préjean;Albert Ducrocq;Albert Costa;Albert Kahn;Expert;He confided his memories to his son Patrick Préjean, in a book published in 1979.;
25;en;What prize has been awarded to the best French-speaking journalists since 1933 ?;Albert London;Albert Finney;Albert Decourtray;Albert Spaggiari;Expert;Albert Londres will say : Our job is not to please, nor to do harm, it is to carry the pen in the wound.;https://en.wikipedia.org/wiki/Albert_Londres
26;en;Who is the inventor of an aerial photography system, the Hélivision ?;Albert Lamorisse;Albert Decourtray;Albert Calmette;Albert Lebrun;Expert;This pioneering technique of anti-vibration systems for aerial shots was used in the first « James Bond \u003c/I\u003e.;https://en.wikipedia.org/wiki/Albert_Lamorisse
27;en;Which Albert was French rugby union champion in 1945 ?;Albert Ferrasse;Albert Samain;Albert Batteux;Albert Calmette;Expert;Having played on the second left line at SU Agen, Albert Ferrasse was an excellent touchdown receiver because of his relaxation.;
28;en;To which cyberneticist, among others, do we owe the electronic fox ?;Albert Ducrocq;Albert Jacquard;Albert Spaggiari;Albert Kahn;Expert;Ducrocq had endowed it with a capacitive sense by means of a mass detection device recovered from a mine detector.;
29;en;What French Symbolist poet used fifteen-line sonnets ?;Albert Samain;Albert London;Albert Spaggiari;Albert Jacquard;Expert;Many musicians compose melodies on his texts, such as « Arpège » by Gabriel Fauré or « La Maison du matin ».;https://en.wikipedia.org/wiki/Albert_Samain
30;en;Which serial killer strangled thirteen women between 1962 and 1964 ?;Albert DeSalvo;Albert Ducrocq;Albert Dieudonné;Albert Kahn;Expert;He was also nicknamed the Man in Green in reference to the color of his workman's outfit carrying out repairs.;https://en.wikipedia.org/wiki/Albert_DeSalvo
1;de;Welcher französische Humorist ist bekannt für seine Skizzen auf dem Kanal + Kanal ?;Albert Algoud;Albert Spaggiari;Albert Préjean;Albert Ferrasse;Débutant;In « Nulle part ailleurs » trat er in der Gruppe der Schauspieler auf, die an den Dreharbeiten zu Karl Zeros Skizzen beteiligt waren.;
2;de;Welcher Albert hat Theaterstücke, Romane, Kurzgeschichten und Gedichte geschrieben ?;Albert Camus;Albert Uderzo;Albert Ducrocq;Albert Samain;Débutant;Der Nobelpreisträger Albert Camus entwickelte einen Humanismus, der auf dem Bewusstsein der Absurdität des menschlichen Zustands basiert.;https://de.wikipedia.org/wiki/Albert_Camus
3;de;Welcher Prinz von Monaco heiratete die Schwimmerin Charlène Wittstock ?;Albert II.;Albert I;Albert III;Albert IV;Débutant;Prinz Albert II ist der Sohn von Prinz Rainier III (1923-2005) und Grace Kelly (1929-1982), einer internationalen amerikanischen Schauspielerin.;https://de.wikipedia.org/wiki/Albert_II._(Monaco)
4;de;Wer war nacheinander Deutscher, Staatenloser, Schweizer und Schweizeramerikaner ?;Albert Einstein;Albert Schweitzer;Albert Batteux;Albert Fratellini;Débutant;Albert Einstein veröffentlichte 1905 seine spezielle Relativitätstheorie und 1915 seine als allgemeine Relativitätstheorie bekannte Gravitationstheorie.;https://de.wikipedia.org/wiki/Albert_Einstein
5;de;Wer wurde am 23. Dezember 1909 der dritte König der Belgier ?;Albert I;Albert II.;Albert III;Albert IV;Débutant;Mit Leidenschaft für Bergsteigen und Autor großer Anstiege starb er 1934 bei einem Kletterunfall in Marche-les-Dames.;https://de.wikipedia.org/wiki/Albert_I._(Belgien)
6;de;Wer ist mit dem Drehbuchautor René Goscinny der Schöpfer der Serie « Asterix » ?;Albert Uderzo;Albert Calmette;Albert Ferrasse;Albert Ducrocq;Débutant;Da Albert Uderzo farbenblind ist, wurde die Färbung von « Asterix » Alben lange Zeit von seinem Bruder Marcel Uderzo bereitgestellt.;https://de.wikipedia.org/wiki/Albert_Uderzo
7;de;Wer war mit seinen beiden Brüdern ein weltberühmter Clown ?;Albert Fratellini;Albert Ferrasse;Albert Dieudonné;Albert Dupontel;Débutant;Albert heiratete Amalia di Palma. Sie hatten eine Tochter Alberta-Luisa, verheiratet mit dem niederländischen Zirkusdirektor Ernest Carré.;
8;de;Welcher Albert hat Kult-Skizzen wie « Le Bac » oder « Rambo » vorgeschlagen ?;Albert Dupontel;Albert Algoud;Alberto Contador;Albert Canet;Débutant;Um seine Familie und insbesondere seinen Vater zu erhalten, wählte Philippe Guillaume Albert Dupontel als Künstlernamen.;https://de.wikipedia.org/wiki/Albert_Dupontel
9;de;Welcher Biologe ist Spezialist für Populationsgenetik ?;Albert Jacquard;Albert Samain;Albert Schweitzer;Albert Algoud;Débutant;Er ist auch Mitglied des Sponsoring-Komitees der französischen Koordinierung für das Jahrzehnt der Kultur des Friedens und der Gewaltlosigkeit.;https://de.wikipedia.org/wiki/Albert_Jacquard
10;de;Wer war von 1932 bis 1940 Präsident der Französischen Republik ?;Albert Lebrun;Albert Decourtray;Albert Batteux;Albert London;Débutant;Überredet, angesichts erheblicher Gefahren Rückgriff zu nehmen, nahm er 1939 an, seine Kandidatur für eine zweite Amtszeit vorzulegen.;https://de.wikipedia.org/wiki/Albert_Lebrun
11;de;Welcher Arzt und Pastor erhielt 1952 den Friedensnobelpreis ?;Albert Schweitzer;Albert Costa;Albert Lamorisse;Albert Finney;Confirmé;Das Krankenhaus, das er ab 1913 im Äquatorialwald am Ufer des Ogooué errichtete, machte ihn weltweit bekannt.;https://de.wikipedia.org/wiki/Albert_Schweitzer
12;de;Wer war bekanntlich der Mastermind des Überfalls des Jahrhunderts im Jahr 1976 ?;Albert Spaggiari;Albert Costa;Albert Jacquard;Albert Canet;Confirmé;Als Unterstützer der OAS, Schriftsteller und Fotograf entkam er der französischen Polizei während seines Laufs, der bis zu seinem Tod dauerte.;https://de.wikipedia.org/wiki/Albert_Spaggiari
13;de;Welche dieser Aussagen bezeichnet keinen Roman von Albert Cohen ?;« Mission »;« Solal »;« Nailcruncher »;« Les Valeureux »;Confirmé;Zunächst Diplomat, veröffentlichte er 1930 seinen ersten Roman, doch erst 1968 wurde er mit « Belle du Seigneur » berühmt.;https://de.wikipedia.org/wiki/Albert_Cohen
14;de;Welcher spanische Tennisspieler war 2002 der Gewinner bei Roland Garros ?;Albert Costa;Albert Préjean;Albert Samain;Albert DeSalvo;Confirmé;Als Sandplatzspezialist gewann er 12 ATP-Turniere auf dieser Oberfläche und schlug im Finale 2002 Juan Carlos Ferrero.;https://de.wikipedia.org/wiki/Albert_Costa_(Tennisspieler)
15;de;Wem verdanken wir die Tuberkulose-Impfung mit BCG ?;Albert Calmette;Albert Spaggiari;Albert Schweitzer;Albert Einstein;Confirmé;Er war der Bruder von Émile Calmette, Generalinspekteur der Streitkräfte, und Gaston Calmette, Direktor von Le Figaro.;https://de.wikipedia.org/wiki/Albert_Calmette
16;de;Welcher Fernsehmoderator ist mit « Tender Age und Wood Head » verbunden ?;Albert Raisner;Albert Préjean;Albert London;Albert Algoud;Confirmé;Er war eine emblematische Figur der französischen audiovisuellen Landschaft in den 1960er Jahren und ein Pionier der Yé-Yés-Ära.;https://de.wikipedia.org/wiki/Albert_Raisner
17;de;Wer spielte Ernest Hemingway und Winston Churchill im Fernsehen ?;Albert Finney;Albert Algoud;Albert Canet;Albert Samain;Confirmé;Als Schauspieler, Regisseur, Produzent und Sänger wurde er zweimal für die Tony Awards für die Rolle des Martin Luther nominiert.;https://de.wikipedia.org/wiki/Albert_Finney
18;de;Wer ist der Hauptdarsteller in « Napoleon », einem Abel Gance-Film ?;Albert Dieudonné;Albert Calmette;Albert Dupontel;Albert Algoud;Confirmé;Jean Tulard zufolge wäre er von seiner Rolle so geprägt gewesen, dass er sich im Laufe der Jahre als Kaiser gesehen hätte.;
19;de;Welcher Albert war Präsident des französischen Tennisverbandes ?;Albert Canet;Albert Jacquard;Albert Lebrun;Albert Decourtray;Confirmé;Albert Canet, Sohn des Ingenieurs Gustave Canet, Designer der berühmten Canet-Kanone, war von 1925 bis 1930 Präsident der FFT.;https://de.wikipedia.org/wiki/Albert_Canet
20;de;In welcher Kunst ist der Franzose Albert Marquet mit seinen leuchtenden Farben abgebildet ?;Malerei;Fotografie;Skulptur;Kino;Confirmé;Albert Marquets Arbeit besteht aus vereinfachten Plänen, hellen und erniedrigten Farben und einer vollendeten Kunst des Einrahmens.;https://de.wikipedia.org/wiki/Albert_Marquet
21;de;Wer hat eine ikonografische Sammlung mit dem Titel « Archives of the Planet » gesammelt ?;Albert Kahn;Albert Calmette;Albert Jacquard;Albert Lamorisse;Expert;Diese Sammlung aus Autochromen (Farbfotografien auf Glasplatten) ist die größte der Welt.;https://de.wikipedia.org/wiki/Albert_Kahn
22;de;Welcher Kardinal war auch Erzbischof von Lyon und französischer Akademiker ?;Albert Decourtray;Albert Raisner;Albert London;Albert Ducrocq;Expert;Wenn Lut Kardinal von Johannes Paul II. Während des Konsistoriums vom 25. Mai 1985 mit dem Titel Kardinalpriester der Dreifaltigkeit der Berge geschaffen.;https://de.wikipedia.org/wiki/Albert_Decourtray
