1;De quelle poupée de 29 cm au succès international Ruth Handler est-elle la créatrice ?;Barbie;Jasmine;Rosella;Blondine;Débutant;Barbie fait le régal des petites filles depuis 1959 et suscite aussi de nombreuses controverses suite à son image.;http://fr.wikipedia.org/wiki/Poupée_Barbie
2;Quel célèbre chef cuisinier et restaurateur français s'est donné la mort le 24 février 2003 ?;Bernard Loiseau;Patrick Bertron;Arnaud Lallement;Richard Leblanc;Débutant;Né en 1951, il avait été formé chez les frères Troisgros à Roanne et avait bâti un empire, faisant une marque de son nom.;http://fr.wikipedia.org/wiki/Bernard_Loiseau
3;Quel écrivain belge a fait son entrée dans la collection La Pléiade le 6 mars 2003 ?;Georges Simenon;Michel Delville;Edmond Lacoste;Roger Foulon;Débutant;Une belle consécration pour l'auteur qui côtoie Balzac, Proust et Kafka dans cette prestigieuse collection.;http://fr.wikipedia.org/wiki/Georges_Simenon
4;Quel ex-Beatle a donné un concert sur la place Rouge de Moscou le 24 mai 2003 ?;Paul McCartney;John Lennon;George Harrison;Ringo Starr;Débutant;L'événement très inhabituel dans ce pays rassembla 20 000 personnes dont le président russe Vladimir Poutine.;http://fr.wikipedia.org/wiki/Paul_McCartney
5;Des pommes, des poires et des scoubidous : quel chanteur nous a quitté en 2004 ?;Sacha Distel;Enrico Macias;Eddy Mitchell;Claude Nougaro;Débutant;La carrière du chanteur né le 29 janvier 1933 avait été lancée en 1958 avec la chanson Scoubidou.;http://fr.wikipedia.org/wiki/Sacha_Distel
6;Qui est l'auteur du best-seller Da Vinci Code publié à des millions d'exemplaires ?;Dan Brown;Robert Bloch;David Baldacci;Kent Anderson;Débutant;L'auteur signe là un roman d'aventures ésotériques dont l'un des épisodes clés de situe dans l'église Saint-Sulpice à Paris.;http://fr.wikipedia.org/wiki/Dan_Brown
7;Connu pour ses soirées blanches à Saint-Tropez, qui avait découvert entre autres Brel et Dalida ?;Eddie Barclay;Johnny Stark;Valéry Zeitoun;Tristan Duval;Débutant;Célèbre pour ses huit mariages, Eddie Barclay avait rapporté des États-Unis le microsillon.;http://fr.wikipedia.org/wiki/Eddie_Barclay
8;Qui s'était fait connaître avec sa chanson Gaby oh Gaby, en 1980 ?;Alain Bashung;Patrick Bruel;Florent Pagny;Alain Souchon;Débutant;Ses nombreux tubes lui avaient permis de devenir l'artiste français le plus récompensé avec 11 victoires de la musique.;http://fr.wikipedia.org/wiki/Alain_Bashung
9;Quel était le surnom de Michael Jackson qui nous quitta le 25 juin 2009 à seulement 50 ans ?;Roi de la pop;Dieu de la scène;Prince du raï;Fils du roi;Débutant;Star dès l'enfance avec ses frères, les Jackson Five, Michael Jackson a inventé les clips comme de véritables courts métrages.;http://fr.wikipedia.org/wiki/Michael_Jackson
10;Le 10 juin 2000, quel chanteur a fêté ses 40 ans de carrière sur le Champ-de-Mars ?;Johnny Hallyday;Sacha Distel;Paul McCartney;Claude Nougaro;Débutant;Un million de personnes se sont déplacées pour entendre vingt-quatre tubes du chanteur dans ce concert gratuit.;http://fr.wikipedia.org/wiki/Johnny_Hallyday
11;Quel artiste originaire de Toulouse avait chanté sa « ville rose » comme personne ?;Claude Nougaro;Marcel Amont;Francis Cabrel;Alain Bashung;Confirmé;« Troubadour baroque » comme il aimait à se définir, il a été emporté par une longue maladie le 4 mars 2004.;http://fr.wikipedia.org/wiki/Claude_Nougaro
12;Quel chef cuisinier français a été sacré « meilleur cuisinier du monde » le 8 mars 2003 ?;Alain Ducasse;Norbert Tarayre;Thierry Marx;Philippe Etchebest;Confirmé;Directeur du Plaza Athénée à Paris, Alain Ducasse a reçu ce titre de l'Amarican Academy of Hspitality and Science.;http://fr.wikipedia.org/wiki/Alain_Ducasse
13;Quel chanteur et acteur a donné quatre concerts au Parc des Princes pour fêter ses 60 ans ?;Johnny Hallyday;Dick Rivers;Alain Souchon;Marc Lavoine;Confirmé;60 000 spectateurs se sont pressés le 15 juin pour le dernier de ces concerts et pour fêter cet anniversaire.;http://fr.wikipedia.org/wiki/Johnny_Hallyday
14;Quelle actrice française est morte des suites de coups de son compagnon le 1er août 2003 ?;Marie Trintignant;Dominique Lavanant; Julie Depardieu;Danielle Darrieux;Confirmé;Marie Trintignant s'était violemment disputée avec son compagnon Bertrand Cantat, leader du groupe Noir Désir.;http://fr.wikipedia.org/wiki/Marie_Trintignant
15;De son vrai nom Françoise Quirez, qui avait connu le succès dès son 1er livre, Bonjour tristesse ?;Françoise Sagan;Jeanne Moreau;Ingrid Bergman;Michèle Morgan;Confirmé;Le « charmant petit monstre », tel que la surnommait François Mauriac, nous a laissé des livres d'un talent indiscutable.;http://fr.wikipedia.org/wiki/Françoise_Sagan
16;Quel personnage le dessinateur de BD Morris a-t-il laissé plus seul que jamais en 2001 ?;Lucky Luke;Cédric;Gaston;Papyrus;Confirmé;Après 97 albums, le dessinateur belge né en 1923 s'imposait comme un maître de la ligne claire.;http://fr.wikipedia.org/wiki/Lucky_Luke
17;Quelle présentatrice télé le prince Felipe d'Espagne a-t-il épousé le 22 mai 2004 ?;Letizia Ortiz;Conchita Puig;Clara del Rey;Joaquina Vedruna;Confirmé;Les tenants de la tradition trouvèrent sacrilège qu'un futur roi épouse une roturière, divorcée de surcroît.;http://fr.wikipedia.org/wiki/Letizia_Ortiz
18;À qui appartenaient les plus beaux yeux bleus d'Hollywood, définitivement fermés en 2008 ?;Paul Newman;Henry Fonda;Robert Duvall;Ben Kingsley;Confirmé;Ayant joué dans quelques soixante films, ses yeux bleus en avaient fait le séducteur d'Hollywood.;http://fr.wikipedia.org/wiki/Paul_Newman
19;Quelle femme fut élue à l'Académie française au fauteuil de Pierre Messmer ?;Simone Veil;Élisabeth Hubert;Roselyne Bachelot;Marisol Touraine;Confirmé;Figure majeure de la politique, plusieurs fois ministre, elle a été en 1975 l'instigatrice de la loi légalisant l'IVG.;http://fr.wikipedia.org/wiki/Simone_Veil
20;Quel auteur français populaire a laissé San-Antonio orphelin le 6 juin 2000 ?;Frédéric Dard;Pierre Forquin;Michel Carnal;François Brigneau;Confirmé;Les prolifiques aventures de San Antonio ont révélé Frédéric Dard comme un maître du langage populaire.;http://fr.wikipedia.org/wiki/Frédéric_Dard
21;Quel est le titre du premier livre pour enfants écrit par la chanteuse américaine Madonna ?;Les Roses Anglaises;Bonjour matin;Il était une fois;Le beau Soleil;Expert;C'est à Paris que la chanteuse a choisi d'effectuer le lancement international de cet ouvrage publié en 30 langues.;http://fr.wikipedia.org/wiki/Madonna
22;À quel écrivain et critique littéraire fut attribué le très prestigieux 100e prix Goncourt ?;Jacques-Pierre Amette;Patrick Grainville;Henri Pourrat;René Maran;Expert;Ce prix anniversaire a été attribué quinze jours plus tôt que prévu, passant ainsi devant le prix Femina.;http://fr.wikipedia.org/wiki/Jacques-Pierre_Amette
23;Quel auteur de romans d'espionnage a avoué en 2000 avoir bien été espion ?;John Le Carré;Eric Ambler;Adam Hall;Nicolas Freeling;Expert;Diplomate, John Le Carré travaillait en fait pour l'Intelligence Service depuis ses études à Berne.;http://fr.wikipedia.org/wiki/John_le_Carré
24;Quel anthropologue fut élu à la quasi unanimité à l'Académie française le 17 mars 2005 ?;René Girard;Didier Fassin;Alain Bertho;Alain Le Pichon;Expert;Son œuvre anthropologique est formée à l'écart des courants philosophiques de son temps.;http://fr.wikipedia.org/wiki/René_Girard_(philosophe)
25;Quelle chanteuse a retrouvé en 2001 sa photographie sur des paquets de préservatifs ?;Madonna;Britney Spears;Janet Jackson;Lady Gaga;Expert;La chanteuse qui n'avait pas donné son autorisation n'a pu les faire retirer, la photo étant exploitable à vie.;http://fr.wikipedia.org/wiki/Madonna
26;Qui a mis un terme à sa carrière de styliste de haute couture le 22 janvier 2002 ?;Yves Saint Laurent;Alexander McQueen;Christian Dior;André Courrèges;Expert;Plusieurs milliers de personnes suivirent son dernier défilé sur le parvis du centre Pompidou, sur écran géant.;http://fr.wikipedia.org/wiki/Yves_Saint_Laurent
27;Qui a créé la polémique en exposant ses œuvres pop kitsch au cœur du château de Versailles ?;Jeff Koons;Lawrence Weiner;Andy Warhol;Mark Wallinger;Expert;L'installation du « roi du kitsch » chez le Roi-Soleil ne fut pas du goût de tous qui « porte atteinte aux intérêts de la France ».;http://fr.wikipedia.org/wiki/Jeff_Koons
28;Qui fut le premier écrivain du Maghreb a revêtir l'habit vert de l'Académie française ?;Assia Djebar;Anna Gréki;Salima Ghezali;Myriam Ben;Expert;À la fois essayiste, romancière et cinéaste, Assia Djebar est le premier écrivain du Maghreb à devenir « immortel ».;http://fr.wikipedia.org/wiki/Assia_Djebar
29;Quelle chanteuse islandaise fut récompensée en 2000 pour sa performance d'actrice ?;Björk;Soley;Arndis Halla;Heioa;Expert;Björk fut consacrée par le 53e festival de Cannes pour son interprétation dans le film danois Dancer in the Dark.;http://fr.wikipedia.org/wiki/Björk
30;Sous quel nom d'artiste le Chanteur Claude Dhotel nous a-t-il quitté le 14 mars 2000 ?;C. Jérôme;Alain Bashung;Claude Nougaro;Claude Brassens;Expert;Ses chansons comme Kiss me ou C'est moi en avaient fait le meilleur représentant de la chanson de variété populaire.;http://fr.wikipedia.org/wiki/C._Jérôme