17;nl;Wie speelde Ernest Hemingway en Winston Churchill op televisie ?;Albert Finney;Albert Algoud;Albert Canet;Albert Samain;Confirmé;Komiek, regisseur, producer en zanger, hij is tweemaal genomineerd voor de Tony Awards voor de rol van Martin Luther.;https://nl.wikipedia.org/wiki/Albert_Finney
18;nl;Wie is de hoofdrolspeler in « Napoleon », een film van Abel Gance ?;Albert Dieudonné;Albert Calmette;Albert Dupontel;Albert Algoud;Confirmé;Volgens Jean Tulard zou hij zo getekend zijn geweest door zijn rol dat hij zichzelf in de loop der jaren als de keizer zou gaan beschouwen.;
19;nl;Welke Albert was de voorzitter van de Franse tennisfederatie ?;Albert Canet;Albert Jacquard;Albert Lebrun;Albert Decourtray;Confirmé;Zoon van de ingenieur Gustave Canet, ontwerper van het beroemde Canet-kanon, Albert Canet was voorzitter van de FFT van 1925 tot 1930.;
20;nl;In welke kunst wordt de Fransman Albert Marquet geïllustreerd met zijn felle kleuren ?;Schilderen;Fotografie;Sculptuur;Bioscoop;Confirmé;Het werk van Albert Marquet bestaat uit vereenvoudigde plannen, in heldere en gedegradeerde kleuren, met een kunst van het inlijsten.;https://nl.wikipedia.org/wiki/Albert_Marquet
21;nl;Wie verzamelde een iconografische collectie met de titel « Archives of the Planet » ?;Albert Kahn;Albert Calmette;Albert Jacquard;Albert Lamorisse;Expert;Deze collectie van autochromen (kleurenfoto's op glasplaten) is de grootste ter wereld.;
22;nl;Welke kardinaal was ook aartsbisschop van Lyon en een Franse academicus ?;Albert Decourtray;Albert Raisner;Albert Londen;Albert Ducrocq;Expert;Als hij tijdens de kerkenraad van 25 mei 1985 door Johannes Paulus II tot kardinaal werd gemaakt met de titel van kardinaal-priester van Trinité-des-Monts.;https://nl.wikipedia.org/wiki/Albert_Decourtray
23;nl;Wie is een van de drie beste Franse voetbalcoaches van de 20e eeuw ?;Albert Batteux;Albert Finney;Albert Dieudonné;Albert Lebrun;Expert;Toen Batteux coach werd van het Stade de Reims, zette hij een speelstijl op die we het reims-spel zouden noemen.;https://nl.wikipedia.org/wiki/Albert_Batteux
24;nl;Wie was Monsieur Loyal in het eerste Jean Richard-circus ?;Albert Préjean;Albert Ducrocq;Albert Costa;Albert Kahn;Expert;Hij vertrouwde zijn herinneringen toe aan zijn zoon Patrick Préjean, in een boek dat in 1979 werd gepubliceerd.;
25;nl;Welke prijs is er sinds 1933 aan de beste Franstalige journalisten toegekend ?;Albert Londen;Albert Finney;Albert Decourtray;Albert Spaggiari;Expert;Albert Londres zal zeggen : Het is niet onze taak om te behagen, noch om kwaad te doen, het is om de pen in de wond te dragen.;https://nl.wikipedia.org/wiki/Albert_Londres
26;nl;Wie is de uitvinder van een luchtfotografiesysteem, de Hélivision ?;Albert Lamorisse;Albert Decourtray;Albert Calmette;Albert Lebrun;Expert;Deze baanbrekende techniek van antivibratiesystemen voor luchtopnames werd gebruikt in de eerste « James Bond \u003c/I\u003e.;https://nl.wikipedia.org/wiki/Albert_Lamorisse
27;nl;Welke Albert was in 1945 de Franse rugby union-kampioen ?;Albert Ferrasse;Albert Samain;Albert Batteux;Albert Calmette;Expert;Albert Ferrasse speelde op de tweede linkerlijn bij SU Agen en was een uitstekende touchdown-ontvanger vanwege zijn ontspanning.;
28;nl;Aan welke cyberneticus hebben we onder meer de elektronische vos te danken ?;Albert Ducrocq;Albert Jacquard;Albert Spaggiari;Albert Kahn;Expert;Ducrocq had het een capacitief gevoel gegeven door middel van een massa-detectieapparaat dat werd hersteld van een mijndetector.;
29;nl;Welke Franse symbolistische dichter gebruikte sonnetten van vijftien regels ?;Albert Samain;Albert Londen;Albert Spaggiari;Albert Jacquard;Expert;Veel muzikanten componeren melodieën op zijn teksten, zoals « Arpège » van Gabriel Fauré of « La Maison du matin ».;
30;nl;Welke seriemoordenaar heeft tussen 1962 en 1964 dertien vrouwen gewurgd ?;Albert DeSalvo;Albert Ducrocq;Albert Dieudonné;Albert Kahn;Expert;Hij kreeg ook de bijnaam de man in het groen, verwijzend naar de kleur van zijn werkkleding die reparaties uitvoert.;https://nl.wikipedia.org/wiki/Albert_DeSalvo
