175;nl;In welk land kun je manioba met rijst eten ?;Brazilië;Ségal;Vietnam;India;Expert;Dit feestelijke gerecht is gemaakt met bladeren van de maniokplant die fijn zijn geplet en een week gekookt.;https://nl.wikipedia.org/wiki/Cassave
176;nl;Welk element heeft het hoogste smeltpunt van alle metalen ?;Tungsten;Goud;Platina;Nikkel;Expert;Zuiver wolfraam is een hard metaal, variërend van staalgrijs tot tinwit dat met een ijzerzaag kan worden gesneden.;https://nl.wikipedia.org/wiki/Wolfraam
177;nl;Welke romanschrijver pleegde zelfmoord bij cyanide quai Voltaire in Parijs ?;Montherlant;Hemingway;Malraux;Butor;Expert;Bij zijn dood in 1972 zal Montherlant een bericht overlaten aan Jean-Claude Barat, zijn universele ontvanger: ik word blind.;https://nl.wikipedia.org/wiki/Henry_de_Montherlant
178;nl;Jeanne Chauvin was de eerste vrouw in Frankrijk die welk beroep uitoefende ?;Advocaat;Minister;Apotheker;Bankier;Expert;Sinds 2017 heet de bibliotheek van de Faculteit der Rechtsgeleerdheid van de openbare universiteit Paris-Descartes Jeanne Chauvin.;
179;nl;Welke rivier is ook de langste zijrivier van de Mississippi-rivier ?;Missouri;Minnesota;Wisconsin;Arkansas;Expert;Missouri heeft de bijnaam Big Muddy omdat het water zichtbaar slib bij zijn samenvloeiing met de Mississippi draagt.;https://nl.wikipedia.org/wiki/Missouri_(rivier)
180;nl;Welke beroemde Franse politicus wordt hetzelfde jaar geboren als Johannes Paulus II ?;Georges Marchais;Raymond Barre;Jacques Chirac;François Miterrand;Expert;Paus Johannes Paulus II wordt door velen beschouwd als een van de meest invloedrijke politieke leiders van de 20e eeuw.;https://nl.wikipedia.org/wiki/Paus_Johannes_Paulus_II
