21;nl;Hoeveel dollars zou Apple in vijf jaar tijd zijn beroemde iPhone hebben binnengehaald ?;150 miljard;120 miljard;90 miljard;60 miljard;Expert;De iPhone blijft tot op de dag van vandaag het toestel dat de markt voor smartphones omvormde tot massaproducten.;https://nl.wikipedia.org/wiki/IPhone
22;nl;Rachel Legrain-Trapani werd gekozen tot Miss Frankrijk, maar in welk jaar ?;2007;2009;2011;2013;Expert;Begin 2008 sloot ze zich aan bij de 6-9 band met Bruno Guillon, waar ze een column schreef in « Bring in the guest » op het NRJ12-kanaal.;
23;nl;Welke hond is met Jean Dujardin een van de sterren van de film « The Artist » ?;Uggie;Clement;Blondi;Balto;Expert;Op jonge leeftijd opgepikt door de Colombiaanse trainer Omar von Muller, drukte Uggie zijn stempel op de Walk of Fame.;
24;nl;In welk jaar was het 300 jaar geleden dat Jean-Jacques Rousseaux werd geboren ?;2012;2002;1992;1982;Expert;Een controverse zal zich verzetten tegen degenen die geloven dat Rousseau in zekere zin de vader is van totalitarismen en degenen die hem vrijwaren.;https://nl.wikipedia.org/wiki/Jean-Jacques_Rousseau
25;nl;Welke zakelijke microblogging-tool werd in 2012 door Microsoft overgenomen ?;Yammer;Viadeo;LinkedIn;Myspace;Expert;Volgens TechCrunch werd de dienst in september 2010 gebruikt door een miljoen gebruikers in 80.000 bedrijven over de hele wereld.;https://nl.wikipedia.org/wiki/Yammer
26;nl;Welke auteur van « Swedish Matches » stierf op 28 juni 2012 op 88-jarige leeftijd ?;Robert Sabatier;Georges Conchon;Pierre Biron;Lucien Gachon;Expert;Ook bekend als Robert Vellerut, was hij lid van het ere-comité van het Internationale Huis van Dichters van Saint-Malo.;
27;nl;Aan wie vertrouwden de Rolling Stones hun logo toe voor hun 50-jarig jubileum ?;Shephard Fairey;Kenny Scharf;Anthony Clark;Curtis Kulig;Expert;Afkomstig uit de skateboardscene, werd Shephard Fairey voor het eerst bekend met de « André the Giant Has a Posse » stickers.;
28;nl;Welke verjaardag vierde het beroemde zonnebrillenmerk Ray-Ban in 2012 ?;Zijn 75 jaar;Zijn 100 jaar;Zijn 50 jaar;Zijn 25 jaar;Expert;De Amerikaanse luchtmacht bestelde in 1933 een model voor haar jachtpiloten dat de naam Aviator kreeg toen het in 1936 op de markt werd gebracht.;https://nl.wikipedia.org/wiki/Ray-Ban
29;nl;Wie is de manager van zangeres en actrice Jane Birkin ?;Olivier Gluzman;Adam Alpert;Steve Goncalves;Tim Smith;Expert;Bijna volledig afwezig in de bioscoop in de jaren negentig, keert Jane Birkin terug met een iconische status in haar films.;https://nl.wikipedia.org/wiki/Jane_Birkin
30;nl;Wat is de titel van de musical Spice Girls die in 2012 wordt gepresenteerd ?;« Viva Forever »;« Too Much »;« Holler »;« Headlines »;Expert;Na een persconferentie in het Saint Pancras Hotel ging « Viva Forever » in 2012 in première in het Picadilly Theatre in Londen.;https://nl.wikipedia.org/wiki/Viva_Forever
