1;fr;Dans quelle ville est exposé le masque doré du cercueil de Toutânkhamon ?;Le Caire;Louxor;Boulaq;Alexandrie;Débutant;Le musée égyptien du Caire est l'un des plus grands musées entièrement consacré à l'Antiquité égyptienne.;https://fr.wikipedia.org/wiki/Masque_funéraire_de_Toutânkhamon
2;fr;Quel métier exerçait Howard Carter, fils du peintre animalier Samuel John Carter ?;Archéologue;Physicien;Journaliste;Décorateur;Débutant;Howard Carter est principalement connu pour avoir découvert en 1922 la tombe de Toutânkhamon.;https://fr.wikipedia.org/wiki/Howard_Carter
3;fr;Combien de sarcophages protégeaient la momie de Toutânkhamon ?;Trois;Deux;Quatre;Cinq;Débutant;Au bout de soixante-dix jours, Toutânkhamon sera inhumé, selon les rites funéraires royaux.;https://fr.wikipedia.org/wiki/Toutânkhamon
4;fr;De quelle matière est fait le masque mortuaire de Toutânkhamon ?;Or;Bronze;Plâtre;Argent;Débutant;Sur le visage de Toutânkhamon est rabattu un masque en or fin dont les traits rappellent le visage de la reine Tiyi.;https://fr.wikipedia.org/wiki/Toutânkhamon
5;fr;Quel matériau précieux évoquait le dieu Soleil pour les Égyptiens ?;Or;Platine;Titane;Palladium;Débutant;Dans la mythologie égyptienne, Rê (ou Râ) est le dieu du disque solaire et le créateur de l'univers.;https://fr.wikipedia.org/wiki/Rê
6;fr;Quel est le plus vaste musée consacré à la civilisation de l'Égypte ancienne ?;Musée du Caire;Musée de Gizeh;Musée de Fayoum;Musée de Banha ;Débutant;Le musée du Caire a reçu plus de cent millions de visiteurs au cours du XXe siècle.;https://fr.wikipedia.org/wiki/Musée_égyptien_du_Caire
7;fr;De quoi est fait le sarcophage extérieur protégeant la momie de Toutânkhamon ?;Bois;Fer;Roche;Papyrus;Débutant;La tombe de Toutânkhamon aurait été visitée par deux fois par les pilleurs de tombe.;https://fr.wikipedia.org/wiki/Toutânkhamon
8;fr;Par quelle technique les Égyptiens ouvraient-ils à l'âme le monde souterrain ?;Embaumement;Dissection;Crémation;Pendaison;Débutant;Dans l'Égypte ancienne, les embaumeurs sont également appelés « taricheutes », signifiant « viande conservée, corps embaumé ».;https://fr.wikipedia.org/wiki/Embaumement
9;fr;Dans l'Égypte antique, quelle demeure était indispensable à la vie éternelle ?;Sarcophage;Baptistère;Mausolée;Colombarium;Débutant;Le plus souvent sculpté dans la pierre et placé au-dessus du sol, le sarcophage est parfois enterré.;https://fr.wikipedia.org/wiki/Sarcophage
10;fr;Dans quelle vallée a été découvert le tombeau du pharaon Toutânkhamon ?;Vallée des rois;Vallée des princes;Vallée des ducs;Vallée des dieux;Débutant;La vallée des rois est une région d'Égypte située sur la rive occidentale du Nil à la hauteur de Thèbes (aujourd'hui Louxor).;https://fr.wikipedia.org/wiki/Vallée_des_rois
11;fr;Quel est le poids du masque funéraire en or massif du cercueil de Toutânkhamon ?;11 kg;8 kg;5 kg;2 kg;Confirmé;Cette sculpture, découverte en 1925, est un véritable chef-d'oeuvre de l'orfèvrerie égyptienne.;https://fr.wikipedia.org/wiki/Masque_funéraire_de_Toutânkhamon
12;fr;Sur le masque de Toutânkhamon, quel animal repousse les ennemis de son souffle ?;Cobra;Cheval;Dragon;Scorpion;Confirmé;Dans la mythologie égyptienne, Ouadjet est une déesse cobra protectrice de la Basse-Égypte.;https://fr.wikipedia.org/wiki/Masque_funéraire_de_Toutânkhamon
13;fr;Que symbolise la barbe postiche du masque funéraire de Toutânkhamon ?;Immortalité;Puissance;Gloire;Postérité;Confirmé;Dans l'Égypte antique, la barbe postiche est l'un des attributs que partage le pharaon avec les dieux.;https://fr.wikipedia.org/wiki/Barbe_postiche
14;fr;Quel matériau précieux symbolise les os du pharaon défunt ?;Argent;Or;Platine;Bronze;Confirmé;Les expositions consacrées à Toutânkhamon connaissent très régulièrement un succès populaire considérable.;https://fr.wikipedia.org/wiki/Tombeau_de_Toutânkhamon
15;fr;Quel mécène finança les fouilles du tombeau de Toutânkhamon par Howard Carter ?;Lord Carnarvon;Thomas Young;Harry Burton;Geoffrey Martin;Confirmé;Lord Carnarvon se maria en 1895 avec la très riche Almina Wombwell, fille naturelle du banquier Alfred de Rothschild.;https://fr.wikipedia.org/wiki/George_Herbert_(égyptologue)
16;fr;À qui fut d'abord réservé l'embaumement sous l'Ancien Empire égyptien ?;Aux pharaons;Aux scribes;Aux prêtres;Aux animaux;Confirmé;L'embaumement désigne l'ensemble des techniques visant à conserver les corps des personnes mortes.;https://fr.wikipedia.org/wiki/Embaumement
17;fr;Combien de marches descendent vers la porte d'entrée de la tombe de Toutânkhamon ?;Seize;Trente;Quatre;Cinquante;Confirmé;De là, un corridor conduit à une porte fermant l'entrée de la première pièce, appelée « antichambre » par Carter.;https://fr.wikipedia.org/wiki/Tombeau_de_Toutânkhamon
18;fr;Comment la première pièce de la tombe de Toutânkhamon a-t-elle été appelée ?;Antichambre;Vestibule;Réserve;Dortoir;Confirmé;Lors de sa découverte, l'antichambre contenait plus de 700 pièces entassées pêle-mêle.;https://fr.wikipedia.org/wiki/Tombeau_de_Toutânkhamon
19;fr;Par quoi la momie de Toutânkhamon a-t-elle été presque carbonisée ?;Onguents;Souffre;Natron;Bronze;Confirmé;C'est en effet par les onguents versés au moment de l'inhumation que la momie a presque été carbonisée.;https://fr.wikipedia.org/wiki/Toutânkhamon
20;fr;Combien de filles, mortes prématurément, le pharaon Toutânkhamon aurait-il eues ?;Deux;Trois;Quatre;Cinq;Confirmé;L'examen de leurs momies réalisé en 2011 a révélé qu'un des foetus est mort à cinq ou six mois de grossesse.;https://fr.wikipedia.org/wiki/Toutânkhamon
21;fr;Qui a découvert en 1922 le tombeau de Toutânkhamon ?;Howard Carter;Somers Clarke;Henry Salt;Alfred Lucas;Expert;En 1924, il effectua de nombreuses interviews aux États-Unis où il y était vu comme une véritable star.;https://fr.wikipedia.org/wiki/Howard_Carter
22;fr;Quelle désignation égyptologique est utilisée pour le tombeau de Toutânkhamon ?;KV62;MC23;DS36;ZX44;Expert;La visite de la tombe KV62 est soumise à une tarification particulière qui peut toutefois varier en fonction des saisons.;https://fr.wikipedia.org/wiki/Tombeau_de_Toutânkhamon
23;fr;Combien d'oeuvres et de pièces de mobilier contenait la tombe de Toutânkhamon ?;2 099;1 245;3 627;4 830;Expert;La « chambre du trésor » contenait des maquettes de bateaux, de nombreuses statues et deux momies de foetus.;https://fr.wikipedia.org/wiki/Tombeau_de_Toutânkhamon
24;fr;Quel nom porte la coiffe la plus emblématique des pharaons ?;Némès;Pakol;Causia;Kippa;Expert;Le némès est un couvre-chef de tissu, assez complexe, composé de plusieurs parties.;https://fr.wikipedia.org/wiki/Némès
25;fr;Quelle déesse protectrice du pharaon se retrouve sur le masque de Toutânkhamon ?;Nekhbet;Kekou;Miysis;Hathor;Expert;Dans son rôle de protectrice du pharaon, Nekhbet est associée à la déesse cobra Ouadjet symbole de Basse-Égypte.;https://fr.wikipedia.org/wiki/Nekhbet
26;fr;Quel minerai était souvent utilisé pour les bijoux funéraires chez les Égyptiens ?;Améthyste;Zircon;Grenat;Opale;Expert;La couleur de l'améthyste ne reste stable que jusqu'à 250°C. Au-delà, la plupart des améthystes se décolorent.;https://fr.wikipedia.org/wiki/Améthyste
27;fr;De quoi sont incrustés les yeux du célèbre masque de Toutânkhamon ?;Lapis-lazuli;Agate;Topaze;Turquoise;Expert;Le lapis-lazuli est surtout connu comme pierre ornementale, opaque, de couleur bleue.;https://fr.wikipedia.org/wiki/Lapis-lazuli
28;fr;Quel minerai permettait aux Égyptiens de déshydrater les tissus humains ?;Natron;Nickel;Lithium;Bismuth;Expert;Les Égyptiens ont observé la similitude de matière entre le natron purifié, chauffé et asséché et la partie soluble dans l'eau.;https://fr.wikipedia.org/wiki/Natron
29;fr;Que glissait-on sous le visage des momies pour leur redonner leur forme ?;Argile;Gypse;Ocre;Houille;Expert;Une momie est un cadavre qui a été préservé de la destruction et de la putréfaction.;https://fr.wikipedia.org/wiki/Momie
30;fr;De quelle maladie infectieuse la momie de Toutânkhamon était-elle porteuse ?;Paludisme;Rougeole;Tuberculose;Malaria;Expert;Quatre des momies faisant partie de l'étude, y compris celle de Toutânkhamon, sont porteuses de parasites du paludisme.;https://fr.wikipedia.org/wiki/Toutânkhamon
1;en;In which city is the golden mask of Tutankhamun's coffin on display ?;Cairo;Luxor;Boulaq;Alexandria;Débutant;The Egyptian Museum in Cairo is one of the largest museums entirely devoted to Egyptian Antiquity.;
2;en;What profession did Howard Carter, son of animal painter Samuel John Carter, do ?;Archaeologist;Physicist;Journalist;Decorator;Débutant;Howard Carter is best known for having discovered Tutankhamun's tomb in 1922.;https://en.wikipedia.org/wiki/Howard_Carter
3;en;How many sarcophagi protected Tutankhamun's mummy ?;Three;Two;Four;Five;Débutant;At the end of seventy days, Tutankhamun will be buried, according to the royal funeral rites.;
4;en;What material is Tutankhamun's death mask made of ?;Gold;Bronze;Plaster;Money;Débutant;Over the face of Tutankhamun is folded a fine gold mask whose features recall the face of Queen Tiyi.;
5;en;What precious material evoked the Sun god for the Egyptians ?;Gold;Platinum;Titanium;Palladium;Débutant;In Egyptian mythology, Ra (or Ra) is the god of the solar disk and the creator of the universe.;
6;en;What is the largest museum dedicated to the civilization of ancient Egypt ?;Cairo Museum;Giza Museum;Fayoum Museum;Banha Museum;Débutant;The Cairo Museum received over one hundred million visitors during the XX \u003csup\u003e th \u003c/sup\u003e century.;
7;en;What is the outer sarcophagus protecting Tutankhamun's mummy made of ?;Wood;Iron;Rock;Papyrus;Débutant;Tutankhamun's tomb is said to have been visited twice by tomb robbers.;
8;en;By what technique did the Egyptians open the underground world to the soul ?;Embalming;Dissection;Cremation;Hanging;Débutant;In ancient Egypt, embalmers are also called taricheutes, meaning preserved meat, embalmed body.;https://en.wikipedia.org/wiki/Embalming
9;en;In ancient Egypt, what abode was essential for eternal life ?;Sarcophagus;Baptistery;Mausoleum;Colombarium;Débutant;Most often carved in stone and placed above the ground, the sarcophagus is sometimes buried.;https://en.wikipedia.org/wiki/Sarcophagus
10;en;In which valley was the tomb of Pharaoh Tutankhamun discovered ?;Valley of the Kings;Valley of the Princes;Valley of the Dukes;Valley of the Gods;Débutant;The Valley of the Kings is a region of Egypt located on the west bank of the Nile at the height of Thebes (now Luxor).;
11;en;What is the weight of the solid gold funerary mask from Tutankhamun's coffin ?;11 kg;8 kg;5 kg;2 kg;Confirmé;This sculpture, discovered in 1925, is a true masterpiece of Egyptian goldsmithing.;
12;en;On Tutankhamun's mask, which animal repels enemies with its breath ?;Cobra;Horse;Dragon;Scorpio;Confirmé;In Egyptian mythology, Wadjet is a protective cobra goddess of Lower Egypt.;
13;en;What does the false beard of Tutankhamun's funeral mask symbolize ?;Immortality;Power;Glory;Posterity;Confirmé;In ancient Egypt, the false beard is one of the attributes that the pharaoh shares with the gods.;
14;en;What precious material symbolizes the bones of the deceased pharaoh ?;Money;Gold;Platinum;Bronze;Confirmé;The exhibitions devoted to Tutankhamun very regularly experience considerable popular success.;
15;en;Which patron funded Howard Carter's excavation of Tutankhamun's tomb ?;Lord Carnarvon;Thomas Young;Harry Burton;Geoffrey Martin;Confirmé;Lord Carnarvon married in 1895 with the very rich Almina Wombwell, natural daughter of the banker Alfred de Rothschild.;
16;en;Who was first reserved for embalming under the Old Egyptian Empire ?;To the pharaohs;To the scribes;To priests;To animals;Confirmé;Embalming refers to all the techniques aimed at preserving the bodies of dead people.;https://en.wikipedia.org/wiki/Embalming
17;en;How many steps go down to the front door of Tutankhamun's tomb ?;Sixteen;Thirty;Four;Fifty;Confirmé;From there, a corridor leads to a door closing the entrance to the first room, called the antechamber by Carter.;
18;en;What was the first room in Tutankhamun's tomb called ?;Antechamber;Vestibule;Reserve;Dormitory;Confirmé;When it was discovered, the antechamber contained more than 700 rooms piled up jumbled together.;
19;en;How was Tutankhamun's mummy almost charred ?;Ointments;Suffers;Natron;Bronze;Confirmé;It is indeed by the ointments poured at the time of burial that the mummy was almost charred.;
20;en;How many daughters who died prematurely would Pharaoh Tutankhamun have had ?;Two;Three;Four;Five;Confirmé;Examination of their mummies in 2011 revealed that one of the fetuses died at five or six months of pregnancy.;
21;en;Who discovered Tutankhamun's tomb in 1922 ?;Howard Carter;Somers Clarke;Henry Salt;Alfred Lucas;Expert;In 1924, he did many interviews in the United States where he was seen as a real star.;https://en.wikipedia.org/wiki/Howard_Carter
22;en;What Egyptian designation is used for Tutankhamun's tomb ?;KV62;MC23;DS36;ZX44;Expert;The visit to the KV62 tomb is subject to a specific price which may vary depending on the season.;
23;en;How many works and pieces of furniture did Tutankhamun's tomb contain ?;2,099;1,245;3,627;4,830;Expert;The treasure chamber contained models of ships, numerous statues and two mummies of fetuses.;
24;en;What name does the most emblematic headdress of the pharaohs bear ?;Nemes;Pakol;Causia;Kippa;Expert;The nemes is a head covering of fabric, quite complex, made up of several parts.;
25;en;Which protective goddess of the pharaoh is found on Tutankhamun's mask ?;Nekhbet;Kekou;Miysis;Hathor;Expert;In her role of protector of the pharaoh, Nekhbet is associated with the cobra goddess Ouadjet, symbol of Lower Egypt.;https://en.wikipedia.org/wiki/Nekhbet
26;en;What mineral was often used for funerary jewelry among the Egyptians ?;Amethyst;Zircon;Garnet;Opal;Expert;The color of amethyst only remains stable up to 250 ° C. Beyond that, most amethysts will discolour.;
27;en;What are the eyes of the famous Tutankhamun mask encrusted with ?;Lapis-lazuli;Agate;Topaz;Turquoise;Expert;Lapis lazuli is best known as an ornamental stone, opaque, blue in color.;https://en.wikipedia.org/wiki/Lapis lazuli
28;en;What mineral allowed the Egyptians to dehydrate human tissue ?;Natron;Nickel;Lithium;Bismuth;Expert;The Egyptians observed the similarity in matter between the purified, heated and dried natron and the water soluble part.;https://en.wikipedia.org/wiki/Natron
29;en;What did we slip under the mummies' faces to restore their shape ?;Clay;Gypsum;Ocher;Coal;Expert;A mummy is a corpse that has been preserved from destruction and decay.;https://en.wikipedia.org/wiki/Mummy
30;en;What infectious disease was Tutankhamun's mummy a carrier of ?;Malaria;Measles;Tuberculosis;Malaria;Expert;Four of the mummies included in the study, including Tutankhamun's, are carriers of malaria parasites.;
1;de;In welcher Stadt ist die goldene Maske von Tutanchamuns Sarg ausgestellt ?;Kairo;Luxor;Boulaq;Alexandria;Débutant;Das Ägyptische Museum in Kairo ist eines der größten Museen, die sich ausschließlich der ägyptischen Antike widmen.;
2;de;Welchen Beruf hat Howard Carter, Sohn des Tiermalers Samuel John Carter, ausgeübt ?;Archäologe;Physiker;Journalist;Dekorateur;Débutant;Howard Carter ist am bekanntesten dafür, dass er 1922 Tutanchamuns Grab entdeckt hat.;https://de.wikipedia.org/wiki/Howard_Carter
3;de;Wie viele Sarkophage schützten Tutanchamuns Mumie ?;Drei;Zwei;Vier;Fünf;Débutant;Am Ende von siebzig Tagen wird Tutanchamun gemäß den königlichen Bestattungsriten begraben.;
4;de;Aus welchem Material besteht Tutanchamuns Totenmaske ?;Gold;Bronze;Gips;Geld;Débutant;Über dem Gesicht von Tutanchamun ist eine feine Goldmaske gefaltet, deren Gesichtszüge an das Gesicht von Königin Tiyi erinnern.;
5;de;Welches kostbare Material rief den Sonnengott für die Ägypter hervor ?;Gold;Platin;Titan;Palladium;Débutant;In der ägyptischen Mythologie ist Rê (oder Râ) der Gott der Sonnenscheibe und der Schöpfer des Universums.;
6;de;Was ist das größte Museum, das der Zivilisation des alten Ägypten gewidmet ist ?;Kairo Museum;Gizeh Museum;Fayoum Museum;Banha Museum;Débutant;Das Kairoer Museum empfing im 20.;
7;de;Woraus besteht der äußere Sarkophag, der Tutanchamuns Mumie schützt ?;Holz;Eisen;Rock;Papyrus;Débutant;Tutanchamuns Grab soll zweimal von Grabräubern besucht worden sein.;
8;de;Mit welcher Technik haben die Ägypter die Untergrundwelt für die Seele geöffnet ?;Einbalsamierung;Präparation;Einäscherung;Hängend;Débutant;Im alten Ägypten werden Einbalsamierer auch Taricheutes genannt, was konserviertes Fleisch und einbalsamierter Körper bedeutet.;https://de.wikipedia.org/wiki/Einbalsamierung
9;de;Welcher Wohnsitz war im alten Ägypten für das ewige Leben wesentlich ?;Sarkophag;Baptisterium;Mausoleum;Colombarium;Débutant;Meistens in Stein gemeißelt und über dem Boden platziert, ist der Sarkophag manchmal begraben.;https://de.wikipedia.org/wiki/Sarkophag
10;de;In welchem Tal wurde das Grab des Pharao Tutanchamun entdeckt ?;Tal der Könige;Tal der Fürsten;Tal der Herzöge;Tal der Götter;Débutant;Das Tal der Könige ist eine Region Ägyptens am Westufer des Nils auf der Höhe von Theben (heute Luxor).;
11;de;Wie schwer ist die Grabmaske aus massivem Gold aus Tutanchamuns Sarg ?;11 kg;8 kg;5 kg;2 kg;Confirmé;Diese 1925 entdeckte Skulptur ist ein wahres Meisterwerk der ägyptischen Goldschmiedekunst.;
12;de;Welches Tier stößt auf Tutanchamuns Maske Feinde mit seinem Atem ab ?;Cobra;Pferd;Drache;Skorpion;Confirmé;In der ägyptischen Mythologie ist Wadjet eine schützende Kobra-Göttin aus Unterägypten.;
13;de;Was symbolisiert der falsche Bart von Tutanchamuns Trauermaske ?;Unsterblichkeit;Macht;Ruhm;Nachwelt;Confirmé;Im alten Ägypten ist der falsche Bart eines der Attribute, die der Pharao mit den Göttern teilt.;https://de.wikipedia.org/wiki/Königsbart
14;de;Welches kostbare Material symbolisiert die Knochen des verstorbenen Pharaos ?;Geld;Gold;Platin;Bronze;Confirmé;Die Ausstellungen, die Tutanchamun gewidmet sind, verzeichnen sehr regelmäßig einen beachtlichen Erfolg in der Bevölkerung.;
15;de;Welcher Gönner finanzierte Howard Carters Ausgrabung von Tutanchamuns Grab ?;Lord Carnarvon;Thomas Young;Harry Burton;Geoffrey Martin;Confirmé;Lord Carnarvon heiratete 1895 mit der sehr reichen Almina Wombwell, der leiblichen Tochter des Bankiers Alfred de Rothschild.;
16;de;Wer war zuerst für die Einbalsamierung unter dem altägyptischen Reich reserviert ?;Zu den Pharaonen;An die Schriftgelehrten;An die Priester;Zu Tieren;Confirmé;Embalming bezieht sich auf alle Techniken, die darauf abzielen, die Körper von Toten zu erhalten.;https://de.wikipedia.org/wiki/Einbalsamierung
17;de;Wie viele Stufen gehen zur Haustür von Tutanchamuns Grab hinunter ?;Sechzehn;Dreißig;Vier;Fünfzig;Confirmé;Von dort führt ein Korridor zu einer Tür, die den Eingang zum ersten Raum schließt, der von Carter Vorraum genannt wird.;
18;de;Wie hieß der erste Raum in Tutanchamuns Grab ?;Vorkammer;Vorraum;Reserve;Schlafsaal;Confirmé;Als es entdeckt wurde, enthielt der Vorraum mehr als 700 zusammengestapelte Räume.;
19;de;Wie war Tutanchamuns Mumie fast verkohlt ?;Salben;Leidet;Natron;Bronze;Confirmé;Durch die Salben, die zum Zeitpunkt der Beerdigung gegossen wurden, war die Mumie tatsächlich fast verkohlt.;
20;de;Wie viele Töchter, die vorzeitig gestorben sind, hätte Pharao Tutanchamun gehabt ?;Zwei;Drei;Vier;Fünf;Confirmé;Die Untersuchung ihrer Mumien im Jahr 2011 ergab, dass einer der Feten im fünften oder sechsten Schwangerschaftsmonat starb.;
21;de;Wer entdeckte 1922 Tutanchamuns Grab ?;Howard Carter;Somers Clarke;Henry Salt;Alfred Lucas;Expert;1924 führte er viele Interviews in den USA, wo er als echter Star angesehen wurde.;https://de.wikipedia.org/wiki/Howard_Carter
22;de;Welche ägyptische Bezeichnung wird für Tutanchamuns Grab verwendet ?;KV62;MC23;DS36;ZX44;Expert;Der Besuch des KV62-Grabes unterliegt einem bestimmten Preis, der je nach Jahreszeit variieren kann.;
23;de;Wie viele Werke und Möbelstücke enthielt Tutanchamuns Grab ?;2,099;1.245;3,627;4.830;Expert;Die Schatzkammer enthielt Schiffsmodelle, zahlreiche Statuen und zwei Mumien von Feten.;
24;de;Wie heißt der kultigste Kopfschmuck des Pharaos ?;Nemes;Pakol;Kausie;Kippa;Expert;Die Nemes sind eine ziemlich komplexe Kopfbedeckung aus Stoff, die aus mehreren Teilen besteht.;
25;de;Welche Schutzgöttin des Pharaos befindet sich auf Tutanchamuns Maske ?;Nekhbet;Kekou;Miysis;Hathor;Expert;In ihrer Rolle als Beschützerin des Pharaos ist Nekhbet mit der Kobra-Göttin Ouadjet, dem Symbol Unterägyptens, verbunden.;https://de.wikipedia.org/wiki/Nechbet
26;de;Welches Mineral wurde bei den Ägyptern oft für Grabschmuck verwendet ?;Amethyst;Zirkon;Granat;Opal;Expert;Die Farbe des Amethysts bleibt nur bis 250 ° C stabil. Darüber hinaus verfärben sich die meisten Amethysten.;
27;de;Womit sind die Augen der berühmten Tutanchamun-Maske verkrustet ?;Lapislazuli;Achat;Topas;Türkis;Expert;Lapislazuli ist am besten als Zierstein bekannt, undurchsichtig und blau.;https://de.wikipedia.org/wiki/Lapislazuli
28;de;Welches Mineral erlaubte den Ägyptern, menschliches Gewebe zu dehydrieren ?;Natron;Nickel;Lithium;Wismut;Expert;Die Ägypter beobachteten die Ähnlichkeit der Materie zwischen dem gereinigten, erhitzten und getrockneten Natron und dem wasserlöslichen Teil.;https://de.wikipedia.org/wiki/Soda (Mineral)
29;de;Was sind wir unter die Gesichter der Mumien gerutscht, um ihre Form wiederherzustellen ?;Ton;Gips;Ocker;Kohle;Expert;Eine Mumie ist eine Leiche, die vor Zerstörung und Verfall bewahrt wurde.;https://de.wikipedia.org/wiki/Mumie
30;de;Von welcher Infektionskrankheit war Tutanchamuns Mumie Trägerin ?;Malaria;Masern;Tuberkulose;Malaria;Expert;Vier der in die Studie einbezogenen Mumien, darunter die von Tutanchamun, sind Träger von Malariaparasiten.;
1;es;¿En qué ciudad se exhibe la máscara dorada del ataúd de Tutankamón ?;El Cairo;Luxor;Boulaq;Alejandría;Débutant;El Museo Egipcio de El Cairo es uno de los museos más grandes dedicados íntegramente a la Antigüedad egipcia.;
2;es;¿Qué profesión ejercía Howard Carter, hijo del pintor de animales Samuel John Carter ?;Arqueólogo;Físico;Periodista;Decorador;Débutant;Howard Carter es mejor conocido por haber descubierto la tumba de Tutankhamon en 1922.;https://es.wikipedia.org/wiki/Howard_Carter
3;es;¿Cuántos sarcófagos protegieron la momia de Tutankamón ?;Tres;Dos;Cuatro;Cinco;Débutant;Al final de los setenta días, Tutankhamon será enterrado, según los ritos funerarios reales.;
4;es;¿De qué material está hecha la máscara mortuoria de Tutankamón ?;Oro;Bronce;Yeso;Dinero;Débutant;Sobre el rostro de Tutankamón se dobla una fina máscara de oro cuyos rasgos recuerdan el rostro de la reina Tiyi.;
5;es;¿Qué material precioso evocaba al dios Sol para los egipcios ?;Oro;Platino;Titanio;Paladio;Débutant;En la mitología egipcia, Ra (o Ra) es el dios del disco solar y el creador del universo.;
6;es;¿Cuál es el museo más grande dedicado a la civilización del antiguo Egipto ?;Museo de El Cairo;Museo de Giza;Museo Fayoum;Museo Banha;Débutant;El Museo de El Cairo recibió más de cien millones de visitantes durante el siglo XX \u003csup\u003e th \u003c/sup\u003e.;
7;es;¿De qué está hecho el sarcófago exterior que protege la momia de Tutankamón ?;Madera;Hierro;Rock;Papiro;Débutant;Se dice que la tumba de Tutankamón fue visitada dos veces por ladrones de tumbas.;
8;es;¿Con qué técnica abrieron los egipcios el mundo subterráneo al alma ?;Embalsamamiento;Disección;Cremación;Colgando;Débutant;En el antiguo Egipto, los embalsamadores también se llaman taricheutes, que significa carne en conserva, cuerpo embalsamado.;https://es.wikipedia.org/wiki/Embalsamamiento
9;es;En el antiguo Egipto, ¿qué morada era esencial para la vida eterna ?;Sarcófago;Baptisterio;Mausoleo;Colombarium;Débutant;Muy a menudo tallado en piedra y colocado sobre el suelo, el sarcófago a veces se entierra.;https://es.wikipedia.org/wiki/Sarcófago
10;es;¿En qué valle se descubrió la tumba del faraón Tutankamón ?;Valle de los Reyes;Valle de los Príncipes;Valle de los Duques;Valle de los Dioses;Débutant;El Valle de los Reyes es una región de Egipto ubicada en la orilla oeste del Nilo a la altura de Tebas (ahora Luxor).;
11;es;¿Cuál es el peso de la máscara funeraria de oro macizo del ataúd de Tutankamón ?;11 kg;8 kg;5 kg;2 kg;Confirmé;Esta escultura, descubierta en 1925, es una verdadera obra maestra de la orfebrería egipcia.;
12;es;En la máscara de Tutankamón, ¿qué animal repele a los enemigos con su aliento ?;Cobra;Caballo;Dragón;Escorpio;Confirmé;En la mitología egipcia, Wadjet es una diosa cobra protectora del Bajo Egipto.;
13;es;¿Qué simboliza la barba postiza de la máscara funeraria de Tutankamón ?;Inmortalidad;Poder;Gloria;Posteridad;Confirmé;En el antiguo Egipto, la barba postiza es uno de los atributos que el faraón comparte con los dioses.;
14;es;¿Qué material precioso simboliza los huesos del faraón fallecido ?;Dinero;Oro;Platino;Bronce;Confirmé;Las exposiciones dedicadas a Tutankamón experimentan con mucha regularidad un considerable éxito popular.;
15;es;¿Qué patrocinador financió la excavación de Howard Carter de la tumba de Tutankhamon ?;Lord Carnarvon;Thomas Young;Harry Burton;Geoffrey Martin;Confirmé;Lord Carnarvon se casó en 1895 con la muy rica Almina Wombwell, hija natural del banquero Alfred de Rothschild.;
