1;fr;Sous quel autre nom est aussi connue des spécialistes la crypto-monnaie Peercoin ?;PPCoin;RipCoin;ConnectCoin;DualCoin;Débutant;Peercoin fut inspiré de Bitcoin et partage avec lui une grande partie de son code source ainsi que son implémentation technique.;https://fr.wikipedia.org/wiki/Peercoin
2;fr;Dans quel portefeuille peuvent être stockés les Ethers ?;Wallet;Basket;Magnet;Disket;Débutant;Ethereum est la deuxième plus importante monnaie cryptographique décentralisée avec une capitalisation supérieure à cent milliards.;https://fr.wikipedia.org/wiki/Ethereum
3;fr;Quel investisseur de crypto-monnaies est aussi le créateur du site bitcoin.com ?;Roger Ver;Gavin Wood;Charlie Lee;Sunny King;Débutant;À la fin de l'année 2013, Roger Ver a fait don en bitcoins de plus d'un million de dollars à la Fondation pour l'éducation économique.;https://fr.wikipedia.org/wiki/Bitcoin
4;fr;Combien compte-t-on à ce jour de crypto-monnaies de la catégorie infrastructure ?;Une dizaine;Une centaine;Une cinquantaine;Un millier;Débutant;Malgré leur faible nombre, ce sont ces crypto-monnaies qui sont susceptibles d'apporter des changements les plus profonds.;https://fr.wikipedia.org/wiki/Cryptomonnaie
5;fr;Qu'apporte la crypto-monnaie par rapport à d'autres solutions comme PayPal ?;Anonymat;Traçabilité;Identification;Frais de dossier;Débutant;De nouvelles directives européennes bientôt transposées en droit français vont donner priorité à la lutte contre le blanchiment.;https://fr.wikipedia.org/wiki/Cryptomonnaie
6;fr;En quelle année Bitcoin, la première crypto-monnaie, a-t-elle vu le jour ?;2009;2011;2013;2015;Débutant;En tant que monnaie ou commodité, les bitcoins peuvent être échangés contre d'autres monnaies, biens ou services.;https://fr.wikipedia.org/wiki/Bitcoin
7;fr;Quelle opération sert à valider les transactions et sécuriser le réseau Bitcoin ?;Minage;Routage;Débogage;Hachage;Débutant;Le fait de miner une cryptomonnaie consiste à fournir un service au réseau de ladite monnaie en échange d'une récompense pécuniaire.;https://fr.wikipedia.org/wiki/Minage_de_cryptomonnaie
8;fr;Dans quelle série télévisée créée par Sam Esmail parle-t-on du Bitcoin ?;« Mr. Robot »;« Breaking Bad »;« The Affair »;« Homeland »;Débutant;Selon The Guardian en 2016, « Mr. Robot » est l'une des séries les plus excitantes du moment, refusant de jouer selon les règles.;https://fr.wikipedia.org/wiki/Mr._Robot_(série_télévisée)
9;fr;Sur quelle plate-forme pouvez-vous acheter jusqu'à 200 crypto-monnaies différentes ?;Bittrex;Cryptopia;Kraken;CoinHouse;Débutant;Leur moteur de trading personnalisé a été conçu pour être évolutif et pour garantir que les ordres soient exécutés en temps réel.;https://fr.wikipedia.org/wiki/Cryptomonnaie
10;fr;Quel était le cours du bitcoin en janvier 2018, sachant qu'il valait 1 euro en 2001 ?;9 306 euros;7 607 euros;5 944 euros;3 519 euros;Débutant;Les bitcoins sont émis de façon dégressive jusqu'à atteindre un montant maximal de 21 millions dans quelques décennies.;https://fr.wikipedia.org/wiki/Bitcoin
11;fr;Quel ancien employé de Google a développé la monnaie électronique Litecoin ?;Charlie Lee;Kevin Castner;Terri Hall;Robert Walsh;Confirmé;Le réseau de Litecoin a pour but de créer un bloc toutes les deux minutes trente, plutôt que toutes les dix minutes pour Bitcoin.;https://fr.wikipedia.org/wiki/Litecoin
12;fr;En quelle année fut fondé le protocole de paiement open-source Stellar ?;2014;2012;2010;2016;Confirmé;Le procotole de paiement Stellar est supporté par une fondation à but non-lucratif, la Stellar Development Foundation.;https://fr.wikipedia.org/wiki/Stellar_(protocole_de_paiement)
13;fr;Quel type de crypto-monnaie va bien au-delà du simple moyen de paiement ?;Infrastructure;Social;Shopping;Local;Confirmé;Véritables poids lourds, on ne devrait pas les appeler crypto-monnaies, leur ambition allant au delà du paiement.;https://fr.wikipedia.org/wiki/Cryptomonnaie
14;fr;Quelle crypto-monnaie ultra-sécurisée cible exclusivement le marché du cannabis légal ?;PotCoin;PayCoin;ZiftrCoin;QuickCoin;Confirmé;En juin 2017, PotCoin a sponsorisé le voyage de l'ex star de la NBA Dennis Rodman, alors en visite en Corée du Nord.;https://fr.wikipedia.org/wiki/Cryptomonnaie
15;fr;Quel est le symbole utilisé par la crypto-monnaie Primecoin ?;Lettre psi;Aigle doré;Zéro rouge;Double carré;Confirmé;Le mécanisme de fonctionnement de cette crypto-monnaie participe à l'identification de nombres premiers de grande capacité.;https://fr.wikipedia.org/wiki/Cryptomonnaie
16;fr;Quel nom porte la première crypto-monnaie conçue pour les systèmes Android ?;MangoCoinz;Burstcoin;Reddcoin;Vertcoin;Confirmé;MangoCoinz utilise les senseurs de votre smartphone ou de votre tablette pour convertir l'énergie liée aux mouvements en monnaie.;https://fr.wikipedia.org/wiki/Cryptomonnaie
17;fr;Quel pays fut le premier à interdire l'utilisation du bitcoin sur son territoire ?;Thaïlande;Russie;Allemagne;États-Unis;Confirmé;En 2016, la banque centrale de Thaïlande a indiqué que le bitcoin n'était pas illégal mais a mis en garde contre son utilisation.;https://fr.wikipedia.org/wiki/Bitcoin
18;fr;Quelle crypto-monnaie exploite l'espace disque non utilisé d'un ordinateur ?;Burstcoin;Vertcoin;NameCoin;MangoCoinz;Confirmé;De l'espace libre suffit pour vérifier les transactions de la blockchain Burstcoin et ainsi recevoir des Burst en récompense de ce travail.;https://fr.wikipedia.org/wiki/Cryptomonnaie
19;fr;Quel développeur est depuis ses débuts au coeur de la crypto-monnaie Peercoin ?;Sunny King;Charlie Lee;Roger Ver;Gavin Wood;Confirmé;Peercoin fut inspiré de Bitcoin et partage avec lui une grande partie de son code source ainsi que son implémentation technique.;https://fr.wikipedia.org/wiki/PeerCoin
20;fr;Quelle crypto-monnaie tente d'inciter à la production d'électricité photovoltaïque ?;SolarCoin;Burstcoin;Vertcoin;NameCoin;Confirmé;La Fondation a conçu l'octroi de SolarCoins pour durer 40 ans, de manière à générer 97 500 TWh d'électricité de source solaire.;https://fr.wikipedia.org/wiki/SolarCoin
21;fr;Laquelle de ces plate-formes d'échange de crypto-monnaies a été créée en 2017 ?;Binance;CoinBase;Bibox;Bittrex;Expert;Sur Binance, plate-forme mondiale, vous pouvez trader un grand nombre d'Alt-coin différents avec du Bitcoin ou de l'Ethereum.;https://fr.wikipedia.org/wiki/Cryptomonnaie
22;fr;Quelle monnaie native est utilisée par le protocole de paiement Ripple ?;XRP;PRP;RIL;PPE;Expert;Lancé en 2012, le réseau Ripple vise à permettre des transactions financières mondiales sécurisées de toute taille sans rejets de débit.;https://fr.wikipedia.org/wiki/Ripple_(protocole_de_paiement)
23;fr;Quel docteur en informatique a publié le whitepaper de Polkadot ?;Gavin Wood;Charlie Lee;Sunny King;Roger Ver;Expert;Grâce à Polkadot, des blockchains différentes peuvent interchanger des messages de manière sécurisée et sans tiers de confiance.;https://fr.wikipedia.org/wiki/Polkadot
24;fr;Quelle crypto-monnaie a pour slogan « Unbank the banked » ?;OmiseGO;PotCoin;Burstcoin;SolarCoin;Expert;OmiseGO souhaite une décentralisation totale des flux financiers couplée à un accès généralisé aux outils financiers traditionnels.;https://fr.wikipedia.org/wiki/OmiseGO
25;fr;Quel type de crypto-monnaie à usage professionnel est surnommé Bitcoin 2.0 ?;Infrastructure;Social;Shopping;Local;Expert;Les projets de type infrastructure visent à construire de véritables alternatives aux systèmes financiers actuels existants.;https://fr.wikipedia.org/wiki/Cryptomonnaie
26;fr;Quelle crypto-monnaie locale est destinée aux habitants de l'Islande ?;AuroaCoin;NEO;PeerCoin;Litecoin;Expert;Les pièces ont été distribuées gratuitement aux 330 000 citoyens islandais via un largage le 25 mars 2014 à minuit.;https://fr.wikipedia.org/wiki/Cryptomonnaie
27;fr;Laquelle de ces crypto-monnaies est utilisable pour des investissements à long terme ?;NxT;Reddcoin;PeerCoin;NameCoin;Expert;Nxt a été conçu comme une plate-forme flexible autour de laquelle applications et services financiers peuvent être construits.;https://fr.wikipedia.org/wiki/Cryptomonnaie
28;fr;Quelle plate-forme d'échange de bitcoins fut rachetée par Mark Karpelès ?;Mt. Gox;CoinBase;Binance;Huobi;Expert;Son effondrement brutal survenu en février 2014 serait dû à un piratage informatique ayant résulté à une perte de 744 408 bitcoins.;https://fr.wikipedia.org/wiki/Mt._Gox
29;fr;En France, à qui le ministre de l'Économie a-t-il confié une mission sur le bitcoin ?;Jean-Pierre Landau;Serge Lasvignes;Jean Lemierre;Jean-Louis Levet;Expert;Jean-Pierre Landau enseigne à l'Université de Princeton, au sein de l'école Woodrow Wilson pour les relations internationales.;https://fr.wikipedia.org/wiki/Jean-Pierre_Landau_(haut_fonctionnaire)
30;fr;Quelle crypto-monnaie chinoise est similaire à Ethereum ?;NEO;NxT;PPCoin;XRP;Expert;Développée depuis 2014, NEO permet d'implémenter des smart contracts dans de nombreux langages de programmation.;https://fr.wikipedia.org/wiki/Cryptomonnaie
1;en;Under what other name is also known specialists cryptocurrency Peercoin ?;PPCoin;RipCoin;ConnectCoin;DualCoin;Débutant;Peercoin was inspired by Bitcoin and shares with him much of his source code as well as his technical implementation.;https://en.wikipedia.org/wiki/Peercoin
2;en;In which portfolio can the Ethers be stocked ?;Wallet;Basketball;Magnet;Disket;Débutant;Ethereum is the second largest decentralized cryptographic currency with a capitalization of more than one hundred billion.;https://en.wikipedia.org/wiki/Ethereum
3;en;Which cryptocurrency investor is also the creator of the site bitcoin.com ?;Roger Ver;Gavin Wood;Charlie Lee;Sunny King;Débutant;At the end of 2013, Roger Ver donated more than $ 1 million in bitcoins to the Foundation for Economic Education.;https://en.wikipedia.org/wiki/Bitcoin
4;en;How many crypto-currencies in the infrastructure category are there so far ?;A dozen;One hundred;About fifty;A thousand;Débutant;Despite their small numbers, it is these crypto-currencies that are likely to bring about the most profound changes.;https://en.wikipedia.org/wiki/Cryptocurrency
5;en;What does cryptocurrency bring compared to other solutions like PayPal ?;Anonymity;Traceability;Identification;Fees;Débutant;New European directives soon to be transposed into French law will give priority to the fight against money laundering.;https://en.wikipedia.org/wiki/Cryptocurrency
6;en;In which year did Bitcoin, the first cryptocurrency, come into being ?;2009;2011;2013;2015;Débutant;As a currency or commodity, bitcoins can be exchanged for other currencies, goods or services.;https://en.wikipedia.org/wiki/Bitcoin
7;en;Which operation is used to validate transactions and secure the Bitcoin network ?;Mining;Routing;Debugging;Hashing;Débutant;Mining a cryptocurrency consists in providing a service to the network of the currency in exchange for a pecuniary reward.;
8;en;In what television series created by Sam Esmail are we talking about Bitcoin ?;« Mr. Robot »;« Breaking Bad »;« The Affair »;« Homeland »;Débutant;According to The Guardian in 2016, « Mr. Robot » is one of the most exciting series of the moment, refusing to play by the rules.;
9;en;On which platform can you buy up to 200 different crypto-currencies ?;Bittrex;Cryptopia;Kraken;CoinHouse;Débutant;Their custom trading engine has been designed to be scalable and to ensure that orders are executed in real time.;https://en.wikipedia.org/wiki/Cryptocurrency
10;en;What was the price of bitcoin in January 2018, knowing that it was worth 1 euro in 2001 ?;EUR 9,306;EUR 7,607;EUR 5,944;EUR 3,519;Débutant;Bitcoins are being aggressively disbursed to a maximum of $ 21 million in a few decades.;https://en.wikipedia.org/wiki/Bitcoin
11;en;Which former Google employee developed the Litecoin electronic currency ?;Charlie Lee;Kevin Castner;Terri Hall;Robert Walsh;Confirmé;The goal of the Litecoin network is to create a block every two minutes thirty, rather than every ten minutes for Bitcoin.;https://en.wikipedia.org/wiki/Litecoin
12;en;In which year was the Stellar open-source payment protocol founded ?;2014;2012;2010;2016;Confirmé;The Stellar procotole is supported by a non-profit foundation, the Stellar Development Foundation.;https://en.wikipedia.org/wiki/Stellar_(payment_network)
13;en;What type of cryptocurrency goes well beyond the simple means of payment ?;Infrastructure;Social;Shopping;Local;Confirmé;True trucks, we should not call them crypto-currencies, their ambition going beyond payment.;https://en.wikipedia.org/wiki/Cryptocurrency
14;en;Which ultra-secure cryptocurrency exclusively targets the legal cannabis market ?;PotCoin;PayCoin;ZiftrCoin;QuickCoin;Confirmé;In June 2017, PotCoin sponsored the trip of former NBA star Dennis Rodman, then visiting North Korea.;https://en.wikipedia.org/wiki/Cryptocurrency
15;en;What is the symbol used by the cryptocurrency Primecoin ?;Psi letter;Golden eagle;Red Zero;Double square;Confirmé;The mechanism of operation of this cryptocurrency contributes to the identification of prime numbers of high capacity.;https://en.wikipedia.org/wiki/Cryptocurrency
16;en;What name is the first cryptocurrency designed for Android systems ?;MangoCoinz;Burstcoin;Reddcoin;Vertcoin;Confirmé;MangoCoinz uses the sensors on your smartphone or tablet to convert energy to money movements.;https://en.wikipedia.org/wiki/Cryptocurrency
17;en;Which country was the first to ban the use of bitcoin on its territory ?;Thailand;Russia;Germany;United States;Confirmé;In 2016, Thailand's central bank said that bitcoin was not illegal, but cautioned against using it.;https://en.wikipedia.org/wiki/Bitcoin
18;en;Which cryptocurrency exploits the unused disk space of a computer ?;Burstcoin;Vertcoin;NameCoin;MangoCoinz;Confirmé;Free space is enough to check the Burstcoin blockchain transactions and receive Burst for this job.;https://en.wikipedia.org/wiki/Cryptocurrency
19;en;Which developer is since its beginnings at the heart of cryptocurrency Peercoin ?;Sunny King;Charlie Lee;Roger Ver;Gavin Wood;Confirmé;Peercoin was inspired by Bitcoin and shares with him much of his source code as well as his technical implementation.;
20;en;Which cryptocurrency tries to encourage the production of photovoltaic electricity ?;SolarCoin;Burstcoin;Vertcoin;NameCoin;Confirmé;The Foundation has designed SolarCoins for 40 years to generate 97 500 TWh of solar power.;
21;en;Which of these cryptocurrency trading platforms was created in 2017 ?;Binance;CoinBase;Bibox;Bittrex;Expert;On Binance, a global platform, you can trade a large number of different Alt-coins with Bitcoin or Ethereum.;https://en.wikipedia.org/wiki/Cryptocurrency
22;en;Which native currency is used by the Ripple payment protocol ?;XRP;PRP;RIL;PPE;Expert;Launched in 2012, the Ripple network aims to enable secure global financial transactions of any size without debiting.;https://en.wikipedia.org/wiki/Ripple_(payment_protocol)
23;en;Which computer doctor has published the Polkadot whitepaper ?;Gavin Wood;Charlie Lee;Sunny King;Roger Ver;Expert;Thanks to Polkadot, different blockchains can interchange messages securely and without a trusted third party.;
24;en;Which cryptocurrency has the slogan « Unbank the banked » ?;OmiseGO;PotCoin;Burstcoin;SolarCoin;Expert;OmiseGO wants total decentralization of financial flows coupled with widespread access to traditional financial tools.;
25;en;What kind of business cryptocurrency is often nicknamed Bitcoin 2.0 ?;Infrastructure;Social;Shopping;Local;Expert;Infrastructure projects aim to build real alternatives to existing financial systems.;https://en.wikipedia.org/wiki/Cryptocurrency
26;en;Which local cryptocurrency is intended for the inhabitants of Iceland ?;AuroaCoin;NEO;PeerCoin;Litecoin;Expert;The coins were distributed free of charge to the 330,000 Icelandic citizens via a dropping on 25 March 2014 at midnight.;https://en.wikipedia.org/wiki/Cryptocurrency
27;en;Which of these crypto-currencies can be used for long-term investments ?;NxT;Reddcoin;PeerCoin;NameCoin;Expert;Nxt was conceived as a flexible platform around which financial applications and services can be built.;https://en.wikipedia.org/wiki/Cryptocurrency
28;en;Which bitcoin trading platform was bought by Mark Karpeles ?;Mt. Gox;CoinBase;Binance;Huobi;Expert;Its brutal collapse in February 2014 was due to hacking resulting in a loss of 744,408 bitcoins.;https://en.wikipedia.org/wiki/Mt._Gox
29;en;In France, who did the Minister of Economy entrust with a mission on bitcoin ?;Jean-Pierre Landau;Serge Lasvignes;Jean Lemierre;Jean-Louis Levet;Expert;Jean-Pierre Landau teaches at Princeton University, at Woodrow Wilson School for International Relations.;https://en.wikipedia.org/wiki/Jean-Pierre_Landau
30;en;Which Chinese cryptocurrency is similar to Ethereum ?;NEO;NxT;PPCoin;XRP;Expert;Developed since 2014, NEO enables the implementation of smart contracts in many programming languages.;https://en.wikipedia.org/wiki/Cryptocurrency
1;de;Unter welchem banderen Namen sind auch Spezialisten für Kryptowährung Peercoin bekannt ?;PPCoin;RipCoin;ConnectCoin;DualCoin;Débutant;Peercoin wurde von Bitcoin inspiriert und teilt mit ihm einen Großteil seines Quellcodes sowie seine technische Implementierung.;
2;de;In welchem Portfolio können die Ether gelagert werden ?;Brieftasche;Basketball;Magnet;Disket;Débutant;Ethereum ist die zweitgrößte dezentrale kryptografische Währung mit einer Kapitalisierung von mehr als einhundert Milliarden.;https://de.wikipedia.org/wiki/Ethereum
3;de;Welcher Cryptocurrency-Investor ist auch der Schöpfer der Site bitcoin.com ?;Roger Ver;Gavin Wood;Charlie Lee;Sunny King;Débutant;Ende 2013 spendete Roger Ver der Stiftung für wirtschaftliche Bildung mehr als 1 Million US-Dollar an Bitcoins.;https://de.wikipedia.org/wiki/Bitcoin
4;de;Wie viele Kryptowährungen in der Kategorie Infrastruktur gibt es bisher ?;Ein Dutzend;Einhundert;Ungefähr fünfzig;Tausend;Débutant;Trotz ihrer geringen Anzahl werden diese Kryptowährungen wahrscheinlich die tiefgreifendsten Veränderungen bewirken.;https://de.wikipedia.org/wiki/Kryptowährung
5;de;Was bringt die Kryptowährung im Vergleich zu anderen Lösungen wie PayPal ?;Anonymität;Rückverfolgbarkeit;Identifizierung;Gebühren;Débutant;Neue europäische Richtlinien, die in Kürze in französisches Recht umgesetzt werden, werden der Bekämpfung der Geldwäsche Vorrang einräumen.;https://de.wikipedia.org/wiki/Kryptowährung
6;de;In welchem Jahr entstand Bitcoin, die erste Kryptowährung ?;2009;2011;2013;2015;Débutant;Als Währung oder Ware können Bitcoins gegen andere Währungen, Waren oder Dienstleistungen eingetauscht werden.;https://de.wikipedia.org/wiki/Bitcoin
7;de;Mit welcher Operation werden Transaktionen validiert und das Bitcoin-Netzwerk gesichert ?;Bergbau;Routing;Debuggen;Hashing;Débutant;Das Mining einer Kryptowährung besteht darin, dem Netzwerk einen Dienst für die Währung gegen eine finanzielle Belohnung bereitzustellen.;
8;de;In welcher Fernsehserie von Sam Esmail geht es um Bitcoin ?;« Mr. Robot »;« Breaking Bad »;« The Affair »;« Homeland »;Débutant;Laut The Guardian aus dem Jahr 2016 ist « Mr. Robot » eine der aufregendsten Serien im Moment und weigert sich, die Regeln einzuhalten.;
9;de;Auf welcher Plattform können Sie bis zu 200 verschiedene Kryptowährungen kaufen ?;Bittrex;Kryptopie;Kraken;Münzhaus;Débutant;Ihre angepasste Trading-Engine wurde so konzipiert, dass sie skalierbar ist und die Ausführung von Aufträgen in Echtzeit gewährleistet.;https://de.wikipedia.org/wiki/Kryptowährung
10;de;Was war der Preis für Bitcoin im Januar 2018, als man wusste, dass es im Jahr 2001 1 Euro wert war ?;9.306 EUR;7.607 EUR;5.944 EUR;3.519 EUR;Débutant;Bitcoins werden in wenigen Jahrzehnten aggressiv auf maximal 21 Millionen US-Dollar ausgezahlt.;https://de.wikipedia.org/wiki/Bitcoin
11;de;Welcher ehemalige Google-Mitarbeiter hat die elektronische Währung Litecoin entwickelt ?;Charlie Lee;Kevin Castner;Terri Hall;Robert Walsh;Confirmé;Das Ziel des Litecoin-Netzwerks ist es, alle zwei Minuten und nicht alle zehn Minuten einen Block für Bitcoin zu erstellen.;https://de.wikipedia.org/wiki/Litecoin
12;de;In welchem Jahr wurde das Open-Source-Zahlungsprotokoll Stellar gegründet ?;2014;2012;2010;2016;Confirmé;Das Stellar-Protokoll wird von einer gemeinnützigen Stiftung, der Stellar Development Foundation, unterstützt.;https://de.wikipedia.org/wiki/Stellar_(Bezahlsystem)
13;de;Welche Art von Kryptowährung geht weit über das einfache Zahlungsmittel hinaus ?;Infrastruktur;Soziale;Einkaufen;Lokal;Confirmé;Wahre Lastwagen, wir sollten sie nicht als Kryptowährungen bezeichnen, ihr Ehrgeiz geht über die Bezahlung hinaus.;https://de.wikipedia.org/wiki/Kryptowährung
14;de;Welche hochsichere Kryptowährung zielt ausschließlich auf den legalen Cannabismarkt ab ?;PotCoin;PayCoin;ZiftrCoin;QuickCoin;Confirmé;Im Juni 2017 sponserte PotCoin die Reise des ehemaligen NBA-Stars Dennis Rodman nach Nordkorea.;https://de.wikipedia.org/wiki/Kryptowährung
15;de;Welches Symbol wird von der Kryptowährung Primecoin verwendet ?;Psi Brief;Steinadler;Rote Null;Doppelquadrat;Confirmé;Der Funktionsmechanismus dieser Kryptowährung trägt zur Identifizierung von Primzahlen mit hoher Kapazität bei.;https://de.wikipedia.org/wiki/Kryptowährung
16;de;Wie heißt die erste Kryptowährung, die für Android-Systeme entwickelt wurde ?;MangoCoinz;Burstcoin;Reddcoin;Vertcoin;Confirmé;MangoCoinz verwendet die Sensoren Ihres Smartphones oder Tablets, um Energie in Geldbewegungen umzuwandeln.;https://de.wikipedia.org/wiki/Kryptowährung
17;de;Welches Land hat als erstes die Verwendung von Bitcoin in seinem Hoheitsgebiet verboten ?;Thailand;Russland;Deutschland;Vereinigte Staaten;Confirmé;2016 erklärte die thailändische Zentralbank, dass Bitcoin nicht illegal sei, warnte jedoch davor, es zu verwenden.;https://de.wikipedia.org/wiki/Bitcoin
18;de;Welche Kryptowährung nutzt den nicht genutzten Speicherplatz eines Computers aus ?;Burstcoin;Vertcoin;NameCoin;MangoCoinz;Confirmé;Freier Speicherplatz reicht aus, um die Burstcoin-Blockchain-Transaktionen zu überprüfen und Burst für diesen Job zu erhalten.;https://de.wikipedia.org/wiki/Kryptowährung
19;de;Welcher Entwickler ist seit seinen Anfängen das Herzstück der Kryptowährung Peercoin ?;Sunny King;Charlie Lee;Roger Ver;Gavin Wood;Confirmé;Peercoin wurde von Bitcoin inspiriert und teilt mit ihm einen Großteil seines Quellcodes sowie seine technische Implementierung.;
20;de;Welche Kryptowährung soll die Erzeugung von Photovoltaik-Strom fördern ?;SolarCoin;Burstcoin;Vertcoin;NameCoin;Confirmé;Die Stiftung entwickelt SolarCoins seit 40 Jahren zur Erzeugung von 97 500 TWh Solarenergie.;
21;de;Welche dieser Kryptowährungs-Handelsplattformen wurde 2017 erstellt ?;Binance;CoinBase;Bibox;Bittrex;Expert;Auf Binance, einer globalen Plattform, können Sie eine große Anzahl verschiedener Alt-Münzen mit Bitcoin oder Ethereum handeln.;https://de.wikipedia.org/wiki/Kryptowährung
22;de;Welche einheimische Währung wird vom Ripple-Zahlungsprotokoll verwendet ?;XRP;PRP;RIL;PSA;Expert;Das 2012 gestartete Ripple-Netzwerk zielt darauf ab, sichere globale Finanztransaktionen jeder Größe ohne Belastung zu ermöglichen.;https://de.wikipedia.org/wiki/Ripple_(Geldsystem)
23;de;Welcher Computerarzt hat das Polkadot-Whitepaper veröffentlicht ?;Gavin Wood;Charlie Lee;Sunny King;Roger Ver;Expert;Dank Polkadot können verschiedene Blockchains Nachrichten sicher und ohne vertrauenswürdige Dritte austauschen.;https://de.wikipedia.org/wiki/Polkadot
24;de;Welche Kryptowährung hat der Slogan « Unbank the banked » ?;OmiseGO;PotCoin;Burstcoin;SolarCoin;Expert;OmiseGO möchte eine vollständige Dezentralisierung der Finanzströme in Verbindung mit einem umfassenden Zugang zu traditionellen Finanzinstrumenten.;
25;de;Welche Art von Business-Kryptowährung wird häufig als Bitcoin 2.0 bezeichnet ?;Infrastruktur;Soziale;Einkaufen;Lokal;Expert;Infrastrukturprojekte zielen darauf ab, echte Alternativen zu bestehenden Finanzsystemen zu schaffen.;https://de.wikipedia.org/wiki/Kryptowährung
26;de;Welche lokale Kryptowährung ist für die Bewohner Islands gedacht ?;AuroaCoin;NEO;PeerCoin;Litecoin;Expert;Die Münzen wurden am 25. März 2014 um Mitternacht kostenlos an die 330.000 isländischen Bürger verteilt.;https://de.wikipedia.org/wiki/Kryptowährung
27;de;Welche dieser Kryptowährungen kann für langfristige Investitionen verwendet werden ?;NxT;Reddcoin;PeerCoin;NameCoin;Expert;Nxt wurde als flexible Plattform konzipiert, auf der Finanzanwendungen und -dienste erstellt werden können.;https://de.wikipedia.org/wiki/Kryptowährung
28;de;Welche Bitcoin-Handelsplattform hat Mark Karpeles gekauft ?;Mt. Gox;CoinBase;Binance;Huobi;Expert;Der brutale Zusammenbruch im Februar 2014 war auf Hackerangriffe zurückzuführen, die einen Verlust von 744.408 Bitcoins zur Folge hatten.;https://de.wikipedia.org/wiki/Mt.Gox
29;de;Wen beauftragte der Wirtschaftsminister in Frankreich mit einer Mission für Bitcoin ?;Jean-Pierre Landau;Serge Lasvignes;Jean Lemierre;Jean-Louis Levet;Expert;Jean-Pierre Landau unterrichtet an der Princeton University der Woodrow Wilson School for International Relations.;
30;de;Welche chinesische Kryptowährung ähnelt Ethereum ?;NEO;NxT;PPCoin;XRP;Expert;NEO wurde seit 2014 entwickelt und ermöglicht die Implementierung intelligenter Verträge in vielen Programmiersprachen.;https://de.wikipedia.org/wiki/Kryptowährung
