91;es;¿Quién encarna sin duda la figura emblemática del grupo The Cure ?;Robert Smith;Roger O Donnell;Simon Gallup;Reeves Gabrels;Novato;A la edad de cinco años, Lol Tolhurst se convertirá en amigo de Robert Smith y más tarde creará la primera versión de The Cure.;https://es.wikipedia.org/wiki/Robert_Smith
92;es;¿Con qué movimiento musical todavía está asociado The Cure en la actualidad ?;Nueva ola;Roca;Pop;La danza;Novato;A principios de la década de 1980, surgieron muchas bandas importantes de las nuevas olas de las ciudades provinciales en el sur de Inglaterra.;https://es.wikipedia.org/wiki/New_wave
93;es;¿Cómo podemos describir el peinado del cantante Robert Smith ?;Arachne;Liso;En la plaza;Brushede;Novato;Muchos fans luego copian la ropa suelta y oscura de los músicos de la banda.;https://es.wikipedia.org/wiki/Robert_Smith
94;es;¿Qué título de The Cure se eliminará en el momento de la Guerra del Golfo ?;Matando a un árabe;No eres tú;Detener la molienda;Precisión;Novato;Esto será para disgusto de Robert Smith, quien recordará en conferencias de prensa el texto que lo inspiró.;https://es.wikipedia.org/wiki/Killing_an_Arab
95;es;¿Quién es el único miembro presente desde el origen del grupo The Cure ?;Robert Smith;Roger O Donnell;Simon Gallup;Reeves Gabrels;Novato;Robert Smith también ha sido miembro del jurado de la International Songwriting Competition (ISC).;https://es.wikipedia.org/wiki/Robert_Smith
96;es;¿Qué álbum es considerado la banda más negra de The Cure ?;Pornografía;Flores de sangre;Deseo;Desintegración;Novato;A pesar de su atmósfera opresiva y gótica, este álbum llegará al Top 10 en Inglaterra y en Nueva Zelanda.;https://es.wikipedia.org/wiki/Pornography
97;es;¿En qué ciudad del condado de Sussex se encuentra The Cure ?;Crawley;Basildon;Chichester;Littlehampton;Novato;Crawley está fuertemente influenciado por la influencia del Aeropuerto de Londres Gatwick, que ocupa toda la parte norte de la ciudad.;https://es.wikipedia.org/wiki/The_Cure
98;es;¿Qué instrumento de acompañamiento se presenta en The Cure ?;Baja;Saxofon;Piano;Trompeta;Novato;El bajo es, especialmente debido a la obra particular de Simon Gallup, un componente esencial de la música de The Cure.;https://es.wikipedia.org/wiki/The_Cure
99;es;¿A qué sello musical seguirá fiel The Cure hasta el 2001 ?;Fiction Records;Geffen Records;City Slang;Too Pure;Novato;Chris Parry, ex gerente de Jam y director artístico de Polydor, quería establecer su propio sello independiente.;https://es.wikipedia.org/wiki/Fiction_Records
100;es;¿Quién, por así decirlo, escribe las letras de todas las canciones de The Cure ?;Robert Smith;Simon Gallup;Reeves Gabrels;Jason Cooper;Novato;Según Thierry Desaules, las letras del álbum Pornography son simplemente sublimes y de gran poesía.;
101;es;¿Cuál es el título del primer single de The Cure lanzado en diciembre de 1978 ?;Matando a un árabe;Otro día;Entonces, qué;Fuego en El Cairo;Confirmado;Esta canción, inspirada en la novela de Camus The Foreign, asegura un comienzo de notoriedad gracias a fanzines alternativos.;https://es.wikipedia.org/wiki/Killing_an_Arab
102;es;¿En qué año lanzó Cure el lanzamiento de Three Imaginary Boys ?;1979;1981;1983;1985;Confirmado;The Melody Maker titrera acerca de este álbum: The Eighties Start Here (The 80's start here here).;https://es.wikipedia.org/wiki/Three_Imaginary_Boys
103;es;¿Qué segundo álbum de The Cure es más oscuro y helado que el primero ?;Diecisiete segundos;Pornografía;Fe;El Top;Confirmado;En el 2000, la revista Q colocó a Seventeen Seconds en el número 65 en su lista de los 100 mejores álbumes británicos.;https://es.wikipedia.org/wiki/Seventeen_Seconds_(álbum_de_The_Cure)
104;es;¿Quién se convertirá en el director de clips de The Cure ?;Tim Pope;Vincent Moon;Jonathan Glazer;Spike Jonze;Confirmado;Tim Pope también ha producido comerciales, episodios de series de televisión, documentales y un cortometraje.;https://es.wikipedia.org/wiki/Tim_Pope
105;es;¿Qué canción fue compuesta en 1986 para el programa de televisión The Children of Rock ?;Al igual que el cielo;Canción de cuna;Imágenes tuyas;Nunca es suficiente;Confirmado;La canción se introdujo en el álbum doble Kiss Me, Kiss Me, Kiss Me, disco de platino certificado.;https://es.wikipedia.org/wiki/Just_Like_Heaven
106;es;¿Qué miembro del grupo The Cure tuvo que ser hospitalizado después de un duelo ?;Simon Gallup;Reeves Gabrels;Jason Cooper;Roger O'Donnell;Confirmado;Roberto Soave, bajista de Shelley-an Orphan, estará a cargo de la Wish Tour durante los conciertos de noviembre de 1992.;https://es.wikipedia.org/wiki/Simon_Gallup
107;es;¿En qué banda sonora de la película participó The Cure con el título Burn ?;El Cuervo;Acero;Engendro;Hellboy;Confirmado;Esta es la última película en la que juega el actor Brandon Lee, quien murió durante el rodaje en una escena de tiro.;https://es.wikipedia.org/wiki/El_cuervo_(película_de_1994)
108;es;Después de Fiction Records, ¿con qué sello firmó The Cure en 2003 ?;Geffen Records;Epic Records;Lava Records;Pablo Records;Confirmado;Con motivo de la finalización del contrato con Fiction Records, viene la compilación Greatest Hits que incluye dos nuevos títulos.;https://es.wikipedia.org/wiki/Geffen_Records
109;es;¿Qué otro grupo es Robert Smith un ídolo para su cantante ?;Placebo;Los libertinos;Capitán Phoenix;Exuberante;Confirmado;Los miembros de esta formación colaboraron con Robert Smith, el líder de Placebo que incluso tuvo la oportunidad de entrevistar a su ídolo.;https://es.wikipedia.org/wiki/The_Cure
110;es;¿Cuántos álbumes vendió The Cure en todo el mundo a finales de 2018 ?;30 millones;40 millones;20 millones;10 millones;Confirmado;Además de las grabaciones oficiales, grabadas o en video, hay una gran cantidad de piratas que buscan los fanáticos.;https://es.wikipedia.org/wiki/The_Cure
111;es;¿Cuál de estas propuestas no significa un álbum en vivo de The Cure ?;Dublin;París;Entreat;Concierto;Experto;En 2018, The Cure lanzó oficialmente 5 álbumes en vivo, 12 álbumes de estudio y 11 VHS / DVD, sin contar numerosas compilaciones.;https://es.wikipedia.org/wiki/Anexo:Discografía_de_The_Cure
112;es;¿En qué país ganó rápidamente The Cure un gran éxito en 1980-81 ?;Nueva zelanda;Brasil;Rusia;Alemania;Experto;Este fenómeno pasó de varios años a Curemania, que afectará al continente europeo, y en particular a Francia.;https://es.wikipedia.org/wiki/The_Cure
113;es;¿Cuál fue el nombre anterior del grupo Easy Cure formado en 1976 ?;Malicia;Los libertinos;Spunge;Las membranas;Experto;Los miembros cambiarán el nombre del grupo (Easy Cure) en enero de 1977, y finalmente optarán por The Cure en abril de 1978.;https://es.wikipedia.org/wiki/Malice
114;es;¿En qué año apareció The Cure por primera vez en América del Sur ?;1987;1989;1985;1983;Experto;En este momento, The Cure recibió el título de mejor grupo extranjero del año en Brasil luego de ocho conciertos.;https://es.wikipedia.org/wiki/The_Cure
115;es;¿Quién se unió a The Cure justo antes de la gira mundial Kissing Tour ?;Roger O'Donnell;Tim Kingsbury;Chris Pitman;Andy Bown;Experto;En la introducción, un cortometraje de cinco minutos muestra los primeros planos de la boca y los ojos de Robert Smith.;https://es.wikipedia.org/wiki/Roger_O'Donnell
116;es;¿Qué grupo hizo la primera parte del Tour de oración de The Cure ?;Shelleyan huérfano;Héroe de culto;Brote Prefabricado;Plano de Ficción;Experto;Como testimonio de esta gira, el álbum en vivo Entreat grabado en julio en el Wembley Arena se lanzará el año siguiente.;
117;es;¿Qué emisor de radio apareció en la banda de FM inglesa en 1990 ?;Cure FM;Smith FM;Wish FM;Day FM;Experto;Esta estación, alojada por miembros de Cure, estaba destinada a promover Mixed Up, un disco de remixes.;https://es.wikipedia.org/wiki/The_Cure
118;es;¿Quién le otorgó el premio The Cure the Godlike Genius Award en 2009 ?;Tim Burton;Robert De Niro;Sean Penn;Stephen Frears;Experto;The Cure ha recibido este premio por todos los Premios NME a manos de Tim Burton, quien se inspiró en el grupo.;https://es.wikipedia.org/wiki/The_Cure
119;es;¿Qué grupo holandés es un verdadero grupo clónico de The Cure ?;La esencia;El diesel;El butano;El propano;Experto;El grupo de la década de 1980 reproduce los arreglos de los británicos y copia la voz y las frases de Robert Smith.;https://es.wikipedia.org/wiki/The_Cure
120;es;¿En qué año recibió The Cure el premio Brit a la mejor banda británica ?;1991;1993;1995;1997;Experto;The Cure también recibió un MTV Video Music Award, un Juno Award, un NME Award y varios premios Grammy.;https://es.wikipedia.org/wiki/The_Cure
121;it;Chi incarna senza dubbio la figura emblematica del gruppo The Cure ?;Robert Smith;Roger O Donnell;Simon Gallup;Reeves Gabrels;Newbie;All'età di cinque anni, Lol Tolhurst diventerà amico di Robert Smith e in seguito creerà la prima versione di The Cure.;https://it.wikipedia.org/wiki/Robert_Smith_(musicista)
122;it;Quale movimento musicale è ancora associato a The Cure ?;Nuova ondata;Rock;Pop;Danza;Newbie;Nei primi anni '80, molte importanti band new wave sorsero dalle città di provincia nel sud dell'Inghilterra.;https://it.wikipedia.org/wiki/New_wave_(musica)
123;it;Come possiamo descrivere l'acconciatura del cantante Robert Smith ?;Arachne;Liscio;Nel quadrato;Brushede;Newbie;Molti fan poi copiano gli abiti larghi e scuri dei musicisti della band.;https://it.wikipedia.org/wiki/Robert_Smith_(musicista)
124;it;Quale titolo di The Cure verrà rimosso al tempo della Guerra del Golfo ?;Uccidere un arabo;Non sei tu;Grinding Halt;Precisione;Newbie;Questo sarà per il dispiacere di Robert Smith che ricorderà nelle conferenze stampa il testo che lo ha ispirato.;https://it.wikipedia.org/wiki/Killing_an_Arab
125;it;Chi è l'unico membro presente dall'origine del gruppo The Cure ?;Robert Smith;Roger O Donnell;Simon Gallup;Reeves Gabrels;Newbie;Robert Smith è stato anche membro della giuria dell'International Songwriting Competition (ISC).;https://it.wikipedia.org/wiki/Robert_Smith_(musicista)
126;it;Quale album è considerato la band più nera di The Cure ?;Pornografia;Bloodflowers;Wish;Disintegrazione;Newbie;Nonostante la sua atmosfera opprimente e gotica, questo album raggiungerà la Top 10 in Inghilterra e in Nuova Zelanda.;https://it.wikipedia.org/wiki/Pornography
127;it;In quale città della contea di Sussex si trova The Cure ?;Crawley;Basildon;Chichester;Littlehampton;Newbie;Crawley è fortemente influenzato dall'influenza dell'aeroporto di Londra Gatwick che occupa l'intera parte settentrionale della città.;https://it.wikipedia.org/wiki/The_Cure
128;it;Quale strumento di accompagnamento è presente in The Cure ?;Basso;Sassofono;Piano;Tromba;Newbie;Il basso è, soprattutto a causa della particolare esecuzione di Simon Gallup, un componente essenziale della musica di The Cure.;https://it.wikipedia.org/wiki/The_Cure
129;it;A quale etichetta musicale saranno conservati i Cure fino al 2001 ?;Fiction Records;Geffen Records;City Slang;Too Pure;Newbie;Chris Parry, ex manager di Jam e direttore artistico di Polydor, voleva fondare la propria etichetta indipendente.;https://it.wikipedia.org/wiki/Fiction_Records
130;it;Chi, per così dire, scrive i testi di tutte le canzoni di The Cure ?;Robert Smith;Simon Gallup;Reeves Gabrels;Jason Cooper;Newbie;Secondo Thierry Desaules, i testi dell'album Pornography sono semplicemente sublimi e di grande poesia.;
131;it;Qual è il titolo del primo singolo di The Cure pubblicato nel dicembre 1978 ?;Uccidere un arabo;Un altro giorno;Quindi cosa;Incendio al Cairo;Confermato;Questa canzone, ispirata al romanzo di Camus The Foreign, assicura un inizio di notorietà grazie alle fanzine alternative.;https://it.wikipedia.org/wiki/Killing_an_Arab
132;it;In che anno ha pubblicato la Cure Three Imaginary Boys ?;1979;1981;1983;1985;Confermato;The Melody Maker parlerà di questo album: The Eighties Start Here (Gli anni '80 iniziano qui).;https://it.wikipedia.org/wiki/Three_Imaginary_Boys
133;it;Quale secondo album di The Cure è più scuro e ghiacciato del primo ?;Diciassette secondi;Pornografia;Fede;The Top;Confermato;Nel 2000, la rivista Q collocò Diciassette secondi al n. 65 nella sua lista dei 100 migliori album britannici.;https://it.wikipedia.org/wiki/Seventeen_Seconds
134;it;Chi diventerà il direttore delle clip di The Cure ?;Tim Pope;Vincent Moon;Jonathan Glazer;Spike Jonze;Confermato;Tim Pope ha anche prodotto spot pubblicitari, episodi di serie televisive, documentari e un cortometraggio.;
135;it;Quale canzone è stata composta nel 1986 per il programma televisivo The Children of Rock ?;Solo come il Paradiso;Ninnananna;Foto di te;Mai abbastanza;Confermato;La canzone è stata introdotta nel doppio album Kiss Me, Kiss Me, Kiss Me, disco in platino certificato.;https://it.wikipedia.org/wiki/Just_Like_Heaven_(singolo)
136;it;Quale membro del gruppo The Cure ha dovuto essere ricoverato in ospedale a seguito di un lutto ?;Simon Gallup;Reeves Gabrels;Jason Cooper;Roger O'Donnell;Confermato;Roberto Soave, Shelley, un bassista di Orphan, sarà responsabile del Wish Tour durante i concerti nel novembre 1992.;https://it.wikipedia.org/wiki/Simon_Gallup
137;it;A quale colonna sonora del film hanno partecipato The Cure con il senza titolo Burn ?;Il corvo;Acciaio;Spawn;Hellboy;Confermato;Questo è l'ultimo film in cui recita l'attore Brandon Lee, morto durante le riprese in una scena di tiro.;https://it.wikipedia.org/wiki/Il_corvo_-_The_Crow
138;it;Dopo la Fiction Records, con quale etichetta ha firmato The Cure nel 2003 ?;Geffen Records;Epic Records;Lava Records;Pablo Records;Confermato;In occasione della fine del contratto con la Fiction Records arriva la compilation Greatest Hits che include due nuovi titoli.;https://it.wikipedia.org/wiki/Geffen_Records
139;it;Quale altro gruppo è Robert Smith un idolo per il suo cantante ?;Placebo;I libertini;Capitano Phoenix;Lush;Confermato;I membri di questa formazione hanno collaborato con Robert Smith, il leader di Placebo, pur avendo l'opportunità di intervistare il suo idolo.;https://it.wikipedia.org/wiki/The_Cure
140;it;Quanti album hanno venduto The Cure in tutto il mondo alla fine del 2018 ?;30 milioni;40 milioni;20 milioni;10 milioni;Confermato;Oltre alle registrazioni ufficiali, registrate o in video, ci sono un gran numero di bootleg ricercati dai fan.;https://it.wikipedia.org/wiki/The_Cure
141;it;Quale di queste proposte non significa un album dal vivo di The Cure ?;Dublino;Parigi;Inserimento;Concerto;Expert;Nel 2018, The Cure ha pubblicato ufficialmente 5 album live, 12 album in studio e 11 VHS / DVD, senza contare le numerose compilation.;https://it.wikipedia.org/wiki/Discografia_dei_The_Cure
142;it;In quale paese The Cure vinse molto rapidamente un grande successo nel 1980-81 ?;Nuova Zelanda;Brasile;Russia;Germania;Expert;Questo fenomeno è stato devoluto da diversi anni alla Curemania, che interesserà il continente europeo, in particolare la Francia.;https://it.wikipedia.org/wiki/The_Cure
143;it;Come si chiamava il precedente gruppo Easy Cure nel 1976 ?;Malizia;I libertini;Spunge;Le Membrane;Expert;I membri cambieranno il nome del gruppo (Easy Cure) nel gennaio 1977 e, infine, optano per The Cure nell'aprile 1978.;
144;it;In quale anno i Cure sono apparsi per la prima volta in Sud America ?;1987;1989;1985;1983;Expert;In questo momento, The Cure è stato insignito del titolo di miglior gruppo straniero dell'anno in Brasile dopo otto concerti.;https://it.wikipedia.org/wiki/The_Cure
145;it;Chi si è unito a The Cure poco prima del tour mondiale Kissing Tour ?;Roger O'Donnell;Tim Kingsbury;Chris Pitman;Andy Bown;Expert;Nell'introduzione, un cortometraggio di cinque minuti mostra primi piani della bocca e degli occhi di Robert Smith.;https://it.wikipedia.org/wiki/Roger_O'Donnell
146;it;Quale gruppo ha fatto la prima parte del Prayer Tour di The Cure ?;Shelleyan Orphan;Cult Hero;Germoglio prefabbricato;Fiction piana;Expert;A testimonianza di questo tour, l'album dal vivo Entreat registrato a luglio alla Wembley Arena verrà rilasciato l'anno successivo.;
147;it;Quale emettitore radio è apparso nella banda FM inglese nel 1990 ?;Cure FM;Smith FM;Wish FM;Day FM;Expert;Questa stazione, ospitata dai membri stessi dei Cure, aveva lo scopo di promuovere Mixed Up, un disco di remix.;https://it.wikipedia.org/wiki/The_Cure
148;it;Chi ha regalato The Cure the Godlike Genius Award nel 2009 ?;Tim Burton;Robert De Niro;Sean Penn;Stephen Frears;Expert;The Cure ha ricevuto questo premio per l'intero NME Awards per mano di Tim Burton, che è stato ispirato dal gruppo.;https://it.wikipedia.org/wiki/The_Cure
149;it;Quale gruppo olandese è un vero gruppo clone di The Cure ?;L'essenza;Il diesel;Il butano;Il propano;Expert;Il gruppo degli anni '80 riproduce gli arrangiamenti degli inglesi e copia la voce e il fraseggio di Robert Smith.;https://it.wikipedia.org/wiki/The_Cure
150;it;In quale anno The Cure ha ricevuto il Brit Award come migliore band britannica ?;1991;1993;1995;1997;Expert;The Cure ha anche ricevuto un MTV Video Music Award, un Juno Award, un NME Award e diversi Grammy Awards.;https://it.wikipedia.org/wiki/The_Cure
151;nl;Wie belichaamt zonder twijfel de emblematische figuur van de groep The Cure ?;Robert Smith;Roger O Donnell;Simon Gallup;Reeves Gabrels;Newbie;Op vijfjarige leeftijd wordt Lol Tolhurst de vriend van Robert Smith en zal hij later de eerste versie van The Cure maken.;https://nl.wikipedia.org/wiki/Robert_Smith_(musicus)
152;nl;Met welke muzikale beweging is The Cure nog steeds geassocieerd ?;Nieuwe golf;Rock;Pop;Dans;Newbie;In het begin van de jaren tachtig ontstonden er veel belangrijke new wave-bands uit provinciesteden in Zuid-Engeland.;https://nl.wikipedia.org/wiki/New_wave_(muziekstijl)
153;nl;Hoe kunnen we het kapsel van zanger Robert Smith beschrijven ?;Arachne;Glad;Op het plein;Brushede;Newbie;Veel fans kopiëren vervolgens de losse en donkere kleding van de muzikanten van de band.;https://nl.wikipedia.org/wiki/Robert_Smith_(musicus)
154;nl;Welke titel van The Cure zal worden verwijderd in de tijd van de Golfoorlog ?;Een Arabier vermoorden;It's Not You;Malen Halt;Nauwkeurigheid;Newbie;Dit zal tot grote ergernis zijn van Robert Smith, die zich op persconferenties zal herinneren aan de tekst die hem heeft geïnspireerd.;
155;nl;Wie is het enige lid dat aanwezig is sinds de oorsprong van The Cure-groep ?;Robert Smith;Roger O Donnell;Simon Gallup;Reeves Gabrels;Newbie;Robert Smith was ook jurylid van de International Songwriting Competition (ISC).;https://nl.wikipedia.org/wiki/Robert_Smith_(musicus)
156;nl;Welk album wordt beschouwd als de zwartste band in The Cure ?;Pornografie;Bloedbloemen;Wens;Desintegratie;Newbie;Ondanks zijn beklemmende en gotische atmosfeer zal dit album de top 10 in zowel Engeland als Nieuw-Zeeland bereiken.;https://nl.wikipedia.org/wiki/Pornography
157;nl;In welke stad in Sussex County is de thuishaven van The Cure ?;Crawley;Basildon;Chichester;Littlehampton;Newbie;Crawley wordt sterk beïnvloed door de invloed van London Gatwick Airport, dat het hele noordelijke deel van de stad beslaat.;https://nl.wikipedia.org/wiki/The_Cure
158;nl;Welk begeleidingsinstrument is te zien op The Cure ?;Laag;Saxofoon;Piano;Trompet;Newbie;De bas is, vooral vanwege het specifieke spel van Simon Gallup, een essentieel onderdeel van de muziek van The Cure.;https://nl.wikipedia.org/wiki/The_Cure
159;nl;Op welk muzieklabel zal The Cure tot 2001 trouw blijven ?;Fiction Records;Geffen Records;City Slang;Too Pure;Newbie;Chris Parry, voormalig Jam-manager en artistiek directeur bij Polydor, wilde zijn eigen onafhankelijke label vestigen.;
160;nl;Wie schrijft zogezegd de tekst van alle nummers van The Cure ?;Robert Smith;Simon Gallup;Reeves Gabrels;Jason Cooper;Newbie;Volgens Thierry Desaules is de tekst van het album Pornografie simpelweg subliem en van grote poëzie.;
161;nl;Wat is de titel van de eerste single van The Cure die in december 1978 werd uitgebracht ?;Een Arabier vermoorden;Een andere dag;So What;Vuur in Caïro;Bevestigd;Dit lied, geïnspireerd door Camus 'roman The Foreign, zorgt voor een begin van bekendheid dankzij alternatieve fanzines.;
162;nl;In welk jaar bracht de Cure Three Imaginary Boys uit ?;1979;1981;1983;1985;Bevestigd;The Melody Maker zal titreren over dit album: The Eighties Start Here (The 80's start here).;https://nl.wikipedia.org/wiki/Three_Imaginary_Boys
163;nl;Welk tweede album van The Cure is donkerder en ijzig dan de eerste ?;Zeventien seconden;Pornografie;Geloof;De top;Bevestigd;In 2000 plaatste Q-magazine Seventeen Seconds op nummer 65 in de lijst van de top 100 Britse albums.;https://nl.wikipedia.org/wiki/Seventeen_Seconds
164;nl;Wie wordt de regisseur van clips van The Cure ?;Tim Pope;Vincent Moon;Jonathan Glazer;Spike Jonze;Bevestigd;Tim Pope produceerde ook commercials, afleveringen van televisieseries, documentaires en een korte film.;
165;nl;Welk lied is in 1986 gecomponeerd voor het tv-programma The Children of Rock ?;Just Like Heaven;Slaapliedje;Afbeeldingen van u;Nooit genoeg;Bevestigd;Het liedje werd geïntroduceerd in het dubbele album Kiss Me, Kiss Me, Kiss Me, gecertificeerde platina-schijf.;
166;nl;Welk lid van de Cure-groep moest na een rouw in het ziekenhuis worden opgenomen ?;Simon Gallup;Reeves Gabrels;Jason Cooper;Roger O'Donnell;Bevestigd;Roberto Soave, bassist van Shelley-an Orphan, zal tijdens concerten in november 1992 de leiding hebben over de Wish Tour.;https://nl.wikipedia.org/wiki/Simon_Gallup
167;nl;Met welke soundtrack van films heeft The Cure meegedaan met het titelloze Burn ?;The Crow;Staal;Spawn;Hellboy;Bevestigd;Dit is de nieuwste film waarin acteur Brandon Lee, die stierf tijdens het fotograferen in een opnamescène, speelt.;https://nl.wikipedia.org/wiki/The_Crow_(film)
168;nl;Na Fiction Records, met welk label heeft The Cure zich in 2003 aangemeld ?;Geffen Records;Epic Records;Lava Records;Pablo Records;Bevestigd;Ter gelegenheid van het einde van het contract met Fiction Records komt de compilatie Greatest Hits inclusief twee nieuwe titels.;https://nl.wikipedia.org/wiki/Geffen_Records
169;nl;Welke andere groep is Robert Smith een idool voor zijn zanger ?;Placebo;The Libertines;Captain Phoenix;Lush;Bevestigd;De leden van deze formatie werkten samen met Robert Smith, de leider van Placebo die zelfs de mogelijkheid had om zijn idool te interviewen.;https://nl.wikipedia.org/wiki/The_Cure
170;nl;Hoeveel albums heeft The Cure eind 2018 over de hele wereld verkocht ?;30 miljoen;40 miljoen;20 miljoen;10 miljoen;Bevestigd;Naast officiële opnames, opgenomen of in video, zijn er een groot aantal bootlegs gezocht door fans.;https://nl.wikipedia.org/wiki/The_Cure
171;nl;Welke van deze voorstellen betekent niet een live album van The Cure ?;Dublin;Parijs;Entreat;Concert;Expert;In 2018 bracht The Cure officieel 5 live-albums, 12 studioalbums en 11 VHS / DVD's uit, nog afgezien van talloze compilaties.;
172;nl;In welk land won The Cure zeer snel een groot succes in 1980-81 ?;Nieuw Zeeland;Brazilië;Rusland;Duitsland;Expert;Dit fenomeen is van een aantal jaren overgegaan in Curemania, dat gevolgen zal hebben voor het Europese continent, en met name Frankrijk.;https://nl.wikipedia.org/wiki/The_Cure
173;nl;Wat was de vorige naam van de Easy Cure-groep die in 1976 werd gevormd ?;Malice;The Libertines;Spunge;De membranen;Expert;Leden veranderen de naam van de groep (Easy Cure) in januari 1977 en kiezen uiteindelijk voor The Cure in april 1978.;
174;nl;In welk jaar verscheen The Cure voor het eerst in Zuid-Amerika ?;1987;1989;1985;1983;Expert;Op dit moment kreeg The Cure de titel van beste buitenlandse groep van het jaar in Brazilië na acht concerten.;https://nl.wikipedia.org/wiki/The_Cure
175;nl;Wie heeft zich bij The Cure aangesloten net voor de wereldtournee Kissing Tour ?;Roger O'Donnell;Tim Kingsbury;Chris Pitman;Andy Bown;Expert;In de introductie toont een korte film van vijf minuten close-ups van Robert Smith's mond en ogen.;
176;nl;Welke groep deed het eerste deel van The Cure's Prayer Tour ?;Shelleyan Orphan;Cult Hero;Prefab Sprout;Vliegtuigfictie;Expert;Als een bewijs van deze tour zal het live album Entreat dat in juli in de Wembley Arena is opgenomen, het jaar erop worden uitgebracht.;
177;nl;Welke radiozender verscheen in 1990 op de Engelse FM-band ?;Cure FM;Smith FM;Wish FM;Day FM;Expert;Dit station, gehost door leden van Cure zelf, was bedoeld om Mixed Up, een remixes-schijf, te promoten.;https://nl.wikipedia.org/wiki/The_Cure
178;nl;Wie heeft The Cure de Godlike Genius Award in 2009 gegeven ?;Tim Burton;Robert De Niro;Sean Penn;Stephen Frears;Expert;The Cure heeft deze prijs voor de gehele NME Awards ontvangen van Tim Burton, die zich liet inspireren door de groep.;https://nl.wikipedia.org/wiki/The_Cure
179;nl;Welke Nederlandse groep is een echte kloongroep van The Cure ?;The Essence;De diesel;The Butane;The Propane;Expert;De groep uit de jaren tachtig reproduceert de bewerkingen van de Britten en kopieert de stem en frasering van Robert Smith.;https://nl.wikipedia.org/wiki/The_Cure
180;nl;In welk jaar ontving The Cure de Brit Award voor Best British Band ?;1991;1993;1995;1997;Expert;The Cure heeft ook een MTV Video Music Award, een Juno Award, een NME Award en verschillende Grammy Awards ontvangen.;https://nl.wikipedia.org/wiki/The_Cure
