1;fr;Dans quelle ville peut-on admirer la Petite Sirène sur son rocher ?;Copenhague;Budapest;Bucarest;Amsterdam;Débutant;Située dans le parc Churchill, il s'agit d'une représentation en bronze du personnage du conte éponyme de Hans Christian Andersen.;https://fr.wikipedia.org/wiki/La_Petite_Sirène_(Copenhague)
2;fr;Dans quel État visiterez-vous le grand complexe de loisirs <i>Walt Disney World Resort</i> ?;Floride;Californie;Virginie;Montana;Débutant;C'est une vraie ville fondée sur le tourisme et façonnée par ce que Walt Disney puis l'entreprise Disney ont appelé la <i>magie Disney</i>.;https://fr.wikipedia.org/wiki/Walt_Disney_World_Resort
3;fr;Quel célèbre mausolée de marbre blanc peut-on visiter à Agra, en Inde ?;Taj Mahal;Bombay House;Raj Ghat;Yantra Mandir;Débutant;La construction du mausolée a commencé en 1631 et s'est achevée, dans sa plus grande partie, en 1648.;https://fr.wikipedia.org/wiki/Taj_Mahal
4;fr;Dans quelle ville peut-on admirer des objets d'art au musée du Prado ?;Madrid;Tolède;Cordoue;Séville;Débutant;Le musée présente principalement des peintures européennes du XIVe siècle au début du XIXe siècle.;https://fr.wikipedia.org/wiki/Musée_du_Prado
5;fr;Quelle direction faut-il prendre pour aller bronzer sur le littoral de Rimini ?;Italie;Espagne;Portugal;Grèce;Débutant;Grâce à la plage très étendue et de sable fin, Rimini est une station balnéaire réputée, les touristes venant de toute l'Europe.;https://fr.wikipedia.org/wiki/Rimini
6;fr;Quel parc de 341 hectares prolonge la Cinquième Avenue de New York ?;Central Park;City Park;Griffith Park;Forest Park;Débutant;Le parc est géré par la Central Park Conservancy qui dispose d'un budget annuel de 200 millions de dollars.;https://fr.wikipedia.org/wiki/Central_Park
7;fr;De quel pays avez-vous envoyé votre carte postale en provenance de Koh Phi Phi Ley ?;Thaïlande;Japon;Chine;Corée du Sud;Débutant;La baie paradisiaque de Maya a servi de décor pour de nombreuses scènes du film <i>La Plage</i> avec Leonardo DiCaprio.;https://fr.wikipedia.org/wiki/Koh_Phi_Phi_Ley
8;fr;En Égypte, où se trouve le Sphinx qui se dresse devant les grandes pyramides ?;Gizeh;Le Caire;Suez;Alexandrie;Débutant;Sculpture monumentale monolithique la plus grande du monde (73,5 mètres de long), elle représente un sphinx couchant.;https://fr.wikipedia.org/wiki/Sphinx_de_Gizeh
9;fr;De quel ancien empire peut-on voir les vestiges au Yucatan ?;Mayas;Pipils;Mosquitos;Lenca;Débutant;Au milieu du XIXe siècle, le Yucatan déclara à deux reprises son indépendance et se constitua en République du Yucatan.;https://fr.wikipedia.org/wiki/Yucatan
10;fr;Quel monument bruxellois a été construit à l'occasion de l'Exposition universelle de 1958 ?;Atomium;Tour Noire;Galerie du Roi;Fontaine Anspach;Débutant;L'Atomium représente la maille conventionnelle du cristal de fer (structure cubique centrée) agrandie 165 milliards de fois.;https://fr.wikipedia.org/wiki/Atomium
11;fr;Quel est le pays parfumé des jardins royaux de Shalimar disposés sur trois terrasses ?;Pakistan;Afghanistan;Bangladesh;Bhoutan;Confirmé;L'origine du mot « Shalimar » reste inconnue, mais certains savants pensent que le mot viendrait du persan ou de l'arabe.;https://fr.wikipedia.org/wiki/Jardins_de_Shalimar_(Lahore)
12;fr;Dans quelle ville turque irez-vous au musée du palais de Topkapi ?;Istambul;Ankara;Antioche;Nazilli;Confirmé;Le palais, résidence principale et officielle du sultan ottoman, est construit sur l'emplacement de l'acropole de l'antique Byzance.;https://fr.wikipedia.org/wiki/Palais_de_Topkapi
13;fr;Au départ de Chongqing, à travers les gorges de quel fleuve pouvez-vous faire une croisière ?;Yang-Tsé;Fleuve Jaune;Fleuve Rouge;Amour;Confirmé;La municipalité de Chonqqing a été créée dans les années 1990 pour qu'elle devienne un pôle économique majeur de la Chine.;https://fr.wikipedia.org/wiki/Chongqing
14;fr;Quelle est la plus folle et la plus grande station balnéaire de la côte pacifique du Mexique ?;Acapulco;Progreso;Boca del Rio;Manzanillo;Confirmé;Acapulco est située à 400 km de Mexico, dans une baie profonde semi-circulaire presque fermée et surtout facile d'accès.;https://fr.wikipedia.org/wiki/Acapulco
15;fr;Quelle île de l'archipel des Caraïbes se situe entre la Guadeloupe et la Martinique ?;La Dominique;Bora-Bora;Tahiti;Papeete;Confirmé;L'île est composée d'une chaîne de hauts pitons depuis son extrémité septentrionale à sa pointe méridionale.;https://fr.wikipedia.org/wiki/Dominique_(pays)
16;fr;Dans quelle ville espagnole pourrez-vous admirer les céramiques de l'Alhambra ?;Grenade;Bilbao;Malaga;Séville;Confirmé;L'Alhambra est composée de quatre parties : l'Acazaba, les palais nastrides, le generalife et ses jardins et le palais de Charles V.;https://fr.wikipedia.org/wiki/Alhambra_(Grenade)
17;fr;Où peut-on suivre la Via Dolorosa qui s'étend sur environ 500 mètres ?;Jérusalem;Tel-Aviv;Ashkelon;Ramla;Confirmé;Marqué par neuf des quatorze Stations du chemin de Croix, il s'agit d'un lieu de pèlerinage très important pour les chrétiens.;https://fr.wikipedia.org/wiki/Via_Dolorosa
18;fr;Quel est le pays du Kilimandjaro, montagne composée de trois volcans éteints ?;La Tanzanie;Le Tibet;Le Népal;Le Japon;Confirmé;Le Kilimandjaro est connu pour sa calotte glaciaire sommitale en phase de retrait accéléré depuis le début du XXe siècle.;https://fr.wikipedia.org/wiki/Kilimandjaro
19;fr;Dans quel pays visiterez-vous les ruines de Carthage, ancienne cité punique ?;Tunisie;Hongrie;Turquie;Égypte;Confirmé;Carthage regroupe aujourd'hui de nombreuses résidences d'ambassadeurs ou de richissimes fortunes tunisiennes et expatriées.;https://fr.wikipedia.org/wiki/Carthage
20;fr;Quel site représente la principale attraction grecque du Mont Parnasse ?;Delphes;Olympie;Amphipolis;Lindos;Confirmé;Delphes était le centre du monde, aussi l'« omphalos » y était-il représenté par une pierre de forme conique.;https://fr.wikipedia.org/wiki/Delphes
21;fr;Où en Russie visite-t-on le musée de l'Ermitage, au bord de la Neva ?;Saint-Pétersbourg;Moscou;Sébastopol;Omsk;Expert;Avec plus de 60 000 pièces dans près de 1 000 salles, c'est le plus grand musée du monde en termes d'objets exposés.;https://fr.wikipedia.org/wiki/Musée_de_l'Ermitage
22;fr;Où pouvez-vous arpenter la piazza della Signoria, place touristique de la ville ?;Florence;Rome;Vérone;Padoue;Expert;Des fouilles archéologiques ont mis au jour d'importantes traces d'habitations néolithique, romaines et médiévales à cet endroit.;https://fr.wikipedia.org/wiki/Piazza_della_Signoria
23;fr;Quelle île diabolique peut-on apercevoir de South Point en Australie ?;Tasmanie;Norfolk;Cocos;Christmas;Expert;Situé dans le parc national de la péninsule Wilsons, South Point est le point le plus au sud du «continent» australien.;https://fr.wikipedia.org/wiki/South_Point_(Australie)
24;fr;Sous quel nom l'île de Kerkyra est-elle plus connue des brochures touristiques ?;Corfou;Rhodes;Corinthe;Argos;Expert;La ville de Corfou possède un port qui permet de relier les villes de Brindisi (Italie), Patras et Igoumenitsa.;https://fr.wikipedia.org/wiki/Corfou_(ville)
25;fr;Dans quelle ville peut-on admirer la cathédrale de l'Intercession-de-la-Vierge ?;Moscou;Paris;Madrid;Berne;Expert;Symbole de l'architecture traditionnelle russe, la cathédrale de l'Intercession-de-la-Vierge se trouve sur la place Rouge de Moscou.;https://fr.wikipedia.org/wiki/Cathédrale_Saint-Basile-le-Bienheureux_de_Moscou
26;fr;Étant en Italie, où espérez-vous passer en prenant le col du Brenner ?;En Autriche;En France;En Croatie;En Serbie;Expert;Avec 1 372 m d'altitude, le col du Brenner est le passage le plus bas et le plus fréquenté entre le nord et le sud des Alpes.;https://fr.wikipedia.org/wiki/Col_du_Brenner
27;fr;Où irez-vous en Asie du Sud-Est si vous voulez vous rendre dans la « ville du lion » ?;Singapour;Taïwan;Hong Kong;Shanghai;Expert;Malgré qu'elle soit très densément urbanisée, la végétation luxuriante de Singapour lui a valu le surnom de « Ville jardin ».;https://fr.wikipedia.org/wiki/Singapour
28;fr;Situé dans les Alpes, quel est le plus grand Parc Naturel de France ?;Écrins;Calanques;Cévennes;Mercantour;Expert;Le Parc possède un grand nombre de lacs spectaculaires, dont le lac du Lauvitel, le plus profond et le plus grand du Parc.;https://fr.wikipedia.org/wiki/Parc_national_des_Écrins
29;fr;Dans quel pays allez-vous pour trouver des ruines de la civilisation Scythe-Parthe ?;Pakistan;Cameroun;Pérou;Grèce;Expert;Les Scythes étaient un ensemble de peuples nomades indo-européens d'Eurasie parlant des langues iraniennes.;https://fr.wikipedia.org/wiki/Scythes
30;fr;Quelle statue en bronze de cinquante cm est un point touristique de Bruxelles ?;Manneken-Pis;Atomium;Vaartkapoen;Tour Noire;Expert;La fontaine est située au coeur de Bruxelles, dans le quartier Saint-Jacques, à deux pas de la Grand-Place.;https://fr.wikipedia.org/wiki/Manneken-Pis
