1;fr;Comment appelle-t-on une personne qui élève des abeilles à miel ?;Apiculteur;Ostréiculteur;Aviculteur;Raniculteur;Débutant;Pratiquée sur tous les continents, cette activité diffère selon les variétés d'abeilles, le climat et le développement économique.;https://fr.wikipedia.org/wiki/Apiculteur
2;fr;De quel suc sécrété se nourrissent la plupart des abeilles de nos régions ?;Nectar;Cerne;Bourgeon;Loge;Débutant;Cette substance possède, par son goût ou son odeur, un pouvoir d'attraction sur les insectes ainsi que sur certains oiseaux.;https://fr.wikipedia.org/wiki/Nectar_(botanique)
3;fr;Avec quel autre insecte plus agressif confond-on souvent l'abeille ?;Guêpe;Frelon;Taon;Bourdon;Débutant;La guêpe est un insecte ayant généralement un abdomen jaune rayé de noir et dont la femelle porte un dard venimeux.;https://fr.wikipedia.org/wiki/Guêpe
4;fr;Que font les abeilles volant de fleur en fleur à la recherche de nourriture ?;Elles butinent;Elles ruminent;Elles patinent;Elles dessinent;Débutant;L'abeille récolte ainsi dans la nature nectar, propolis, miellat et pollen. En butinant, l'abeille assure également la pollinisation.;https://fr.wikipedia.org/wiki/Abeille
5;fr;Quel phénomène important l'abeille permet-elle d'assurer en butinant ?;Pollinisation;Germination;Sporulation;Introgression;Débutant;Les plantes contribuent quant à elle à l'alimentation des pollinisateurs en leur fournissant le pollen en excès ou nectar.;https://fr.wikipedia.org/wiki/Pollinisation
6;fr;Laquelle de ces propositions n'est pas un produit dérivé de l'abeille ?;Beurre;Miel;Cire;Gelée;Débutant;Ces produits sont stockés dans des galeries pour les espèces solitaires, des assemblages complexes pour les espèces sociales.;https://fr.wikipedia.org/wiki/Abeille
7;fr;Quel est le seul individu femelle fertile au sein d'une colonie d'abeilles ?;Reine;Ouvrière;Guêpe;Frelon;Débutant;La reine, à l'abdomen plus allongé, est habituellement la mère de la plupart des abeilles de la ruche, sinon de la totalité.;https://fr.wikipedia.org/wiki/Reine_des_abeilles
8;fr;Quel mâle de l'abeille est le produit de l'éclosion d'un oeuf non fécondé ?;Faux bourdon;Phasme;Tique;Coléoptère;Débutant;Contrairement à l'abeille ouvrière femelle, le faux bourdon ne possède pas de dard et ne récolte ni nectar ni pollen.;https://fr.wikipedia.org/wiki/Faux_bourdon
9;fr;Quelle petite abeille a fait la joie des enfants à la télévision dans les années 1980 ?;Maya;Heidi;Tao Tao;Zigby;Débutant;Maya découvre le monde en compagnie de ses amis Willy l'abeille, Flip la sauterelle, Max le ver de terre et Alexandre la souris.;https://fr.wikipedia.org/wiki/Maya_l'abeille_(série_télévisée)
10;fr;Environ combien d'espèces d'abeilles sont répertoriées à ce jour sur la planète ?;20 000;15 000;10 000;5 000;Débutant;Les abeilles peuvent être classées selon leur mode de vie : abeilles domestiques, sauvages, solitaires ou bien sociales.;https://fr.wikipedia.org/wiki/Abeille
11;fr;Quel nom donne-t-on à un groupe d'abeilles vivant en société ?;Colonie;Écotype;Niche;Guilde;Confirmé;En biologie, une colonie est un groupe d'organismes de la même espèce vivant rassemblés selon un mode de vie particulier.;https://fr.wikipedia.org/wiki/Colonie_(biologie)
12;fr;Quelle espèce d'abeille est probablement la plus connue en Europe ?;Apis mellifera;Apis cerana;Apis florea;Apis dorsata;Confirmé;Semi-domestique, le nom de genre Apis est le terme latin pour abeille, et mellifera signifie qui donne du miel.;https://fr.wikipedia.org/wiki/Abeille
13;fr;Quelle est la durée de vie moyenne d'une abeille durant les mois d'été ?;Un mois;Deux mois;Trois mois;Quatre mois;Confirmé;Se nourrissant du nectar des fleurs, une abeille peut vivre jusqu'à dix mois en hiver et seulement un mois en été.;https://fr.wikipedia.org/wiki/Abeille
14;fr;Quelle expression désigne une espèce d'abeille vivant en colonie ?;Abeille sociale;Abeille parasite;Abeille solitaire;Abeille à miel;Confirmé;D'autres espèces sont des abeilles parasites ou abeilles coucous qui pratiquent le cleptoparasitisme.;https://fr.wikipedia.org/wiki/Abeille
15;fr;De quoi la larve d'une future reine des abeilles est-elle exclusivement nourrie ?;Gelée royale;Insectes;Sel;Sédiments;Confirmé;La gelée royale est le produit de sécrétion des abeilles ouvrières, entre le cinquième et le quatorzième jour de leur existence.;https://fr.wikipedia.org/wiki/Gelée_royale
16;fr;Comment appelle-t-on un rassemblement important d'abeilles ?;Essaim;Grappe;Manteau;Sac;Confirmé;Le phénomène dit de nuée n'a pas d'origine météorologique directe mais est saisonnier et lié aux épisodes de sécheresse.;https://fr.wikipedia.org/wiki/Essaim
17;fr;Quelle abeille est la grande favorite de l'apiculture en Europe ?;Abeille noire;Abeille rouge;Abeille bleue;Abeille blanche;Confirmé;Son aire de répartition originale s'étendait de l'ouest de la Russie à l'Europe du Nord et probablement à la péninsule ibérique.;https://fr.wikipedia.org/wiki/Apis_mellifera_mellifera
18;fr;Que se passe-t-il pour l'abeille lorsque celle-ci utilise son dard cranté pour piquer ?;Elle meurt;Elle dort;Elle gonfle;Elle boit;Confirmé;La piqûre entraîne une partie des organes internes de l'abeille, dont son sac à venin, ce qui est presque toujours fatal à l'abeille.;https://fr.wikipedia.org/wiki/Abeille
19;fr;Comment appelle-t-on l'ensemble des ruches d'un apiculteur ?;Rucher;Colonie;Essaim;Grappe;Confirmé;L'emplacement des ruchers se fait notamment en fonction de l'environnement et de l'exposition (de préférence sud ou sud-est).;https://fr.wikipedia.org/wiki/Rucher
20;fr;Quel film d'animation raconte la vie d'une abeille fraîchement diplômée ?;« Bee Movie »;« Rosa »;« Happy Feet »;« Le Lorax »;Confirmé;Ce film d'animation en images de synthèse sorti en 2007 a été écrit et produit par Jerry Seinfeld pour DreamWorks SKG.;https://fr.wikipedia.org/wiki/Bee_Movie_:_Drôle_d'abeille
21;fr;Dans quelle résine a-t-on retrouvé les plus anciens fossiles d'abeilles ?;Ambre;Turquoise;Jais;Opale;Expert;Le plus vieux fossile à ce jour est Melittosphex burmensis, daté de 100 millions d'années et découvert en 2006 en Birmanie.;https://fr.wikipedia.org/wiki/Ambre
22;fr;De combien de castes une colonie d'abeilles est-elle composée ?;Trois;Quatre;Cinq;Six;Expert;La reine, l'unique femelle fertile du groupe, une majorité d'ouvrières et des mâles (ou faux-bourdons) qui fécondent les futures reines.;https://fr.wikipedia.org/wiki/Abeille
23;fr;Quelles abeilles utilisent des galeries creusées dans le bois ?;Xylicoles;Rubicoles;Horticoles;Vinicoles;Expert;Un xylophage est un organisme vivant dont le régime alimentaire est composé principalement d'aubier, mais aussi de bois parfait.;https://fr.wikipedia.org/wiki/Xylophage
24;fr;Jusqu'à combien d'oeufs la reine des abeilles peut-elle pondre environ en une année ?;400 000;300 000;200 000;100 000;Expert;Quand sa spermathèque commence à se vider, elle ne peut plus pondre d'oeufs d'ouvrières et sa diffusion de phéromones se modifie.;https://fr.wikipedia.org/wiki/Reine_des_abeilles
25;fr;Quel processus fait naître une nouvelle reine-mère pour la ruche ?;Remérage;Reinage;Ruchage;Restaurage;Expert;La colonie amorce alors le périlleux processus de nourrir plusieurs nymphes de gelée royale, la survie de la colonie en dépendant.;https://fr.wikipedia.org/wiki/Reine_des_abeilles
26;fr;Dans quelle maternité de la ruche se développent les futures abeilles ?;Couvain;Bûcher;Dortoir;Levant;Expert;Il est généralement situé au centre de la ruche et est entouré de rayons de miel et de pollen (pain d'abeille) pour l'alimenter.;https://fr.wikipedia.org/wiki/Couvain
27;fr;Comment les abeilles évitent-elles d'engendrer un organisme étouffant ?;Essaimage;Remérage;Pollinage;Ruchage;Expert;Ce phénomène a lieu quand une partie des abeilles quitte la ruche avec une reine (l'essaim) pour former une nouvelle colonie.;https://fr.wikipedia.org/wiki/Essaimage
28;fr;Quelle pratique consiste à soigner avec les produits de la ruche ?;Apithérapie;Oligothérapie;Phytothérapie;Ayurveda;Expert;L'apithérapie propose d'utiliser les propriétés supposées du miel, de la propolis, du venin d'abeilles, de la gelée royale et du pollen.;https://fr.wikipedia.org/wiki/Apithérapie
29;fr;Quel choc une piqûre d'abeille peut-elle parfois entraîner sur l'homme ?;Anaphylactique;Perforin;Antigène;Macrophage;Expert;Il s'agit d'une manifestation d'hypersensibilité immédiate due à la libération de médiateurs vaso-actifs chez un sujet sensibilisé.;https://fr.wikipedia.org/wiki/Choc_anaphylactique
30;fr;Qu'ont remplacé les abeilles impériales de Napoléon Bonaparte ?;Fleur de lys;Myosotis;Bleuet;Trèfle;Expert;Les fleurs de lis d'or sur champ d'azur devinrent les armes de France et l'emblème spécifique des rois de France.;https://fr.wikipedia.org/wiki/Fleur_de_lys
1;en;What is a person who raises honey bees called ?;Beekeeper;Oyster farmer;Poultry farmer;Raniculteur;Débutant;Practiced on all continents, this activity differs according to bee varieties, climate and economic development.;https://en.wikipedia.org/wiki/Beekeeper
2;en;What secreted juice do most bees eat ?;Nectar;Circles;Bud;Lodge;Débutant;This substance has, by its taste or smell, a power of attraction on insects as well as on certain birds.;https://en.wikipedia.org/wiki/Nectar
3;en;What other more aggressive insect is the bee often confused with ?;Wasp;Hornet;Horsefly;Bumblebee;Débutant;The wasp is an insect generally with a yellow abdomen striped with black and the female of which carries a poisonous stinger.;https://en.wikipedia.org/wiki/Reload this page
4;en;What do bees do flying from flower to flower in search of food ?;They are foraging;They ruminate;They skate;They draw;Débutant;The bee harvests in nature nectar, propolis, honeydew and pollen.;https://en.wikipedia.org/wiki/Bee
5;en;What important phenomenon does the bee provide by foraging ?;Pollination;Germination;Sporulation;Introgression;Débutant;Plants contribute to the diet of pollinators by providing them with excess pollen or nectar.;https://en.wikipedia.org/wiki/Pollination
6;en;Which of these is not a bee product ?;Butter;Honey;Wax;Jelly;Débutant;These products are stored in galleries for solitary species, complex assemblies for social species.;https://en.wikipedia.org/wiki/Bee
7;en;Who is the only fertile female individual in a bee colony ?;Queen;Worker;Wasp;Hornet;Débutant;The queen, with a more elongated abdomen, is usually the mother of most, if not all, bees in the hive.;https://en.wikipedia.org/wiki/Queen_bee
8;en;Which honey bee is the product of the hatching of an unfertilized egg ?;False drone;Stick insect;Tick;Beetle;Débutant;Unlike the female worker bee, the drone has no stinger and does not harvest nectar or pollen.;https://en.wikipedia.org/wiki/Drone_(bee)
9;en;What little bee delighted children on television in the 1980s ?;Maya;Heidi;Tao Tao;Zigby;Débutant;Maya discovers the world in the company of her friends Willy the bee, Flip the grasshopper, Max the earthworm and Alexander the mouse.;
10;en;How many species of bees are listed so far on the planet ?;20,000;15,000;10,000;5,000;Débutant;Bees can be classified according to their way of life: domestic, wild, solitary or social bees.;https://en.wikipedia.org/wiki/Bee
11;en;What name is given to a group of bees living in society ?;Colony;Ecotype;Niche;Guild;Confirmé;In biology, a colony is a group of living organisms of the same species gathered together according to a particular way of life.;https://en.wikipedia.org/wiki/Colony_(biology)
12;en;Which bee species is probably the best known in Europe ?;Apis mellifera;Apis cerana;Apis florea;Apis dorsata;Confirmé;Semi-domestic, the genus name Apis is the Latin term for bee, and mellifera means that gives honey.;https://en.wikipedia.org/wiki/Bee
13;en;What is the average lifespan of a bee during the summer months ?;One month;Two months;Three months;Four months;Confirmé;Feeding on the nectar of flowers, a bee can live up to ten months in winter and only one month in summer.;https://en.wikipedia.org/wiki/Bee
14;en;What expression denotes a species of bee living in a colony ?;Social bee;Parasitic bee;Lonely bee;Honey bee;Confirmé;Other species are parasitic bees or cuckoo bees who practice cleptoparasitism.;https://en.wikipedia.org/wiki/Bee
15;en;What is the larva of a future queen bee exclusively fed on ?;Royal jelly;Insects;Salt;Sediments;Confirmé;Royal jelly is the secretion product of worker bees, between the fifth and fourteenth day of their existence.;
16;en;What do you call a large gathering of bees ?;Swarm;Cluster;Coat;Bag;Confirmé;The phenomenon known as cloudless does not have a direct meteorological origin but is seasonal and linked to drought episodes.;
17;en;Which bee is the big beekeeping favorite in Europe ?;Black bee;Red bee;Blue bee;White bee;Confirmé;Its original range stretched from western Russia to northern Europe and possibly the Iberian Peninsula.;https://en.wikipedia.org/wiki/European_dark_bee
18;en;What happens when a bee uses its notched sting to sting ?;She dies;She sleeps;It swells;She drinks;Confirmé;The sting involves part of the internal organs of the bee, including its venom sac, which is almost always fatal to the bee.;https://en.wikipedia.org/wiki/Bee
19;en;What do you call all of a beekeeper's hives ?;Apiary;Colony;Swarm;Cluster;Confirmé;The location of the apiaries is made in particular according to the environment and the exposure (preferably south or southeast).;https://en.wikipedia.org/wiki/Apiary
20;en;What animated film tells the life of a freshly graduated bee ?;« Bee Movie »;« Rosa »;« Happy Feet »;« Le Lorax »;Confirmé;This animated film in computer graphics released in 2007 was written and produced by Jerry Seinfeld for DreamWorks SKG.;
21;en;In which resin were the oldest bee fossils found ?;Amber;Turquoise;Jet;Opal;Expert;The oldest fossil to date is Melittosphex burmensis, dated 100 million years ago and discovered in 2006 in Burma.;https://en.wikipedia.org/wiki/Amber
22;en;How many castes does a bee colony consist of ?;Three;Four;Five;Six;Expert;The queen, the only fertile female in the group, a majority of workers and males (or drones) who fertilize future queens.;https://en.wikipedia.org/wiki/Bee
23;en;Which bees use galleries dug in the wood ?;Xylicoles;Rubicoles;Horticultural;Wineries;Expert;A xylophagus is a living organism whose diet consists mainly of sapwood, but also of perfect wood.;
24;en;How many eggs can the queen bee lay approximately in a year ?;400,000;300,000;200,000;100,000;Expert;When its spermatheca begins to empty, it can no longer lay workers' eggs and its distribution of pheromones changes.;https://en.wikipedia.org/wiki/Queen_bee
25;en;What process produces a new queen mother for the hive ?;Remage;Reinage;Perching;Restoration;Expert;The colony then begins the perilous process of feeding several nymphs of royal jelly, the survival of the colony depending on it.;https://en.wikipedia.org/wiki/Queen_bee
26;en;In which maternity of the hive develop the future bees ?;Couvain;Beaker;Dormitory;Levant;Expert;It is generally located in the center of the hive and is surrounded by honeycombs and pollen (bee bread) to feed it.;
27;en;How do bees avoid creating a suffocating organism ?;Swarming;Remage;Pollination;Perching;Expert;This phenomenon occurs when a part of the bees leaves the hive with a queen (the swarm) to form a new colony.;https://en.wikipedia.org/wiki/Swarming (honey bee)
28;en;What is the practice of treating with bee products ?;Apitherapy;Oligotherapy;Phytotherapy;Ayurveda;Expert;Apitherapy suggests using the supposed properties of honey, propolis, bee venom, royal jelly and pollen.;https://en.wikipedia.org/wiki/Reload this page
29;en;What shock can a bee sting sometimes cause on humans ?;Anaphylactic;Perforin;Antigen;Macrophage;Expert;It is a manifestation of immediate hypersensitivity due to the release of vasoactive mediators in a sensitized subject.;
30;en;What have replaced Napoleon Bonaparte's imperial bees ?;Lily flower;Myosotis;Blueberry;Clover;Expert;The golden fleur-de-lis on the azure field became the arms of France and the specific emblem of the kings of France.;https://en.wikipedia.org/wiki/Fleur-de-lis
1;de;Wie heißt eine Person, die Honigbienen züchtet ?;Imker;Austernzüchter;Geflügelzüchter;Raniculteur;Débutant;Diese Aktivität wird auf allen Kontinenten praktiziert und unterscheidet sich je nach Bienensorte, Klima und wirtschaftlicher Entwicklung.;https://de.wikipedia.org/wiki/Imker
2;de;Welchen abgesonderten Saft essen die meisten Bienen ?;Nektar;Kreise;Knospe;Lodge;Débutant;Diese Substanz hat aufgrund ihres Geschmacks oder Geruchs eine Anziehungskraft sowohl auf Insekten als auch auf bestimmte Vögel.;https://de.wikipedia.org/wiki/Nektar_(Botanik)
3;de;Mit welchem anderen aggressiveren Insekt wird die Biene oft verwechselt ?;Wespe;Hornisse;Bremse;Hummel;Débutant;Die Wespe ist ein Insekt, normalerweise mit einem gelben, schwarz gestreiften Bauch, dessen Weibchen einen giftigen Stachel trägt.;https://de.wikipedia.org/wiki/Reload this page
4;de;Was fliegen Bienen auf der Suche nach Nahrung von Blume zu Blume ?;Sie suchen;Sie grübeln;Sie skaten;Sie zeichnen;Débutant;Die Biene erntet in Naturnektar, Propolis, Honigtau und Pollen.;https://de.wikipedia.org/wiki/Bienen
5;de;Welches wichtige Phänomen liefert die Biene durch Nahrungssuche ?;Bestäubung;Keimung;Sporulation;Introgression;Débutant;Pflanzen tragen zur Ernährung von Bestäubern bei, indem sie ihnen überschüssigen Pollen oder Nektar zuführen.;https://de.wikipedia.org/wiki/Bestäubung
6;de;Welches davon ist kein Bienenprodukt ?;Butter;Honig;Wachs;Gelee;Débutant;Diese Produkte werden in Galerien für einzelne Arten, komplexe Baugruppen für soziale Arten gelagert.;https://de.wikipedia.org/wiki/Bienen
7;de;Wer ist das einzige fruchtbare weibliche Individuum in einer Bienenkolonie ?;Königin;Arbeiter;Wespe;Hornisse;Débutant;Die Königin mit einem länglicheren Bauch ist normalerweise die Mutter der meisten, wenn nicht aller Bienen im Bienenstock.;https://de.wikipedia.org/wiki/Bienenkönigin
8;de;Welche Honigbiene entsteht beim Schlüpfen eines unbefruchteten Eies ?;Falsche Drohne;Stabheuschrecke;Häkchen;Käfer;Débutant;Im Gegensatz zur Arbeiterin hat die Drohne keinen Stachel und erntet weder Nektar noch Pollen.;https://de.wikipedia.org/wiki/Drohne_(Hautflügler)
9;de;Welche kleine Biene begeisterte Kinder in den 1980er Jahren im Fernsehen ?;Maya;Heidi;Tao Tao;Zigby;Débutant;Maya entdeckt die Welt in Begleitung ihrer Freunde Willy die Biene, Flip die Heuschrecke, Max der Regenwurm und Alexander die Maus.;
10;de;Wie viele Bienenarten gibt es bisher auf dem Planeten ?;20.000;15.000;10.000;5.000;Débutant;Bienen können nach ihrer Lebensweise klassifiziert werden: Haus-, Wild-, Einzel- oder Sozialbienen.;https://de.wikipedia.org/wiki/Bienen
11;de;Wie heißt eine Gruppe von Bienen, die in der Gesellschaft leben ?;Kolonie;Ökotyp;Nische;Gilde;Confirmé;In der Biologie ist eine Kolonie eine Gruppe lebender Organismen derselben Art, die sich nach einer bestimmten Lebensweise versammelt haben.;https://de.wikipedia.org/wiki/Kolonie_(Biologie)
12;de;Welche Bienenart ist wohl die bekannteste in Europa ?;Apis mellifera;Apis cerana;Apis florea;Apis dorsata;Confirmé;Semi-Domestic, der Gattungsname Apis ist der lateinische Begriff für Biene, und Mellifera bedeutet, dass Honig gegeben wird.;https://de.wikipedia.org/wiki/Bienen
13;de;Was ist die durchschnittliche Lebensdauer einer Biene in den Sommermonaten ?;Ein Monat;Zwei Monate;Drei Monate;Vier Monate;Confirmé;Eine Biene ernährt sich vom Blumennektar und kann im Winter bis zu zehn Monate und im Sommer nur einen Monat leben.;https://de.wikipedia.org/wiki/Bienen
14;de;Welcher Ausdruck bezeichnet eine Bienenart, die in einer Kolonie lebt ?;Soziale Biene;Parasitäre Biene;Einsame Biene;Honigbiene;Confirmé;Andere Arten sind parasitäre Bienen oder Kuckucksbienen, die Cleptoparasitismus praktizieren.;https://de.wikipedia.org/wiki/Bienen
15;de;Was ist die Larve einer zukünftigen Bienenkönigin, die ausschließlich gefüttert wird ?;Gelée Royale;Insekten;Salz;Sedimente;Confirmé;Gelée Royale ist das Sekretionsprodukt von Arbeiterbienen zwischen dem fünften und vierzehnten Tag ihres Bestehens.;
16;de;Wie nennt man eine große Ansammlung von Bienen ?;Schwarm;Cluster;Mantel;Tasche;Confirmé;Das als wolkenlos bekannte Phänomen hat keinen direkten meteorologischen Ursprung, sondern ist saisonabhängig und mit Dürreperioden verbunden.;
17;de;Welche Biene ist der große Imkereifavorit in Europa ?;Schwarze Biene;Rote Biene;Blaue Biene;Weiße Biene;Confirmé;Das ursprüngliche Verbreitungsgebiet erstreckte sich von Westrussland bis nach Nordeuropa und wahrscheinlich bis zur Iberischen Halbinsel.;https://de.wikipedia.org/wiki/Dunkle_Europäische_Biene
18;de;Was passiert, wenn eine Biene ihren gekerbten Stich zum Stechen benutzt ?;Sie stirbt;Sie schläft;Es schwillt an ","Elle gonfle;Sie trinkt;Confirmé;Der Stich betrifft einen Teil der inneren Organe der Biene, einschließlich ihres Giftbeutels, der für die Biene fast immer tödlich ist.;https://de.wikipedia.org/wiki/Bienen
19;de;Wie nennt man alle Bienenstöcke eines Imkers ?;Bienenhaus;Kolonie;Schwarm;Cluster;Confirmé;Die Lage der Bienenhäuser richtet sich insbesondere nach der Umgebung und der Exposition (vorzugsweise nach Süden oder Südosten).;https://de.wikipedia.org/wiki/Bienenhaus
20;de;Welcher Animationsfilm erzählt das Leben einer frisch graduierten Biene ?;« Bee Movie »;« Rosa »;« Happy Feet »;« Le Lorax »;Confirmé;Dieser 2007 veröffentlichte Animationsfilm in Computergrafik wurde von Jerry Seinfeld für DreamWorks SKG geschrieben und produziert.;
21;de;In welchem Harz wurden die ältesten Bienenfossilien gefunden ?;Bernstein;Türkis;Jet;Opal;Expert;Das älteste Fossil ist Melittosphex burmensis, das vor 100 Millionen Jahren datiert und 2006 in Burma entdeckt wurde.;https://de.wikipedia.org/wiki/Bernstein
22;de;Aus wie vielen Kasten besteht eine Bienenkolonie ?;Drei;Vier;Fünf;Sechs;Expert;Die Königin, die einzige fruchtbare Frau in der Gruppe, eine Mehrheit der Arbeiter und Männer (oder Drohnen), die zukünftige Königinnen befruchten.;https://de.wikipedia.org/wiki/Bienen
23;de;Welche Bienen benutzen im Wald gegrabene Galerien ?;Xylicole;Rubicoles;Gartenbau;Weingüter;Expert;Ein Xylophagus ist ein lebender Organismus, dessen Ernährung hauptsächlich aus Splintholz, aber auch aus perfektem Holz besteht.;
24;de;Wie viele Eier kann die Bienenkönigin ungefähr in einem Jahr legen ?;400.000;300.000;200.000;100.000;Expert;Wenn sich die Spermatheca zu entleeren beginnt, kann sie keine Arbeitereier mehr legen und die Verteilung der Pheromone ändert sich.;https://de.wikipedia.org/wiki/Bienenkönigin
25;de;Welcher Prozess bringt eine neue Königinmutter für den Bienenstock hervor ?;Remage;Reinage;Sich niederlassen;Restaurierung;Expert;Die Kolonie beginnt dann den gefährlichen Prozess der Fütterung mehrerer Nymphen von Gelée Royale, wobei das Überleben der Kolonie davon abhängt.;https://de.wikipedia.org/wiki/Bienenkönigin
26;de;In welcher Mutterschaft des Bienenstocks entwickeln sich die zukünftigen Bienen ?;Couvain;Becher;Schlafsaal;Levante;Expert;Es befindet sich im Allgemeinen in der Mitte des Bienenstocks und ist von Waben und Pollen (Bienenbrot) umgeben, um es zu füttern.;
27;de;Wie vermeiden Bienen die Entstehung eines erstickenden Organismus ?;Schwärmen;Remage;Bestäubung;Sich niederlassen;Expert;Dieses Phänomen tritt auf, wenn ein Teil der Bienen den Bienenstock mit einer Königin (dem Schwarm) verlässt, um eine neue Kolonie zu bilden.;https://de.wikipedia.org/wiki/Schwarmtrieb
28;de;Was ist die Praxis der Behandlung mit Bienenprodukten ?;Apitherapie;Oligotherapie;Phytotherapie;Ayurveda;Expert;Apitherapie schlägt vor, die angeblichen Eigenschaften von Honig, Propolis, Bienengift, Gelée Royale und Pollen zu verwenden.;https://de.wikipedia.org/wiki/Reload this page
29;de;Welchen Schock kann ein Bienenstich manchmal beim Menschen verursachen ?;Anaphylaktisch;Perforin;Antigen;Makrophagen;Expert;Es ist eine Manifestation einer sofortigen Überempfindlichkeit aufgrund der Freisetzung von vasoaktiven Mediatoren bei einem sensibilisierten Subjekt.;
30;de;Was hat Napoleon Bonapartes kaiserliche Bienen ersetzt ?;Lilienblume;Myosotis;Blaubeere;Klee;Expert;Die goldene Lilie auf dem azurblauen Feld wurde zum Wappen Frankreichs und zum besonderen Wahrzeichen der französischen Könige.;https://de.wikipedia.org/wiki/Lilie_(Heraldik)
1;es;¿Cómo se llama una persona que cría abejas melíferas ?;Apicultor;Granjero de ostras;Avicultor;Raniculteur;Débutant;Practicada en todos los continentes, esta actividad difiere según las variedades de abejas, el clima y el desarrollo económico.;https://es.wikipedia.org/wiki/Apicultor
2;es;¿Qué jugo secretado comen la mayoría de las abejas ?;Néctar;Círculos;Bud;Lodge;Débutant;Esta sustancia tiene, por su sabor u olor, un poder de atracción tanto para los insectos como para ciertas aves.;https://es.wikipedia.org/wiki/Néctar_(botánica)
3;es;¿Con qué otro insecto más agresivo se confunde a menudo la abeja ?;Avispa;Avispón;Tábano;Abejorro;Débutant;La avispa es un insecto generalmente con un abdomen amarillo rayado con negro y cuya hembra lleva un aguijón venenoso.;https://es.wikipedia.org/wiki/Reload this page
4;es;¿Qué hacen las abejas volando de flor en flor en busca de alimento ?;Están buscando comida;Ellos rumian;Ellos patinan;Dibujan;Débutant;La abeja cosecha en la naturaleza néctar, propóleos, melaza y polen.;https://es.wikipedia.org/wiki/Anthophila
