173;nl;In welk land is Macao gekoloniseerd en meer dan 400 jaar geleden bestuurd ?;Portugal;Spanje;Engeland;Duitsland;Expert;De stad Macao wordt beschouwd als de laatste handelspost evenals de laatste Europese kolonie in China en Azië.;https://nl.wikipedia.org/wiki/Macau
174;nl;Welke van deze schrijvers was 40 jaar oud toen Gustave Flaubert werd geboren ?;Balzac;Stendhal;Hugo;Favre;Expert;Gustave Flaubert heeft de literatuur gekenmerkt door de diepte van zijn psychologische analyses en zijn zorg voor het realisme.;https://nl.wikipedia.org/wiki/Gustave_Flaubert
175;nl;Hoe kan men letterlijk de Republikeinse term Albanië vertalen ?;Country of Eagles;Paardenland;Land van de Doden;Land van de levenden;Expert;Het land heeft een politiek systeem van parlementaire democratie, de hoofdstad is Tirana en de officiële taal is het Albanees.;https://nl.wikipedia.org/wiki/Albanië
176;nl;In welke staat is de US Sing Sing-gevangenis gelegen aan de oevers van de Hudson ?;New York;Texas;Alabama;Geologie;Expert;Sing Sing Prison is geclassificeerd als een maximale veiligheidsinstelling en was de site van grote executies vóór 2004.;https://nl.wikipedia.org/wiki/Sing_Sing_(gevangenis)
177;nl;Wat is waarschijnlijk de meest beroemde bijeenkomst van Camp David in 1978 ?;Sadate-Begin;Nixon-Brezhnev;Clinton-Arafat;Reagan-Thatcher;Expert;Het 50 hectare grote Camp David in Maryland is het officiële vakantieoord van de Amerikaanse president.;https://nl.wikipedia.org/wiki/Camp_David
178;nl;In welke krant deed de beroemde J'accuse... ! van Zola ?;Aurore;Menselijkheid;Figaro;Pravda;Expert;Geschreven tijdens de Dreyfus-affaire, verscheen dit artikel in de vorm van een open brief aan de Franse president Félix Faure.;https://nl.wikipedia.org/wiki/J'accuse...!
179;nl;In welk land stroomt de Shannon door eindeloze landgoederen van meren ?;Ierland;Israël;Verenigde Staten;Canada;Expert;De 386 kilometer van de Shannon River maken het de langste rivier in de Britse eilanden en de meest overvloedige door de stroom.;https://nl.wikipedia.org/wiki/Shannon_(rivier)
180;nl;Welke Franse filosoof leefde in de rue Monsieur-le-Prince 10 in Parijs ?;Auguste Comte;Marcel Proust;Anatole France;Pierre Leroux;Expert;Auguste Comte was de privé-secretaris en vervolgens medewerker van de graaf van Saint-Simon, oprichter van de beweging Saint-Simon.;https://nl.wikipedia.org/wiki/Auguste_Comte
