28;de;Welche Nationalität hat die Ex-Tennisspielerin Gabriela Sabatini ?;Argentinien;Italienisch;Spanisch;Griechisch;Expert;Gabriela Sabatini war 1988 Olympiasiegerin bei den Olympischen Spielen in Seoul und im selben Jahr Finalistin bei den US Open.;https://de.wikipedia.org/wiki/Gabriela_Sabatini
29;de;Wer hat dem Sieger den Roland-Garros-Pokal der Männer 2005 verliehen ?;Zinédine Zidane;Cedric Pioline;Tony Parker;Teddy Riner;Expert;Zidane überreichte Nadal, dem Sieger des Turniers nach dem Finale gegen den Argentinier Mariano Puerta, den ersten Musketier-Pokal.;https://de.wikipedia.org/wiki/French_Open_2005
30;de;Welcher berühmte französische Tennisspieler kommt aus Kamerun ?;Yannick Noah;Gaël Monfils;Jo-Wilfried Tsonga;Gille Simons;Expert;Der Sohn des kamerunischen Fußballspielers Zacharie Noah, der 1961 das Coupe de France gewann, ist der Vater des französischen Basketballspielers Joakim Noah.;https://de.wikipedia.org/wiki/Yannick_Noah
1;es;¿Qué jugador francés ganó el torneo Roland-Garros en 1983 ?;Yannick Noah;Jo-Wilfried Tsonga;Guy Forget;Richard Gasquet;Débutant;Esta victoria le valió ser el único jugador francés que ganó un torneo de Grand Slam de la era Open en singles masculinos.;https://es.wikipedia.org/wiki/Yannick_Noah
2;es;¿Cómo se llama el tenista brasileño profesional Kuga ?;Gustavo Kuerten;Björn Borg;John McEnroe;Novak Djokovic;Débutant;Gustavo Kuerten ganó veinte títulos individuales en el circuito ATP, incluidos tres torneos Roland-Garros, un Masters y cinco Masters 1000.;https://es.wikipedia.org/wiki/Gustavo_Kuerten
3;es;Aunque lleno de aire, ¿de qué material están hechas las pelotas de tenis ?;Caucho;Vidrio;Plastico;Cartón;Débutant;Una pelota de tenis está hecha de una carcasa de goma, llamada núcleo, cubierta con fieltro, a menudo de color amarillo o blanco.;https://es.wikipedia.org/wiki/Tenis
4;es;¿Qué equipo ganó la Copa Davis 2017, la 106a edición de este torneo ?;Francia;Bélgica;Suiza;Italia;Débutant;La Francia de Yannick Noah ganó su décima Copa Davis, entre otras cosas gracias a la victoria de Lucas Pouille sobre Steve Darcis.;https://es.wikipedia.org/wiki/Copa_Davis_2017
5;es;¿Qué jugador belga de pequeño tamaño ganó el torneo Roland-Garros ?;Justine Henin;Kim Clijsters;Elise Mertens;Nancy Feber;Débutant;Gracias a la variedad de su juego, John McEnroe llamó a su revés, por un lado, el mejor revés del mundo, hombres y mujeres combinados.;https://es.wikipedia.org/wiki/Justine_Henin
6;es;¿Cuántas canchas hay en el Abierto de Tenis de Francia ?;17;12;24;8;Débutant;Los tres tribunales más grandes son el tribunal Philippe Chatrier (o tribunal central), el tribunal Suzanne-Lenglen y el tribunal Simonne-Mathieu.;https://es.wikipedia.org/wiki/Torneo_de_Roland_Garros
7;es;En un partido de tenis profesional, ¿qué cambias cada nueve juegos ?;Pelota;Raquetas de nieve;Árbitro;Jersey;Débutant;Se realiza un cambio de bolas cada 9 juegos, excepto el primero que se realiza al final del séptimo juego (porque el calentamiento corresponde a 2 juegos).;https://es.wikipedia.org/wiki/Tenis
8;es;A finales de 2019, ¿cuántas veces ganó Rafael Nadal Roland-Garros ?;Doce;Once;Siete;Trece;Débutant;Después de haber ganado 19 torneos de Grand Slam, es el único jugador que ha ganado 12 títulos individuales en uno de estos cuatro torneos principales.;https://es.wikipedia.org/wiki/Rafael_Nadal
9;es;¿Cuál es la nacionalidad del tenista profesional Roger Federer ?;Suiza;Austriaco;Sueco;Francés;Débutant;Nacido en Basilea, Federer tiene el récord de 310 semanas en primer lugar en el ranking de tenis ATP World Tour.;https://es.wikipedia.org/wiki/Roger_Federer
10;es;¿En cuántos torneos principales se compone el Grand Slam de tenis ?;Cuatro;Cinco;Tres;Seis;Débutant;Los cuatro torneos son el Abierto de Australia en Melbourne, Roland-Garros en París, el Abierto de Estados Unidos en Nueva York y Wimbledon en Londres.;https://es.wikipedia.org/wiki/Grand_Slam_(tenis)
11;es;¿Cuántos jugadores franceses han ganado Roland-Garros entre 1925 y 2019 ?;Cinco;Diez;Siete;Tres;Confirmé;Los ganadores franceses en Roland-Garros son diez nombres: 5 jugadores franceses y 5 jugadores han ganado en la arcilla parisina.;https://es.wikipedia.org/wiki/Torneo_de_Roland_Garros
12;es;¿Cuál es la nacionalidad de la tenista Serena Williams ?;Americano;Inglés;Brasileño;Francés;Confirmé;Serena Jameka Williams, hermana del jugador Venus Williams, es una tenista estadounidense nacida el 26 de septiembre de 1981 en Saginaw.;https://es.wikipedia.org/wiki/Serena_Williams
13;es;¿Qué tenista francés podemos ver en un comercial de Kinder Bueno ?;Jo-Wilfried Tsonga;Yannick Noah;Gael Monfils;Richard Gasquet;Confirmé;Jo-Wilfried Tsonga le pidió a sus seguidores que detuvieran las bromas a veces incesantes sobre su asociación con Kinder Bueno.;https://es.wikipedia.org/wiki/Jo-Wilfried_Tsonga
14;es;¿En qué superficie tuvieron lugar los primeros partidos de tenis ?;Hierba;Cancha de arcilla;Hierba sintética;Hormigón;Confirmé;De hecho, en 1888 el mayor Harry Gem dibujó una cancha de tenis en el césped de su propiedad personal.;https://es.wikipedia.org/wiki/Tenis
15;es;¿En la final de cuál torneo de Grand Slam Bjorn Borg falló cuatro veces ?;US Open;Wimbeldon;Roland-Garros;Abierto de Australia;Confirmé;Björn Borg se convirtió en número mundial en 1977 y fue coronado campeón mundial por la ITF tres veces, en 1978, 1979 y 1980.;https://es.wikipedia.org/wiki/Björn_Borg
16;es;¿Qué torneo de tenis Grand Slam se juega exclusivamente en hierba ?;Wimbeldon;Roland-Garros;Abierto de Australia;US Open;Confirmé;Los partidos del torneo de tenis más antiguo del mundo tienen lugar en una superficie de césped donde no se realiza ninguna sesión nocturna.;https://es.wikipedia.org/wiki/Campeonato_de_Wimbledon
17;es;¿Cuál era el apodo del tenista alemán Boris Becker ?;Boom Boom;Big Ben;Bang Bang;Bam Bam;Confirmé;Becker causó sensación cuando ganó su primer Wimbledon a los 17 años en 1985, ganando su apodo de Boom-Boom Becker.;https://es.wikipedia.org/wiki/Boris_Becker
18;es;¿Qué tenista tiene el récord bastante especial para el número de raquetas rotas ?;Marat Safin;John McEnroe;Marcos Baghdadis;Roger Federer;Confirmé;El ex número uno del mundo rompió 1,055 cuadros en 689 partidos oficiales durante su carrera, o 1.5 raquetas por juego.;https://es.wikipedia.org/wiki/Marat_Safin
19;es;En tenis, ¿cuál es el récord actual de velocidad aproximada registrado en servicio ?;260 km / h;170 km / h;280 km / h;200 km / h;Confirmé;Según los informes, un tenista australiano desconocido rompió el récord de velocidad de servicio con una impresionante cifra de 263 km / h.;https://es.wikipedia.org/wiki/Tenis
20;es;¿En qué trabajo estaba Roland Garros, que dio su nombre al estadio construido en 1928 ?;Aviador;Futbolista;Navegador;Abogado;Confirmé;Roland Garros, aviador francés, teniente piloto durante la Primera Guerra Mundial, nació el 6 de octubre de 1888 en Saint-Denis de La Reunión.;https://es.wikipedia.org/wiki/Roland_Garros
21;es;En 2019, ¿quién tuvo el récord mundial en tenis masculino ?;Federer;Djokovic;Sampras;Nadal;Expert;Roger Federer es el único jugador en la historia del tenis que ha ganado tres torneos de Grand Slam al menos cinco veces.;https://es.wikipedia.org/wiki/Roger_Federer
22;es;¿En cuántos sets ganadores se juegan los partidos de Grand Slam femenino ?;Dos;Tres;Cuatro;Cinco;Expert;Los hombres juegan el mejor de cinco entradas, mientras que las mujeres compiten en dos sets ganadores solamente.;https://es.wikipedia.org/wiki/Grand_Slam_(tenis)
23;es;¿Cuántas horas le tomó a Nadal superar la Roma de Federer en 2006 ?;Cinco;Cuatro;Dos;Tres;Expert;Los buenos resultados de Nadal le permitirán tomar el lugar de Roger Federer en la cima de la clasificación ATP Race 2007 el 30 de abril.;https://es.wikipedia.org/wiki/Rafael_Nadal
24;es;¿Cuál es el tamaño oficial de una cancha de tenis ?;23,77 x 8,23 m;15 x 5 m;21,52 x 8,15 m;24,73 x 9,17 m;Expert;Las líneas de fondo de una cancha de tenis miden 8.23 metros. Las líneas laterales, dibujadas a lo largo de la longitud, son 23.77 metros.;https://es.wikipedia.org/wiki/Tenis
25;es;¿Cuántos decibelios fueron los gritos de Maria Sharapova pronunciados en las canchas ?;105 dbs;83 dbs;126 dbs;50 dbs;Expert;Además de este ruido equivalente al de una hélice de avión pequeño que despega, empuja meditaciones curiosas entre cada punto.;https://es.wikipedia.org/wiki/María_Sharápova
26;es;¿Qué tenista causó la muerte de un árbitro por una de sus bolas que lo golpeó ?;Stefan Edberg;Jimmy Connors;Mats Wilander;Björn Borg;Expert;El 10 de septiembre de 1983, una de las balas de Stefan Edberg alcanzó a un juez de línea, Dick Wertheim, de 61 años, con toda su fuerza.;https://es.wikipedia.org/wiki/Stefan_Edberg
27;es;En singles, en su centro, una red de tenis debería ser ¿qué tan alto ?;91 cm;75 cm;103 cm;88 cm;Expert;La altura de la red en el centro debe estar firmemente retenida por una correa y ofrecer una altura de 0.914 metros, o tres pies.;https://es.wikipedia.org/wiki/Tenis
28;es;¿Cuál es la nacionalidad de la ex tenista Gabriela Sabatini ?;Argentina;Italiano;Español;Griego;Expert;Vicecampeona olímpica en 1988 durante los Juegos Olímpicos de Seúl, Gabriela Sabatini también fue finalista en el Abierto de Estados Unidos el mismo año.;https://es.wikipedia.org/wiki/Gabriela_Sabatini
29;es;¿Quién le dio al ganador el trofeo masculino Roland-Garros en 2005 ?;Zinédine Zidane;Cedric Pioline;Tony Parker;Teddy Riner;Expert;Zidane presentó la primera Copa Mosqueteros a Nadal, ganador del torneo después de la final contra el argentino Mariano Puerta.;https://es.wikipedia.org/wiki/Torneo_de_Roland_Garros_2005
30;es;¿Qué famoso tenista francés es de Camerún ?;Yannick Noah;Gaël Monfils;Jo-Wilfried Tsonga;Gille Simons;Expert;Hijo del futbolista camerunés Zacharie Noah, ganador de la Copa de Francia en 1961, es el padre del jugador de baloncesto francés Joakim Noah.;https://es.wikipedia.org/wiki/Yannick_Noah
1;it;Quale giocatore francese ha vinto il torneo Roland-Garros nel 1983 ?;Yannick Noah;Jo-Wilfried Tsonga;Guy Dimentica;Richard Gasquet;Débutant;Questa vittoria gli è valsa l'unico giocatore francese ad aver vinto un torneo del Grande Slam dell'era Open nei singoli maschili.;https://it.wikipedia.org/wiki/Yannick_Noah
2;it;Quale tennista brasiliano professionista si chiama Kuga ?;Gustavo Kuerten;Björn Borg;John McEnroe;Novak Djokovic;Débutant;Gustavo Kuerten ha vinto venti titoli singoli sul circuito ATP, tra cui tre tornei Roland-Garros, un Masters e cinque Masters 1000.;https://it.wikipedia.org/wiki/Gustavo_Kuerten
3;it;Sebbene pieno d'aria, di che materiale sono fatte le palline da tennis ?;Gomma;Vetro;Plastica;Cartone;Débutant;Una palla da tennis è costituita da un guscio di gomma, chiamato nucleo, ricoperto di feltro, spesso di colore giallo o bianco.;https://it.wikipedia.org/wiki/Tennis
4;it;Quale squadra ha vinto la Coppa Davis 2017, la 106a edizione di questo torneo ?;Francia;Belgio;Svizzera;Italia;Débutant;La Francia di Yannick Noah ha così vinto la sua decima Coppa Davis, tra l'altro grazie alla vittoria di Lucas Pouille su Steve Darcis.;https://it.wikipedia.org/wiki/Coppa_Davis_2017
5;it;Quale giocatore belga di piccole dimensioni ha comunque vinto il torneo Roland-Garros ?;Justine Henin;Kim Clijsters;Elise Mertens;Nancy Feber;Débutant;Grazie alla varietà del suo gioco, John McEnroe ha definito il suo rovescio il miglior rovescio del mondo, uomini e donne messi insieme.;https://it.wikipedia.org/wiki/Justine_Henin
6;it;Quanti campi ci sono al French Tennis Open ?;17;12;24;8;Débutant;I tre tribunali più grandi sono il tribunale Philip-Chatrier (o tribunale centrale), il castello di Suuzanne-Lenglen e il tribunale di Lione-Mathieu.;https://it.wikipedia.org/wiki/Open_di_Francia
7;it;In una partita di tennis professionale, cosa cambi ogni nove partite ?;Ball;Ciaspolate;Arbitro;Jersey;Débutant;Un cambio di palline avviene ogni 9 partite, tranne la prima che si svolge alla fine della settima partita (perché il riscaldamento corrisponde a 2 partite).;https://it.wikipedia.org/wiki/Tennis
8;it;Alla fine del 2019, quante volte Rafael Nadal ha vinto il Roland-Garros ?;Dodici;Undici;Sette;Tredici;Débutant;Dopo aver vinto 19 tornei del Grande Slam, è l'unico giocatore ad aver vinto 12 titoli singoli in uno di questi quattro tornei principali.;https://it.wikipedia.org/wiki/Rafael_Nadal
9;it;Qual è la nazionalità del tennista professionista Roger Federer ?;Svizzera;Austriaco;Svedese;Francese;Débutant;Nato a Basilea, Federer detiene il record per 310 settimane trascorse al primo posto nella classifica del tennis ATP World Tour.;https://it.wikipedia.org/wiki/Roger_Federer
10;it;In quanti tornei principali è costituito il Grand Slam del tennis ?;Quattro;Cinque;Tre;Sei;Débutant;I quattro tornei sono gli Australian Open a Melbourne, il Roland-Garros a Parigi, gli US Open a New York e Wimbledon a Londra.;https://it.wikipedia.org/wiki/Grande_Slam_(tennis)
11;it;Quanti giocatori francesi hanno vinto il Roland-Garros tra il 1925 e il 2019 ?;Cinque;Dieci;Sette;Tre;Confirmé;I vincitori francesi del Roland-Garros sono dieci nomi: 5 giocatori francesi e 5 giocatori hanno vinto sull'argilla parigina.;https://it.wikipedia.org/wiki/Open_di_Francia
12;it;Qual è la nazionalità della tennista Serena Williams ?;Americano;Inglese;Brasiliano;Francese;Confirmé;Serena Jameka Williams, sorella del giocatore Venus Williams, è una tennista americana nata il 26 settembre 1981 a Saginaw.;https://it.wikipedia.org/wiki/Serena_Williams
13;it;Quale tennista francese possiamo vedere in una pubblicità di Kinder Bueno ?;Jo-Wilfried Tsonga;Yannick Noah;Gael Monfils;Richard Gasquet;Confirmé;Jo-Wilfried Tsonga ha chiesto ai suoi sostenitori di interrompere le battute a volte incessanti sulla sua collaborazione con Kinder Bueno.;https://it.wikipedia.org/wiki/Jo-Wilfried_Tsonga
14;it;Su quale superficie si sono svolte le prime partite di tennis ?;Erba;Campo in terra battuta;Erba sintetica;Calcestruzzo;Confirmé;Fu infatti nel 1888 che il maggiore Harry Gem disegnò un ruvido campo da tennis sul prato della sua proprietà personale.;https://it.wikipedia.org/wiki/Tennis
15;it;Nella finale di quale torneo del Grande Slam Bjorn Borg ha fallito quattro volte ?;US Open;Wimbeldon;Roland-Garros;Australian Open;Confirmé;Björn Borg divenne il numero mondiale nel 1977 e incoronò tre volte campione del mondo dall'ITF, nel 1978, 1979 e 1980.;https://it.wikipedia.org/wiki/Björn_Borg
16;it;Quale torneo di tennis del Grande Slam si gioca esclusivamente sull'erba ?;Wimbeldon;Roland-Garros;Australian Open;US Open;Confirmé;Le partite del più antico torneo di tennis del mondo si svolgono su una superficie erbosa dove non si svolgono sessioni notturne.;https://it.wikipedia.org/wiki/Torneo_di_Wimbledon
17;it;Qual era il soprannome del tennista tedesco Boris Becker ?;Boom Boom;Big Ben;Bang Bang;Bam Bam;Confirmé;Becker fece scalpore quando vinse il suo primo Wimbledon a 17 nel 1985, guadagnandosi il soprannome di Boom-Boom Becker.;https://it.wikipedia.org/wiki/Boris_Becker
18;it;Quale tennista detiene il record piuttosto speciale per il numero di racchette rotte ?;Marat Safin;John McEnroe;Marcos Baghdadis;Roger Federer;Confirmé;L'ex numero uno al mondo ha rotto 1.055 frame in 689 partite ufficiali durante la sua carriera, o 1,5 racchette per partita.;https://it.wikipedia.org/wiki/Marat_Safin
19;it;Nel tennis, qual è l'attuale record di velocità approssimativa registrato in servizio ?;260 km / h;170 km / h;280 km / h;200 km / h;Confirmé;Secondo quanto riferito, uno sconosciuto tennista australiano ha battuto il record di velocità di servizio con 263 km / h.;https://it.wikipedia.org/wiki/Tennis
20;it;Quale lavoro fu Roland Garros, che diede il nome allo stadio costruito nel 1928 ?;Aviatore;Calciatore;Navigatore;Avvocato;Confirmé;Aviatore francese, tenente pilota durante la prima guerra mondiale, Roland Garros nacque il 6 ottobre 1888 a Saint-Denis de La Réunion.;https://it.wikipedia.org/wiki/Roland_Garros_(aviatore)
21;it;Nel 2019, chi ha detenuto il titolo mondiale nel tennis maschile ?;Federer;Djokovic;Sampras;Nadal;Expert;Roger Federer è l'unico giocatore nella storia del tennis ad aver vinto tre tornei del Grande Slam almeno cinque volte.;https://it.wikipedia.org/wiki/Roger_Federer
22;it;In quanti set vincenti si giocano le partite del Grand Slam femminile ?;Due;Tre;Quattro;Cinque;Expert;Gli uomini giocano il meglio dei cinque inning mentre le donne competono solo in due set vincenti.;https://it.wikipedia.org/wiki/Grande_Slam_(tennis)
23;it;Quante ore ci sono volute Nadal per superare la Roma di Federer nel 2006 ?;Cinque;Quattro;Due;Tre;Expert;I buoni risultati di Nadal gli permetteranno di prendere il posto di Roger Federer a capo della classifica ATP Race 2007 il 30 aprile.;https://it.wikipedia.org/wiki/Rafael_Nadal
24;it;Qual è la dimensione ufficiale di un campo da tennis ?;23,77 x 8,23 m;15 x 5 m;21,52 x 8,15 m;24,73 x 9,17 m;Expert;Le linee di fondo di un campo da tennis misurano 8,23 metri. Le linee laterali, disegnate lungo la lunghezza, sono 23,77 metri.;https://it.wikipedia.org/wiki/Tennis
25;it;Quanti decibel sono state pronunciate le grida di Maria Sharapova sul campo ?;105 dbs;83 dbs;126 dbs;50 dbs;Expert;Oltre a questo rumore equivalente a quello dell'elica di un piccolo aereo in decollo, spinge curiose meditazioni tra ogni punto.;https://it.wikipedia.org/wiki/Marija_ ?arapova
26;it;Quale tennista ha causato la morte di un arbitro per una delle sue palle che lo ha colpito ?;Stefan Edberg;Jimmy Connors;Mats Wilander;Björn Borg;Expert;Il 10 settembre 1983, uno dei proiettili di Stefan Edberg colpì un guardalinee, Dick Wertheim, allora 61enne, con tutta la forza.;https://it.wikipedia.org/wiki/Stefan_Edberg
27;it;Nei single, al suo centro, una rete da tennis dovrebbe essere alta ?;91 cm;75 cm;103 cm;88 cm;Expert;L'altezza della rete al centro deve essere saldamente trattenuta da una cinghia e offrire un'altezza di 0,914 metri o tre piedi.;https://it.wikipedia.org/wiki/Tennis
28;it;Qual è la nazionalità dell'ex tennista Gabriela Sabatini ?;Argentina;Italiano;Spagnolo;Greco;Expert;La vice campionessa olimpica nel 1988 durante le Olimpiadi di Seoul, Gabriela Sabatini è stata anche finalista degli US Open nello stesso anno.;https://it.wikipedia.org/wiki/Gabriela_Sabatini
29;it;Chi ha assegnato al vincitore il trofeo maschile Roland-Garros nel 2005 ?;Zinédine Zidane;Cedric Pioline;Tony Parker;Teddy Riner;Expert;Zidane ha consegnato la prima Coppa dei Moschettieri a Nadal, vincitore del torneo dopo la finale contro l'argentino Mariano Puerta.;https://it.wikipedia.org/wiki/Open_di_Francia_2005
30;it;Quale famoso tennista francese viene dal Camerun ?;Yannick Noah;Gaël Monfils;Jo-Wilfried Tsonga;Gille Simons;Expert;Figlio del calciatore camerunese Zacharie Noah, vincitore della Coupe de France nel 1961, è il padre del giocatore di basket francese Joakim Noah.;https://it.wikipedia.org/wiki/Yannick_Noah
1;nl;Welke Franse speler won het Roland-Garros-toernooi in 1983 ?;Yannick Noah;Jo-Wilfried Tsonga;Guy vergeten;Richard Gasquet;Débutant;Deze overwinning verdiende hem om de enige Franse speler te zijn die een Grand Slam-toernooi van het Open tijdperk in heren singles heeft gewonnen.;https://nl.wikipedia.org/wiki/Yannick_Noah
2;nl;Welke professionele Braziliaanse tennisspeler heet Kuga ?;Gustavo Kuerten;Björn Borg;John McEnroe;Novak Djokovic;Débutant;Gustavo Kuerten won twintig titels op het ATP-circuit, waaronder drie Roland-Garros-toernooien, een Masters en vijf Masters 1000.;https://nl.wikipedia.org/wiki/Gustavo_Kuerten
3;nl;Hoewel gevuld met lucht, van welk materiaal zijn tennisballen gemaakt ?;Rubber;Glas;Kunststof;Karton;Débutant;Een tennisbal is gemaakt van een rubberen schaal, een kern genoemd, bedekt met vilt, vaak geel of wit van kleur.;https://nl.wikipedia.org/wiki/Tennis
4;nl;Welk team won de Davis Cup 2017, de 106e editie van dit toernooi ?;Frankrijk;België;Zwitserland;Italië;Débutant;Yannick Noah's Frankrijk won daarmee zijn tiende Davis Cup, onder andere dankzij de overwinning van Lucas Pouille op Steve Darcis.;https://nl.wikipedia.org/wiki/Davis_Cup_2017
5;nl;Welke Belgische speler met een kleine omvang heeft toch het Roland-Garros-toernooi gewonnen ?;Justine Henin;Kim Clijsters;Elise Mertens;Nancy Feber;Débutant;Dankzij de variëteit van zijn spel noemde John McEnroe zijn backhand één hand de beste backhand ter wereld, mannen en vrouwen gecombineerd.;https://nl.wikipedia.org/wiki/Justine_Henin
6;nl;Hoeveel banen zijn er op de internationale Franse tenniskampioenschappen ?;17;12;24;8;Débutant;De drie grootste rechtbanken zijn het Philippe-Chatrier-hof (of centraal hof), het Suzanne-Lenglen-hof en het Simonne-Mathieu-hof.;https://nl.wikipedia.org/wiki/Roland_Garros_(tennistoernooi)
7;nl;Wat verander je in een professionele tenniswedstrijd om de negen wedstrijden ?;Bal;Sneeuwschoenwandelen;Scheidsrechter;Jersey;Débutant;Een verandering van ballen vindt plaats om de 9 spellen, behalve de eerste die plaatsvindt aan het einde van het zevende spel (omdat de warming-up overeenkomt met 2 spellen).;https://nl.wikipedia.org/wiki/Tennis
8;nl;Eind 2019, hoe vaak heeft Rafael Nadal Roland-Garros gewonnen ?;Twaalf;Elf;Zeven;Dertien;Débutant;Hij heeft 19 Grand Slam-toernooien gewonnen en is de enige speler die 12 singles-titels heeft gewonnen in een van deze vier grote toernooien.;https://nl.wikipedia.org/wiki/Rafael_Nadal
9;nl;Wat is de nationaliteit van professionele tennisser Roger Federer ?;Zwitserland;Oostenrijks;Zweeds;Frans;Débutant;Geboren in Basel, heeft Federer het record voor 310 weken doorgebracht op de eerste plaats in de ATP World Tour tennisranglijst.;https://nl.wikipedia.org/wiki/Roger_Federer
10;nl;Uit hoeveel grote toernooien bestaat de tennis grand slam ?;Vier;Vijf;Drie;Zes;Débutant;De vier toernooien zijn de Australian Open in Melbourne, Roland-Garros in Parijs, de US Open in New York en Wimbledon in Londen.;https://nl.wikipedia.org/wiki/Grandslamtoernooi
11;nl;Hoeveel Franse spelers hebben Roland-Garros tussen 1925 en 2019 gewonnen ?;Vijf;Tien;Zeven;Drie;Confirmé;De Franse winnaars bij Roland-Garros zijn tien namen: 5 Franse spelers en 5 spelers hebben gewonnen op de Parijse klei.;https://nl.wikipedia.org/wiki/Roland_Garros_(tennistoernooi)
12;nl;Wat is de nationaliteit van tennisser Serena Williams ?;Amerikaans;Engels;Braziliaans;Frans;Confirmé;Serena Jameka Williams, zus van speler Venus Williams, is een Amerikaanse tennisspeler geboren op 26 september 1981 in Saginaw.;https://nl.wikipedia.org/wiki/Serena_Williams
13;nl;Welke Franse tennisspeler kunnen we zien in een Kinder Bueno-commercial ?;Jo-Wilfried Tsonga;Yannick Noah;Gael Monfils;Richard Gasquet;Confirmé;Jo-Wilfried Tsonga vroeg zijn aanhangers om de soms onophoudelijke grappen over zijn samenwerking met Kinder Bueno te stoppen.;https://nl.wikipedia.org/wiki/Jo-Wilfried_Tsonga
14;nl;Op welk oppervlak vonden de eerste tenniswedstrijden plaats ?;Gras;Clay court;Kunstgras;Beton;Confirmé;In 1888 schetste majoor Harry Gem een bruwe tennisbaan op het grasveld van zijn persoonlijke bezittingen.;https://nl.wikipedia.org/wiki/Tennis
15;nl;Heeft Bjorn Borg vier keer gefaald in de finale van welk Grand Slam-toernooi ?;US Open;Wimbeldon;Roland-Garros;Australian Open;Confirmé;Björn Borg werd wereldnummer in 1977 en werd driemaal wereldkampioen door de ITF, in 1978, 1979 en 1980.;https://nl.wikipedia.org/wiki/Björn_Borg
16;nl;Welk Grand Slam-tennistoernooi wordt exclusief op gras gespeeld ?;Wimbeldon;Roland-Garros;Australian Open;US Open;Confirmé;De wedstrijden van het oudste tennistoernooi ter wereld vinden plaats op een grasveld waar geen nachtsessie plaatsvindt.;https://nl.wikipedia.org/wiki/Wimbledon_(tennistoernooi)
17;nl;Wat was de bijnaam van de Duitse tennisser Boris Becker ?;Boem Boem;Big Ben;Bang Bang;Bam Bam;Confirmé;Becker veroorzaakte een sensatie toen hij zijn eerste Wimbledon op 17 in 1985 won en zijn bijnaam Boom-Boom Becker verdiende.;https://nl.wikipedia.org/wiki/Boris_Becker
18;nl;Welke tennisspeler heeft het nogal speciale record voor het aantal gebroken rackets ?;Marat Safin;John McEnroe;Marcos Baghdadis;Roger Federer;Confirmé;De voormalige nummer één brak 1.055 frames in 689 officiële wedstrijden tijdens zijn carrière, of 1,5 rackets per game.;https://nl.wikipedia.org/wiki/Marat_Safin
19;nl;In tennis, wat is het huidige geschatte snelheidsrecord dat tijdens de dienst is geregistreerd ?;260 km / u;170 km / u;280 km / u;200 km / u;Confirmé;Een onbekende Australische tennisspeler verbrak het dienstsnelheidsrecord met een indrukwekkende 263 km / u.;https://nl.wikipedia.org/wiki/Tennis
20;nl;Welke taak had Roland Garros, die zijn naam gaf aan het in 1928 gebouwde stadion ?;Vlieger;Voetballer;Navigator;Advocaat;Confirmé;De Franse vlieger, luitenantpiloot tijdens de Eerste Wereldoorlog, Roland Garros werd geboren op 6 oktober 1888 in Saint-Denis de La Réunion.;https://nl.wikipedia.org/wiki/Roland_Garros_(luchtheld)
21;nl;Wie behaalde in 2019 het wereldtitelrecord in herentennis ?;Federer;Djokovic;Sampras;Nadal;Expert;Roger Federer is de enige speler in de tennisgeschiedenis die minstens vijf keer drie Grand Slam-toernooien heeft gewonnen.;https://nl.wikipedia.org/wiki/Roger_Federer
22;nl;In hoeveel winnende sets worden de Grand Slam-wedstrijden voor dames gespeeld ?;Twee;Drie;Vier;Vijf;Expert;Mannen spelen het beste van vijf innings, terwijl vrouwen slechts in twee winnende sets strijden.;https://nl.wikipedia.org/wiki/Grandslamtoernooi
