1;es;¿Bajo qué otro nombre también se conocen especialistas en criptomoneda Peercoin ?;PPCoin;RipCoin;ConnectCoin;DualCoin;Débutant;Peercoin se inspiró en Bitcoin y comparte con él gran parte de su código fuente, así como de su implementación técnica.;https://es.wikipedia.org/wiki/Peercoin
2;es;¿En qué cartera se pueden almacenar los Ethers ?;Billetera;Baloncesto;Imán;Disquete;Débutant;Ethereum es la segunda moneda criptográfica descentralizada más grande con una capitalización de más de cien mil millones.;https://es.wikipedia.org/wiki/Ethereum
3;es;¿Qué inversor de criptomonedas es también el creador del sitio bitcoin.com ?;Roger Ver;Gavin Wood;Charlie Lee;Sunny King;Débutant;A finales de 2013, Roger Ver donó más de $ 1 millón en bitcoins a la Fundación para la Educación Económica.;https://es.wikipedia.org/wiki/Bitcoin
4;es;¿Cuántas criptomonedas en la categoría de infraestructura hay hasta ahora ?;Una docena;Cien;Unos cincuenta;Mil;Débutant;A pesar de sus pequeños números, es probable que estas criptomonedas provoquen los cambios más profundos.;https://es.wikipedia.org/wiki/Criptomoneda
5;es;¿Qué aporta la criptomoneda en comparación con otras soluciones como PayPal ?;Anonimato;Trazabilidad;Identificación;Honorarios;Débutant;Las nuevas directivas europeas que pronto se incorporarán a la legislación francesa darán prioridad a la lucha contra el blanqueo de dinero.;https://es.wikipedia.org/wiki/Criptomoneda
6;es;¿En qué año surgió Bitcoin, la primera criptomoneda ?;2009;2011;2013;2015;Débutant;Como moneda o mercancía, los bitcoins se pueden cambiar por otras monedas, bienes o servicios.;https://es.wikipedia.org/wiki/Bitcoin
7;es;¿Qué operación se utiliza para validar las transacciones y asegurar la red de Bitcoin ?;Minería;Enrutamiento;Depuración;Hashing;Débutant;La extracción de una criptomoneda consiste en proporcionar un servicio a la red de la moneda a cambio de una recompensa pecuniaria.;
8;es;¿En qué serie de televisión creada por Sam Esmail estamos hablando de Bitcoin ?;« Mr. Robot »;« Breaking Bad »;« The Affair »;« Homeland »;Débutant;Según The Guardian en 2016, « Mr. Robot » es una de las series más emocionantes del momento y se niega a cumplir las reglas.;
9;es;¿En qué plataforma puedes comprar hasta 200 criptomonedas diferentes ?;Bittrex;Criptopia;Kraken;CoinHouse;Débutant;Su motor de negociación personalizado ha sido diseñado para ser escalable y garantizar que las órdenes se ejecuten en tiempo real.;https://es.wikipedia.org/wiki/Criptomoneda
10;es;¿Cuál fue el precio de bitcoin en enero de 2018, sabiendo que valía 1 euro en 2001 ?;9,306 EUR;7,607 EUR;5,944 EUR;3,519 EUR;Débutant;Los bitcoins se están desembolsando agresivamente hasta un máximo de $ 21 millones en unas pocas décadas.;https://es.wikipedia.org/wiki/Bitcoin
11;es;¿Qué ex empleado de Google desarrolló la moneda electrónica Litecoin ?;Charlie Lee;Kevin Castner;Terri Hall;Robert Walsh;Confirmé;El objetivo de la red Litecoin es crear un bloque cada dos minutos treinta, en lugar de cada diez minutos para Bitcoin.;https://es.wikipedia.org/wiki/Litecoin
12;es;¿En qué año se fundó el protocolo de pago de código abierto Stellar ?;2014;2012;2010;2016;Confirmé;El procotole Stellar es apoyado por una fundación sin fines de lucro, la Stellar Development Foundation.;
13;es;¿Qué tipo de criptomoneda va más allá de los simples medios de pago ?;Infraestructura;Social;Compras;Local;Confirmé;Verdaderos camiones, no deberíamos llamarlos criptomonedas, su ambición va más allá del pago.;https://es.wikipedia.org/wiki/Criptomoneda
14;es;¿Qué criptomoneda ultrasegura se dirige exclusivamente al mercado legal del cannabis ?;PotCoin;PayCoin;ZiftrCoin;QuickCoin;Confirmé;En junio de 2017, PotCoin patrocinó el viaje de la ex estrella de la NBA Dennis Rodman, que luego visitó Corea del Norte.;https://es.wikipedia.org/wiki/Criptomoneda
15;es;¿Cuál es el símbolo utilizado por la criptomoneda Primecoin ?;Letra psi;Águila real;Rojo cero;Doble plaza;Confirmé;El mecanismo de operación de esta criptomoneda contribuye a la identificación de números primos de alta capacidad.;https://es.wikipedia.org/wiki/Criptomoneda
16;es;¿Qué nombre es la primera criptomoneda diseñada para sistemas Android ?;MangoCoinz;Burstcoin;Reddcoin;Vertcoin;Confirmé;MangoCoinz usa los sensores en su teléfono inteligente o tableta para convertir energía en movimientos de dinero.;https://es.wikipedia.org/wiki/Criptomoneda
17;es;¿Qué país fue el primero en prohibir el uso de bitcoin en su territorio ?;Tailandia;Rusia;Alemania;Estados Unidos;Confirmé;En 2016, el banco central de Tailandia dijo que bitcoin no era ilegal, pero advirtió contra su uso.;https://es.wikipedia.org/wiki/Bitcoin
18;es;¿Qué criptomoneda explota el espacio en disco no utilizado de una computadora ?;Burstcoin;Vertcoin;NameCoin;MangoCoinz;Confirmé;El espacio libre es suficiente para verificar las transacciones de blockchain de Burstcoin y recibir Burst para este trabajo.;https://es.wikipedia.org/wiki/Criptomoneda
19;es;¿Qué desarrollador está desde sus inicios en el corazón de la criptomoneda Peercoin ?;Sunny King;Charlie Lee;Roger Ver;Gavin Wood;Confirmé;Peercoin se inspiró en Bitcoin y comparte con él gran parte de su código fuente, así como de su implementación técnica.;
20;es;¿Qué criptomoneda intenta fomentar la producción de electricidad fotovoltaica ?;SolarCoin;Burstcoin;Vertcoin;NameCoin;Confirmé;La Fundación ha diseñado SolarCoins durante 40 años para generar 97 500 Thh de energía solar.;
21;es;¿Cuál de estas plataformas de comercio de criptomonedas se creó en 2017 ?;Binance;CoinBase;Bibox;Bittrex;Expert;En Binance, una plataforma global, puede intercambiar una gran cantidad de monedas Alt diferentes con Bitcoin o Ethereum.;https://es.wikipedia.org/wiki/Criptomoneda
22;es;¿Qué moneda nativa usa el protocolo de pago Ripple ?;XRP;PRP;RIL;EPI;Expert;Lanzada en 2012, la red Ripple tiene como objetivo permitir transacciones financieras globales seguras de cualquier tamaño sin débito.;https://es.wikipedia.org/wiki/XRP_(criptomoneda)
23;es;¿Qué doctor en informática ha publicado el documento técnico de Polkadot ?;Gavin Wood;Charlie Lee;Sunny King;Roger Ver;Expert;Gracias a Polkadot, diferentes blockchains pueden intercambiar mensajes de forma segura y sin un tercero de confianza.;https://es.wikipedia.org/wiki/Polkadot
24;es;¿Qué criptomoneda tiene el eslogan « Unbank the banked » ?;OmiseGO;PotCoin;Burstcoin;SolarCoin;Expert;OmiseGO desea la descentralización total de los flujos financieros junto con un acceso generalizado a las herramientas financieras tradicionales.;https://es.wikipedia.org/wiki/OmiseGO
25;es;¿Qué tipo de criptomoneda comercial a menudo se llama Bitcoin 2.0 ?;Infraestructura;Social;Compras;Local;Expert;Los proyectos de infraestructura apuntan a construir alternativas reales a los sistemas financieros existentes.;https://es.wikipedia.org/wiki/Criptomoneda
26;es;¿Qué criptomoneda local está destinada a los habitantes de Islandia ?;AuroaCoin;NEO;PeerCoin;Litecoin;Expert;Las monedas se distribuyeron gratuitamente a los 330,000 ciudadanos islandeses a través de una entrega el 25 de marzo de 2014 a la medianoche.;https://es.wikipedia.org/wiki/Criptomoneda
27;es;¿Cuál de estas criptomonedas se puede usar para inversiones a largo plazo ?;NxT;Reddcoin;PeerCoin;NameCoin;Expert;Nxt fue concebido como una plataforma flexible alrededor de la cual se pueden construir aplicaciones y servicios financieros.;https://es.wikipedia.org/wiki/Criptomoneda
28;es;¿Qué plataforma de comercio de bitcoins fue comprada por Mark Karpeles ?;Monte Gox;CoinBase;Binance;Huobi;Expert;Su brutal colapso en febrero de 2014 se debió a la piratería que resultó en una pérdida de 744,408 bitcoins.;
29;es;En Francia, ¿a quién le confió el Ministro de Economía una misión en bitcoin ?;Jean-Pierre Landau;Serge Lasvignes;Jean Lemierre;Jean-Louis Levet;Expert;Jean-Pierre Landau enseña en la Universidad de Princeton, en la Woodrow Wilson School for International Relations.;
30;es;¿Qué criptomoneda china es similar a Ethereum ?;NEO;NxT;PPCoin;XRP;Expert;Desarrollado desde 2014, NEO permite la implementación de contratos inteligentes en muchos lenguajes de programación.;https://es.wikipedia.org/wiki/Criptomoneda
1;it;Con quale altro nome è anche noto specialista criptovaluta Peercoin ?;PPCoin;RipCoin;ConnectCoin;DualCoin;Débutant;Peercoin è stato ispirato da Bitcoin e condivide con lui gran parte del suo codice sorgente e della sua implementazione tecnica.;
2;it;In quale portafoglio possono essere immagazzinati gli eteri ?;Portafoglio;Pallacanestro;Magnete;Disket;Débutant;Ethereum è la seconda valuta crittografica decentralizzata più grande con una capitalizzazione di oltre cento miliardi.;https://it.wikipedia.org/wiki/Ethereum
3;it;Quale investitore in criptovaluta è anche il creatore del sito bitcoin.com ?;Roger Ver;Gavin Wood;Charlie Lee;Sunny King;Débutant;Alla fine del 2013, Roger Ver ha donato oltre 1 milione di dollari in bitcoin alla Foundation for Economic Education.;https://it.wikipedia.org/wiki/Bitcoin
4;it;Quante criptovalute nella categoria delle infrastrutture ci sono finora ?;Una dozzina;Cento;Circa cinquanta;Mille;Débutant;Nonostante il loro piccolo numero, sono queste criptovalute che possono causare i cambiamenti più profondi.;https://it.wikipedia.org/wiki/Criptovaluta
5;it;Cosa comporta la criptovaluta rispetto ad altre soluzioni come PayPal ?;Anonimato;Tracciabilità;Identificazione;Commissioni;Débutant;Le nuove direttive europee che saranno presto recepite nel diritto francese daranno priorità alla lotta contro il riciclaggio di denaro.;https://it.wikipedia.org/wiki/Criptovaluta
6;it;In quale anno è nato Bitcoin, la prima criptovaluta ?;2009;2011;2013;2015;Débutant;Come valuta o merce, i bitcoin possono essere scambiati con altre valute, beni o servizi.;https://it.wikipedia.org/wiki/Bitcoin
7;it;Quale operazione viene utilizzata per convalidare le transazioni e proteggere la rete Bitcoin ?;Estrazione;Instradamento;Debug;Hashing;Débutant;L'estrazione di una criptovaluta consiste nel fornire un servizio alla rete della valuta in cambio di una ricompensa pecuniaria.;
8;it;In quali serie televisive create da Sam Esmail stiamo parlando di Bitcoin ?;« Mr. Robot »;« Breaking Bad »;« The Affair »;« Homeland »;Débutant;Secondo The Guardian nel 2016, « Mr. Robot » è una delle serie più eccitanti del momento, che rifiuta di rispettare le regole.;
9;it;Su quale piattaforma puoi acquistare fino a 200 diverse criptovalute ?;Bittrex;Cryptopia;Kraken;CoinHouse;Débutant;Il loro motore di trading personalizzato è stato progettato per essere scalabile e per garantire che gli ordini vengano eseguiti in tempo reale.;https://it.wikipedia.org/wiki/Criptovaluta
10;it;Qual è stato il prezzo del bitcoin a gennaio 2018, sapendo che valeva 1 euro nel 2001 ?;9.306 EUR;7.607 EUR;5.944 EUR;3.519 EUR;Débutant;I bitcoin vengono erogati in modo aggressivo a un massimo di $ 21 milioni in pochi decenni.;https://it.wikipedia.org/wiki/Bitcoin
11;it;Quale ex dipendente di Google ha sviluppato la valuta elettronica Litecoin ?;Charlie Lee;Kevin Castner;Sala Terri;Robert Walsh;Confirmé;L'obiettivo della rete Litecoin è creare un blocco ogni due minuti e trenta, anziché ogni dieci minuti per Bitcoin.;https://it.wikipedia.org/wiki/Litecoin
12;it;In quale anno è stato fondato il protocollo di pagamento open source Stellar ?;2014;2012;2010;2016;Confirmé;Il procotole Stellare è supportato da una fondazione senza scopo di lucro, la Stellar Development Foundation.;https://it.wikipedia.org/wiki/Stellar_(criptovaluta)
13;it;Quale tipo di criptovaluta va ben oltre il semplice mezzo di pagamento ?;Infrastruttura;Sociale;Acquisti;Locale;Confirmé;Veri camion, non dovremmo chiamarli criptovalute, la loro ambizione va oltre il pagamento.;https://it.wikipedia.org/wiki/Criptovaluta
14;it;Quale criptovaluta ultra sicura si rivolge esclusivamente al mercato legale della cannabis ?;PotCoin;PayCoin;ZiftrCoin;QuickCoin;Confirmé;Nel giugno 2017, PotCoin ha sponsorizzato il viaggio dell'ex star della NBA Dennis Rodman, visitando poi la Corea del Nord.;https://it.wikipedia.org/wiki/Criptovaluta
15;it;Qual è il simbolo utilizzato dalla criptovaluta Primecoin ?;Lettera psi;Aquila reale;Red Zero;Doppio quadrato;Confirmé;Il meccanismo di funzionamento di questa criptovaluta contribuisce all'identificazione di numeri primi di elevata capacità.;https://it.wikipedia.org/wiki/Criptovaluta
16;it;Qual è il nome della prima criptovaluta progettata per i sistemi Android ?;MangoCoinz;Burstcoin;Reddcoin;Vertcoin;Confirmé;MangoCoinz utilizza i sensori sul tuo smartphone o tablet per convertire l'energia in movimenti di denaro.;https://it.wikipedia.org/wiki/Criptovaluta
17;it;Quale paese è stato il primo a vietare l'uso del bitcoin sul suo territorio ?;Thailandia;Russia;Germania;Stati Uniti;Confirmé;Nel 2016, la banca centrale thailandese ha dichiarato che il bitcoin non era illegale, ma ha messo in guardia dall'utilizzarlo.;https://it.wikipedia.org/wiki/Bitcoin
18;it;Quale criptovaluta sfrutta lo spazio su disco inutilizzato di un computer ?;Burstcoin;Vertcoin;NameCoin;MangoCoinz;Confirmé;Lo spazio libero è sufficiente per controllare le transazioni blockchain di Burstcoin e ricevere Burst per questo lavoro.;https://it.wikipedia.org/wiki/Criptovaluta
19;it;Quale sviluppatore è fin dalle sue origini al centro della criptovaluta Peercoin ?;Sunny King;Charlie Lee;Roger Ver;Gavin Wood;Confirmé;Peercoin è stato ispirato da Bitcoin e condivide con lui gran parte del suo codice sorgente e della sua implementazione tecnica.;
20;it;Quale criptovaluta cerca di incoraggiare la produzione di elettricità fotovoltaica ?;SolarCoin;Burstcoin;Vertcoin;NameCoin;Confirmé;La Fondazione ha progettato SolarCoin per 40 anni per generare 97,500 THW di energia solare.;https://it.wikipedia.org/wiki/SolarCoin
21;it;Quale di queste piattaforme di trading di criptovaluta è stata creata nel 2017 ?;Binance;CoinBase;Bibox;Bittrex;Expert;Su Binance, una piattaforma globale, puoi scambiare un gran numero di monete Alt diverse con Bitcoin o Ethereum.;https://it.wikipedia.org/wiki/Criptovaluta
22;it;Quale valuta nativa viene utilizzata dal protocollo di pagamento Ripple ?;XRP;PRP;RIL;DPI;Expert;Lanciata nel 2012, la rete Ripple mira a consentire transazioni finanziarie globali sicure di qualsiasi dimensione senza addebito.;https://it.wikipedia.org/wiki/Ripple
23;it;Quale medico ha pubblicato il white paper di Polkadot ?;Gavin Wood;Charlie Lee;Sunny King;Roger Ver;Expert;Grazie a Polkadot, diverse blockchain possono scambiare messaggi in modo sicuro e senza una terza parte attendibile.;
24;it;Quale criptovaluta ha lo slogan « Unbank the banked » ?;OmiseGO;PotCoin;Burstcoin;SolarCoin;Expert;OmiseGO vuole il decentramento totale dei flussi finanziari unito ad un ampio accesso agli strumenti finanziari tradizionali.;
25;it;Quale tipo di criptovaluta aziendale viene spesso soprannominata Bitcoin 2.0 ?;Infrastruttura;Sociale;Acquisti;Locale;Expert;I progetti infrastrutturali mirano a costruire alternative reali ai sistemi finanziari esistenti.;https://it.wikipedia.org/wiki/Criptovaluta
26;it;Quale criptovaluta locale è destinata agli abitanti dell'Islanda ?;AuroaCoin;NEO;PeerCoin;Litecoin;Expert;Le monete sono state distribuite gratuitamente ai 330.000 cittadini islandesi tramite una caduta il 25 marzo 2014 a mezzanotte.;https://it.wikipedia.org/wiki/Criptovaluta
27;it;Quale di queste criptovalute può essere utilizzata per investimenti a lungo termine ?;NxT;Reddcoin;PeerCoin;NameCoin;Expert;Nxt è stata concepita come una piattaforma flessibile attorno alla quale è possibile creare applicazioni e servizi finanziari.;https://it.wikipedia.org/wiki/Criptovaluta
28;it;Quale piattaforma di trading di bitcoin è stata acquistata da Mark Karpeles ?;Mt. Gox;CoinBase;Binance;Huobi;Expert;Il suo brutale crollo nel febbraio 2014 è dovuto alla pirateria informatica con conseguente perdita di 744.408 bitcoin.;https://it.wikipedia.org/wiki/Mt._Gox
29;it;In Francia, a chi è stata affidata la missione del bitcoin sul bitcoin ?;Jean-Pierre Landau;Serge Lasvignes;Jean Lemierre;Jean-Louis Levet;Expert;Jean-Pierre Landau insegna alla Princeton University, alla Woodrow Wilson School for International Relations.;
30;it;Quale criptovaluta cinese è simile a Ethereum ?;NEO;NxT;PPCoin;XRP;Expert;Sviluppato dal 2014, NEO consente l'implementazione di contratti intelligenti in molti linguaggi di programmazione.;https://it.wikipedia.org/wiki/Criptovaluta
1;nl;Onder welke andere naam staan book bekende specialisten cryptocurrency Peercoin ?;PPCoin;RipCoin;ConnectCoin;DualCoin;Débutant;Peercoin werd geïnspireerd door Bitcoin en deelt veel van zijn broncode en zijn technische implementatie met hem.;
2;nl;In welke portefeuille kunnen de Ethers worden opgeslagen ?;Portemonnee;Basketbal;Magneet;Disket;Débutant;Ethereum is de tweede grootste gedecentraliseerde cryptografische valuta met een kapitalisatie van meer dan honderd miljard.;https://nl.wikipedia.org/wiki/Ethereum
3;nl;Welke investeerder in cryptocurrency is ook de maker van de site bitcoin.com ?;Roger Ver;Gavin Wood;Charlie Lee;Zonnige koning;Débutant;Eind 2013 schonk Roger Ver meer dan $ 1 miljoen aan bitcoins aan de Foundation for Economic Education.;https://nl.wikipedia.org/wiki/Bitcoin
4;nl;Hoeveel crypto-valuta's in de infrastructuurcategorie zijn er tot nu toe ?;Een dozijn;Honderd;Ongeveer vijftig;Duizend;Débutant;Ondanks hun kleine aantal zijn het deze cryptovaluta's die waarschijnlijk de meest ingrijpende veranderingen zullen teweegbrengen.;https://nl.wikipedia.org/wiki/Cryptogeld
5;nl;Wat brengt cryptocurrency ten opzichte van andere oplossingen zoals PayPal ?;Anonimiteit;Traceerbaarheid;Identificatie;Kosten;Débutant;Nieuwe Europese richtlijnen die binnenkort in de Franse wetgeving worden omgezet, zullen prioriteit geven aan de bestrijding van het witwassen van geld.;https://nl.wikipedia.org/wiki/Cryptogeld
6;nl;In welk jaar is Bitcoin, de eerste cryptocurrency, ontstaan ?;2009;2011;2013;2015;Débutant;Als valuta of grondstof kunnen bitcoins worden ingewisseld voor andere valuta, goederen of diensten.;https://nl.wikipedia.org/wiki/Bitcoin
7;nl;Welke bewerking wordt gebruikt om transacties te valideren en het Bitcoin-netwerk te beveiligen ?;Mijnbouw;Routering;Debuggen;Hashing;Débutant;Mijnbouw van een cryptocurrency bestaat uit het leveren van een service aan het netwerk van de valuta in ruil voor een geldelijke beloning.;
8;nl;In welke televisieseries gemaakt door Sam Esmail hebben we het over Bitcoin ?;« Mr. Robot »;« Breaking Bad »;« The Affair »;« Homeland »;Débutant;Volgens The Guardian in 2016 is « Mr. Robot » een van de meest opwindende series van dit moment, die weigert volgens de regels te spelen.;
9;nl;Op welk platform kunt u tot 200 verschillende crypto-valuta's kopen ?;Bittrex;Cryptopia;Kraken;CoinHouse;Débutant;Hun aangepaste handelsengine is ontworpen om schaalbaar te zijn en ervoor te zorgen dat orders in realtime worden uitgevoerd.;https://nl.wikipedia.org/wiki/Cryptogeld
10;nl;Wat was de prijs van bitcoin in januari 2018, wetende dat het 1 euro waard was in 2001 ?;EUR 9.306;EUR 7.607;EUR 5.944;EUR 3.519;Débutant;Bitcoins worden binnen enkele decennia agressief uitbetaald tot een maximum van $ 21 miljoen.;https://nl.wikipedia.org/wiki/Bitcoin
11;nl;Welke voormalige Google-medewerker heeft de elektronische valuta van Litecoin ontwikkeld ?;Charlie Lee;Kevin Castner;Terri Hall;Robert Walsh;Confirmé;Het doel van het Litecoin-netwerk is om elke twee minuten een blok te maken in plaats van om de tien minuten voor Bitcoin.;https://nl.wikipedia.org/wiki/Litecoin
12;nl;In welk jaar werd het Stellar open-source betalingsprotocol opgericht ?;2014;2012;2010;2016;Confirmé;De Stellar-procotole wordt ondersteund door een stichting zonder winstoogmerk, de Stellar Development Foundation.;
13;nl;Welk type cryptocurrency gaat veel verder dan de eenvoudige betaalmiddelen ?;Infrastructuur;Sociaal;Winkelen;Lokaal;Confirmé;Echte vrachtwagens, we moeten ze geen cryptovaluta's noemen, hun ambitie gaat verder dan betalen.;https://nl.wikipedia.org/wiki/Cryptogeld
14;nl;Welke ultraveilige cryptocurrency richt zich exclusief op de legale cannabismarkt ?;PotCoin;PayCoin;ZiftrCoin;QuickCoin;Confirmé;In juni 2017 sponsorde PotCoin de reis van de voormalige NBA-ster Dennis Rodman en vervolgens een bezoek aan Noord-Korea.;https://nl.wikipedia.org/wiki/Cryptogeld
15;nl;Wat is het symbool dat wordt gebruikt door de cryptocurrency Primecoin ?;Psi brief;Steenarend;Rode nul;Dubbel vierkant;Confirmé;Het werkingsmechanisme van deze cryptocurrency draagt bij aan de identificatie van priemgetallen met hoge capaciteit.;https://nl.wikipedia.org/wiki/Cryptogeld
16;nl;Welke naam is de eerste cryptocurrency ontworpen voor Android-systemen ?;MangoCoinz;Burstcoin;Reddcoin;Vertcoin;Confirmé;MangoCoinz gebruikt de sensoren op uw smartphone of tablet om energie om te zetten in geldbewegingen.;https://nl.wikipedia.org/wiki/Cryptogeld
17;nl;Welk land verbood als eerste het gebruik van bitcoin op zijn grondgebied ?;Thailand;Rusland;Duitsland;Verenigde Staten;Confirmé;In 2016 zei de centrale bank van Thailand dat bitcoin niet illegaal was, maar waarschuwde tegen het gebruik ervan.;https://nl.wikipedia.org/wiki/Bitcoin
18;nl;Welke cryptocurrency exploiteert de ongebruikte schijfruimte van een computer ?;Burstcoin;Vertcoin;NameCoin;MangoCoinz;Confirmé;Vrije ruimte is voldoende om de Burstcoin-blockchain-transacties te controleren en Burst te ontvangen voor deze taak.;https://nl.wikipedia.org/wiki/Cryptogeld
19;nl;Welke ontwikkelaar is sinds het begin in het hart van cryptocurrency Peercoin ?;Zonnige koning;Charlie Lee;Roger Ver;Gavin Wood;Confirmé;Peercoin werd geïnspireerd door Bitcoin en deelt veel van zijn broncode en zijn technische implementatie met hem.;
20;nl;Welke cryptocurrency probeert de productie van fotovoltaïsche elektriciteit aan te moedigen ?;SolarCoin;Burstcoin;Vertcoin;NameCoin;Confirmé;De Foundation heeft SolarCoins 40 jaar lang ontworpen om 97 500 TWh aan zonne-energie te genereren.;
21;nl;Welke van deze cryptocurrency-handelsplatforms is in 2017 gemaakt ?;Binance;CoinBase;Bibox;Bittrex;Expert;Op Binance, een wereldwijd platform, kunt u een groot aantal verschillende Alt-munten verhandelen met Bitcoin of Ethereum.;https://nl.wikipedia.org/wiki/Cryptogeld
22;nl;Welke nationale valuta wordt gebruikt door het Ripple-betalingsprotocol ?;XRP;PRP;RIL;PBM;Expert;Het Ripple-netwerk werd in 2012 geïntroduceerd en is bedoeld om veilige wereldwijde financiële transacties van elke omvang mogelijk te maken zonder te debiteren.;
23;nl;Welke computerarts heeft de Polkadot-whitepaper gepubliceerd ?;Gavin Wood;Charlie Lee;Zonnige koning;Roger Ver;Expert;Dankzij Polkadot kunnen verschillende blockchains berichten veilig en zonder een vertrouwde derde partij uitwisselen.;
24;nl;Welke cryptocurrency heeft de slogan « Unbank the banked » ?;OmiseGO;PotCoin;Burstcoin;SolarCoin;Expert;OmiseGO wil totale decentralisatie van financiële stromen in combinatie met brede toegang tot traditionele financiële instrumenten.;
25;nl;Wat voor soort zakelijke cryptocurrency wordt vaak de bijnaam Bitcoin 2.0 gegeven ?;Infrastructuur;Sociaal;Winkelen;Lokaal;Expert;Infrastructuurprojecten zijn gericht op het bouwen van echte alternatieven voor bestaande financiële systemen.;https://nl.wikipedia.org/wiki/Cryptogeld
26;nl;Welke lokale cryptocurrency is bedoeld voor de inwoners van IJsland ?;AuroaCoin;NEO;PeerCoin;Litecoin;Expert;De munten werden gratis uitgedeeld aan de 330.000 IJslandse burgers via een dropping op 25 maart 2014 om middernacht.;https://nl.wikipedia.org/wiki/Cryptogeld
27;nl;Welke van deze cryptovaluta's kunnen worden gebruikt voor langetermijninvesteringen ?;NxT;Reddcoin;PeerCoin;NameCoin;Expert;Nxt is opgevat als een flexibel platform waarrond financiële applicaties en services kunnen worden gebouwd.;https://nl.wikipedia.org/wiki/Cryptogeld
28;nl;Welk bitcoin-handelsplatform is gekocht door Mark Karpeles ?;Mount Gox;CoinBase;Binance;Huobi;Expert;De brute ineenstorting in februari 2014 was te wijten aan hacken resulterend in een verlies van 744.408 bitcoins.;
29;nl;Wie heeft de minister van Economie in Frankrijk een missie op bitcoin toevertrouwd ?;Jean-Pierre Landau;Serge Lasvignes;Jean Lemierre;Jean-Louis Levet;Expert;Jean-Pierre Landau geeft les aan de Princeton University, aan de Woodrow Wilson School for International Relations.;
30;nl;Welke Chinese cryptocurrency lijkt op Ethereum ?;NEO;NxT;PPCoin;XRP;Expert;NEO is ontwikkeld sinds 2014 en maakt de implementatie van slimme contracten in veel programmeertalen mogelijk.;https://nl.wikipedia.org/wiki/Cryptogeld
