3;es;En determinadas regiones de Europa, ¿con quién va acompañado San Nicolás ?;Padre Fouettard;Jack Frost;Cascanueces;Julbock;Débutant;Vestido con un gran abrigo negro con una gran capucha y botas gruesas, el padre Fouettard a veces lleva un látigo y una bolsa.;
4;es;Además del blanco, ¿qué color se asocia a menudo con San Nicolás ?;Rojo;Negro;Azul;Amarillo;Débutant;Estaba en malva y blanco, con un trasero, originalmente dorado, luego en rojo y blanco, lo que lo acerca al Papá Noel de hoy.;
5;es;¿A qué viaja San Nicolás en la Bélgica francófona ?;Burro mágico;Reno volador;Elefante real;Caballo blanco;Débutant;En el norte como en el sur del país, San Nicolás llega la noche del 5 al 6 de diciembre para dejar regalos y dulces.;
6;es;¿Qué encontramos en la piel de los niños belgas el día de San Nicolás ?;Speculoos;Cougnou;Faluche;Pastel de azúcar;Débutant;Tradicionalmente, se consume con mayor frecuencia durante el Adviento y más particularmente durante la fiesta de San Nicolás.;
7;es;¿En qué país tiene lugar la noche de los paquetes sorpresa en vísperas de Saint-Nicolas ?;Holanda;Suiza;Luxemburgo;Polonia;Débutant;Los paquetes sorpresa, entregados por Sinterklaas junto a la chimenea o en el rellano, suelen ir acompañados de poemas.;
8;es;¿Cuál es el nombre del acólito de Saint-Nicolas en el folclore alsaciano ?;Hans Trapp;Hermann Gessler;Guifred Estruch;Bos de Bénac;Débutant;En el origen de este personaje, estaría el mariscal Jean de Dratt (Hans von Trotha), un bruto sanguinario que aterrorizaba a la población.;
9;es;¿En qué ciudad del sur de Nancy hay una gran basílica dedicada al Santo ?;Saint-Nicolas-de-Port;Val de Briey;Mont-Saint-Martin;Villerupt;Débutant;En 1193 se construirá allí una segunda iglesia. También en este vendrá a rezar Juana de Arco en 1429.;https://es.wikipedia.org/wiki/Saint-Nicolas-de-Port
10;es;¿De qué dios escandinavo se inspirarían algunos de los atributos de San Nicolás ?;Odin;Loki;Thor;Vali;Débutant;De hecho, Odin siempre está acompañado por sus dos cuervos que lo ven todo y su fiel caballo Sleipnir.;https://es.wikipedia.org/wiki/Odín
11;es;En Holanda, ¿qué vehículo aterriza Saint Nicolas desde España ?;Barco;Avión;Globo de aire caliente;Planeador;Confirmé;Llega desde España en un stoomboot llamado Pakjesboot 12 (Small Packet Boat 12).;
12;es;¿De qué región de Francia ha sido San Nicolás el santo patrón desde 1477 ?;Lorena;Lemosín;Languedoc;Lyonnais;Confirmé;De hecho, mientras Lorena estaba ocupada por Borgoña, el duque René II exigió la victoria (que recibió) de San Nicolás.;https://es.wikipedia.org/wiki/Lorena (Francia)
13;es;En Nancy, ¿en cuántas semanas se extienden las fiestas de San Nicolás ?;Dos semanas;Una semana;Tres semanas;Cuatro semanas;Confirmé;En toda la ciudad hay carreras, espectáculos callejeros, un mercado de agricultores e incluso el pueblo de La Marmaille.;
14;es;¿Cuántas personas vinieron a escuchar a San Nicolás en Friburgo en 2015 ?;25,000;15.000;5,000;35,000;Confirmé;Tradicionalmente, allí da un discurso que contiene pasajes satíricos sobre los acontecimientos de la ciudad del año pasado.;
15;es;En Hungría, ¿qué pone San Nicolás en las botas de los niños malvados ?;Un palo;Un plátano;Un martillo;Una rata falsa;Confirmé;San Nicolás suele ir acompañado del Krampusz, el espantoso ayudante que se encarga de secuestrar a los niños malvados.;
16;es;¿Qué profesión ejercía Pierre Lenoir, que se convertiría en el padre Fouettard ?;Carnicero;Carpintero;Mason;Cerrajero;Confirmé;Cortó a tres niños en trozos pequeños para finalmente ponerlos en su tina de salazón para hacer un poco de sal.;
17;es;¿Qué día celebramos a San Nicolás para la Iglesia Ortodoxa ?;19 de diciembre;11 de diciembre;2 de enero;24 de diciembre;Confirmé;La Iglesia Ortodoxa todavía usa el calendario juliano, que era un calendario solar usado en la antigua Roma.;https://es.wikipedia.org/wiki/Calendario_juliano
18;es;Además de los niños, ¿de quién es también patrón San Nicolás ?;Abogados;Carpinteros;Especialistas en informática;Secretarios;Confirmé;Hoy es el patrón de muchas corporaciones como prisioneros, abogados, terapeutas ocupacionales y solteros.;
19;es;En Austria, ¿qué personajes que rodean a San Nicolás asustan a la multitud ?;Krampus;Kolobox;Curupira;Lagahoo;Confirmé;Con una máscara de demonio con cuernos y pieles gruesas, agitan cadenas, persiguiendo a la gente con palos.;https://es.wikipedia.org/wiki/Krampus
20;es;¿Qué representa la reliquia de San Nicolás en Saint-Nicolas-de-Port ?;Phalanx;Cubitus;Húmero;Occipital;Confirmé;La basílica fue restaurada a partir de 1983 gracias al considerable legado de la Sra. Camille Croué-Friedman, originaria de la ciudad.;
21;es;¿Cuál es el punto de paso esencial del desfile de San Nicolás en Metz ?;Place d'Armes;Los trinitarios;Fuerte de Queuleu;Fort Moselle;Expert;En Metz, se llevan a cabo muchas festividades como el desfile de Saint-Nicolas, espectáculos y también fuegos artificiales.;
22;es;¿En qué región de Francia es Père Fouettard una mujer, mitad hada, mitad bruja ?;Franco Condado;Gascuña;Touraine;Anjou;Expert;Franche-Comté también tiene sus brioches de Saint-Nicolas, como el alsaciano Männele, también llamado Jean Bonhomme.;
23;es;En Luxemburgo, ¿qué distribuye el padre Fouettard a los niños traviesos ?;Ramitas;Cardos;Ortigas;Zarzas;Expert;En Luxemburgo, el padre Fouettard es un hombre pequeño cuyo rostro no se ve porque está oculto por una gran capucha.;
24;es;¿En qué país marchan los Iffelträger con enormes mitras iluminadas ?;Suiza;Bélgica;Hungría;Polonia;Expert;Los acompañan cientos de personas que agitan grandes campanas y campanas.;
25;es;¿Quién pintó « La Saint-Nicolas », visible en el Rijksmuseum de Amsterdam ?;Jan Steen;Jacobus Vrel;Cornelis Vroom;Acciones de Andries;Expert;Representante del Barroco, Jan Steen es uno de los pintores de género holandeses más importantes de su tiempo.;https://es.wikipedia.org/wiki/Jan_Havicksz_Steen
26;es;En 2004, ¿quién lanzó el cómic « El santo patrón » de la colección Ciboulette ?;Jochen Gerner;Paul Gillon;Jean Graton;Alain Goutal;Expert;Nacido en Nancy en 1970, Jochen Gerner se graduó en la École nationale supérieure d'art de Nancy, donde estudió de 1988 a 1993.;
27;es;¿Qué distribuye San Nicolás a los niños de Romont, en el cantón de Friburgo ?;Biscomes;Bricelets;Caracs;Cuchaules;Expert;Consumido en el norte de Suiza, el biscôme es una especie de pan de jengibre plano, de color marrón y con un sabor picante.;
28;es;¿Quién revivió la tradición de Saint-Nicolas en Bulle, capital del distrito de Gruyère ?;Henri Gremaud;Nicolas Marchal;Joseph Bertrand;Ernest Bonnardel;Expert;Hoy, la organización y animación del festival está en manos de la compañía de teatro Trétaux de Chalamala.;
29;es;¿De qué capital del distrito de Sarine Saint Nicolas es el patrón de la ciudad ?;Friburgo;Corserey;Avry;Ponthaux;Expert;La ciudad suiza está bajo el patrocinio de San Nicolás de Myra, Santa Bárbara y Santa Catalina de Alejandría.;https://es.wikipedia.org/wiki/Friburgo_(Suiza)
30;es;¿En qué país europeo se llama San Nicolás Mikolajki ?;Polonia;Suiza;Holanda;Luxemburgo;Expert;En la escuela, todos hacen un pequeño obsequio simbólico a un colega cuyo nombre se dibujó unos días antes.;
1;it;Quale vescovo va in scena durante la festa di San Nicola ?;Nicolas de Myre;Benedetto da Norcia;Alessio di Roma;Martin di Tours;Débutant;Vescovo di Mira in Licia, partecipò probabilmente al Primo Concilio di Nicea durante il quale combatté l'arianesimo.;https://it.wikipedia.org/wiki/San_Nicola_di_Bari
2;it;In che giorno si festeggia San Nicola per la Chiesa Cattolica ?;6 dicembre;19 dicembre;24 dicembre;11 dicembre;Débutant;La festa di San Nicola è una tradizione longeva in diversi paesi europei così come nel nord e nell'est della Francia.;
3;it;In certe regioni d'Europa, con chi è accompagnato San Nicola ?;Padre Fouetterd;Jack Frost;Schiaccianoci;Julbock;Débutant;Vestito con un ampio cappotto nero con un grande cappuccio e stivali spessi, padre Fouettard a volte porta una frusta e una borsa.;
4;it;Oltre al bianco, quale colore è spesso associato a San Nicola ?;Rosso;Nero;Blu;Giallo;Débutant;Era in color malva e bianco, con un calcio, originariamente dorato, poi rosso e bianco, che lo avvicina al Babbo Natale di oggi.;
5;it;In cosa si reca Saint Nicolas nel Belgio francofono ?;Asino magico;Renna volante;Elefante reale;Cavallo bianco;Débutant;Nel nord come nel sud del paese, Saint Nicolas viene la notte dal 5 al 6 dicembre per consegnare regali e dolci.;
6;it;Cosa troviamo nei panni dei bambini belgi nel giorno di San Nicola ?;Speculoos;Cougnou;Falche;Torta di zucchero;Débutant;Tradizionalmente, viene consumato più spesso durante l'Avvento e più in particolare durante la festa di San Nicola.;
7;it;In quale paese si svolge la serata dei pacchi sorpresa alla vigilia di Saint-Nicolas ?;Paesi Bassi;Svizzera;Lussemburgo;Polonia;Débutant;I pacchi sorpresa, regalati da Sinterklaas davanti al caminetto o sul pianerottolo, sono spesso accompagnati da poesie.;
8;it;Qual è il nome dell'accolito di Saint-Nicolas nel folklore alsaziano ?;Hans Trapp;Hermann Gessler;Guifred Estruch;Bos de Benac;Débutant;All'origine di questo personaggio ci sarebbe il maresciallo Jean de Dratt (Hans von Trotha), un bruto assetato di sangue che terrorizzava la popolazione.;
9;it;In quale città a sud di Nancy si trova una grande basilica dedicata al Santo ?;Saint-Nicolas-de-Port;Val de Briey;Mont-Saint-Martin;Villerupt;Débutant;Nel 1193 vi verrà costruita una seconda chiesa. È anche in questo che Giovanna d'Arco verrà a pregare nel 1429.;https://it.wikipedia.org/wiki/Saint-Nicolas-de-Port
10;it;Da quale dio scandinavo si sarebbero ispirati alcuni degli attributi di San Nicola ?;Odino;Loki;Thor;Vali;Débutant;Odino, infatti, è sempre accompagnato dai suoi due corvi che vedono tutto e dal suo fedele cavallo Sleipnir.;https://it.wikipedia.org/wiki/Odino
11;it;Nei Paesi Bassi, quale veicolo atterra Saint Nicolas dalla Spagna ?;Barca;Aereo;Mongolfiera;Aliante;Confirmé;Arriva dalla Spagna su uno stoomboot chiamato Pakjesboot 12 (Small Packet Boat 12).;
12;it;Da quale regione della Francia San Nicola è il patrono dal 1477 ?;Lorena;Limosino;Linguadoca;Lione;Confirmé;Infatti, mentre la Lorena era occupata dalla Borgogna, il duca Renato II chiese la vittoria (che ricevette) da San Nicola.;https://it.wikipedia.org/wiki/Lorena (regione francese)
13;it;A Nancy, per quante settimane si diffondono le feste di Saint-Nicolas ?;Due settimane;Una settimana;Tre settimane;Quattro settimane;Confirmé;In tutta la città ci sono gare, spettacoli di strada, un mercato contadino e persino il villaggio di La Marmaille.;
14;it;Quante persone sono venute ad ascoltare San Nicola a Friburgo nel 2015 ?;25.000;15.000;5.000;35.000;Confirmé;Tradizionalmente, tiene un discorso lì che contiene passaggi satirici sugli eventi della città dell'anno passato.;
15;it;In Ungheria, cosa mette San Nicola negli stivali dei bambini malvagi ?;Un bastone;Una banana;Un martello;Un falso ratto;Confirmé;San Nicola è spesso accompagnato dai Krampusz, lo spaventoso aiutante che si occupa di rapire i bambini malvagi.;
16;it;Quale professione esercitò Pierre Lenoir, che sarebbe diventato padre Fouettard ?;Macellaio;Falegname;massone;Fabbro;Confirmé;Ha tagliato tre bambini in piccoli pezzi per metterli finalmente nella sua vasca di salatura per fare un po' di sale.;
17;it;In che giorno si festeggia San Nicola per la Chiesa Ortodossa ?;19 dicembre;11 dicembre;2 gennaio;24 dicembre;Confirmé;La Chiesa ortodossa usa ancora il calendario giuliano, che era un calendario solare usato nell'antica Roma.;https://it.wikipedia.org/wiki/Calendario_giuliano
18;it;Oltre ai bambini, di chi è anche il patrono San Nicola ?;Avvocati;Falegnami;Specialisti IT;Segretari;Confirmé;Oggi è il patrono di molte aziende come detenuti, avvocati, terapisti occupazionali e scapoli.;
19;it;In Austria, quali personaggi che circondano San Nicola spaventano la folla ?;Krampus;Kolobox;Curupira;Lagahoo;Confirmé;Indossando una maschera da diavolo cornuto e pellicce spesse, agitano le catene, inseguendo le persone con i bastoni.;https://it.wikipedia.org/wiki/Krampus
20;it;Cosa rappresenta la reliquia di San Nicola a Saint-Nicolas-de-Port ?;Falange;Cubito;Omero;Occipitale;Confirmé;La basilica è stata restaurata a partire dal 1983 grazie al notevole lascito della signora Camille Croué-Friedman, originaria della città.;
21;it;Qual è il punto di passaggio essenziale della sfilata di Saint-Nicolas a Metz ?;Place d'Armes;I Trinitari;Fort de Queuleu;Forte Mosella;Expert;A Metz si svolgono molte feste come la sfilata di Saint-Nicolas, spettacoli e anche fuochi d'artificio.;https://it.wikipedia.org/wiki/Place_d'Armes_(Metz)
22;it;In quale regione della Francia Père Fouettard è una donna, metà fata e metà strega ?;Franca Contea;Guascogna;Touraine;Angiò;Expert;La Franca Contea ha anche le sue brioches Saint-Nicolas, come l'alsaziana Männele, chiamata anche Jean Bonhomme.;
23;it;In Lussemburgo, cosa distribuisce padre Fouettard ai bambini cattivi ?;ramoscelli;Cardi;Ortiche;Rovi;Expert;In Lussemburgo, padre Fouettard è un uomo piccolo il cui volto non è visibile perché nascosto da un enorme cappuccio.;
24;it;In quale paese la marcia Iffelträger indossa enormi mitra illuminate ?;Svizzera;Belgio;Ungheria;Polonia;Expert;Sono accompagnati da centinaia di persone che agitano grandi campane e campanelli.;
25;it;Chi ha dipinto « La Saint-Nicolas », visibile al Rijksmuseum di Amsterdam ?;Jan Steen;Jacobus Vrel;Cornelis Vroom;Andries Stock;Expert;Rappresentante del barocco, Jan Steen è uno dei più importanti pittori di genere olandesi del suo tempo.;https://it.wikipedia.org/wiki/Jan_Steen
26;it;Chi ha pubblicato nel 2004 il fumetto « Il santo patrono » nella collezione Ciboulette ?;Jochen Gerner;Paul Gillon;Jean Graton;Alain Goutal;Expert;Nato a Nancy nel 1970, Jochen Gerner si è laureato all'École nationale supérieure d'art de Nancy, dove ha studiato dal 1988 al 1993.;
27;it;Cosa distribuisce Saint Nicolas ai bambini di Romont, nel cantone di Friburgo ?;Biscotti;Bricchetti;Caracs;Cuchaules;Expert;Consumato nel nord della Svizzera, il biscôme è una specie di panpepato piatto, di colore marrone e dal sapore piccante.;
28;it;Chi ha fatto rivivere la tradizione di Saint-Nicolas a Bulle, capoluogo del distretto della Gruyère ?;Henri Gremaud;Nicolas Marchal;Joseph Bertrand;Ernest Bonnardel;Expert;Oggi l'organizzazione e l'animazione del festival sono nelle mani della compagnia teatrale Trétaux de Chalamala.;
29;it;Da quale capoluogo del distretto di Sarine Saint Nicolas è il patrono della città ?;Friburgo;corsetto;Avry;Ponthaux;Expert;La città svizzera è posta sotto il patronato di San Nicola di Mira, Santa Barbara e Santa Caterina d'Alessandria.;https://it.wikipedia.org/wiki/Friburgo_(Svizzera)
30;it;In quale paese europeo si chiama San Nicola Mikolajki ?;Polonia;Svizzera;Paesi Bassi;Lussemburgo;Expert;A scuola tutti fanno un piccolo regalo simbolico a un collega il cui nome viene estratto qualche giorno prima.;
1;nl;Welke bisschop wordt opgevoerd tijdens het feest van Sinterklaas ?;Nicolas de Myre;Benedictus van Nursia;Alexis van Rome;Martin van Tours;Débutant;Bisschop van Myra in Lycia, nam hij waarschijnlijk deel aan het Eerste Concilie van Nicea waarin hij het Arianisme bestreed.;https://nl.wikipedia.org/wiki/Nicolaas_van_Myra
2;nl;Welke dag vieren we Sinterklaas voor de katholieke kerk ?;6 december;19 december;24 december;11 december;Débutant;Het feest van Sinterklaas is een langlevende traditie in verschillende Europese landen, maar ook in het noorden en oosten van Frankrijk.;
3;nl;Met wie wordt Sinterklaas in bepaalde regio's van Europa vergezeld ?;Vader Fouettard;Jack Frost;Notenkraker;Julbock;Débutant;Gekleed in een grote zwarte jas met een grote capuchon en dikke laarzen, draagt pater Fouettard soms een zweep en een tas.;
4;nl;Welke kleur wordt naast wit vaak geassocieerd met Sinterklaas ?;Rood;Zwart;Blauw;Geel;Débutant;Hij was in mauve en wit, met een kont, oorspronkelijk goud, dan in rood en wit, wat hem dichter bij de huidige kerstman brengt.;
5;nl;Waarheen reist Sinterklaas in Franstalig België ?;Magische ezel;Vliegend rendier;Koninklijke olifant;Wit paard;Débutant;Zowel in het noorden als in het zuiden van het land reist Sinterklaas de nacht van 5 op 6 december af om cadeautjes en snoepjes af te geven.;
6;nl;Wat vinden we op Sinterklaas in de schoenen van Belgische kinderen ?;Speculoos;Cougnou;Faluche;Suikertaart;Débutant;Traditioneel wordt het meestal geconsumeerd tijdens de advent en meer in het bijzonder tijdens het feest van Sinterklaas.;
7;nl;In welk land vindt de avond van de verrassingspakketten plaats aan de vooravond van Sint-Niklaas ?;Nederland;Zwitserland;Luxemburg;Polen;Débutant;De verrassingspakketten, die Sinterklaas geeft bij de open haard of op de overloop, gaan vaak vergezeld van gedichten.;
8;nl;Hoe heet de acoliet van Sint-Niklaas in de Elzasser folklore ?;Hans Trapp;Hermann Gessler;Guifred Estruch;Bos de Benac;Débutant;Aan de oorsprong van dit personage zou maarschalk Jean de Dratt (Hans von Trotha) staan, een bloeddorstige bruut die de bevolking terroriseerde.;
9;nl;In welke stad in het zuiden van Nancy staat een grote basiliek gewijd aan de heilige ?;Saint-Nicolas-de-Port;Val de Briey;Mont-Saint-Martin;Villerupt;Débutant;In 1193 wordt daar een tweede kerk gebouwd. Het is ook in deze dat Jeanne d'Arc in 1429 zal komen bidden.;https://nl.wikipedia.org/wiki/Saint-Nicolas-de-Port
10;nl;Van welke Scandinavische god zouden sommige attributen van Sinterklaas zijn geïnspireerd ?;Odin;Loki;Thor;Vali;Débutant;Inderdaad, Odin wordt altijd vergezeld door zijn twee kraaien die alles zien en zijn trouwe paard Sleipnir.;https://nl.wikipedia.org/wiki/Odin_(god)
11;nl;Met welk voertuig landt Sinterklaas in Nederland vanuit Spanje ?;Boot;Vliegtuig;Heteluchtballon;Zweefvliegtuig;Confirmé;Het komt uit Spanje op een stoomboot genaamd Pakjesboot 12 (Small Packet Boat 12).;
12;nl;Uit welke regio van Frankrijk is Sint-Nicolaas sinds 1477 de patroonheilige ?;Lotharingen;Limousin;Languedoc;Lyonnais;Confirmé;Inderdaad, terwijl Lorraine door Bourgondië werd bezet, eiste hertog René II de overwinning (die hij ontving) van Sint-Nicolaas.;https://nl.wikipedia.org/wiki/Lotharingen (regio)
13;nl;In Nancy, over hoeveel weken zijn de feesten van Sint-Nicolaas verdeeld ?;Twee weken;Een week;Drie weken;Vier weken;Confirmé;Door de hele stad zijn er races, straatshows, een boerenmarkt en zelfs het dorp La Marmaille.;
14;nl;Hoeveel mensen kwamen er in 2015 naar Sinterklaas luisteren in Fribourg ?;25.000;15.000;5.000;35.000;Confirmé;Traditioneel houdt hij daar een toespraak die satirische passages bevat over de gebeurtenissen in de stad van het afgelopen jaar.;
15;nl;Wat stopt Sinterklaas in Hongarije in de laarzen van slechte kinderen ?;Een stok;Een banaan;Een hamer;Een valse rat;Confirmé;Sinterklaas wordt vaak vergezeld door de Krampusz, de angstaanjagende helper die de leiding heeft over de ontvoering van de slechte kinderen.;
16;nl;Welk beroep oefende Pierre Lenoir uit, die pater Fouettard zou worden ?;Slager;Timmerman;Metselaar;Slotenmaker;Confirmé;Hij sneed drie kinderen in kleine stukjes om ze uiteindelijk in zijn zoutkuip te doen om een beetje zout te maken.;
17;nl;Op welke dag vieren we Sinterklaas voor de Orthodoxe Kerk ?;19 december;11 december;2 januari;24 december;Confirmé;De orthodoxe kerk gebruikt nog steeds de Juliaanse kalender, een zonnekalender die in het oude Rome werd gebruikt.;https://nl.wikipedia.org/wiki/Juliaanse_kalender
18;nl;Van wie is naast de kinderen Sinterklaas ook de beschermheilige ?;Advocaten;Timmerlieden;IT-specialisten;secretaresses;Confirmé;Tegenwoordig is hij de beschermheer van vele bedrijven, zoals gevangenen, advocaten, ergotherapeuten en vrijgezellen.;
19;nl;Welke personages rond Sinterklaas schrikken in Oostenrijk de menigte af ?;Krampus;Kolobox;Curupira;Lagahoo;Confirmé;Met een gehoornd duivelsmasker en dikke vachten zwaaien ze met kettingen en jagen ze mensen op met stokken.;https://nl.wikipedia.org/wiki/Krampus
20;nl;Wat vertegenwoordigt de relikwie van Sint-Nicolaas in Saint-Nicolas-de-Port ?;Falanx;Cubitus;Opperarmbeen;occipitaal;Confirmé;De basiliek werd vanaf 1983 gerestaureerd dankzij het aanzienlijke legaat van mevrouw Camille Croué-Friedman, oorspronkelijk afkomstig uit de stad.;
21;nl;Wat is het essentiële doorgangspunt van de parade van Sint-Niklaas in Metz ?;Place d'Armes;De Trinitariërs;Fort de Queuleu;Fort Moezel;Expert;In Metz vinden veel festiviteiten plaats, zoals de Sint-Niklaasparade, shows en ook vuurwerk.;
22;nl;In welke regio van Frankrijk is Père Fouettard een vrouw, half fee, half heks ?;Franche-Comté;Gascogne;Touraine;Anjou;Expert;Franche-Comté heeft ook zijn Saint-Nicolas brioches, zoals de Elzasser Männele, ook wel Jean Bonhomme genoemd.;
23;nl;Wat deelt pater Fouettard in Luxemburg uit aan stoute kinderen ?;Takjes;Distels;Brandnetels;Bramen;Expert;In Luxemburg is pater Fouettard een kleine man wiens gezicht niet zichtbaar is omdat het wordt verborgen door een enorme kap.;
24;nl;In welk land marcheren de Iffelträger met enorme verlichte mijters ?;Zwitserland;België;Hongarije;Polen;Expert;Ze worden vergezeld door honderden mensen die met grote klokken zwaaien.;
25;nl;Wie schilderde « La Saint-Nicolas », te zien in het Rijksmuseum in Amsterdam ?;Jan Steen;Jacobus Vrel;Cornelis Vroom;Andries Voorraad;Expert;Vertegenwoordiger van de barok, Jan Steen is een van de belangrijkste Nederlandse genreschilders van zijn tijd.;https://nl.wikipedia.org/wiki/Jan_Steen
26;nl;Wie bracht in 2004 de strip « De patroonheilige » uit in de Ciboulette-collectie ?;Jochen Gerner;Paul Gillon;Jean Graton;Alain Goutal;Expert;Jochen Gerner, geboren in 1970 in Nancy, studeerde af aan de École nationale supérieure d'art de Nancy, waar hij van 1988 tot 1993 studeerde.;
27;nl;Wat deelt Sint-Nicolaas uit aan de kinderen van Romont, in het kanton Fribourg ?;Biscoms;Brikeletten;Caracs;Cuchaules;Expert;Biscôme, geconsumeerd in Noord-Zwitserland, is een soort platte peperkoek, bruin van kleur en met een pittige smaak.;
28;nl;Wie heeft de traditie van Sint-Niklaas nieuw leven ingeblazen in Bulle, de hoofdstad van het district Gruyère ?;Henri Gremaud;Nicolas Marchal;Joseph Bertrand;Ernest Bonnardel;Expert;Vandaag de dag is de organisatie en animatie van het festival in handen van de theatergroep Trétaux de Chalamala.;
29;nl;Van welke hoofdstad van het district Sarine Saint Nicolas is hij de beschermheilige van de stad ?;Freiburg;Corserey;Avry;Ponthaus;Expert;De Zwitserse stad staat onder het beschermheerschap van Sint Nicolaas van Myra, Sint Barbara en Sint Catharina van Alexandrië.;https://nl.wikipedia.org/wiki/Fribourg_(stad)
30;nl;In welk Europees land heet Sinterklaas Mikolajki ?;Polen;Zwitserland;Nederland;Luxemburg;Expert;Op school geeft iedereen een klein symbolisch cadeau aan een collega wiens naam een paar dagen eerder is getrokken.;
