3;es;En cerámica, ¿qué tipo de material utiliza para almacenar líquidos ?;Grès;Yeso;Céladon;Maldición;Débutant;La uva, más noble que la terracota, ocupa el segundo lugar en la producción de cerámica de alta temperatura.;https://es.wikipedia.org/wiki/Gres
4;es;¿Qué máquina genera cerámica regular en cantidad ?;Rueda de alfarero;Pirómetro;Patcher;Brame;Débutant;Entre 3500 y 3450 a. C. BC, la cerámica experimentó una verdadera revolución con la introducción de la rueda de alfarero en el Medio Oriente.;https://es.wikipedia.org/wiki/Torno_de_alfarero
5;es;¿Qué material de silicato se usa mucho en cerámica ?;Arcilla;Maldición;Limon;Arena;Débutant;La arcilla hidratada es maleable, se puede moldear, se solidifica después del secado y el resto permanentemente.;https://es.wikipedia.org/wiki/Arcilla
6;es;¿Qué revestimiento vitrificable se coloca en la superficie de una cerámica para endurecerla ?;Correo electrónico;Ajour;Freelance;Galleta;Débutant;El óxido de hierro produce tonos verdes, rojos, amarillos, negros o marrones, azul de óxido de cobalto y verde de óxido de cromo.;https://es.wikipedia.org/wiki/Gla%E7ure
7;es;¿La cerámica de qué civilización es universalmente conocida por la porcelana ?;Chino;Griego;Francés;Peruano;Débutant;Los grandes jarrones azules y blancos, que aparecieron durante la dinastía Yuan Mongol, se desarrollarán completamente bajo el Ming.;
8;es;En cerámica, ¿qué técnica de formateo usa solo los dedos ?;Modelado;Tiro;Vertiendo;Tratando;Débutant;Para cocinar, las diferentes piezas obtenidas se colocan en un horno a una temperatura de 1,000 ° C durante aproximadamente ocho horas.;https://es.wikipedia.org/wiki/Alfarería
9;es;¿Qué civilización preincaica es mejor conocida por la cerámica ?;Nazca;Patayan;Pipiles;Valdivia;Confirmé;Poco coloridos durante el período inicial, son de gran riqueza policromada más tarde, entre Nazca medio y tardío.;https://es.wikipedia.org/wiki/Nazca_(cultura)
10;es;¿Qué objeto se usa para cubrir pisos, paredes y duchas ?;Azulejo;Búnker;Dintel;Frisia;Débutant;Los azulejos se utilizan para formar la pared de pinturas murales y revestimientos de pisos, desde cuadrados simples hasta mosaicos complejos.;https://es.wikipedia.org/wiki/Baldosa
11;es;¿Qué tipo de cerámica forman parte de la uva y la porcelana ?;Vitrificado;Poroso;Stannifer;Bien;Confirmé;Le grés es un material cerámico caracterizado por una gran dureza y excelente resistencia al ataque químico.;
12;es;¿Qué material cerámico se hornea a una temperatura superior a 1200 ° C ?;Grès;Pátina;Colombin;Porcelana;Confirmé;La uva apareció en China durante la dinastía Shang y la dinastía Han, alcanzando su perfección con las salchichas de Song.;https://es.wikipedia.org/wiki/Gres
13;es;¿Qué museo ofrece una magnífica colección de 340,000 piezas de cerámica ?;Ciudad prohibida;Louvre;Museo Tate;Vaticano;Confirmé;El Museo del Palacio de la Ciudad Prohibida de Beijing presenta colecciones imperiales chinas de las dinastías Tang y Song.;https://es.wikipedia.org/wiki/Ciudad_Prohibida
14;es;¿Cuál de estos términos se opone directamente al de terracota ?;Tierra cruda;Arcilla;Tierra vieja;Tierra química;Débutant;Anteriormente a la terracota, encontramos en todas las civilizaciones una cerámica y ladrillos hechos de barro.;
15;es;¿De qué color obtenemos con óxido de cobalto ?;Azul;Rojo;Verde;Amarillo;Confirmé;El cobalto más puro vino a gran costo del Medio Oriente a través de España, el de Europa Central con un azul menos profundo.;https://es.wikipedia.org/wiki/Gla%E7ure
16;es;¿Qué técnica de cerámica superpone largos charcos de arcilla ?;Colombin;Mirette;Rodando;Reserva;Confirmé;El alfarero asegura las palomas presionándolas una contra la otra y alisa la superficie a medida que la moneda sube.;https://es.wikipedia.org/wiki/Colombín
17;es;¿Qué ciudad del norte de Francia tiene un museo dedicado a la práctica de la cerámica ?;Ruan;Caen;Le Havre;Dieppe;Confirmé;Este museo, creado en 1864 y con el sello de museo de Francia, se encuentra en el hotel Hocqueville, cerca de la plaza Verdrel en Rouen.;
18;es;¿Qué disciplina se dedica al estudio de objetos en cerámica ?;Ceramologia;Trazabilidad;Palinología;Rejilla;Confirmé;La cerámica incluye el estudio de las técnicas de fabricación (fabricación, horneado), sus formas y la de los motivos decorativos.;https://es.wikipedia.org/wiki/C%E9ramologie
19;es;¿Cómo se describe una cerámica que usa texto en su decoración ?;Hablando;Extruido;Alandié;Crudo;Confirmé;La placa participó en el esfuerzo sindical nacional expresando acentos bélicos, humorísticos o satíricos.;https://es.wikipedia.org/wiki/C%E9ramique
20;es;¿Qué técnica te permite pegar elementos de formas diferentes ?;Barbotina;Reducción;Calibracion;Champlevé;Confirmé;Los mangos de un florero, por ejemplo, se modelan y luego se ensamblan al deslizamiento en el cuerpo del florero girado.;
21;es;¿Cuál es el filete sin cocinar entre 980° C y 1040° C ?;Galleta;Biscotte;Pan;Pastel;Expert;El bizcocho de porcelana se usa para hacer estatuillas, mesas y reducciones de estatuas.;
22;es;¿Qué revestimiento a base de arcilla puede hacer que una cerámica sea más suave ?;Engobe;Estèque;Chamotte;Araña de luces;Expert;Como el engobe contiene arcilla suelta, si se deposita sobre la cerámica seca, se rompería rápidamente.;https://es.wikipedia.org/wiki/Engobe
23;es;¿Qué sabor verde oliva es característico de la cerámica china antigua ?;Celadón;Pernette;Mullita;Coquemar;Expert;Celadon (literalmente porcelana verde) se refiere a un color y también a un tipo de cerámica peculiar de China y el Lejano Oriente.;https://es.wikipedia.org/wiki/Celadón
24;es;¿Qué cerámica fina translúcida se produce a partir del caolín ?;Porcelana;Estampado;Neriage;Albarelle;Expert;Las caolinas son arcillas blancas, friables y refractarias, compuestas de caolinita o silicatos de aluminio.;
25;es;¿Qué correo electrónico japonés marrón oscuro a veces se llama gamuza ?;Tenmoku;Dotaku;Nintoku;Daibutsu;Expert;Este correo electrónico se obtiene mezclando feldespato, tiza, arcilla, sílice, bentonita y óxido de hierro rojo (hematita).;https://es.wikipedia.org/wiki/Gla%E7ure
26;es;En cerámica, ¿cómo se llama el gránulo de arcilla desintegrado en agua ?;Barbotina;Raspado;Mandrin;Fritte;Expert;La decoración con el deslizamiento consiste en agregar relieves de deslizamiento en una cerámica : la llamada cerámica decorada con deslizamiento.;
27;es;¿Cuántos años de matrimonio simbolizan la boda de loza ?;9 años;19 años;29 años;39 años;Expert;El folklore francés abarca las fábulas, las creencias populares, los cuentos de hadas y las leyendas de todos los pueblos que viven en Francia.;https://es.wikipedia.org/wiki/Fayenza
28;es;¿Qué se llama el plato giratorio de la torre del alfarero ?;Girelle;Rondeau;Cne;Engobe;Expert;Después de colocar un terrón de arcilla en el centro de la bandeja, el alfarero centra su suelo y luego lo sacude durante su rotación.;https://es.wikipedia.org/wiki/Alfarería
29;es;¿Desde cuándo se ha reconocido en Francia el know-how de la cerámica del arte ?;2009;1999;1989;1979;Expert;Cada Estado Parte tomará las medidas necesarias para salvaguardar su patrimonio cultural inmaterial.;
30;es;¿Qué arquitecto es conocido por su acristalamiento arquitectónico acristalado ?;Louis Sullivan;Victor Bourgeois;Jean Welz;Tony Garnier;Expert;En ese momento, los dibujos del arquitecto estadounidense nacido en 1856 en Boston habrían sido imposibles de ejecutar en cualquier otro medio.;https://es.wikipedia.org/wiki/Louis_Sullivan
1;it;Il termine ceramica deriva dall'antico greco « keramos » che significa...;Terra di ceramica;Impronta;Stampaggio;Tesson;Débutant;La parola appare nel suo senso moderno solo nella metà del diciannovesimo secolo quando l'archeologia inizia a interessarsi alla ceramica.;https://it.wikipedia.org/wiki/Ceramica
2;it;Di che tipo di ceramica fanno parte la maiolica e la terracotta ?;Poroso;Vetrificato;Bene;Stannifer;Débutant;Faenza, dal nome della città italiana di Faenza, dove è stata inventata, è una ceramica smaltata o verniciata con uno sfondo bianco.;https://it.wikipedia.org/wiki/Fa%EFence
3;it;In ceramica, che tipo di materiale utilizza per conservare i liquidi ?;Grès;Intonaco;Céladon;Maledizione;Débutant;L'uva, più nobile della terracotta, è al secondo posto nella produzione di ceramiche ad alta temperatura.;https://it.wikipedia.org/wiki/Ceramica
4;it;Quale macchina genera ceramiche regolari in quantità ?;Potter's wheel;Pirometro;Patcher;Brame;Débutant;Tra il 3500 e il 3450 a.C. AC, la ceramica ha subito una vera rivoluzione con l'introduzione della ruota del vasaio in Medio Oriente.;https://it.wikipedia.org/wiki/Ruota_del_vasaio
5;it;Quale materiale ai silicati è molto usato in ceramica ?;Argilla;Maledizione;Limon;Sabbia;Débutant;L'argilla idratata è malleabile, può essere modellata, diventa solida dopo l'essiccazione e il resto in modo permanente.;https://it.wikipedia.org/wiki/Argilla
6;it;Quale rivestimento vetrificabile è posto sulla superficie di una ceramica per indurirla ?;E-mail;Ajour;Libero professionista;Biscotto;Débutant;L'ossido di ferro produce toni di verde, rosso, giallo, nero o marrone, blu di ossido di cobalto e verde di ossido di cromo.;https://it.wikipedia.org/wiki/Gla%E7ure
7;it;La ceramica di quale civiltà è universalmente nota per la porcellana ?;Cinese;Greco;Francese;Peruviano;Débutant;I grandi vasi blu e bianchi, che apparvero durante la dinastia mongola Yuan, si svilupperanno completamente sotto il Ming.;
8;it;In ceramica, quale tecnica di formattazione utilizza solo le dita ?;Modellazione;Scatto;Versare;Prova;Débutant;Per la cottura, i diversi pezzi ottenuti vengono messi in forno a una temperatura di 1.;https://it.wikipedia.org/wiki/Lavorazione della ceramica
9;it;Quale civiltà pre-inca è meglio conosciuta per la ceramica ?;Nazca;Patayan;Pipils;Valdivia;Confirmé;Poco colorati durante il periodo iniziale, sono di grande ricchezza policroma in seguito, tra il medio e il tardo Nazca.;https://it.wikipedia.org/wiki/Civiltà_Nazca
10;it;Quale oggetto viene utilizzato per coprire pavimenti, pareti e docce ?;Piastrella;Bunker;Architrave;Frisia;Débutant;Le piastrelle sono utilizzate per formare il muro di dipinti murali e rivestimenti per pavimenti, da semplici quadrati a complessi mosaici.;https://it.wikipedia.org/wiki/Piastrella
11;it;Che tipo di ceramica fa parte dell'uva e della porcellana ?;Vetrificato;Poroso;Stannifer;Bene;Confirmé;Le grés è un materiale ceramico caratterizzato da una grandissima durezza e un'eccellente resistenza agli attacchi chimici.;
12;it;Quale materiale ceramico viene cotto ad una temperatura superiore a 1200 ° C ?;Grès;Patina;Colombin;Porcellana;Confirmé;L'uva è apparsa in Cina durante la dinastia Shang e la dinastia Han, raggiungendo la sua perfezione con le salsicce di Song.;https://it.wikipedia.org/wiki/Ceramica
13;it;Quale museo offre una magnifica collezione di 340.000 pezzi di ceramica ?;Città Proibita;Louvre;Museo della Tate;Vaticano;Confirmé;Il Museo del Palazzo nella Città Proibita di Pechino ospita collezioni imperiali cinesi delle dinastie Tang e Song.;https://it.wikipedia.org/wiki/Città_Proibita
14;it;Quale di questi termini è direttamente contrario a quello della terracotta ?;Terra cruda;Argilla;Vecchia Terra;Terra chimica;Débutant;Precedentemente alla terracotta, troviamo in tutte le civiltà una ceramica e mattoni fatti di fango.;https://it.wikipedia.org/wiki/Mattone_di_fango
15;it;Di che colore abbiamo con l'ossido di cobalto ?;Blu;Rosso;Verde;Giallo;Confirmé;Il cobalto più puro è venuto a spese del Medio Oriente attraverso la Spagna, quella dell'Europa centrale che ha dato blues meno profondi.;https://it.wikipedia.org/wiki/Gla%E7ure
16;it;Quale tecnica della ceramica sovrappone lunghe pozzanghere di argilla ?;Colombin;Mirette;Rotolamento;Prenota;Confirmé;Il vasaio protegge i piccioni premendoli l'uno contro l'altro e leviga la superficie mentre la moneta sale.;
17;it;Quale città del nord della Francia ha un museo dedicato alla pratica della ceramica ?;Rouen;Caen;Le Havre;Dieppe;Confirmé;Questo museo, creato nel 1864 e con l'etichetta museo della Francia, si trova nell'hotel Hocqueville, vicino a piazza Verdrel a Rouen.;
18;it;Quale disciplina è dedicata allo studio degli oggetti in ceramica ?;Ceramologia;Tracciabilità;Palinologia;Griglia;Confirmé;La ceramologia comprende lo studio delle tecniche di fabbricazione (fabbricazione, cottura), le loro forme e quella dei motivi decorativi.;https://it.wikipedia.org/wiki/C%E9ramologie
19;it;Come si descrive una ceramica che usa il testo nel suo arredamento ?;Parlare;Estruso;Alandié;Greggio;Confirmé;La placca ha partecipato allo sforzo dell'Unione Europea esprimendo accenti bellicosi, umoristici o satirici.;https://it.wikipedia.org/wiki/C%E9ramique
20;it;Quale tecnica ti consente di incollare elementi di forma diversa ?;Barbotina;Riduzione;Calibrazione;Champlevé;Confirmé;Le maniglie di un vaso sono ad esempio modellate a parte e quindi assemblate allo slip sul corpo del vaso tornito.;https://it.wikipedia.org/wiki/Barbottina
21;it;Cos'è il filetto senza cottura tra 980° C e 1040° C ?;Biscotto;Biscotte;Pane;Torta;Expert;Il biscotto di porcellana viene utilizzato per realizzare statuette, piani d'appoggio e riduzioni di statue.;
22;it;Quale rivestimento a base di argilla può rendere più liscia una ceramica ?;Engobe;Estèque;Chamotte;Lampadario;Expert;Poiché l'embobe contiene argilla sciolta, se fosse posata sulla ceramica asciutta, si spezzerebbe rapidamente.;https://it.wikipedia.org/wiki/Ingobbio
23;it;Quale sapore verde oliva è caratteristico delle antiche ceramiche cinesi ?;Celadon;Pernette;Mullite;Coquemar;Expert;Celadon (letteralmente porcellana verde) si riferisce a un colore e anche a un tipo di ceramica peculiare della Cina e dell'Estremo Oriente.;https://it.wikipedia.org/wiki/Celadon
24;it;Quale ceramica fine e traslucida viene prodotta dal caolino ?;Porcellana;Timbratura;Neriage;Albarelle;Expert;I caolini sono argille bianche, friabili e refrattarie, composte da caolinite o silicati di alluminio.;https://it.wikipedia.org/wiki/Caolino
25;it;Quale e-mail giapponese marrone scuro viene talvolta chiamata camoscio ?;Tenmoku;Dotaku;Nintoku;Daibutsu;Expert;Questa e-mail è ottenuta mescolando feldspato, gesso, argilla sferica, silice, bentonite e ossido di ferro rosso (ematite).;https://it.wikipedia.org/wiki/Gla%E7ure
26;it;In ceramica, come si chiama il pellet di argilla disintegrato in acqua ?;Barbotina;Raschiando;Mandrin;Fritte;Expert;L'arredamento con lo slip consiste nell'aggiungere degli slip in rilievo su una ceramica : la cosiddetta ceramica decorata con slip.;https://it.wikipedia.org/wiki/Barbottina
27;it;Quanti anni di matrimonio simboleggiano il matrimonio di maiolica ?;9 anni;19 anni;29 anni;39 anni;Expert;Il folklore francese comprende le favole, le credenze popolari, le fiabe e le leggende di tutti i popoli che vivono in Francia.;https://it.wikipedia.org/wiki/Faience
28;it;Cosa si chiama il giradischi della torre del vasaio ?;Girelle;Rondeau;Cne;Engobe;Expert;Dopo aver sistemato una zolla di argilla al centro del vassoio, il vasaio centra la sua terra e poi la scuote durante la sua rotazione.;https://it.wikipedia.org/wiki/Lavorazione della ceramica
29;it;Da quale anno il know-how della ceramica d'arte è riconosciuto in Francia ?;2009;1999;1989;1979;Expert;Ogni stato parte deve adottare le misure necessarie per salvaguardare il proprio patrimonio culturale immateriale.;
30;it;Quale architetto è noto per i suoi vetri architettonici vetrati ?;Louis Sullivan;Victor Bourgeois;Jean Welz;Tony Garnier;Expert;A quel tempo, i disegni dell'architetto americano nato nel 1856 a Boston sarebbero stati impossibili da eseguire su qualsiasi altro mezzo.;https://it.wikipedia.org/wiki/Louis_Sullivan
1;nl;De term keramiek komt van de oude Griekse « keramos » wat betekent...;Aardewerk Aarde;Voetafdruk;Vormen;Tesson;Débutant;Het woord verschijnt pas in de moderne betekenis van het woord in de helft van de negentiende eeuw, wanneer de archeologie belangstelling begint te krijgen voor keramiek.;https://nl.wikipedia.org/wiki/Keramiek
2;nl;Van wat voor soort keramiek zijn faience en terracotta onderdeel ?;Poreus;Verglaasd;Fijn;Stannifer;Débutant;Faenza, van de naam van de Italiaanse stad Faenza, waar het werd uitgevonden, is een geëmailleerd of gelakt aardewerk met een witte achtergrond.;https://nl.wikipedia.org/wiki/Fa%EFence
3;nl;Wat voor materiaal gebruikt keramiek voor het bewaren van vloeistoffen ?;Grès;Gips;Céladon;Vloek;Débutant;Druif, edeler dan terracotta, staat op de tweede plaats bij de productie van keramiek op hoge temperatuur.;https://nl.wikipedia.org/wiki/Gres_(keramisch_product)
4;nl;Welke machine genereert regelmatig keramiek in hoeveelheid ?;Potter's wheel;Pyrometer;Patcher;Brame;Débutant;Tussen 3500 en 3450 v.Chr BC, het aardewerk onderging een echte revolutie met de introductie van het pottenbakkerswiel in het Midden-Oosten.;https://nl.wikipedia.org/wiki/Pottenbakkersschijf
5;nl;Welk silicaatmateriaal wordt veel in keramiek gebruikt ?;Clay;Vloek;Limon;Zand;Débutant;De gehydrateerde klei is kneedbaar, kan worden gevormd, wordt vast na drogen en de rest permanent.;https://nl.wikipedia.org/wiki/Klei
6;nl;Welke vitrificerende coating wordt op het oppervlak van een keramiek geplaatst om het te harden ?;E-mail;Ajour;Freelance;Biscuit;Débutant;IJzeroxide produceert groene, rode, gele, zwarte of bruine tinten, kobaltoxide blauw en chroomoxide groen.;https://nl.wikipedia.org/wiki/Gla%E7ure
7;nl;De keramiek waarvan de beschaving universeel bekend staat om porselein ?;Chinees;Grieks;Frans;Peruaans;Débutant;De grote blauwe en witte vazen, die verschenen tijdens de Yuan Mongoolse dynastie, zullen zich volledig ontwikkelen onder de Ming.;
8;nl;In aardewerk, welke opmaaktechniek gebruikt alleen de vingers ?;Modelleren;Schieten;Gieten;Bezig met proberen;Débutant;Voor het koken worden de verschillende verkregen stukken gedurende ongeveer acht uur in een oven geplaatst bij een temperatuur van 1.;https://nl.wikipedia.org/wiki/Pottenbakken
9;nl;Welke pre-Inca-beschaving is het best bekend voor keramiek ?;Nazca;Patayan;Pipils;Valdivia;Confirmé;Ze zijn in de beginperiode weinig kleurrijk en hebben later een grote polychrome rijkdom, tussen medium en late Nazca.;https://nl.wikipedia.org/wiki/Nazcacultuur
10;nl;Welk object wordt gebruikt om vloeren, muren en douches te bedekken ?;Tegel;Bunker;Lintel;Friesland;Débutant;Tegels worden gebruikt om de muur van muurschilderingen en vloerbedekkingen te vormen, van eenvoudige vierkanten tot complexe mozaïeken.;https://nl.wikipedia.org/wiki/Vloertegel
11;nl;Wat voor soort keramiek hoort bij de druiven en het porselein ?;Verglaasd;Poreus;Stannifer;Fijn;Confirmé;Le grés is een keramisch materiaal dat wordt gekenmerkt door een zeer grote hardheid en uitstekende weerstand tegen chemische aantasting.;
12;nl;Welk keramisch materiaal wordt gebakken bij een temperatuur boven 1200 ° C ?;Grès;Patina;Colombin;Porselein;Confirmé;De druif verscheen in China tijdens de Shang-dynastie en de Han-dynastie en bereikte zijn perfectie met de worsten van Song.;https://nl.wikipedia.org/wiki/Gres_(keramisch_product)
13;nl;Welk museum biedt een prachtige verzameling van 340.000 stukken keramiek ?;Verboden Stad;Louvre;Tate Museum;Vaticaan;Confirmé;Het Paleismuseum in de Verboden Stad van Beijing heeft Chinese keizerlijke collecties uit de Tang- en Song-dynastieën.;https://nl.wikipedia.org/wiki/Verboden_Stad
14;nl;Welke van deze termen is direct tegengesteld aan die van terracotta ?;Ruwe aarde;Clay;Oude aarde;Chemische aarde;Débutant;Voorafgaand aan het terracotta vinden we in alle beschavingen aardewerk en bakstenen van modder.;https://nl.wikipedia.org/wiki/Zonsteen_(bouwkunde)
15;nl;Welke kleur krijgen we met kobaltoxide ?;Blauw;Rood;Groen;Geel;Confirmé;Het zuiverste kobalt kwam via Spanje uit het Midden-Oosten voor grote kosten, dat van Midden-Europa met minder diepe blues.;https://nl.wikipedia.org/wiki/Gla%E7ure
16;nl;Welke aardewerktechniek legt lange plassen klei op ?;Colombin;Mirette;Rollen;Reserveren;Confirmé;De pottenbakker zet de duiven vast door ze tegen elkaar te drukken en maakt het oppervlak glad als de munt stijgt.;
17;nl;Welke stad in het noorden van Frankrijk heeft een museum gewijd aan het beoefenen van keramiek ?;Rouen;Caen;Le Havre;Dieppe;Confirmé;Dit museum, opgericht in 1864 en met het label museum van Frankrijk, bevindt zich in het hotel Hocqueville, in de buurt van Verdrel Square in Rouen.;
18;nl;Welke discipline is gewijd aan het bestuderen van objecten in keramiek ?;Ceramologie;Traceerbaarheid;Palynologie;Grid;Confirmé;Ceramologie omvat de studie van productietechnieken (maken, bakken), hun vormen en die van decoratieve motieven.;https://nl.wikipedia.org/wiki/C%E9ramologie
19;nl;Hoe beschrijft men een keramiek die tekst in zijn decor gebruikt ?;Spreken;Geëxtrudeerd;Alandié;Ruw;Confirmé;De plaat nam deel aan de inspanningen van de nationale vakbond door oorlogsachtige, humoristische of satirische accenten uit te drukken.;https://nl.wikipedia.org/wiki/C%E9ramique
20;nl;Met welke techniek kunt u elementen met verschillende vormen plakken ?;Barbotine;Vermindering;Kalibratie;Champlevé;Confirmé;De handgrepen van een vaas worden bijvoorbeeld uit elkaar gemodelleerd en vervolgens gemonteerd op de slip op het lichaam van de gedraaide vaas.;
21;nl;Wat is de filet zonder te koken tussen 980° C en 1040° C ?;Biscuit;Biscotte;Brood;Cake;Expert;Het porseleinen koekje wordt gebruikt om beeldjes, tafelbladen en beeldverlagingen te maken.;
22;nl;Welke op klei gebaseerde coating kan een keramische soepeler maken ?;Engobe;Estèque;Chamotte;Kroonluchter;Expert;Omdat de engobe losse klei bevat, zou het snel barsten als het op het droge keramiek zou worden gelegd.;https://nl.wikipedia.org/wiki/Slibgoed
23;nl;Welke olijfgroene smaak is kenmerkend voor oud Chinees keramiek ?;Celadon;Pernette;Mullite;Coquemar;Expert;Celadon (letterlijk groen porselein) verwijst naar een kleur en ook naar een soort keramiek eigen aan China en het Verre Oosten.;https://nl.wikipedia.org/wiki/Celadon
24;nl;Welke fijne, doorschijnende keramiek wordt geproduceerd uit kaolien ?;Porselein;Stempelen;Neriage;Albarelle;Expert;Kaolines zijn witte, brokkelige en vuurvaste kleisoorten, samengesteld uit kaoliniet of aluminiumsilicaten.;https://nl.wikipedia.org/wiki/Kaolien
25;nl;Welke donkerbruine Japanse e-mail wordt soms gems genoemd ?;Tenmoku;Dotaku;Nintoku;Daibutsu;Expert;Deze e-mail wordt verkregen door veldspaat, krijt, ball clay, silica, bentoniet en rood ijzeroxide (hematiet) te mengen.;https://nl.wikipedia.org/wiki/Gla%E7ure
26;nl;In keramiek, wat is de naam van de kleikorrel die in water uiteenvalt ?;Barbotine;Schrapen;Mandrin;Fritte;Expert;Het decor met de slip bestaat uit het toevoegen van reliëfs op een aardewerk : zogenaamd slipversierd aardewerk.;
27;nl;Hoeveel jaar huwelijk symboliseert het huwelijk van faience ?;9 jaar oud;19 jaar oud;29 jaar oud;39 jaar oud;Expert;Franse folklore omvat de fabels, populaire overtuigingen, sprookjes en legendes van alle volkeren die in Frankrijk wonen.;https://nl.wikipedia.org/wiki/Faience_(aardewerk)
28;nl;Wat wordt de draaitafel van de toren van de pottenbakker genoemd ?;Girelle;Rondeau;Cne;Engobe;Expert;Nadat hij een kluit klei in het midden van de bak heeft gerangschikt, centreert de pottenbakker zijn grond en schudt deze vervolgens tijdens zijn rotatie.;https://nl.wikipedia.org/wiki/Pottenbakken
29;nl;Sinds welk jaar wordt de knowhow van keramiek van kunst erkend in Frankrijk ?;2009;1999;1989;1979;Expert;Elke staatspartij moet de nodige stappen ondernemen om het immaterieel cultureel erfgoed te beschermen.;
30;nl;Welke architect staat bekend om zijn architecturale beglazing met beglazing ?;Louis Sullivan;Victor Bourgeois;Jean Welz;Tony Garnier;Expert;Op dat moment zouden de tekeningen van de Amerikaanse architect, geboren in 1856 in Boston, onmogelijk op een ander medium kunnen worden uitgevoerd.;https://nl.wikipedia.org/wiki/Louis_Sullivan
