175;nl;Wat aten de families in Engeland rond het vuur in Halloween ?;Hazelnoten;Kersen;Bananen;Abrikozen;Expert;Halloween werd bekritiseerd in Engeland tijdens de periode van de hervormingen om zich te verzetten tegen het idee van de pre-bestemming.;https://nl.wikipedia.org/wiki/Halloween
176;nl;Welke operator lanceerde een oranje mobiele telefoon gedoopt Olaween ?;Frankrijk Teletekst;Bouygues;Alstom;Fnac;Expert;Op het moment van de naamswijziging (Orange sinds 1 juli 2013) was France Télélécom het 121ste wereldwijde bedrijf.;https://nl.wikipedia.org/wiki/France_Télécom
177;nl;In Frankrijk, tussen 1990 en 2000, welke taart werd er gemaakt voor Halloween ?;Samain;Bedelaar;Vacherin;Chanteclair;Expert;Deze cake werd vervolgens gemaakt van bladerdeeg, appels, geroosterde hazelnoten, rozijnen en karamel.;https://nl.wikipedia.org/wiki/Halloween
178;nl;Welk feest creëerde de Braziliaanse overheid in 2005 in plaats van Halloween ?;Saci Day;Feest van Dama;Alicanto;Night of the Martians;Expert;Saci wordt afgebeeld als een zwarte eenbenige zwarte jongen die een pijp rookt en een rode hoed met magische kracht draagt.;
179;nl;Wat beschermen auto's kinderen tijdens Halloween in Manitoba, Churchill ?;IJsberen;Ratten van smaak;Vleermuizen;Kangaroos;Expert;Met knipperende lichten doen de auto's de beren schrikken, die soms in de stad kunnen lopen bij het vallen van de avond.;https://nl.wikipedia.org/wiki/Halloween
180;nl;Welke artiest heeft in 2003 een postuum album uitgebracht met de titel Halloween ?;Frank Zappa;Scott Page;Trent Reznor;Max Johnston;Expert;Halloween is een live-album, van liedjes opgenomen in het Palladium van New York op 27, 28 en 31 oktober 1978.;