88;de;Was hat die brasilianische Regierung 2005 statt Halloween gefeiert ?;Saci Tag;Fest der Dama;Alicanto;Nacht der Marsmenschen;Expert;Saci wird als schwarzer einbeiniger schwarzer Junge dargestellt, der eine Pfeife raucht und einen roten Hut mit magischer Kraft trägt.;https://de.wikipedia.org/wiki/Saci
89;de;Was schützen Autos Kinder in Manitoba, Churchill ?;Eisbären;Ratten des Geschmacks;Fledermäuse;Kängurus;Expert;Mit blinkenden Lichtern erschrecken die Autos die Bären, die manchmal bei Einbruch der Dunkelheit in der Stadt laufen können.;https://de.wikipedia.org/wiki/Halloween
90;de;Welcher Künstler veröffentlichte 2003 ein posthumes Live-Album mit dem Titel Halloween ?;Frank Zappa;Scott Seite;Trent Reznor;Max Johnston;Expert; Halloween ist ein Live-Album, basierend auf Songs, die am 27., 28. und 31. Oktober 1978 im Palladium in New York aufgenommen wurden.;
91;es;¿En la tarde de qué día del año celebramos Halloween ?;31 de octubre;31 de diciembre;30 de noviembre;30 de septiembre;Novato;Halloween o Halloween (uso canadiense) es un festival tradicional y pagano que se origina en las islas anglo-celtas.;https://es.wikipedia.org/wiki/Halloween
92;es;¿En la víspera de qué festividad cristiana podemos participar en Halloween ?;Toussaint;Carême;Pascua;Asunción;Novato;Precedió por un día la conmemoración de los fieles muertos, cuya solemnidad se fijó oficialmente el 2 de noviembre.;https://es.wikipedia.org/wiki/Día de Todos los Santos
93;es;¿En qué serie escrita por R. L. Stine encontramos muchos episodios de Halloween ?;Carne De Pollo;Salem;Siberia;Buffy;Novato;La mayoría de estas historias, escritas en 1992, se han adaptado en episodios que retranscriben fielmente el universo de los libros.;https://es.wikipedia.org/wiki/Goosebumps_(serie_de_televisión)
94;es;¿Qué hacen los niños durante la noche de Halloween ?;Dulces;Arañas;Calabazas;Fantasias;Novato;Los pequeños hablantes de inglés gritan ¡Truco o trato! (¡Relleno o dulce!), ¡Mientras estamos en Francia, escuchamos a Candy o mucho!;https://es.wikipedia.org/wiki/Halloween
95;es;¿De qué color es, con el negro, tradicionalmente asociado con Halloween ?;Naranja;Verde;Azul;Rosa;Novato;Para la historiadora Nadine Cretin, estos colores fueron adoptados después de la reunión de Halloween con la antigua fiesta de los Muertos de México.;https://es.wikipedia.org/wiki/Halloween
96;es;¿En casa, que denuncian ciertas voces contra la fiesta de halloween ?;Americanización;Africanización;Arabización;Hispanización;Novato;Este término se usa ampliamente para describir la influencia ejercida por los Estados Unidos en las vidas de los ciudadanos de otros países del mundo.;https://es.wikipedia.org/wiki/Americanización
97;es;¿Qué psicosis sartorial ha aparecido recientemente en Francia durante Halloween ?;Payaso malicioso;Oso demoníaco;Zombie gritando;Dragón de fuego;Novato;Algunas personas vestidas de payasos se divertían persiguiendo a niños pequeños al amenazarlos con cuchillos.;https://es.wikipedia.org/wiki/Halloween
98;es;¿Quién hizo la película Halloween: Night of Masks estrenada en 1978 ?;John Carpenter;Ridley Scott;Joe Dante;Wes Craven;Novato;Esta película larga producida por Moustapha Akkad es parte de la serie de películas Halloween, que es la obra original.;https://es.wikipedia.org/wiki/Halloween_(película_de_1978)
99;es;¿Qué personaje es probablemente el más popular de Halloween ?;Jack-o'-lantern;Siegfried;Aymon;Bayard;Novato;Iluminado por un carbón ardiente colocado en un nabo hundido, Jack fue condenado a vagar sin rumbo fijo hasta el día del juicio.;https://es.wikipedia.org/wiki/Jack-o'-lantern
100;es;En Escocia, ¿qué debes atrapar con la boca en un famoso juego de Halloween ?;Manzana;Pastel;Cuchillo;Pañuelo;Novato;Este popular juego para niños es uno en el que una manzana debe ser atrapada en una bandeja de agua usando solo su boca.;https://es.wikipedia.org/wiki/Halloween
101;es;¿Qué serie de televisión es el sexto episodio de la temporada 2 titulado Halloween ?;Buffy;Encantado;Caído;Fallo;Confirmado;En una encuesta organizada por Syfy en 2012, el público televisivo la clasificó en el puesto 16 en los mejores episodios de la serie.;https://es.wikipedia.org/wiki/Halloween_(Buffy_the_Vampire_Slayer)
102;es;La icónica linterna de Halloween es de una leyenda de qué país ?;Irlanda;Noruega;Suecia;Finlandia;Confirmado;Un jack-o'-lantern es un nabo iluminado e iluminado desde el interior con una vela, y en el que se cortó una cara.;https://es.wikipedia.org/wiki/Jack-o'-lantern
103;es;¿Con qué nombre se conoció por primera vez a Halloween en las primeras regiones de los Estados Unidos ?;Tarde de las torres;Noche de los ogros;Fiesta infantil;Día de los muertos;Confirmado;Los disfraces de los niños sirven para dar la ilusión de que los espíritus malignos de la antigüedad regresan para atormentar las calles de las ciudades.;https://es.wikipedia.org/wiki/Halloween
104;es;¿Cuál es el personaje central de la serie de películas de Halloween ?;Michael Myers;Rompecabezas;Norman Bates;Damien Thorn;Confirmado;El personaje Michael Myers aparece en nueve películas, además de novelas, un videojuego y en varios cómics.;https://es.wikipedia.org/wiki/Michael_Myers
105;es;En Irlanda, ¿qué consigues en todo el país para celebrar Halloween ?;Fuegos artificiales;Idioma;Un disparo;Las cuerdas;Confirmado;En Irlanda, Halloween es una fiesta muy popular, conocida como el gaélico Oche Shamhna (la noche del fin del verano).;https://es.wikipedia.org/wiki/Halloween
106;es;¿Cuánto se gasta cada año en los Estados Unidos para Halloween ?;8 millones;6 millones;4 millones;2 millones;Confirmado;En varios países que tradicionalmente no celebran Halloween, su introducción ha provocado más o menos oposición.;https://es.wikipedia.org/wiki/Halloween
107;es;¿En qué ciudad está prohibido celebrar Halloween en las escuelas ?;Moscú;Berlín;Amsterdam;Londres;Confirmado;En Rusia, el Kremlin y la Iglesia ortodoxa están tratando de frenar la creciente popularidad de Halloween.;https://es.wikipedia.org/wiki/Halloween
108;es;¿Qué compañía organizó en 1999 una Fiesta de Halloween en el Zénith de Paris ?;Coca-Cola;Lego;Playmobil;Nestlé;Confirmado;La marca Coca-Cola ha organizado al mismo tiempo más de 400 operaciones en bares y discotecas de Francia.;https://es.wikipedia.org/wiki/Halloween
109;es;¿En qué series de televisión es Halloween el día más mágico del año ?;Encantado;Caído;Fallo;Héroes;Confirmado;Es por esta magia que los demonios derrotados en el último año pueden regresar de la muerte para el día.;https://es.wikipedia.org/wiki/Charmed
110;es;En China, ¿qué fiesta está muy cerca de la fiesta de Halloween, aún sin oposición ?;Fiesta de los fantasmas;Fiesta de los dragones;Fiesta de las estrellas;Fiesta de sushi;Confirmado;La tradición dice que durante este período, los espíritus retenidos en el inframundo son liberados porque no reciben adoración.;https://es.wikipedia.org/wiki/Festival_de_los_fantasmas
111;es;¿Qué otra celebración es la tradición de Halloween un legado ?;Samain;Beltaine;Imbolc;Tralee;Experto;Este festival fue celebrado a principios de otoño por los celtas y fue para ellos una especie de fiesta de Año Nuevo.;https://es.wikipedia.org/wiki/Samhain
112;es;En Irlanda, ¿qué pastel ligero de fruta se cocinó y probó durante Halloween ?;Barmbrack;Koulitch;Joffre;Rombosse;Experto;Se colocó un anillo en el pastel antes de cocinar, y quien lo encontrara encontraría el amor verdadero durante el año.;https://es.wikipedia.org/wiki/Halloween
113;es;¿Cuándo apareció la costumbre de Trick or treat en los Estados Unidos ?;1930;1950;1970;1990;Experto;Hoy en día, uno de cada dos estadounidenses celebra Halloween, el 72% distribuye dulces y el 40% se vuelve loco.;https://es.wikipedia.org/wiki/Halloween
114;es;¿Quién fundó la empresa Optos-Opus en Francia para registrar la marca de Halloween ?;Philippe Cahen;André Dumont;Pascal Barbier;Alexandre aix;Experto;La compañía vende productos de confitería, bebidas, pasteles y diversos productos alimenticios para mejorar la imagen de la fiesta.;https://es.wikipedia.org/wiki/Halloween
115;es;En Inglaterra, ¿qué comían las familias alrededor del fuego en Halloween ?;Avellanas;Cerezas;Plátanos;Albaricoques;Experto;Halloween fue criticado en Inglaterra durante el período de las reformas por oponerse a la noción de pre-destino.;https://es.wikipedia.org/wiki/Halloween
116;es;¿Qué operador lanzó un teléfono celular naranja bautizado como Olaween ?;Francia teletexto;Bouygues;Alstom;Fnac;Experto;En el momento del cambio de nombre (Orange desde el 1 de julio de 2013), France Télélécom era la 121a compañía global.;https://es.wikipedia.org/wiki/France_Télécom
117;es;En Francia, entre 1990 y 2000, ¿qué pastel se hizo para Halloween ?;Samain;Mendigo;Vacherin;Chanteclair;Experto;Esta torta fue hecha de hojaldre, manzanas, avellanas tostadas, pasas y caramelo.;https://es.wikipedia.org/wiki/Halloween
118;es;¿Qué celebración creó el gobierno brasileño en 2005 en lugar de Halloween ?;Día del Saci;Fiesta de la dama;Alicanto;Noche de los marcianos;Experto;Saci es retratado como un niño negro de una sola pierna que fuma una pipa y usa un sombrero rojo con poder mágico.;https://es.wikipedia.org/wiki/Sací
119;es;¿Qué protegen los autos a los niños en Halloween en Manitoba, Churchill ?;Osos polares;Ratas de gusto;Murciélagos;Canguros;Experto;Con las luces encendidas, los autos asustan a los osos, quienes a veces pueden caminar en la ciudad al anochecer.;https://es.wikipedia.org/wiki/Halloween
120;es;¿Qué artista lanzó en 2003 un álbum póstumo en vivo titulado Halloween ?;Frank zappa;Scott Page;Trent Reznor;Max Johnston;Experto;Halloween es un álbum en vivo, de canciones grabadas en el Palladium de Nueva York el 27, 28 y 31 de octubre de 1978.;https://es.wikipedia.org/wiki/Halloween_(álbum)
121;it;La sera di quale giorno dell'anno festeggiamo Halloween ?;31 ottobre;31 dicembre;30 novembre;30 settembre;Newbie;Halloween o Halloween (uso canadese) è un tradizionale festival popolare e pagano proveniente dalle isole anglo-celtiche.;https://it.wikipedia.org/wiki/Halloween
122;it;Alla vigilia di quale festa cristiana possiamo partecipare ad Halloween ?;Toussaint;Carême;Pasqua;Presupposto;Newbie;Ha preceduto per un giorno la Commemorazione dei morti fedeli, la cui solennità è stata ufficialmente fissata il 2 novembre.;https://it.wikipedia.org/wiki/Tutti i Santi
123;it;In quale serie scritta da R. L. Stine troviamo molti episodi di Halloween ?;Carne di pollo;Salem;Siberia;Buffy;Newbie;La maggior parte di queste storie, scritte nel 1992, sono state adattate in episodi che ritengono fedelmente l'universo dei libri.;https://it.wikipedia.org/wiki/Piccoli_brividi_(serie_televisiva)
124;it;Cosa fanno i bambini durante la notte di Halloween ?;Candy;Ragni;Zucche;Fantasie;Newbie;Piccoli oratori inglesi urlano Dolcetto o scherzetto! (Ripieno o caramelle!), mentre in Francia, sentiamo Candy o molto!;https://it.wikipedia.org/wiki/Halloween
125;it;Di che colore è, con il nero, tradizionalmente associato a Halloween ?;Arancione;Verde;Blu;Rose;Newbie;Per la storica Nadine Cretin, questi colori sono stati adottati dopo l'incontro di Halloween con l'antica festa dei morti del Messico.;https://it.wikipedia.org/wiki/Halloween
126;it;A casa, che denuncia certe voci contro la festa di Halloween ?;Americanizzazione;Africanizzazione;Arabizzazione;Ispanizzazione;Newbie;Questo termine è ampiamente usato per descrivere l'influenza esercitata dagli Stati Uniti sulla vita dei cittadini di altri paesi del mondo.;https://it.wikipedia.org/wiki/Americanizzazione
127;it;Quale psicosi sartoriale è apparsa di recente in Francia durante Halloween ?;Clown dannoso;Orso demoniaco;Zombie che urla;Fire Dragon;Newbie;Alcune persone vestite da pagliacci si divertivano a rincorrere i bambini piccoli minacciandoli con i coltelli.;https://it.wikipedia.org/wiki/Halloween
128;it;Chi ha realizzato il film Halloween: Night of Masks pubblicato nel 1978 ?;John Carpenter;Ridley Scott;Joe Dante;Wes Craven;Newbie;Questo lungometraggio prodotto da Moustapha Akkad fa parte della serie di film Halloween, che è l'opera originale.;https://it.wikipedia.org/wiki/Halloween_-_La_notte_delle_streghe
129;it;Quale personaggio è probabilmente il più popolare di Halloween ?;Jack-o'-lantern;Siegfried;Aymon;Bayard;Newbie;Illuminato da un carbone ardente posto in una rape infossata, Jack fu condannato a vagare senza meta fino al giorno del giudizio.;https://it.wikipedia.org/wiki/Jack-o'-lantern
130;it;In Scozia, cosa dovresti prendere con la bocca in un famoso gioco di Halloween ?;Apple;Torta;Coltello;Fazzoletto;Newbie;Questo famoso gioco per bambini è quello in cui una mela deve essere catturata in un vassoio d'acqua usando solo la sua bocca.;https://it.wikipedia.org/wiki/Halloween
131;it;Quale serie TV è il sesto episodio della seconda stagione, intitolato Halloween ?;Buffy;Charmed;Fallen;Glitch;Confermato;In un sondaggio organizzato da Syfy nel 2012, il pubblico televisivo si è classificato al 16 ° posto nei migliori episodi della serie.;
132;it;L'iconica lanterna di Halloween è da una leggenda di quale paese ?;Irlanda;Norvegia;Svezia;Finlandia;Confermato;Una lanterna è una rapa accesa e illuminata dall'interno con una candela e in cui è stata tagliata una faccia.;https://it.wikipedia.org/wiki/Jack-o'-lantern
133;it;Sotto quale nome era noto per la prima volta Halloween nelle prime regioni degli Stati Uniti ?;Sera delle torri;La notte degli orchi;Festa dei bambini;Giorno dei morti;Confermato;I costumi per bambini servono a dare l'illusione che gli spiriti maligni del passato tornino a perseguitare le strade delle città.;https://it.wikipedia.org/wiki/Halloween
134;it;Qual è il personaggio centrale della serie di film Halloween ?;Michael Myers;Jigsaw;Norman Bates;Damien Thorn;Confermato;Il personaggio Michael Myers appare in nove film, oltre a romanzi, un videogioco e in diversi fumetti.;https://it.wikipedia.org/wiki/Michael_Myers
135;it;In Irlanda, cosa ottieni in tutto il paese per festeggiare Halloween ?;Fuochi d'artificio;Lingua;Un colpo;Le stringhe;Confermato;In Irlanda, Halloween è una festa molto popolare, conosciuta come la gaelica Oche Shamhna (la notte della fine dell'estate).;https://it.wikipedia.org/wiki/Halloween
136;it;Quanto viene speso ogni anno negli Stati Uniti per Halloween ?;8 miliardi;6 miliardi;4 miliardi;2 miliardi;Confermato;In diversi paesi che tradizionalmente non festeggiano Halloween, la sua introduzione ha scatenato più o meno opposizione.;https://it.wikipedia.org/wiki/Halloween
137;it;In quale città è proibito celebrare Halloween nelle scuole ?;Mosca;Berlino;Amsterdam;Londra;Confermato;In Russia, il Cremlino e la Chiesa ortodossa stanno cercando di frenare la crescente popolarità di Halloween.;https://it.wikipedia.org/wiki/Halloween
138;it;Quale compagnia organizzò nel 1999 un Halloween Party allo Zénith de Paris ?;Coca-Cola;Lego;Playmobil;Nestlé;Confermato;Il marchio Coca-Cola ha organizzato contemporaneamente più di 400 operazioni nei bar e nelle discoteche della Francia.;https://it.wikipedia.org/wiki/Halloween
139;it;In quale serie televisiva Halloween è il giorno più magico dell'anno ?;Charmed;Fallen;Glitch;Heroes;Confermato;È con questa magia che i demoni sconfitti nell'ultimo anno possono tornare dai morti per la giornata.;https://it.wikipedia.org/wiki/Streghe
140;it;In Cina, quale festa è molto vicina alla festa di Halloween, ancora incontrastata ?;Festa dei fantasmi;Festa dei draghi;Festa delle stelle;Sushi party;Confermato;Secondo la tradizione, durante questo periodo, gli spiriti presenti negli inferi vengono rilasciati perché non ricevono l'adorazione.;https://it.wikipedia.org/wiki/Ullambana
141;it;Quale altra celebrazione è la tradizione di Halloween in eredità ?;Samain;Beltaine;Imbolc;Tralee;Expert;Questo festival è stato celebrato all'inizio del autunno dai Celti ed è stato per loro una specie di festa di Capodanno.;https://it.wikipedia.org/wiki/Samhain
142;it;In Irlanda, quale torta di frutta leggera è stata cucinata e assaggiata durante Halloween ?;Barmbrack;Koulitch;Joffre;Rombosse;Expert;Un anello è stato inserito nella torta prima della cottura e chiunque abbia trovato l'anello avrebbe trovato il vero amore durante l'anno.;https://it.wikipedia.org/wiki/Halloween
143;it;Quando è nata l'usanza di Dolcetto o scherzetto negli Stati Uniti ?;1930;1950;1970;1990;Expert;Oggi, Halloween è celebrato da uno su due americani, il 72% distribuisce caramelle e il 40% impazzisce.;https://it.wikipedia.org/wiki/Halloween
144;it;Chi ha fondato la società Optos-Opus in Francia per registrare il marchio Halloween ?;Philippe Cahen;André Dumont;Pascal Barbier;Alexandre Aix;Expert;L'azienda vende dolciumi, bevande, torte e vari prodotti alimentari per migliorare l'immagine della festa.;https://it.wikipedia.org/wiki/Halloween
145;it;In Inghilterra, cosa hanno mangiato intorno al fuoco le famiglie ad Halloween ?;Nocciole;Ciliegie;Banane;Albicocche;Expert;Halloween è stato criticato in Inghilterra durante il periodo delle riforme per essere contrario alla nozione di pre-destinazione.;https://it.wikipedia.org/wiki/Halloween
146;it;Quale operatore ha lanciato un cellulare arancione battezzato Olaween ?;Televideo Francia;Bouygues;Alstom;Fnac;Expert;Al momento della modifica del nome (Orange dal 1 ° luglio 2013), France Télélécom era la 121a compagnia globale.;https://it.wikipedia.org/wiki/France_Télécom
147;it;In Francia, tra il 1990 e il 2000, che torta è stata fatta per Halloween ?;Samain;Mendicante;Vacherin;Chanteclair;Expert;Questa torta è stata quindi preparata con pasta sfoglia, mele, nocciole tostate, uvetta e caramello.;https://it.wikipedia.org/wiki/Halloween
148;it;Che celebrazione ha creato il governo brasiliano nel 2005 invece di Halloween ?;Saci Day;Festa della Dama;Alicanto;La notte dei marziani;Expert;Saci è ritratto come un nero ragazzo nero con una gamba sola che fuma una pipa e indossa un cappello rosso con poteri magici.;https://it.wikipedia.org/wiki/Saci (folclore)
149;it;Cosa fanno le auto per proteggere i bambini ad Halloween a Manitoba, Churchill ?;Orsi polari;Ratti del gusto;Pipistrelli;Canguri;Expert;Con le luci lampeggianti, le macchine spaventano gli orsi, che a volte possono camminare in città al calar della notte.;https://it.wikipedia.org/wiki/Halloween
150;it;Quale artista ha pubblicato nel 2003 un album dal vivo postumo intitolato Halloween ?;Frank Zappa;Pagina Scott;Trent Reznor;Max Johnston;Expert;Halloween è un album dal vivo, tratto da canzoni registrate al Palladium di New York il 27, 28 e 31 ottobre 1978.;https://it.wikipedia.org/wiki/Halloween_(album)
151;nl;In de avond van welke dag van het jaar vieren we Halloween ?;31 oktober;31 december;30 november;30 september;Newbie;Halloween of Halloween (Canadees gebruik) is een traditioneel volks- en heidens festival afkomstig van de Anglo-Keltische eilanden.;https://nl.wikipedia.org/wiki/Halloween
152;nl;Aan de vooravond van welke christelijke vakantie kunnen we deelnemen aan Halloween ?;Toussaint;Carême;Pasen;Veronderstelling;Newbie;Het ging een dag vooraf aan de Herdenking van de Dode Gelovigen, wiens plechtigheid officieel werd vastgesteld op 2 november.;https://nl.wikipedia.org/wiki/Allerheiligen
153;nl;In welke serie geschreven door R. L. Stine vinden we veel Halloween-afleveringen ?;Kippenvlees;Salem;Siberië;Buffy;Newbie;De meeste van deze verhalen, geschreven in 1992, zijn verwerkt in afleveringen die trouw het universum van boeken opnieuw transcriberen.;
154;nl;Wat doen kinderen tijdens de nacht van Halloween ?;Candy;Spinnen;Pompoenen;Fantasieën;Newbie;Kleine Engelssprekenden gillen Trick of traktatie! (Stuffing of snoep!), terwijl we in Frankrijk zijn, horen we Candy of veel!;https://nl.wikipedia.org/wiki/Halloween
155;nl;Welke kleur heeft zwart, traditioneel geassocieerd met Halloween ?;Oranje;Groen;Blauw;Rose;Newbie;Voor de historicus Nadine Cretin werden deze kleuren aangenomen na de ontmoeting van Halloween met het oude feest van de doden van Mexico.;https://nl.wikipedia.org/wiki/Halloween
156;nl;Thuis, dat bepaalde stemmen tegen het Halloween-feest aanklagen ?;Amerikanisering;Afrikatisering;Arabization;Hispanization;Newbie;Deze term wordt veel gebruikt om de invloed van de Verenigde Staten op het leven van burgers van andere landen van de wereld te beschrijven.;https://nl.wikipedia.org/wiki/Amerikanisering
157;nl;Welke kleermakerspsychose is onlangs in Frankrijk verschenen tijdens Halloween ?;Schadelijke clown;Demonische beer;Zombie schreeuwen;Vuurdraak;Newbie;Sommige mensen verkleed als clowns hadden plezier aan het achtervolgen van jonge kinderen door hen met messen te bedreigen.;https://nl.wikipedia.org/wiki/Halloween
158;nl;Wie heeft de film Halloween: Night of Masks uitgebracht in 1978 ?;John Carpenter;Ridley Scott;Joe Dante;Wes Craven;Newbie;Deze lange film geproduceerd door Moustapha Akkad maakt deel uit van de reeks films Halloween, het originele opus.;https://nl.wikipedia.org/wiki/Halloween_(1978)
159;nl;Welk personage is waarschijnlijk het populairste Halloween ?;Jack-o'-lantern;Siegfried;Aymon;Bayard;Newbie;Verlicht door een brandende kolen geplaatst in een gezonken raap, werd Jack veroordeeld om doelloos rond te dwalen tot de dag des oordeels.;https://nl.wikipedia.org/wiki/Jack-o'-lantern
160;nl;Wat moet je in Schotland vangen met een beroemde Halloween-game ?;Apple;Cake;Mes;Zakdoek;Newbie;Deze populaire kindergame is er een waarbij een appel alleen in zijn mond in een bak water gevangen moet worden.;https://nl.wikipedia.org/wiki/Halloween
161;nl;Welke tv-serie is de zesde aflevering van seizoen 2 met de titel Halloween ?;Buffy;Charmed;Fallen;Glitch;Bevestigd;In een enquête die Syfy in 2012 organiseerde, rangschikte het televisiepubliek het op de 16e plaats in de beste afleveringen van de serie.;
162;nl;De iconische Halloween-lantaarn komt uit een legende van welk land ?;Ierland;Noorwegen;Zweden;Finland;Bevestigd;Een hefboomlantaarn is een raap en wordt van binnenuit verlicht met een kaars, en waarin een gezicht is afgesneden.;https://nl.wikipedia.org/wiki/Jack-o'-lantern
163;nl;Onder welke naam was Halloween voor het eerst bekend in de eerste regio's van de Verenigde Staten ?;Avond van de torens;Nacht van de ogres;Kinderfeestje;Dag van de Doden;Bevestigd;De kostuums van de kinderen dienen om de illusie te geven dat de boze geesten van vroeger terugkomen om de straten van steden te achtervolgen.;https://nl.wikipedia.org/wiki/Halloween
164;nl;Wat is het centrale personage uit de reeks Halloween films ?;Michael Myers;Jigsaw;Norman Bates;Damien Thorn;Bevestigd;Het personage Michael Myers verschijnt in negen films, maar ook in romans, een videogame en in verschillende stripverhalen.;https://nl.wikipedia.org/wiki/Michael_Myers
165;nl;Wat krijg je in Ierland overal in het land om Halloween te vieren ?;Vuurwerk;Taal;Eén schot;De snaren;Bevestigd;In Ierland is Halloween een erg populaire feestdag, bekend als het Gaelic Oche Shamhna (de nacht van het einde van de zomer).;https://nl.wikipedia.org/wiki/Halloween
166;nl;Hoeveel wordt er elk jaar in de VS uitgegeven voor Halloween ?;8 miljard;6 miljard;4 miljard;2 miljard;Bevestigd;In verschillende landen, die traditioneel niet Halloween vieren, heeft de introductie ervan min of meer tegenstand opgeroepen.;https://nl.wikipedia.org/wiki/Halloween
167;nl;In welke stad is het verboden om Halloween op scholen te vieren ?;Moskou;Berlijn;Amsterdam;Londen;Bevestigd;In Rusland proberen het Kremlin en de orthodoxe kerk de groeiende populariteit van Halloween in te dammen.;https://nl.wikipedia.org/wiki/Halloween
168;nl;Welk bedrijf organiseerde in 1999 een Halloween-feest in de Zenith de Paris ?;Coca-Cola;Lego;Playmobil;Nestlé;Bevestigd;Het merk Coca-Cola heeft tegelijkertijd meer dan 400 operaties georganiseerd in de bars en discotheken van Frankrijk.;https://nl.wikipedia.org/wiki/Halloween
169;nl;In welke televisieserie is Halloween de meest magische dag van het jaar ?;Charmed;Fallen;Glitch;Heroes;Bevestigd;Het is door deze magie dat de demonen versloeg in het afgelopen jaar kan terugkomen van de doden voor de dag.;https://nl.wikipedia.org/wiki/Charmed_(televisieserie)
170;nl;Welke partij staat in China heel dicht bij de Halloween-partij, nog steeds onbetwist ?;Feest van de geesten;Feest van de draken;Stars Party;Sushi feestje;Bevestigd;Volgens de overlevering worden tijdens deze periode de geesten in de onderwereld vrijgelaten omdat ze geen aanbidding ontvangen.;https://nl.wikipedia.org/wiki/Geestenfeest
171;nl;Welke andere viering is de Halloween-traditie een erfenis ?;Samain;Beltaine;Imbolc;Tralee;Expert;Dit festival werd aan het begin van de herfst gevierd door de Kelten en was voor hen een soort nieuwjaarsfeest.;https://nl.wikipedia.org/wiki/Samhain
172;nl;Welke lichte fruitcake werd in Ierland gekookt en geproefd tijdens Halloween ?;Barmbrack;Koulitch;Joffre;Rombosse;Expert;Voor het koken werd een ring in de cake geplaatst en degene die de ring vond, vond gedurende het jaar ware liefde.;https://nl.wikipedia.org/wiki/Halloween
173;nl;Wanneer verscheen de gewoonte van Trick or treat in de Verenigde Staten ?;1930;1950;1970;1990;Expert;Vandaag wordt Halloween gevierd door één op de twee Amerikanen, 72% verspreidt snoep en 40% wordt gek.;https://nl.wikipedia.org/wiki/Halloween
174;nl;Wie heeft het bedrijf Optos-Opus in Frankrijk opgericht om het merk Halloween te registreren ?;Philippe Cahen;André Dumont;Pascal Barbier;Alexandre Aix;Expert;Het bedrijf verkoopt zoetwaren, dranken, gebak en verschillende voedingsproducten om het imago van het feest te verbeteren.;https://nl.wikipedia.org/wiki/Halloween
