1;fr;Quelle icône de la mode portait toujours en public un catogan et des lunettes noires ?;Karl Lagerfeld;Paco Rabanne;Pierre Cardin;Thierry Mugler;Débutant;En plus de ses occupations en haute couture, Karl Lagerfeld a édité des livres en Allemagne et possédait une librairie.;https://fr.wikipedia.org/wiki/Karl_Lagerfeld
2;fr;Pour quelle marque la célèbre top model Kate Moss arbore-t-elle les it bags de la collection ?;Longchamp;Chanel;Gucci;Mango;Débutant;C'est une campagne de publicité pour la marque américaine Calvin Klein qui a propulsé Kate Moss sur le devant de la scène.;https://fr.wikipedia.org/wiki/Kate_Moss
3;fr;Quel mythique modèle de lunettes Ray-Ban est associé aux Blues Brothers ?;Wayfarer;Vuarnet;Ekoï;Cébé;Débutant;Les Wayfarer sont parfois citées comme une des meilleures ventes de conception de lunettes de soleil de l'histoire.;https://fr.wikipedia.org/wiki/Ray-Ban_Wayfarer
4;fr;Quel prénom monsieur Takada a-t-il su faire rayonner dans le milieu de la mode ?;Kenzo;Karl;Kalvin;Kyrio;Débutant;En 1993, Kenzo Takada a revendu la marque Kenzo au groupe LVMH, demeurant propriétaire du nom complet.;https://fr.wikipedia.org/wiki/Kenzo_Takada
5;fr;Pour quelle marque de luxe l'actrice Catherine Deneuve a-t-elle posé assise sur une valise ?;Louis Vuitton;Boucheron;Cerruti;Ralph Lauren;Débutant;Pendant six années consécutives (de 2006 à 2012), Louis Vuitton a été nommée marque de luxe la plus précieuse au monde.;https://fr.wikipedia.org/wiki/Louis_Vuitton
6;fr;Quelle star de « Loft Story » a lancé un parfum fraise des bois et pastèque ?;Loana;Afida Turner;Laure de Lattre;Kenza Braiga;Débutant;La renommée de Loana lui a permis de s'essayer aux métiers de styliste, de chanteuse et de présentatrice de télévision française.;https://fr.wikipedia.org/wiki/Loana_Petrucciani
7;fr;Quel ancien couturier de chez Dior a inventé le smoking pour femme ?;Yves Saint Laurent;André Courrèges;Christian Dior;Pierre Balmain;Débutant;Saint Laurent a réinventé le trench-coat dès 1962, instauré le smoking pour femmes en 1966 et le tailleur-pantalon en 1967.;https://fr.wikipedia.org/wiki/Yves_Saint_Laurent
8;fr;À quelle marque française de mode la salamandre est-elle étroitement liée ?;Agnès b.;Naf Naf;Lacoste;Dim;Débutant;Tarantino a fait appel à Agnès b. pour créer l'intégralité des tenues portées à l'écran par Uma Thurman dans le film « Pulp Fiction ».;https://fr.wikipedia.org/wiki/Agnès_b.
9;fr;Quelle couleur signe avec classe et sensualité les semelles des chaussures Louboutin ?;Rouge;Verte;Bleue;Mauve;Débutant;Christian Louboutin, inspiré par le pop art, a basé sa spécificité sur la semelle en cuir rouge visant à devenir son signe distinctif.;https://fr.wikipedia.org/wiki/Christian_Louboutin
10;fr;Quelle fleur est devenue un symbole de la maison de couture Coco Chanel ?;Camélia;Rose;Coquelicot;Marguerite;Débutant;Coco Chanel a fait du camélia son emblème et a lancé la mode du camélia blanc à la boutonnière, très vite devenue un engouement.;https://fr.wikipedia.org/wiki/Camellia
11;fr;Quelle marque de luxe a sponsorisé le Prix de Diane de 1983 à 2007 ?;Hermès;Dior;Courrèges;Cardin;Confirmé;La course sacre à Chantilly la meilleure pouliche de trois ans dans une ambiance de ferveur sportive et de pique-nique chic.;https://fr.wikipedia.org/wiki/Prix_de_Diane
12;fr;À quel italien John Galliano a-t-il succédé à la tête de la maison Dior ?;Gianfranco Ferré;Ottavio Missoni;Riccardo Tisci;Enrico Coveri;Confirmé;Initialement destiné au métier d'architecte, Gianfranco Ferré a débuté dans la mode en 1970 en dessinant des accessoires.;https://fr.wikipedia.org/wiki/Gianfranco_Ferré
13;fr;Quelle styliste britannique a fêté en 2007 ses 35 ans d'underground ?;Vivienne Westwood;Stella McCartney;Zandra Rhodes;Sarah Burton;Confirmé;Dans les années 1970, Vivienne Westwood a créé une boutique de mode qui contribua à lancer la mode punk.;https://fr.wikipedia.org/wiki/Vivienne_Westwood
14;fr;De quelle marque Laetitia Casta, Lindsay Lohan et Kirsten Dunst ont-elles été les égéries ?;Miu Miu;Berluti;Rodeo Drive;Moncler;Confirmé;Miu Miu, marque lancée en 1993 et souvent appelée la petite soeur de Prada, est voulue plus jeune et plus abordable.;https://fr.wikipedia.org/wiki/Prada_(entreprise)
15;fr;Quel couturier a créé les parfums « Rouge » et « Noir » pour la société Avon ?;Christian Lacroix;Franck Sorbier;Raf Simons;Thierry Mugler;Confirmé;Christian Lacroix s'est orienté vers divers univers, comme notamment la décoration d'hôtels ou de moyens de transport.;https://fr.wikipedia.org/wiki/Christian_Lacroix
16;fr;Quel styliste italien a été consultant mode sur la série télévisée « Deux flics à Miami » ?;Gianni Versace;Valentino;Paco Rabanne;John Galliano;Confirmé;Au sommet de la gloire et du succès artistique, Gianni Versace fut assassiné à l'âge de 50 ans à Miami de deux balles dans la tête.;https://fr.wikipedia.org/wiki/Gianni_Versace
17;fr;Quel couturier espagnol avait été surnommé le métallurgiste par Chanel ?;Paco Rabanne;Antonio del Castillo;Mariano Madrazo;Cristobal Balenciaga;Confirmé;Paco Rabanne s'est également illustré dans les médias à travers des prédictions (s'étant la plupart du temps révélées d'ailleurs fausses).;https://fr.wikipedia.org/wiki/Paco_Rabanne
18;fr;Pour quelle marque Laure Manaudou s'est-elle retrouvée dans une fontaine publique ?;Lancel;Gucci;Pliage;Fendi;Confirmé;À ses débuts, Lancel commercialisait des pipes et accessoires pour fumeurs et a déposé le brevet du briquet automatique.;https://fr.wikipedia.org/wiki/Lancel
19;fr;Quel couturier a créé les costumes de la tournée mondiale d'Elton John de 1992 ?;Gianni Versace;Rocco Barocco;Romeo Gigli;Giuseppe Zanotti;Confirmé;Le 3 décembre 1995, Elton John a remis en personne à Gianni Versace le prix VHI Fashion and Music Award à New York.;https://fr.wikipedia.org/wiki/Gianni_Versace
20;fr;Le Mahina est un modèle de grand sac signé de quelle marque ?;Vuitton;Hermès;Gucci;Chanel;Confirmé;D'emblée, son design voluptueux et généreux et son cuir doux comme une peau de bébé accrochent l'oeil et la main.;https://fr.wikipedia.org/wiki/Louis_Vuitton
21;fr;Qui a créé un pendentif en forme de jambe pour lancer sa ligne de bijoux ?;Stella McCartney;Mary Quant;Zandra Rhodes;Sarah Burton;Expert;En tant que végétarienne comme sa mère Linda Eastman, Stella McCartney n'utilise ni fourrure ni cuir dans ses collections.;https://fr.wikipedia.org/wiki/Stella_McCartney
22;fr;Quel duo a lancé une collection dans une boutique avec des chaises au plafond ?;Viktor et Rolf;H et M;Dolce et Gabbana;Paul et Shark;Expert;En 2015, Viktor et Rolf a annoncé l'arrêt de sa ligne de prêt-à-porter, préférant se concentrer sur le parfum et la haute couture.;https://fr.wikipedia.org/wiki/Viktor_et_Rolf
23;fr;De quel pays vient la marque Uniqlo qui propose des vêtements basiques ?;Japon;Suède;Inde;Canada;Expert;Disney a signé un contrat avec Uniqlo pour commercialiser en Chine ses produits « Star Wars », « Avengers » et « La Reine des neiges ».;https://fr.wikipedia.org/wiki/Uniqlo
24;fr;Quelle Danoise installée à Paris a créé une mode pour la vraie vie ?;Vanessa Bruno;Louise Chéruit;Nina Ricci;Madeleine Vionnet;Expert;La mode de Vanessa Bruno est constituée d'épaisses couches de tricot et de jambières justaucorps, en couleurs sobres ou pastel.;https://fr.wikipedia.org/wiki/Vanessa_Bruno
25;fr;En 2008, sur quel endroit du corps était-il chic de porter le mini-sac Chanel ?;À la cheville;À la taille;Au poignet;Autour du cou;Expert;Gabrielle Chasnel, dite Coco Chanel, née en 1883, est à l'origine de la Maison Chanel, symbole de l'élégance française.;https://fr.wikipedia.org/wiki/Coco_Chanel
26;fr;Quel est le pays d'origine de la chaîne de magasins Hennes et Mauritz ?;Suède;France;Espagne;Royaume-Uni;Expert;Hennes et Mauritz est présent dans 61 pays, emploie environ 148 000 personnes et possède plus de 4 000 magasins.;https://fr.wikipedia.org/wiki/Hennes_et_Mauritz
27;fr;Quel franco-tunisien a sculpté les silhouettes de Grace Jones et de Tina Turner ?;Azzedine Alaïa;Bouchra Jarrar;Emanuel Ungaro;Izet Curi;Expert;De très nombreux artistes et personnalités ont côtoyé Azzedine Alaïa, mais c'est bien Grace Jones qui deviendra sa muse.;https://fr.wikipedia.org/wiki/Azzedine_Alaïa
28;fr;Quel couturier a fait poser Naomi Campbell et Dita Von Teese nues pour ses tee-shirts ?;Marc Jacobs;Ralph Lauren;Tom Ford;Mike Ness;Expert;Créateur de mode américain, Marc Jacobs a été directeur artistique des collections Louis Vuitton de 1997 à 2013.;https://fr.wikipedia.org/wiki/Marc_Jacobs
29;fr;Quel parfum proposé dans une boule à facettes fut lancé par Cathy Guetta ?;« Ibiza »;« Saint-Tropez »;« Palace »;« Paris »;Expert;Cathy Guetta est une organisatrice de soirées et de spectacles, ainsi qu'une personnalité de télévision française.;https://fr.wikipedia.org/wiki/Cathy_Guetta
30;fr;En 2007, quel créateur a dessiné pour Lenôtre la bûche de Noël ?;Karl Lagerfeld;Paco Rabanne;Gianni Versace;Pierre Cardin;Expert;L'entreprise Lenôtre possède actuellement 15 boutiques en France, soit 13 à Paris et 2 sur la côte d'Azur, à Cannes et à Nice.;https://fr.wikipedia.org/wiki/Lenôtre
1;en;What fashion icon always wears a catogan and dark glasses ?;Karl Lagerfeld;Paco Rabanne;Pierre Cardin;Thierry Mugler;Débutant;In addition to his high fashion jobs, Karl Lagerfeld publishes books in Germany and owns a bookstore.;https://en.wikipedia.org/wiki/Karl_Lagerfeld
2;en;For what brand does the famous supermodel Kate Moss wear the collection's it bags ?;Longchamp;Chanel;Gucci;Mango;Débutant;It was the advertising campaign for American brand Calvin Klein that propelled Kate Moss to the front of the stage.;https://en.wikipedia.org/wiki/Kate_Moss
3;en;What mythical model of Ray-Ban is associated with the Blues Brothers ?;Wayfarer;Vuarnet;Ekoï;Cébé;Débutant;The Wayfarer are sometimes cited as one of the best selling sunglasses design in history.;https://en.wikipedia.org/wiki/Ray-Ban_Wayfarer
4;en;What name has Mr. Takada been able to radiate in the fashion world ?;Kenzo;Karl;Kalvin;Kyrio;Débutant;In 1993, Kenzo Takada sold the Kenzo brand to the LVMH group, owning the full name.;https://en.wikipedia.org/wiki/Kenzo_Takada
5;en;For which luxury brand did Catherine Deneuve sit on a suitcase ?;Louis Vuitton;Boucheron;Cerruti;Ralph Lauren;Débutant;For six consecutive years (from 2006 to 2012), Louis Vuitton has been named the most valuable luxury brand in the world.;https://en.wikipedia.org/wiki/Louis_Vuitton
6;en;Which star of « Loft Story » has launched a strawberry scent of wood and pastel ?;Loana;Afida Turner;Laure de Lattre;Kenza Braiga;Débutant;Loana's fame has given her the chance to work as a stylist, singer and French television presenter.;
7;en;What old fashion designer from Dior invented the women's tuxedo ?;Yves Saint Laurent;André Courrèges;Christian Dior;Pierre Balmain;Débutant;Saint Laurent invented the trench coat from 1962, introduced the women's tuxedo in 1966 and the pantsuit in 1967.;https://en.wikipedia.org/wiki/Yves_Saint_Laurent_(designer)
8;en;To which French fashion brand is the salamander linked ?;Agnès b.;Naf Naf;Lacoste;Dim;Débutant;Tarantino appealed to Agnès b. to create all the outfits brought to the screen by Uma Thurman in « Pulp Fiction ».;
9;en;What color is the soles of Louboutin shoes ?;Red;Green;Blue;Mauve;Débutant;Christian Louboutin, inspired by pop art, has based its specificity on the red leather sole to become its hallmark.;https://en.wikipedia.org/wiki/Christian_Louboutin
10;en;Which flower has become a symbol of the Coco Chanel fashion house ?;The camera;The rose;The poppy;The daisy;Débutant;Coco Chanel has made the camera its emblem and has launched the fashion of the white camelia at the buttonhole, which has become a craze.;https://en.wikipedia.org/wiki/Camellia
11;en;Which luxury brand sponsored the Prix de Diane from 1983 to 2007 ?;Hermès;Dior;Courrèges;Cardin;Confirmé;The race crowned Chantilly the best filly of three years in an atmosphere of sporting fervor and chic picnic.;https://en.wikipedia.org/wiki/Prix_de_Diane
12;en;What Italian did John Galliano take over at the head of Dior ?;Gianfranco Ferré;Ottavio Missoni;Riccardo Tisci;Enrico Coveri;Confirmé;Originally intended for the architectural profession, Gianfranco Ferré started fashion in 1970 by designing accessories.;https://en.wikipedia.org/wiki/Gianfranco_Ferré
13;en;Which British stylist feted in 2007 her 35 years underground ?;Vivienne Westwood;Stella McCartney;Zandra Rhodes;Sarah Burton;Confirmé;In the 1970s, Vivienne Westwood created a fashion store that helped launch punk fashion.;https://en.wikipedia.org/wiki/Vivienne_Westwood
14;en;Which brand Laetitia Casta, Lindsay Lohan and Kirsten Dunst were the most successful ?;Miu Miu;Berluti;Rodeo Drive;Moncler;Confirmé;Miu Miu, brand launched in 1993 and often called « Prada's little sister », is wanted younger and more affordable.;https://en.wikipedia.org/wiki/Prada
15;en;Which designer has created « Red » and « Black » perfumes for Avon ?;Christian Lacroix;Franck Sorbier;Raf Simons;Thierry Mugler;Confirmé;Christian Lacroix has turned to various worlds, such as the decoration of hotels or means of transport.;https://en.wikipedia.org/wiki/Christian_Lacroix
16;en;Which Italian stylist was fashion consultant on « Two cops in Miami » ?;Gianni Versace;Valentino;Paco Rabanne;John Galliano;Confirmé;At the height of glory and artistic success, Gianni Versace was murdered in Miami at the age of 50 by two bullets in the head.;https://en.wikipedia.org/wiki/Gianni_Versace
17;en;What Spanish couturier was nicknamed the metallurgist by Chanel ?;Paco Rabanne;Antonio del Castillo;Mariano Madrazo;Cristobal Balenciaga;Confirmé;Paco Rabanne has also illustrated himself in the media through predictions (most of the time being revealed false).;https://en.wikipedia.org/wiki/Paco_Rabanne
18;en;For what brand of bags did Laure Manaudou find herself in a fountain ?;Lancel;Gucci;Pliage;Fendi;Confirmé;At the outset, Lancel marketed smoking pipes and accessories and filed the patent for the automatic lighter.;https://en.wikipedia.org/wiki/Lancel_(company)
19;en;Which designer created the costumes for the 1992 Elton John World Tour ?;Gianni Versace;Rocco Barocco;Romeo Gigli;Giuseppe Zanotti;Confirmé;On December 3, 1995, Elton John presented in person to Gianni Versacele « VHI Fashion and Music Award » in New York.;https://en.wikipedia.org/wiki/Gianni_Versace
20;en;The Mahina is a model of big bag signed of which brand ?;Vuitton;Hermès;Gucci;Chanel;Confirmé;From the outset, its voluptuous and generous design and soft leather like a baby skin catch the eye and the hand.;https://en.wikipedia.org/wiki/Louis_Vuitton
21;en;Who created a leg-shaped pendant to launch his line of jewelry ?;Stella McCartney;Mary Quant;Zandra Rhodes;Sarah Burton;Expert;As a venereal like her mother Linda Eastman, Stella McCartney does not use fur or leather in her collections.;https://en.wikipedia.org/wiki/Stella_McCartney
22;en;Which duo launched a collection in a shop with chairs on the ceiling ?;Viktor and Rolf;H and M;Dolce and Gabbana;Paul and Shark;Expert;In 2015, Viktor and Rolf announced the end of their ready-to-wear line, preferring to focus on perfume and haute couture.;https://en.wikipedia.org/wiki/Viktor_and_Rolf
23;en;Which country does the Uniqlo brand that offers basic clothing come from ?;From Japan;From Sweden;From India;From Canada;Expert;Disney has signed a contract with Uniqlo to market China's « Star Wars », « Avengers » and « The Frozen » products.;https://en.wikipedia.org/wiki/Uniqlo
24;en;What Danish living in Paris has created a fashion for real life ?;Vanessa Bruno;Louise Chéruit;Nina Ricci;Madeleine Vionnet;Expert;Vanessa Bruno's fashion is made up of thick layers of knit and leggings leotards, in sober or pastel colors.;https://en.wikipedia.org/wiki/Vanessa_Bruno
25;en;In 2008, where was it chic to wear the Chanel mini-bag ?;At the ankle;At the waist;Wrist;Around the neck;Expert;Gabrielle Chasnel, known as Coco Chanel, born in 1883, is at the origin of the Maison Chanel, a symbol of French elegance.;https://en.wikipedia.org/wiki/Coco_Chanel
26;en;What is the country of origin of the Hennes and Mauritz ?;Sweden;France;Spain;United Kingdom;Expert;Hennes and Mauritz is present in 61 countries and employs around 148,000 people and owns 4,000 shops.;
27;en;What Franco-Tunisian carved the silhouettes of Grace Jones and Tina Turner ?;Azzedine Alaïa;Bouchra Jarrar;Emanuel Ungaro;Izet Curi;Expert;Many artists and personalities have served Azzedine Alaïa, but it is Grace Jones that will become her muse.;https://en.wikipedia.org/wiki/Azzedine_Alaïa
28;en;What designer put Naomi Campbell and Dita Von Teese naked for her T-shirts ?;Marc Jacobs;Ralph Lauren;Tom Ford;Mike Ness;Expert;American fashion designer, Marc Jacobs was Artistic Director of the Louis Vuitton Collections from 1997 to 2013.;https://en.wikipedia.org/wiki/Marc_Jacobs
29;en;What perfume proposed in a mirror ball was launched by Cathy Guetta ?;« Ibiza »;« Saint-Tropez »;« Palace »;« Paris »;Expert;Cathy Guetta is an organizer of parties and shows, as well as a French television personality.;https://en.wikipedia.org/wiki/Cathy_Guetta
30;en;What designer designed for Lenôtre the 2007 Christmas bean ?;Karl Lagerfeld;Paco Rabanne;Gianni Versace;Pierre Cardin;Expert;The company Lenôtre currently has 15 stores in France, 13 in Paris and 2 on the Cote d'Azur, in Cannes and Nice.;https://en.wikipedia.org/wiki/Lenôtre
1;de;Welche Mode-Ikone trägt immer einen Catogan und eine dunkle Brille ?;Karl Lagerfeld;Paco Rabanne;Pierre Cardin;Thierry Mugler;Débutant;Neben seinen High Fashion-Jobs veröffentlicht Karl Lagerfeld Bücher in Deutschland und besitzt eine Buchhandlung.;https://de.wikipedia.org/wiki/Karl_Lagerfeld
2;de;Für welche Marke trägt das berühmte Supermodel Kate Moss die It-Bags der Kollektion ?;Longchamp;Chanel;Gucci;Mango;Débutant;Es war die Werbekampagne für die amerikanische Marke Calvin Klein, die Kate Moss an die Spitze der Bühne brachte.;https://de.wikipedia.org/wiki/Kate_Moss
3;de;Welches mythische Modell von Ray-Ban wird mit den Blues Brothers in Verbindung gebracht ?;Wanderer;Vuarnet;Ekoï;Cébé;Débutant;Die Wayfarer werden manchmal als eines der meistverkauften Sonnenbrillen-Designs der Geschichte bezeichnet.;
4;de;Welchen Namen konnte Herr Takada in der Modewelt ausstrahlen ?;Kenzo;Karl;Kalvin;Kyrio;Débutant;1993 verkaufte Kenzo Takada die Marke Kenzo an die LVMH-Gruppe mit dem vollen Namen.;https://de.wikipedia.org/wiki/Kenzo_Takada
5;de;Für welche Luxusmarke saß Catherine Deneuve auf einem Koffer ?;Louis Vuitton;Boucheron;Cerruti;Ralph Lauren;Débutant;In sechs aufeinander folgenden Jahren (von 2006 bis 2012) wurde Louis Vuitton zur wertvollsten Luxusmarke der Welt gekürt.;https://de.wikipedia.org/wiki/Louis_Vuitton
6;de;Welcher Star von « Loft Story » hat einen Erdbeerduft nach Holz und Pastell ins Leben gerufen ?;Loana;Afida Turner;Laure de Lattre;Kenza Braiga;Débutant;Loanas Berühmtheit hat ihr die Chance gegeben, als Stylistin, Sängerin und französische Fernsehmoderatorin zu arbeiten.;
7;de;Welcher alte Modedesigner von Dior hat den Damen Smoking erfunden ?;Yves Saint Laurent;André Courrèges;Christian Dior;Pierre Balmain;Débutant;Saint Laurent erfand den Trenchcoat aus dem Jahr 1962, führte 1966 den Damen-Smoking und 1967 den Hosenanzug ein.;https://de.wikipedia.org/wiki/Yves_Saint_Laurent
8;de;Mit welcher französischen Modemarke ist der Salamander verbunden ?;Agnès b.;Naf Naf;Lacoste;Dim;Débutant;Tarantino wandte sich an Agnès b. alle Outfits zu erstellen, die Uma Thurman in « Pulp Fiction » auf den Bildschirm gebracht hat.;
9;de;Welche Farbe haben die Sohlen von Louboutin-Schuhen ?;Rot;Grün;Blau;Malvenfarben;Débutant;Christian Louboutin, inspiriert von der Pop Art, hat seine Besonderheit auf die rote Ledersohle gesetzt, um ihr Markenzeichen zu werden.;https://de.wikipedia.org/wiki/Christian_Louboutin
10;de;Welche Blume ist zum Symbol des Modehauses Coco Chanel geworden ?;Die Kamera;Die Rose;Die Mohnblume;Das Gänseblümchen;Débutant;Coco Chanel hat die Kamera zu seinem Emblem gemacht und am Knopfloch die Mode der weißen Camelia ins Leben gerufen, die zu einer Verrücktheit geworden ist.;https://de.wikipedia.org/wiki/Kamelien
11;de;Welche Luxusmarke hat den Prix de Diane von 1983 bis 2007 gesponsert ?;Hermès;Dior;Courrèges;Cardin;Confirmé;Das Rennen krönte Chantilly das beste Stutfohlen von drei Jahren in einer Atmosphäre von sportlichem Eifer und schickem Picknick.;
12;de;Welcher Italiener übernahm John Galliano an der Spitze von Dior ?;Gianfranco Ferré;Ottavio Missoni;Riccardo Tisci;Enrico Coveri;Confirmé;Ursprünglich für den architektonischen Beruf bestimmt, begann Gianfranco Ferré 1970 mit dem Design von Accessoires.;https://de.wikipedia.org/wiki/Gianfranco_Ferré
13;de;Welcher britische Stylist feierte 2007 ihren 35-jährigen Untergrund ?;Vivienne Westwood;Stella McCartney;Zandra Rhodes;Sarah Burton;Confirmé;In den 70er Jahren gründete Vivienne Westwood einen Modegeschäft, der zur Einführung von Punkmode beitrug.;https://de.wikipedia.org/wiki/Vivienne_Westwood
14;de;Welche Marke Laetitia Casta, Lindsay Lohan und Kirsten Dunst waren die erfolgreichsten ?;Miu Miu;Berluti;Rodeo Drive;Moncler;Confirmé;Miu Miu, eine Marke, die 1993 gegründet wurde und oft als kleine Schwester von Prada bezeichnet wird, ist jünger und günstiger.;https://de.wikipedia.org/wiki/Prada
15;de;Welcher Designer hat « Red » und « Black » Parfums für Avon entwickelt ?;Christian Lacroix;Franck Sorbier;Raf Simons;Thierry Mugler;Confirmé;Christian Lacroix hat sich verschiedenen Welten zugewandt, etwa der Dekoration von Hotels oder Transportmitteln.;https://de.wikipedia.org/wiki/Christian_Lacroix
16;de;Welcher italienische Stylist war an « Zwei Polizisten in Miami » als Modeberater tätig ?;Gianni Versace;Valentino;Paco Rabanne;John Galliano;Confirmé;Auf dem Höhepunkt des Ruhms und des künstlerischen Erfolgs wurde Gianni Versace im Alter von 50 Jahren in Miami von zwei Kugeln im Kopf ermordet.;https://de.wikipedia.org/wiki/Gianni_Versace
17;de;Welcher spanische Couturier wurde von Chanel den Metallurgen genannt ?;Paco Rabanne;Antonio del Castillo;Mariano Madrazo;Cristobal Balenciaga;Confirmé;Paco Rabanne hat sich auch in den Medien durch Vorhersagen (meistens als falsch offenbart) dargestellt.;https://de.wikipedia.org/wiki/Paco_Rabanne
18;de;Für welche Taschenmarke befand sich Laure Manaudou in einem Brunnen ?;Lancel;Gucci;Pliage;Fendi;Confirmé;Zu Beginn vermarktete Lancel Tabakpfeifen und Zubehör und meldete das automatische Feuerzeug an.;
19;de;Welcher Designer hat die Kostüme für die Elton John World Tour 1992 entworfen ?;Gianni Versace;Rocco Barocco;Romeo Gigli;Giuseppe Zanotti;Confirmé;Am 3. Dezember 1995 überreichte Elton John Gianni Versacele den « VHI Fashion and Music Award » in New York.;https://de.wikipedia.org/wiki/Gianni_Versace
20;de;Die Mahina ist ein Modell von Big Bag, von welcher Marke signiert ?;Vuitton;Hermès;Gucci;Chanel;Confirmé;Sein üppiges und großzügiges Design und weiches Leder wie eine Babyhaut fallen sofort ins Auge und in die Hand.;https://de.wikipedia.org/wiki/Louis_Vuitton
21;de;Wer hat einen beinförmigen Anhänger geschaffen, um seine Schmucklinie auf den Markt zu bringen ?;Stella McCartney;Mary Quant;Zandra Rhodes;Sarah Burton;Expert;Stella McCartney, die wie ihre Mutter Linda Eastman verehrt wird, verwendet in ihren Kollektionen kein Fell oder Leder.;https://de.wikipedia.org/wiki/Stella_McCartney
22;de;Welches Duo hat eine Kollektion in einem Geschäft mit Stühlen an der Decke vorgestellt ?;Viktor und Rolf;H und M;Dolce und Gabbana;Paul und Shark;Expert;2015 kündigten Viktor und Rolf das Ende ihrer Konfektionslinie an und konzentrierten sich lieber auf Parfüm und Haute Couture.;https://de.wikipedia.org/wiki/Viktor_und_Rolf
23;de;Aus welchem Land stammt die Marke Uniqlo, die Basiskleidung anbietet ?;Aus Japan;Aus Schweden;Aus Indien;Aus Kanada;Expert;Disney hat mit Uniqlo einen Vertrag zur Vermarktung der chinesischen Produkte « Star Wars », « Avengers » und « The Frozen » unterzeichnet.;https://de.wikipedia.org/wiki/Uniqlo
24;de;Welches dänische Leben in Paris hat eine Mode für das wirkliche Leben geschaffen ?;Vanessa Bruno;Louise Chéruit;Nina Ricci;Madeleine Vionnet;Expert;Vanessa Brunos Mode besteht aus dicken Lagen aus Strick und Leggings, in nüchternen oder pastellfarbenen Farben.;
25;de;Wo war es 2008 schick, die Chanel Mini-Tasche zu tragen ?;Am Knöchel;In der Taille;Handgelenk;Um den Hals;Expert;Gabrielle Chasnel, bekannt als Coco Chanel, geboren 1883, ist der Ursprung des Maison Chanel, ein Symbol für französische Eleganz.;https://de.wikipedia.org/wiki/Coco_Chanel
26;de;Was ist das Ursprungsland der Hennes und Mauritz ?;Schweden;Frankreich;Spanien;Vereinigtes Königreich;Expert;Hennes und Mauritz ist in 61 Ländern vertreten, beschäftigt rund 148.000 Mitarbeiter und hat mehr als 4.000 Geschäfte.;
27;de;Welcher Franco-Tunesier hat die Silhouetten von Grace Jones und Tina Turner geschnitzt ?;Azzedine Alaïa;Bouchra Jarrar;Emanuel Ungaro;Izet Curi;Expert;Viele Künstler und Persönlichkeiten haben Azzedine Alaïa gedient, aber Grace Jones wird ihre Muse werden.;https://de.wikipedia.org/wiki/Azzedine_Alaïa
