94;es;¿Cuántos miles de pasajeros podría sostener el Titanic a bordo ?;3,000;2,000;1,000;4,000;Novato;El casco del Titanic estaba equipado con dieciséis compartimentos estancos para proteger la nave de los cursos de agua.;https://es.wikipedia.org/wiki/RMS Titanic
95;es;¿En qué año fue coronado emperador Carlomagno en Roma ?;800;900;700;600;Novato;Soberano reformador, con conciencia cultural, protege las artes y las letras y está en el origen del renacimiento carolingio.;https://es.wikipedia.org/wiki/Carlomagno
96;es;En medida, ¿cuál es el valor en milímetros de pulgada ?;25 mm;32 mm;16 mm;45 mm;Novato;El pulgar es una unidad que se remonta a la Edad Media, que ahora se usa para tamaños de neumáticos o pantallas de computadora.;https://es.wikipedia.org/wiki/Pulgada
97;es;¿Qué edad tenía Mozart cuando se realizó su primera ópera en público ?;13 años;15 años;11 años;17 años;Novato;Murió a la edad de 35 años, Mozart deja atrás 626 obras de arte que abarcan todos los géneros musicales de su época.;https://es.wikipedia.org/wiki/Wolfgang_Amadeus_Mozart
98;es;En la mitología griega, ¿cuántos argonautas acompañaron a Jason ?;50;40;100;500;Novato;La plaga de los argonautas ha dado lugar a varios motivos que se inspiran con bastante libertad de diferentes fuentes del mito.;https://es.wikipedia.org/wiki/Argonautas
99;es;¿En qué año tuvo lugar el primer Festival de Cine de Cannes ?;1946;1956;1966;1976;Novato;El Festival se fundó en 1946 en un proyecto de Jean Zay, Ministro de Educación Nacional y Bellas Artes del Frente Popular.;https://es.wikipedia.org/wiki/Festival_de_Cannes
100;es;¿Cuántos años ha pasado Robinson Crusoe en su isla ?;28;24;20;16;Novato;Robinson Crusoe es una novela inglesa escrita por Daniel Defoe cuya historia está inspirada en la vida de Alexander Selkirk.;https://es.wikipedia.org/wiki/Robinson_Crusoe
101;es;En computación, ¿cuántos bytes hay en un kilobyte ?;1 024;256;512;32;Confirmado;El término se usa como una unidad de medida de computadora para indicar la capacidad de memorización de la memoria.;
102;es;¿En qué año ganó Michel Preud'homme el Premio Lev Yachine ?;1994;1992;1990;1988;Confirmado;Michel Preud'homme ocupó el puesto de entrenador en el Standard de Liège, después de ser el director deportivo del mismo club.;https://es.wikipedia.org/wiki/Michel_Preud'homme
103;es;¿Cuánto tiene el sitio de Carnac menhires en sus alineaciones ?;2 934;2 394;1 934;1 394;Confirmado;El sitio de Carnac está ubicado en el límite norte de Mor Braz, entre el Golfo de Morbihan al este y la península de Quiberon al oeste.;https://es.wikipedia.org/wiki/Carnac
104;es;¿Cuántos son los satélites naturales conocidos alrededor de Júpiter ?;69;59;49;39;Confirmado;Júpiter es el segundo planeta del Sistema Solar, después de Saturno, con el mayor número de satélites naturales observados.;https://es.wikipedia.org/wiki/Satélites_de_Júpiter
105;es;¿A qué distancia está la línea de salida desde el primer obstáculo hasta los 400 m ?;45 m;37 m;29 m;18 m;Confirmado;Los mejores atletas masculinos terminan la carrera en unos 47 segundos y las atletas femeninas en unos 53 segundos.;https://es.wikipedia.org/wiki/400_metros_vallas
106;es;¿Cuántos partidos ha jugado la selección belga de fútbol con Guy Thys ?;100;80;120;140;Confirmado;Nacido en Amberes e hijo de Ivan Thys, Guy Thys fue el entrenador del equipo de fútbol nacional belga más exitoso.;https://es.wikipedia.org/wiki/Guy_Thys
107;es;¿Cuál es el porcentaje de silicio utilizado en la composición de la corteza terrestre ?;25%;19%;8%;32%;Confirmado;El silicio está comparativamente solo presente en cantidades relativamente pequeñas en la materia que constituye el ser vivo.;https://es.wikipedia.org/wiki/Silicio
108;es;¿Cuántos años ha sido Ferdinand Marcos presidente de Filipinas ?;21;17;25;19;Confirmado;Marcos puede ser considerado como un experto en el desembolso de fondos: habría rechazado miles de millones de dólares del Tesoro de Filipinas.;https://es.wikipedia.org/wiki/Ferdinand_Marcos
109;es;¿Cuántos espectadores pueden hoy dar la bienvenida a las arenas de Verona ?;22,000;19,000;16,000;13 000;Confirmado;Casi todas las noches de marzo a septiembre, los espectáculos tienen lugar y tienen el tema de antiguas luchas de gladiadores.;https://es.wikipedia.org/wiki/Arena_de_Verona
110;es;¿Cuántas piezas contenía el palacio imperial en la Ciudad Prohibida ?;9,999;8,888;7,777;6,666;Confirmado;La cifra de 9.999 se explica por el hecho de que solo a sus divinidades se les permitió construir un palacio con 10.000 piezas.;https://es.wikipedia.org/wiki/Ciudad_Prohibida
111;es;¿Cuál es la longitud total del puente Golden Gate en San Francisco ?;1 280 m;1 146 m;1 073 m;996 m;Experto;El puente Golden Gate fue, hasta 1964, el puente colgante más largo del mundo y sigue siendo un famoso monumento de San Francisco.;https://es.wikipedia.org/wiki/Puente_Golden_Gate
112;es;¿Cuántas canciones de Elvis Presley fueron las número uno en el desfile de éxitos de Estados Unidos ?;18;16;14;12;Experto;Elvis ha ayudado a popularizar el incipiente género rockabilly, una combinación enérgica de música country, rhythm and blues.;https://es.wikipedia.org/wiki/Elvis_Presley
113;es;En la mitología griega, ¿cuánto tenía el gigante Argos ojos ?;100;80;60;40;Experto;Siempre hay cincuenta que duermen y cincuenta que miran, por lo que es imposible engañar a su vigilancia.;https://es.wikipedia.org/wiki/Argos_Panoptes
114;es;¿Con qué frecuencia es el área de China más grande que la de Japón ?;39;29;19;9;Experto;Desde 1945, Japón ha formado un archipiélago de 6.852 islas, las cuatro más grandes de las cuales son Hokkaido, Honshu, Shikoku y Kyushu.;https://es.wikipedia.org/wiki/Japón
115;es;¿Cuál es la longitud de la cordillera de los Andes a 6,962 metros ?;7,100 km;6,700 km;8,300 km;9,700 km;Experto;La cordillera de los Andes comienza en Venezuela y luego cruza Colombia, Ecuador, Perú, Bolivia, Chile y Argentina.;https://es.wikipedia.org/wiki/Cordillera_de_los_Andes
116;es;¿Cuánto dura el túnel ferroviario japonés Seikan ?;53 km;42 km;37 km;29 km;Experto;El túnel Seikan es un poco más largo que el Túnel del Canal y tiene una sección de 23,3 km bajo el lecho marino.;https://es.wikipedia.org/wiki/Túnel_Seikan
117;es;¿Cuántos confeti fueron arrojados a John Glenn después de su famoso viaje espacial ?;3,474 toneladas;2,828 toneladas;1,732 toneladas;4,437 toneladas;Experto;Después de dejar la NASA en 1963, comenzó una exitosa carrera política que lo obligó a dedicarse al mundo de los negocios.;https://es.wikipedia.org/wiki/John_Glenn
118;es;¿Cuántos soldados tiene el ejército enterrado del emperador Qin ?;8,000;6,000;4,000;10,000;Experto;Los colores minerales se aplicaron después de cocinar en las estatuas, lo que permitió distinguir las diferentes unidades.;https://es.wikipedia.org/wiki/Mausoleo_de_Qin_Shi_Huang
119;es;¿En qué año descubrió la lata Nicolas Appert ?;1795;1829;1847;1902;Experto;El enlatado se puede definir como un proceso de conservación que consiste en esterilizar por calor los productos perecederos.;https://es.wikipedia.org/wiki/Nicolás_Appert
120;es;¿Cuál es el número de islas presentes en toda Finlandia ?;180,000;160,000;140,000;120,000;Experto;La mayoría de las islas se encuentran en el suroeste, en el archipiélago de Aland, y en la costa sur del golfo de Finlandia.;https://es.wikipedia.org/wiki/Finlandia
121;it;Quanti lavori ha eseguito Hercules per Eurystheus, King of Tiryns ?;12;10;100;40;Newbie;L'ebraico corrisponde a Ercole Romano, Fenice Melqart, Cerchio Artificiale e Kakasbo in Asia Minore.;https://it.wikipedia.org/wiki/Eracle
122;it;A che età Nadia Comaneci ha ottenuto il punteggio perfetto di 10 alle Olimpiadi ?;14 anni;15 anni;13 anni;16 anni;Newbie;Nadia Comaneci è stata naturalizzata americana dopo la sua carriera sportiva, non avendo mai rappresentato questo paese in competizione.;https://it.wikipedia.org/wiki/Nadia_Com?neci
123;it;Qual è la differenza tra la 87 e la 86 piazza ?;173;87;86;1;Newbie;Ogni numero reale strettamente positivo è il quadrato di esattamente due numeri, uno strettamente positivo, l'altro strettamente negativo.;https://it.wikipedia.org/wiki/Quadrato_(algebra)
124;it;Quante migliaia di passeggeri potrebbero tenere il Titanic a bordo ?;3.000;2.000;1.000;4.000;Newbie;Lo scafo del Titanic era dotato di sedici compartimenti stagni per proteggere la nave dai corsi d'acqua.;https://it.wikipedia.org/wiki/RMS Titanic
125;it;In quale anno Carlo Magno fu incoronato imperatore a Roma ?;800;900;700;600;Newbie;Sovrano riformatore, culturalmente cosciente, protegge le arti e le lettere ed è all'origine del rinascimento carolingio.;https://it.wikipedia.org/wiki/Carlo Magno
126;it;In misura, qual è il valore in millimetri di un pollice ?;25 mm;32 mm;16 mm;45 mm;Newbie;Il pollice è un'unità risalente al Medioevo, ora utilizzata per taglie di pneumatici o schermi di computer.;https://it.wikipedia.org/wiki/Pollice_(unità_di_misura)
127;it;Che età aveva Mozart quando la sua prima opera fu rappresentata in pubblico ?;13 anni;15 anni;11 anni;17 anni;Newbie;Morto all'età di 35 anni, Mozart lascia alle sue spalle 626 opere provate che abbracciano tutti i generi musicali della sua epoca.;https://it.wikipedia.org/wiki/Wolfgang_Amadeus_Mozart
128;it;Nella mitologia greca, quanti Argonauti hanno accompagnato Jason ?;50;40;100;500;Newbie;La piaga degli Argonauti ha dato origine a numerosi motivi ispirati abbastanza liberamente da diverse fonti di mito.;https://it.wikipedia.org/wiki/Argonauti
129;it;In quale anno si è svolto il primo Festival di Cannes ?;1946;1956;1966;1976;Newbie;Il Festival è stato fondato nel 1946 su progetto di Jean Zay, Ministro dell'Istruzione Nazionale e delle Belle Arti del Fronte Popolare.;https://it.wikipedia.org/wiki/Festival_di_Cannes
130;it;Quanti anni ha trascorso Robinson Crusoe nella sua isola ?;28;24;20;16;Newbie;Robinson Crusoe è un romanzo inglese scritto da Daniel Defoe la cui storia è ispirata molto liberamente alla vita di Alexander Selkirk.;https://it.wikipedia.org/wiki/Robinson_Crusoe
131;it;Nel calcolo, quanti byte sono in un kilobyte ?;1 024;256;512;32;Confermato;Il termine è usato come unità di misura del computer per indicare la capacità di memorizzazione della memoria.;
132;it;In quale anno Michel Preud'homme ha vinto il Premio Lev Yachine ?;1994;1992;1990;1988;Confermato;Michel Preud'homme ha ricoperto la carica di allenatore dello Standard de Liège, dopo essere stato il direttore sportivo dello stesso club.;https://it.wikipedia.org/wiki/Michel_Preud'homme
133;it;Quanto il sito di Carnac ha i menhir nei suoi allineamenti ?;2 934;2 394;1 934;1 394;Confermato;Il sito Carnac si trova al limite settentrionale di Mor Braz, tra il Golfo di Morbihan a est e la penisola di Quiberon a ovest.;https://it.wikipedia.org/wiki/Carnac
134;it;Quanti sono finora noti i satelliti naturali attorno a Giove ?;69;59;49;39;Confermato;Giove è il secondo pianeta del Sistema Solare, dopo Saturno, con il maggior numero di satelliti naturali osservati.;https://it.wikipedia.org/wiki/Satelliti_naturali_di_Giove
135;it;Quanto dista la linea di partenza dal primo ostacolo alla barriera dei 400 metri ?;45 m;37 m;29 m;18 m;Confermato;I migliori atleti di sesso maschile terminano la gara in circa 47 secondi e le atlete in circa 53 secondi.;https://it.wikipedia.org/wiki/400_metri_ostacoli
136;it;Quante partite ha giocato la squadra nazionale belga con Guy Thys ?;100;80;120;140;Confermato;Nato ad Anversa e figlio di Ivan Thys, Guy Thys è stato l'allenatore della squadra nazionale di calcio belga di maggior successo.;https://it.wikipedia.org/wiki/Guy_Thys
137;it;Qual è la percentuale di silicio utilizzato nella composizione della corteccia terrestre ?;25%;19%;8%;32%;Confermato;Il silicio è comparativamente presente solo in quantità relativamente piccole nella materia che costituisce il vivente.;https://it.wikipedia.org/wiki/Silicio
138;it;Da quanti anni Ferdinand Marcos è stato presidente delle Filippine ?;21;17;25;19;Confermato;Marcos potrebbe essere considerato un esperto per l'erogazione di fondi: avrebbe allontanato miliardi di dollari dal Tesoro delle Filippine.;https://it.wikipedia.org/wiki/Ferdinand_Marcos
139;it;Quanti spettatori possono oggi accogliere le arene di Verona ?;22.000;19.000;16.000;13 000;Confermato;Quasi tutte le sere da marzo a settembre, gli spettacoli hanno luogo e hanno il tema delle antiche lotte dei gladiatori.;https://it.wikipedia.org/wiki/Arena_di_Verona
140;it;Quanti pezzi contenevano il palazzo imperiale nella Città Proibita ?;9.999;8.888;7.777;6.666;Confermato;La cifra di 9.999 è spiegata dal fatto che solo le loro divinità potevano costruire un palazzo con 10.000 pezzi.;https://it.wikipedia.org/wiki/Città_Proibita
141;it;Qual è la lunghezza totale del Golden Gate Bridge a San Francisco ?;1 280 m;1 146 m;1 073 m;996 m;Expert;Il Golden Gate Bridge fu, fino al 1964, il ponte sospeso più lungo del mondo e rimane un famoso monumento di San Francisco.;https://it.wikipedia.org/wiki/Golden_Gate_Bridge
142;it;Quante canzoni di Elvis Presley erano al primo posto nella hit parade americana ?;18;16;14;12;Expert;Elvis ha contribuito a diffondere il nascente genere rockabilly, un energico mix di musica country e rhythm and blues.;https://it.wikipedia.org/wiki/Elvis_Presley
143;it;Nella mitologia greca, quanto ha visto il gigante Argos ?;100;80;60;40;Expert;Ci sono sempre cinquanta che dormono e cinquanta che guardano, così che è impossibile ingannare la sua vigilanza.;https://it.wikipedia.org/wiki/Argo_Panoptes
144;it;Quante volte l'area della Cina è più grande di quella del Giappone ?;39;29;19;9;Expert;Dal 1945, il Giappone ha formato un arcipelago di 6.852 isole, le quattro più grandi delle quali sono Hokkaido, Honshu, Shikoku e Kyushu.;https://it.wikipedia.org/wiki/Giappone
145;it;Qual è la lunghezza della catena montuosa delle Ande a 6.962 metri ?;7.100 km;6.700 km;8.300 km;9.700 km;Expert;La Cordigliera delle Ande inizia in Venezuela e attraversa poi Colombia, Ecuador, Perù, Bolivia, Cile e Argentina.;https://it.wikipedia.org/wiki/Ande
146;it;Quanto dura il tunnel ferroviario giapponese di Seikan ?;53 km;42 km;37 km;29 km;Expert;Il tunnel di Seikan è leggermente più lungo del tunnel sotto la Manica e ha una sezione di 23,3 km sotto il fondo del mare.;https://it.wikipedia.org/wiki/Galleria_Seikan
147;it;Quanti coriandoli sono stati lanciati a John Glenn dopo il suo famoso viaggio nello spazio ?;3,474 tonnellate;2,828 tonnellate;1,732 tonnellate;4,437 tonnellate;Expert;Dopo aver lasciato la NASA nel 1963, iniziò una carriera politica senza successo che lo costrinse a rivolgersi al mondo degli affari.;https://it.wikipedia.org/wiki/John_Glenn
148;it;Quanti soldati ha l'esercito sepolto dell'Imperatore Qin ?;8.000;6.000;4.000;10.000;Expert;I colori minerali sono stati applicati dopo la cottura sulle statue, rendendo così possibile distinguere le diverse unità.;https://it.wikipedia.org/wiki/Mausoleo_di_Qin_Shi_Huang
149;it;In quale anno Nicolas Appert ha scoperto il barattolo di latta ?;1795;1829;1847;1902;Expert;L'inscatolamento può essere definito come un processo di conservazione che consiste nella sterilizzazione a caldo delle merci deperibili.;https://it.wikipedia.org/wiki/Nicolas_Appert
150;it;Qual è il numero di isole presenti in tutta la Finlandia ?;180.000;160.000;140.000;120.000;Expert;La maggior parte delle isole si trova nel sud-ovest, nell'arcipelago di Aland e lungo la costa meridionale del Golfo di Finlandia.;https://it.wikipedia.org/wiki/Finlandia
151;nl;Hoeveel werken heeft Hercules uitgevoerd voor Eurystheus, koning van Tiryns ?;12;10;100;40;Newbie;Hebreeuws komt overeen met Roman Hercules, Phenician Melqart, Artifical Circle en Kakasbos in Klein-Azië.;https://nl.wikipedia.org/wiki/Herakles_(mythologie)
152;nl;Op welke leeftijd kreeg Nadia Comaneci de perfecte score van 10 op de Olympische Spelen ?;14 jaar oud;15 jaar oud;13 jaar oud;16 jaar oud;Newbie;Nadia Comaneci werd Amerikaan genaturaliseerd na haar sportcarrière en had dit land nog nooit in competitie vertegenwoordigd.;https://nl.wikipedia.org/wiki/Nadia_Com?neci
153;nl;Wat is het verschil tussen het 87 en het 86 vierkant ?;173;87;86;1;Newbie;Elk strikt positief reëel getal is het kwadraat van precies twee getallen, één strikt positief, de andere strikt negatief.;https://nl.wikipedia.org/wiki/Kwadraat
154;nl;Hoeveel duizenden passagiers kon de Titanic aan boord houden ?;3000;2.000;1.000;4.000;Newbie;De romp van de Titanic was uitgerust met zestien waterdichte compartimenten om het schip tegen waterwegen te beschermen.;https://nl.wikipedia.org/wiki/Titanic (schip, 1912)
155;nl;In welk jaar werd Karel de Grote tot keizer gekroond in Rome ?;800;900;700;600;Newbie;Soeverein hervormer, cultureel bewust, hij beschermt de kunst en letters en is de oorsprong van de Karolingische renaissance.;https://nl.wikipedia.org/wiki/Karel_de_Grote
156;nl;Wat is de waarde in millimeters van een inch in maat ?;25 mm;32 mm;16 mm;45 mm;Newbie;De duim is een eenheid die dateert uit de Middeleeuwen en wordt nu gebruikt voor bandenmaten of computerschermen.;https://nl.wikipedia.org/wiki/Inch
157;nl;Hoe oud was Mozart toen zijn eerste opera in het openbaar werd uitgevoerd ?;13 jaar oud;15 jaar;11 jaar;17 jaar;Newbie;Op zijn 35e stierf Mozart met achterlating van 626 kunstwerken die alle muzikale genres van zijn tijd omvatten.;https://nl.wikipedia.org/wiki/Wolfgang_Amadeus_Mozart
158;nl;Hoeveel Argonauten vergezelden Jason in de Griekse mythologie ?;50;40;100;500;Newbie;De Argonauts-pest heeft aanleiding gegeven tot verschillende smeekbeden die vrijelijk geïnspireerd zijn door verschillende bronnen van mythen.;https://nl.wikipedia.org/wiki/Argonauten
159;nl;In welk jaar vond het eerste Filmfestival van Cannes plaats ?;1946;1956;1966;1976;Newbie;Het festival werd in 1946 opgericht op initiatief van Jean Zay, minister van Nationale Educatie en Schone Kunsten van het Volksfront.;https://nl.wikipedia.org/wiki/Filmfestival_van_Cannes
160;nl;Hoeveel jaar heeft Robinson Crusoë op zijn eiland doorgebracht ?;28;24;20;16;Newbie;Robinson Crusoe is een Engelse roman geschreven door Daniel Defoe, wiens verhaal is geïnspireerd op het leven van Alexander Selkirk.;https://nl.wikipedia.org/wiki/Robinson_Crusoe
161;nl;Hoeveel computers zijn in een kilobyte berekend ?;1 024;256;512;32;Bevestigd;De term wordt gebruikt als een computer-meeteenheid om geheugenopslagcapaciteit aan te geven.;
162;nl;In welk jaar won Michel Preud'homme de Lev Yachine-prijs ?;1994;1992;1990;1988;Bevestigd;Michel Preud'homme bekleedde de coachingspost bij Standard de Liege, nadat hij de sportdirecteur van dezelfde club was.;https://nl.wikipedia.org/wiki/Michel_Preud'homme
163;nl;Hoeveel heeft de site van Carnac menhirs in zijn afstemming ?;2 934;2 394;1 934;1 394;Bevestigd;De site van Carnac ligt aan de noordelijke grens van Mor Braz, tussen de Golf van Morbihan in het oosten en het schiereiland Quiberon in het westen.;https://nl.wikipedia.org/wiki/Carnac
164;nl;Hoeveel tot nu toe zijn bekende natuurlijke satellieten rond Jupiter ?;69;59;49;39;Bevestigd;Jupiter is de tweede planeet van het zonnestelsel, na Saturnus, met het grootste aantal waargenomen natuurlijke satellieten.;https://nl.wikipedia.org/wiki/Lijst_van_manen_van_Jupiter
165;nl;Hoe ver is de vertreklijn van de eerste horde naar de 400 m hindernis ?;45 m;37 m;29 m;18 m;Bevestigd;De beste mannelijke atleten eindigen de race in ongeveer 47 seconden en de vrouwelijke atleten in ongeveer 53 seconden.;https://nl.wikipedia.org/wiki/400_meter_horden
166;nl;Hoeveel wedstrijden heeft het Belgische nationale voetbalteam gespeeld met Guy Thys ?;100;80;120;140;Bevestigd;Guy Thys werd geboren in Antwerpen en zoon van Ivan Thys en was de coach van het meest succesvolle Belgische nationale voetbalteam.;https://nl.wikipedia.org/wiki/Guy_Thys
167;nl;Wat is het percentage silicium dat wordt gebruikt in de samenstelling van de terrestrische schors ?;25%;19%;8%;32%;Bevestigd;Silicium is relatief slechts in relatief kleine hoeveelheden aanwezig in de materie die de levenden vormt.;https://nl.wikipedia.org/wiki/Silicium
168;nl;Hoeveel jaar is Ferdinand Marcos president van de Filipijnen geweest ?;21;17;25;19;Bevestigd;Marcos kan worden beschouwd als een expert in het uitbetalen van fondsen: hij zou miljarden dollars van de Filippijnse schatkist hebben afgewend.;https://nl.wikipedia.org/wiki/Ferdinand_Marcos
169;nl;Hoeveel toeschouwers kunnen vandaag de arena's van Verona verwelkomen ?;22.000;19.000;16.000;13 000;Bevestigd;Bijna elke avond van maart tot september vinden er shows plaats met het thema van oude gladiatorengevechten.;https://nl.wikipedia.org/wiki/Arena_van_Verona
170;nl;Hoeveel stukken bevatten het keizerlijk paleis in de Verboden Stad ?;9.999;8.888;7.777;6.666;Bevestigd;Het cijfer van 9.999 wordt verklaard door het feit dat alleen hun godheden een paleis mochten bouwen met 10.000 stuks.;https://nl.wikipedia.org/wiki/Verboden_Stad
171;nl;Wat is de totale lengte van de Golden Gate Bridge in San Francisco ?;1 280 m;1 146 m;1 073 m;996 m;Expert;De Golden Gate Bridge was tot 1964 de langste hangbrug ter wereld en blijft een beroemd monument van San Francisco.;https://nl.wikipedia.org/wiki/Golden_Gate_Bridge
172;nl;Hoeveel nummers van Elvis Presley waren nummer één in de Amerikaanse hitlijsten ?;18;16;14;12;Expert;Elvis heeft het ontluikende rockabilly-genre gepopulariseerd, een energieke mix van countrymuziek en ritme en blues.;https://nl.wikipedia.org/wiki/Elvis_Presley
173;nl;In de Griekse mythologie, hoeveel had de reus Argos ogen ?;100;80;60;40;Expert;Er zijn altijd vijftig die slapen en vijftig die waken, zodat het onmogelijk is om zijn waakzaamheid te misleiden.;https://nl.wikipedia.org/wiki/Argus_Panoptes
174;nl;Hoe vaak is China's gebied groter dan dat van Japan ?;39;29;19;9;Expert;Sinds 1945 heeft Japan een archipel gevormd van 6.852 eilanden, waarvan de vier grootste zijn Hokkaido, Honshu, Shikoku en Kyushu.;https://nl.wikipedia.org/wiki/Japan
175;nl;Hoe lang is het Andesgebergte op 6.962 meter ?;7.100 km;6.700 km;8.300 km;9.700 km;Expert;De Andes-cordillera begint in Venezuela en passeert vervolgens Colombia, Ecuador, Peru, Bolivia, Chili en Argentinië.;https://nl.wikipedia.org/wiki/Andes
176;nl;Hoe lang is de Seikan Japanese Railway Tunnel ?;53 km;42 km;37 km;29 km;Expert;De Seikan-tunnel is iets langer dan de Kanaaltunnel en heeft een deel van 23,3 km onder de zeebodem.;https://nl.wikipedia.org/wiki/Seikantunnel
177;nl;Hoeveel confetti werden er naar John Glenn gegooid na zijn beroemde ruimtereis ?;3,474 ton;2.828 ton;1.732 ton;4.437 ton;Expert;Nadat hij in 1963 de NASA had verlaten, begon hij aan een niet-succesvolle politieke carrière die hem dwong zich tot het bedrijfsleven te wenden.;https://nl.wikipedia.org/wiki/John_Glenn
178;nl;Hoeveel soldaten heeft het leger van de keizer Qin ?;8,000;6.000;4.000;10.000;Expert;Minerale kleuren werden aangebracht na het koken op de standbeelden, waardoor het mogelijk was om de verschillende eenheden te onderscheiden.;
179;nl;In welk jaar heeft Nicolas Appert het blik ontdekt ?;1795;1829;1847;1902;Expert;Inblikken kan worden gedefinieerd als een proces van conservering dat bestaat uit het steriliseren door warmte van de bederfelijke goederen.;https://nl.wikipedia.org/wiki/Nicolas_Appert
180;nl;Hoe groot is het aantal eilanden in heel Finland ?;180.000;160.000;140.000;120.000;Expert;De meeste eilanden liggen in het zuidwesten, in de Aland-archipel en aan de zuidkust van de Finse Golf.;https://nl.wikipedia.org/wiki/Finland
