1;De qui est inspiré le film Le Grand Bleu de Luc Besson ?;Jacques Mayol;Eric Tabarly;Olivier de Kersauson;Alain Colas;Débutant;Jacques Mayol est le premier plongeur au monde à descendre à une profondeur de 100 mètres en apnée.;http://fr.wikipedia.org/wiki/Jacques_Mayol
2;Qui tient le rôle de Jacques Mayol dans le film Le Grand Bleu ?;Jean-Marc Barr;Jean Reno;Paul Shenar;Marc Duret;Débutant;Jean-Marc Barr marque ensuite un tournant dans sa carrière lors de sa rencontre avec Lars von Trier.;http://fr.wikipedia.org/wiki/Jean-Marc_Barr
3;À qui doit-on la musique du film Le Grand Bleu, écoutée dans le monde entier ?;Éric Serra;Ennio Morricone;John Williams;Hanz Zimmer;Débutant;Éric Serra est le compositeur attitré de la musique des films de Luc Besson depuis le début des années 1980.;http://fr.wikipedia.org/wiki/Éric_Serra
4;Qui incarne Enzo Molinari dans le film Le Grand Bleu de Luc Besson ?;Jean Reno;Sergio Castellitto;Jean-Marc Barr;Paul Shenar;Débutant;Jean Reno connaît également une grande popularité grâce à la comédie de Jean-Marie Poiré Les Visiteurs et ses suites.;http://fr.wikipedia.org/wiki/Jean_Reno
5;Quels animaux représentent la véritable famille de Jacques Mayol dans Le Grand Bleu ?;Les dauphins;Les baleines;Les orques;Les requins;Débutant;Certains cétacés sont parfois appelés incorrectement « dauphins » par exemple ceux avec un rostre court ou à peine existant.;http://fr.wikipedia.org/wiki/Dauphin
6;Qui est la partenaire féminine du film Le Grand Bleu aux côtés de Jean-Marc Barr ?;Rosanna Arquette;Monica Belluci;Patricia Arquette;Juliette Binoche;Débutant;Rosanna est la fille de l'acteur comique Lewis Arquette et de la poétesse Mardi Arquette, et la petite-fille de Cliff Arquette.;http://fr.wikipedia.org/wiki/Rosanna_Arquette
7;Qui a réalisé le film Le Grand Bleu Avec Jean-Marc Barr et jean Reno ?;Luc Besson;Brian de Palma;Jean-Pierre Jeunet;Jean Becker;Débutant;Pour le rôle de Jacques Mayol, le premier choix pour Luc Besson était Christophe Lambert, qu'il avait dirigé dans Subway.;http://fr.wikipedia.org/wiki/Le_Grand_Bleu
8;Qui est le champion du monde de plongée sous marine en apnée dans Le Grand Bleu ?;Enzo;Roberto;Jacques;Paolito;Débutant;Le scénario du film Le Grand Bleu s'inspire de la vie des célèbres apnéistes Jacques Mayol et Enzo Maiorca.;http://fr.wikipedia.org/wiki/Le_Grand_Bleu
9;Comment se prénomme le frère du grand Enzo dans le film Le Grand Bleu ?;Roberto;Giovanni;Paolito;Giancardo;Débutant;C'est Marc Duret, acteur français né le 28 septembre 1957 à Nice, qui interprète le rôle de Roberto.;http://fr.wikipedia.org/wiki/Le_Grand_Bleu
10;Lequel de ces acteurs ne joue pas dans le film Le Grand Bleu de Luc Besson ?;Christophe Lambert;Jean-Marc Barr;Jean Reno;Marc Duret;Débutant;Pour le rôle de Jacques Mayol, le premier choix pour Luc Besson était Christophe Lambert, qu'il avait dirigé dans Subway.;http://fr.wikipedia.org/wiki/Le_Grand_Bleu
11;Combien de temps de plus que la version classique dure la version longue du film Grand Bleu ?;36 minutes;16 minutes;56 minutes;76 minutes;Confirmé;La version courte du Grand Bleu dure 132 minutes alors que la version longue compte 168 minutes dans son intégralité.;http://fr.wikipedia.org/wiki/Le_Grand_Bleu
12;En quelle année est sorti pour la première fois le film Le Grand Bleu de Luc Besson ?;1988;1990;1992;1994;Confirmé;Le film est sorti en France le 11 mai 1988 et aux États-Unis le 22 août 1988, à New York.;http://fr.wikipedia.org/wiki/Le_Grand_Bleu
13;Dans quel pays se déroule la toute première scène au début du film Le Grand Bleu de Luc Besson ?;Grèce;Espagne;France;Sicile;Confirmé;Quelques scènes du film ont été tournées en 1987 à Chora et au pied du monastère de Chozoviotissa, sur l'île grecque d'Amorgos.;http://fr.wikipedia.org/wiki/Le_Grand_Bleu
14;Quel est le prénom de la compagne de Jacques Mayol dans le film Le Grand Bleu ?;Johanna;Samantha;Sabrina;Carolina;Confirmé;C'est Julie Dassin qui prête sa version à Rosanna Arquette, interprétant le rôle de Johanna Baker dans le film Le Grand Bleu.;http://fr.wikipedia.org/wiki/Le_Grand_Bleu
15;De quelle couleur est la combinaison que porte Enzo le jour où il meurt dans Le Grand Bleu ?;Rouge;Verte;Bleue;Blanche;Confirmé;L'apnéiste Enzo Maiorca, dont le rôle est interprété par Jean Reno, n'a que très peu apprécié pas le film de Luc Besson.;http://fr.wikipedia.org/wiki/Le_Grand_Bleu
16;Quel est le plat favori de Johanna Baker dans le film Le Grand Bleu ?;Les pâtes;Les pizzas;Le tiramisu;Les lasagnes;Confirmé;L'exploitation en France du film rencontra un des plus gros succès de l'histoire du cinéma français.;http://fr.wikipedia.org/wiki/Le_Grand_Bleu
17;Quel était le métier du père de Jacques Mayol dans le film Le Grand Bleu ?;Pêcheur;Artiste peintre;Boulanger;Musicien;Confirmé;En 2001, Jacques Mayol s'est suicide par pendaison à son domicile de Calone où il vivait depuis plus de trente ans.;http://fr.wikipedia.org/wiki/Jacques_Mayol
18;Quelle est le modèle de voiture conduit par Enzo dans le film Le Grand Bleu ?;Fiat 500;Lada 110;Citroën AX;Renault Super 5;Confirmé;La Fiat 500 (N à R) est un modèle d'automobile urbain fabriqué par le constructeur italien Fiat, en Italie entre 1957 et 1975.;http://fr.wikipedia.org/wiki/Fiat_500_(1957)
19;Qui a écrit les paroles de My Lady Blue, générique de fin du Grand Bleu ?;Luc Besson;Francis Cabrel;Carla Bruni;Véronique Sanson;Confirmé;Le distributeur américain du film ont remplacé la musique d'Eric Serra par une autre écrite par Bill Conti.;http://fr.wikipedia.org/wiki/Le_Grand_Bleu
20;Dans quelle langue le film Le Grand Bleu a-t-il été tourné ?;En anglais;En français;En grec;En espagnol;Confirmé;Le choix de l'anglais, justifié par l'importance du budget du film, a été adopté en cours de tournage.;http://fr.wikipedia.org/wiki/Le_Grand_Bleu
21;Dans quel pays se rencontrent pour la première fois Jacques et Johanna dans le film Le Grand Bleu ?;Au Pérou;En France;Aux Caraïbes;Aux États-Unis;Expert;Le tournage, déroulé en Grèce et au Pérou, a été physiquement très éprouvant pour les comédiens et l'équipe technique.;http://fr.wikipedia.org/wiki/Le_Grand_Bleu
22;Avec ses 9 millions d'entrées en France, quel prix le film Le Grand Bleu a-t-il remporté à Cannes ?;Aucun;Grand prix;Prix du scénario;Prix du jury;Expert;Le Grand Bleu, qui remporta un fort succès auprès des adolescents, est le meilleur film au box-office français en 1988.;http://fr.wikipedia.org/wiki/Le_Grand_Bleu
23;Qui a produit le film Le Grand Bleu pour la société Gaumont ?;Patrice Ledoux;Paul Laffargue;Vincent Malle;Serge Bromberg;Expert;Après Le Grand Bleu, Luc Besson, passionné par le monde aquatique, se lancera dans un autre projet intitulé Atlantis.;http://fr.wikipedia.org/wiki/Patrice_Ledoux
24;Quel acteur habitué des seconds rôles incarne l'Oncle Louis dans le film Le Grand Bleu ?;Jean Bouise;Jean Yanne;Jean Dujardin;Jean Reno;Expert;C'est également l'un des derniers films de Jean Bouise, décédé en 1989, juste après le tournage de Nikita, également de Luc Besson.;http://fr.wikipedia.org/wiki/Le_Grand_Bleu
25;À quelle personne proche de Luc Besson est dédié le film Le Grand Bleu ?;Juliette Besson;Jean Bouise;Jean Reno;Anne Parillaud;Expert;Née en 1987, fille de Luc Besson et d'Anne Parillaud, elle a de nombreux demi-frères et sœurs par son père.;http://fr.wikipedia.org/wiki/Juliette_Besson
26;Quel est le nom de famille de Johanna dans le film Le Grand Bleu ?;Baker;Grocer;Winfield;Miller;Expert;Rosanna est la sœur de Patricia Arquette mais également l'ex belle-sœur de Courteney Cox, qui a été mariée à son frère David.;http://fr.wikipedia.org/wiki/Rosanna_Arquette
27;Comment se prénomme la colocataire de Johanna dans le film Le Grand Bleu ?;Sally;Stacy;Jenny;Kerry;Expert;C'est l'actrice américaine Kimberly Beck , que 'on retrouve entre autre dans le film Vendredi 13 : Chapitre final, qui incarne Sally.;http://fr.wikipedia.org/wiki/Le_Grand_Bleu
28;Qui incarne le patron de Johanna dans le film Le Grand Bleu ?;Griffin Dunne;Stacy Keach;Bill Pullman;Liam Neeson;Expert;Griffin Dunne est un acteur, producteur, réalisateur et scénariste américain né le 8 juin 1955 à New York.;http://fr.wikipedia.org/wiki/Griffin_Dunne
29;Pour quel rôle Luc Besson fait-il une brève apparition dans Le Grand Bleu ?;Plongeur;Restaurateur;Assureur;Navigateur;Expert;Le film est librement inspiré des vies de Jacques Mayol et Enzo Maiorca, célèbres champions de plongée en apnée.;http://fr.wikipedia.org/wiki/Le_Grand_Bleu
30;Qui était le premier choix pour le rôle de Jacques Mayol dans Le Grand Bleu ?;Christophe Lambert;Gérard Lanvin;Mickey Rourke;Mel Gibson;Expert;Lors de son baptême de plongée, l'acteur Christophe Lambert attrapa une otite, ce qui l'obligea à décliner l'offre de Luc Besson.;http://fr.wikipedia.org/wiki/Le_Grand_Bleu