23;nl;Hoeveel uur heeft het Nadal gekost om Federer's Rome in 2006 te overwinnen ?;Vijf;Vier;Twee;Drie;Expert;Dankzij de goede resultaten van Nadal kan hij de plaats van Roger Federer innemen aan het hoofd van het ATP Race 2007-klassement op 30 april.;https://nl.wikipedia.org/wiki/Rafael_Nadal
24;nl;Wat is de officiële grootte van een tennisbaan ?;23,77 x 8,23 m;15 x 5 m;21,52 x 8,15 m;24,73 x 9,17 m;Expert;De bodemlijnen van een tennisbaan meten 8,23 meter. De zijlijnen, langs de lengte getekend, zijn 23,77 meter.;https://nl.wikipedia.org/wiki/Tennis
25;nl;Hoeveel decibels werden het geschreeuw van Maria Sharapova op de rechtbanken uitgesproken ?;105 dbs;83 dbs;126 dbs;50 dbs;Expert;Naast dit geluid dat equivalent is aan dat van een opstijgende kleine propeller, duwt het nieuwsgierige meditaties tussen elk punt.;https://nl.wikipedia.org/wiki/Maria_Sjarapova
26;nl;Welke tennisspeler veroorzaakte de dood van een scheidsrechter door een van zijn ballen die hem raakte ?;Stefan Edberg;Jimmy Connors;Mats Wilander;Björn Borg;Expert;Op 10 september 1983 raakte een van de kogels van Stefan Edberg een grensrechter, Dick Wertheim, toen 61 jaar oud, met volle kracht.;https://nl.wikipedia.org/wiki/Stefan_Edberg
27;nl;In het midden moet een tennisnet in het midden hoe hoog zijn ?;91 cm;75 cm;103 cm;88 cm;Expert;De hoogte van het net in het midden moet stevig worden vastgehouden door een riem en een hoogte van 0,914 meter of drie voet bieden.;https://nl.wikipedia.org/wiki/Tennis
28;nl;Wat is de nationaliteit van ex-tennisspeler Gabriela Sabatini ?;Argentinië;Italiaans;Spaans;Grieks;Expert;Olympisch vice-kampioen in 1988 tijdens de Olympische Spelen in Seoul, Gabriela Sabatini was ook een finalist van de US Open in hetzelfde jaar.;https://nl.wikipedia.org/wiki/Gabriela_Sabatini
29;nl;Wie heeft de winnaar in 2005 de Roland-Garros-trofee voor heren gegeven ?;Zinédine Zidane;Cedric Pioline;Tony Parker;Teddy Riner;Expert;Zidane presenteerde de eerste Musketiersbeker aan Nadal, winnaar van het toernooi na de finale tegen de Argentijnse Mariano Puerta.;https://nl.wikipedia.org/wiki/Roland_Garros_2005
30;nl;Welke beroemde Franse tennisser komt uit Kameroen ?;Yannick Noah;Gaël Monfils;Jo-Wilfried Tsonga;Gille Simons;Expert;Zoon van de Kameroenese voetballer Zacharie Noah, winnaar van de Coupe de France in 1961, hij is de vader van de Franse basketbalspeler Joakim Noah.;https://nl.wikipedia.org/wiki/Yannick_Noah
