18;nl;Wie heeft « You Make Me Feel » opgenomen, later overgenomen door Jimmy Somerville ?;Sylvester;Randy Jones;Dan Hartman;Bobby Farrell;Confirmé;Sylvetser is positief en houdt zich bezig met preventie en zal doorgaan met het opnemen van albums die bedoeld zijn voor de nachtclubnummers.;
19;nl;Welke Trammps-titel komt voor in de film « Saturday Night's Fever » ?;« Disco Inferno »;« Starvin' »;« Body Contact »;« Slipping Out »;Confirmé;Cyndi Lauper deed een cover van dit nummer in de soundtrack van de film « A night at the Roxbury » en Tina Turner in die van « Tina ».;
20;nl;Welke zanger is vooral bekend door de titel « I Love to Love » ?;Tina Charles;Sharon Redd;Roberta Kelly;Madleen Kane;Confirmé;De samenwerking met Biddu ging verder met het volgende album en een ander hitnummer, « Dance Little Lady Dance ».;https://nl.wikipedia.org/wiki/Tina_Charles
21;nl;Wie heeft dankzij « Don't Leave Me This Way » een Grammy gewonnen ?;Thelma Houston;Kiki Dee;Diana Ross;Shanice Wilson;Expert;De buis is in het Frans bewerkt door Sylvie Vartan onder de titel « Ne pars pas comme ca » (2LP « Live au Palais des congres », 1977).;https://nl.wikipedia.org/wiki/Thelma_Houston
22;nl;Wat was het eerste grote succes van de Amerikaanse zanger en bassist Dan Hartman ?;« Instant Replay »;« Second Nature »;« White Boy »;« Images »;Expert;Dan Hartman staat bekend om zijn titels « Free Ride », « I Can Dream About You », « Instant Replay », « Love Sensation » en « Steek mijn vuur weer aan ».;https://nl.wikipedia.org/wiki/Dan_Hartman
23;nl;Welke zanger uit Quebec was succesvol met « Come To Me » ?;France Joli;Tabitha Lemaire;Fanny Bloom;Chantal Renaud;Expert;Ontdekt door Tony Green, Frankrijk Joli is een van de vele artiesten van het Prelude-label die disco-hits heeft verzameld.;https://nl.wikipedia.org/wiki/France_Joli
24;nl;Wie heeft het « Give Me the Night » -album van George Benson geproduceerd ?;Quincy Jones;Don Costa;Vriend Greco;Edgar Sampson;Expert;Het album wordt vaak omschreven als een van de tops van de meer commerciële albums van de gitarist die genres mixt.;
25;nl;Welk Gino Soccio-album is en blijft een discoklassieker ?;« Outline »;« Remember »;« Face To Face »;« Closer »;Expert;Gino Soccio blijft de enige discokunstenaar met drie singles van zijn eerste albums in de beste muzikale ranglijst.;
26;nl;Onder welke naam bracht Isabelle Morizet « Sing to me Mama » uit ?;Karen Cheryl;Sheila;Amanda Lear;Anita Ward;Expert;Karen Cheryl nam als koorzanger deel aan een nummer van het album van Liane Foly, uitgebracht in 2001, « Entre Nous ».;
27;nl;Welke producer uit Whitney Houston heeft « Let's All Chant » uitgebracht ?;Michael Zager;Nile Rodgers;Patrick Cowley;Bobby Orlando;Expert;Hoewel het een discotitel is, bevat deze titel uit 1978 passages over klarinet, klavecimbel en trompet.;https://nl.wikipedia.org/wiki/Let's_all_chant
28;nl;In welk land is « Born to be Alive » voor het eerst geslaagd ?;Italië;Zwitserland;Duitsland;Spanje;Expert;Met 56 gouden platen verkregen in 25 landen, meldt Patrick Hernandez dat de single hem tussen de 800 en 1.500 euro per dag oplevert.;https://nl.wikipedia.org/wiki/Born_to_Be_Alive_(nummer)
29;nl;In welk album verscheen de titel « Where are the women ? » van Patrick Juvet ?;« Paris by night »;« Chrysalide »;« I Love America »;« Lady night »;Expert;Deze disco soundtrack markeert een nieuwe samenwerking tussen Patrick Juvet (componist) en Jean-Michel Jarre (tekstschrijver).;
30;nl;Welk Van McCoy-discolied schreef hij in slechts een paar uur ?;« The Hustle »;« Cupid »;« Car Wash »;« Disco Duck »;Expert;De titel verkocht tien miljoen exemplaren en ontving de Grammy Award voor beste instrumentale popnummer in 1976.;
