1;es;¿Qué compañía ha comercializado la consola de juegos PlayStation 2 ?;Sony;Microsoft;Nintendo;Sega;Débutant;Sony Interactive Entertainment es una subsidiaria de Sony especializada en la industria del video, con sede en San Mateo.;https://es.wikipedia.org/wiki/Sony_Interactive_Entertainment
2;es;¿En qué año se comercializó la consola de juegos PlayStation 2 en Francia ?;2000;2002;2004;2006;Débutant;La consola compitió directamente con Sega Dreamcast, Nintendo GameCube y Microsoft Xbox.;https://es.wikipedia.org/wiki/PlayStation_2
3;es;¿En qué generación de consolas de la marca Sony es la PS2 ?;Sexto;Quinto;Cuarto;Tercero;Débutant;Esta generación comenzó en 1998 y terminó en enero de 2013 con la interrupción de la distribución de PlayStation 2.;
4;es;¿A qué otra consola de Sony tuvo éxito la PlayStation 2 ?;PlayStation;Saturno;Neo-Geo;Mega Drive;Débutant;El 18 de mayo de 2004, casi diez años después de su lanzamiento, Sony anuncia que ha distribuido 100 millones de PlayStation en todo el mundo.;https://es.wikipedia.org/wiki/PlayStation
5;es;Cuando salió, ¿qué medios podría leer PlayStation 2 de una manera innovadora ?;DVD;Rayo azul;Midi Disc;Disco óptico;Débutant;En ese momento, incluir la reproducción de DVD en serie (luego formato completamente nuevo) en este tipo de dispositivo fue una innovación importante.;https://es.wikipedia.org/wiki/PlayStation_2
6;es;¿Qué variante estética de PlayStation 2 salió en 2004 ?;PS2 Slim;PS2 Fat;PS2 Boy;PS2 Grid;Débutant;Este nuevo modelo con una silueta refinada se presentó el 1 de noviembre de 2004 en América del Norte y Europa.;https://es.wikipedia.org/wiki/PlayStation_2
7;es;¿Qué saga fue la más vendida entre los videojuegos disponibles en la PS2 ?;« Gran Theft Auto »;« Dragon Quest »;« Dios de la guerra »;« Final Fantasy »;Débutant;Debido a su contenido violento y la presencia de un minijuego sexual, el juego ha sido prohibido a menores de 18 años.;https://es.wikipedia.org/wiki/Grand_Theft_Auto:_San_Andreas
8;es;¿Cómo calificó la PS2 al aceptar juegos de PlayStation ?;Restaurable;Autopilotado;Admisivo;Ascensional;Débutant;Los problemas de compatibilidad son comunes en la computadora debido a la rápida evolución del hardware y el software.;
9;es;¿Qué gamepad oficial apareció como DualShock ?;DualShock 2;Bongo DK;Kinect;Wavebird;Débutant;Los botones se volvieron analógicos (excepto L3, R3 y Analog) y el controlador produjo dos niveles de vibración extra.;https://es.wikipedia.org/wiki/DualShock
10;es;¿Qué micrófonos podríamos conectar a la PS2 para convertirla en un dispositivo de karaoke ?;SingStar;Kinec;DualShock;KaraMic;Débutant;« SingStar » es una serie de videojuegos de karaoke desarrollados por SCE London Studio y publicados por Sony Computer Entertainment.;https://es.wikipedia.org/wiki/SingStar (serie)
11;es;¿Con qué consola de Sega la PlayStation 2 estaba en competencia directa ?;Dreamcast;GameCube;Xbox;Saturno;Confirmé;Sucesor de Saturno, Dreamcast fue la primera consola de seis generaciones en el mercado, por delante de sus competidores.;https://es.wikipedia.org/wiki/Dreamcast
12;es;¿Cuántas PS2 se vendieron solo dos días después de su lanzamiento en Japón ?;980 000;790 000;560 000;360,000;Confirmé;La PlayStation 2, la consola doméstica más vendida, tiene un total de 150 millones de copias enviadas al 31 de enero de 2011.;https://es.wikipedia.org/wiki/PlayStation_2
13;es;¿Cuántos títulos de videojuegos hay disponibles en el catálogo de PS2 ?;10 828;8 627;6 742;4 996;Confirmé;Sony afirma que se han vendido 1,52 mil millones de copias de estos títulos desde el lanzamiento de la consola el 4 de marzo de 2000.;https://es.wikipedia.org/wiki/PlayStation_2
14;es;¿Cuál fue el precio de lanzamiento de PlayStation 2 en Francia ?;450 ;560 ;620 ;740 ;Confirmé;El precio de la consola se redujo a 300 en 2001, 249 en 2003, 199 en 2004, 149 en 2005, 129 en 2006 y 99 en 2009.;https://es.wikipedia.org/wiki/PlayStation_2
15;es;¿Cuántos juegos estaban disponibles a la salida de la PS2 en Japón ?;Diez;Veinte;Trento;Cuarenta;Confirmé;En la nota « Dead or Alive 2 », « Dynasty Warriors 2 », « FIFA 2001 », « Kessen », « Madden NFL 2001 », « Midnight Club » y « Ridge Racer V ».;https://es.wikipedia.org/wiki/PlayStation_2
16;es;¿En qué año se detuvo la producción de PS2 en el mundo ?;2013;2014;2015;2016;Confirmé;La producción de la consola se detuvo el 30 de noviembre de 2012 y Sony anunció que cesará toda distribución en el territorio japonés desde 2013.;https://es.wikipedia.org/wiki/PlayStation_2
17;es;¿Cuántos procesadores principales incluyeron la PlayStation 2 ?;Tres;Dos;Cuatro;Cinco;Confirmé;La PlayStation 2 tenía muchos procesadores para usar en paralelo, lo que la hacía una consola bastante difícil de programar.;https://es.wikipedia.org/wiki/PlayStation_2
18;es;¿Cómo se llamaban las llamadas versiones de editor de juegos de PS2 ?;Disco azul;Ed Disc;Disco de repuesto;Go Disc;Confirmé;Estas versiones especiales de los juegos de PS2 estaban reservadas para profesionales y especialmente para demostraciones en la tienda.;https://es.wikipedia.org/wiki/PlayStation_2
19;es;¿Qué sistema operativo podría instalarse en la PS2 ?;Linux;Ventanas;Mac OS;Android;Confirmé;Sony ha lanzado un kit que incluye un disco duro de 20GB, un mouse, teclado, tarjeta ether, dos DVD y una distribución de Linux.;https://es.wikipedia.org/wiki/PlayStation_2
20;es;¿Cuál era el peso del modelo delgado de PlayStation 2 ?;900 g;1200 g;600 g;1500 g;Confirmé;Este cambio está asociado con la subcontratación de la caja de alimentación y la eliminación del botón de ENCENDIDO / APAGADO en la parte posterior.;https://es.wikipedia.org/wiki/PlayStation_2
21;es;¿Cuál fue el primer título de « FIFA » que no se lanzó en PlayStation ?;« FIFA 06 »;« FIFA 07 »;« FIFA 07 »;« FIFA 09 »;Expert;El juego estaba disponible en PlayStation 2, Xbox, GameCube, Microsoft Windows, Game Boy Advance, Nintendo DS y PlayStation Portable.;https://es.wikipedia.org/wiki/FIFA_06
22;es;¿Qué tecnología integra la tarjeta de memoria de 8 MB para la PS2 ?;MagicGate;CGMS;Denuvo;Viaccess;Expert;MagicGate es un sistema de protección creado e introducido en 1999 por Sony en sus tarjetas de memoria, especialmente en su Memory Stick.;
23;es;¿Cuál era la capacidad de la memoria interna de PlayStation 2 ?;32 MB;16 MB;8 MB;4 MB;Expert;La tecnología avanzada para la época de PlayStation 2 ha permitido a Sony poder ejecutar un poco menos de 2 mil millones de juegos.;https://es.wikipedia.org/wiki/PlayStation_2
24;es;¿Qué ingeniero japonés dirigió el desarrollo de PlayStation 2 ?;Ken Kutaragi;Hideo Shima;Hiromu Naruse;Yamao Yozo;Expert;Abrió el estudio Celius, filial, 51 % de Namco Bandai y 49 % de Sony, cuyas actividades se centran en el procesador Cel.;https://es.wikipedia.org/wiki/Ken_Kutaragi
25;es;¿Qué juego de disparos de Konami fue lanzado en 2000 en PS2 ?;« Alcance silencioso »;« Castlevania »;« Frogger »;« Parodio »;Expert;Jugando con un rifle arcade, las versiones de consola carecían de dicho accesorio, lo que reduciría el interés.;
26;es;¿Qué nombre era el procesador central de la PlayStation 2 de Sony ?;Motor de la emoción;Sintetizador de gráficos;Procesador de E / S;Dispositivo Mach;Expert;Contiene varios subprocesadores y circuitos especializados que están conectados por un bus interno de 128 bits, sincronizado a 150Mhz.;https://es.wikipedia.org/wiki/PlayStation_2
27;es;¿Cuántos polígonos desnudos podría calcular la PS2 por segundo ?;66,000,000;800;7,000;40,000;Expert;La FPU y las unidades de computación vectorial VU0 y VU1 de 128 bits permitieron que la consola alcanzara 6.2 GFLOPS.;https://es.wikipedia.org/wiki/PlayStation_2
28;es;¿Qué estación multimedia fue lanzada por Sony en Japón en 2003 ?;PSX;PSG;PSM;PSR;Expert;Sirvió como consola de juegos PlayStation y PlayStation 2, grabadora de DVD, sintonizador de TV y reproductor digital a través de su disco duro.;
29;es;¿Qué pequeña cámara adaptable para la PS2 fue desarrollada por Sony ?;EyeToy;SmallCam;FunPlay;Kinect;Expert;El EyeToy fue fabricado principalmente por Logitech, aunque las nuevas versiones fueron desarrolladas posteriormente por Nam Tai.;https://es.wikipedia.org/wiki/EyeToy
30;es;¿En qué saga usamos una cámara con poderes místicos ?;« Proyecto Cero »;« BioShock »;« Sirena Prohibida »;« Dead Rising »;Expert;¿Uno de los mejores juegos de terror o el mejor ? De todos modos, da mucho miedo incluso si juegas a la luz del día.;
1;it;Quale azienda ha commercializzato la console di gioco per PlayStation 2 ?;Sony;Microsoft;Nintendo;Sega;Débutant;Sony Interactive Entertainment è una filiale di Sony specializzata nel settore video, con sede a San Mateo.;https://it.wikipedia.org/wiki/Sony_Interactive_Entertainment
2;it;In quale anno la console di gioco PlayStation 2 è stata commercializzata in Francia ?;2000;2002;2004;2006;Débutant;La console era in diretta concorrenza con Sega Dreamcast, Nintendo GameCube e Microsoft Xbox.;https://it.wikipedia.org/wiki/PlayStation_2
3;it;In quale generazione di console del marchio Sony si trova la PS2 ?;Sesto;Quinto;Quarto;Terzo;Débutant;Questa generazione è iniziata nel 1998 e si è conclusa nel gennaio 2013 con la sospensione della distribuzione PlayStation 2.;
4;it;A quale altra console di Sony la PlayStation 2 è riuscita ?;PlayStation;Saturno;Neo-Geo;Mega Drive;Débutant;Il 18 maggio 2004, quasi dieci anni dopo il suo lancio, Sony annuncia di aver distribuito 100 milioni di PlayStation in tutto il mondo.;https://it.wikipedia.org/wiki/PlayStation
5;it;Quando è uscito, quali media poteva leggere PlayStation 2 in modo innovativo ?;DVD;Raggio blu;Midi Disc;Disco ottico;Débutant;A quel tempo, inclusa la riproduzione seriale di DVD (allora tutto nuovo formato) in questo tipo di dispositivo era un'importante innovazione.;https://it.wikipedia.org/wiki/PlayStation_2
6;it;Quale variante estetica di PlayStation 2 è uscita nel 2004 ?;PS2 Slim;PS2 Fat;PS2 Boy;PS2 Grid;Débutant;Questo nuovo modello di silhouette sottile è stato introdotto il 1 ° novembre 2004 in Nord America ed Europa.;https://it.wikipedia.org/wiki/PlayStation_2
7;it;Quale saga è stata la più venduta tra i videogiochi disponibili su PS2 ?;« Gran Theft Auto »;« Dragon Quest »;« God of War »;« Final Fantasy »;Débutant;A causa del suo contenuto violento e della presenza di un minigioco sessuale, il gioco è stato bandito sotto i 18 anni.;https://it.wikipedia.org/wiki/Grand_Theft_Auto:_San_Andreas
8;it;Come è stata qualificata la PS2, accettando i giochi PlayStation ?;Rinnovabile;Pilota automatico;Ammissivo;Ascensionale;Débutant;I problemi di compatibilità sono comuni nei computer a causa della rapida evoluzione di hardware e software.;
9;it;Quale gamepad ufficiale è apparso sul DualShock ?;DualShock 2;Bongo DK;Kinect;Wavebird;Débutant;I pulsanti sono diventati analogici (tranne L3, R3 e Analog) e il controller ha prodotto due livelli di vibrazione extra.;https://it.wikipedia.org/wiki/DualShock
10;it;Quali microfoni potresti collegare alla PS2 per trasformarlo in un dispositivo karaoke ?;SingStar;Kinec;DualShock;KaraMic;Débutant;« SingStar » è una serie di videogiochi di karaoke sviluppata da SCE London Studio e pubblicata da Sony Computer Entertainment.;https://it.wikipedia.org/wiki/SingStar
11;it;Con quale console di Sega la PlayStation 2 era in competizione diretta ?;Dreamcast;GameCube;Xbox;Saturno;Confirmé;Successore di Saturno, Dreamcast è stata la prima console di sei generazioni sul mercato, davanti ai suoi concorrenti.;https://it.wikipedia.org/wiki/Dreamcast
12;it;Quante PS2 sono state vendute solo due giorni dopo il rilascio in Giappone ?;980 000;790 000;560 000;360.000;Confirmé;La PlayStation 2, la console domestica più venduta, ha un totale di 150 milioni di copie spedite al 31 gennaio 2011.;https://it.wikipedia.org/wiki/PlayStation_2
13;it;Quanti titoli di videogiochi sono disponibili nel catalogo PS2 ?;10 828;8 627;6 742;4 996;Confirmé;La Sony sostiene che 1,52 miliardi di copie di questi titoli sono stati venduti dal lancio della console il 4 marzo 2000.;https://it.wikipedia.org/wiki/PlayStation_2
14;it;Qual è stato il prezzo di lancio di PlayStation 2 in Francia ?;450 ;560 ;620 ;740 ;Confirmé;Il prezzo della console è stato ridotto a 300 nel 2001, 249 nel 2003, 199 nel 2004, 149 nel 2005, 129 nel 2006 e 99 nel 2009.;https://it.wikipedia.org/wiki/PlayStation_2
15;it;Quanti giochi erano disponibili al rilascio di PS2 in Giappone ?;Dieci;Venti;Trento;Quaranta;Confirmé;Sulla nota « Dead or Alive 2 », « Dynasty Warriors 2 », « FIFA 2001 », « Kessen », « Madden NFL 2001 », « Midnight Club » e « Ridge Racer V ».;https://it.wikipedia.org/wiki/PlayStation_2
16;it;Quando è stata interrotta la produzione di PS2 nel mondo ?;2013;2014;2015;2016;Confirmé;La produzione della console è stata interrotta il 30 novembre 2012 e la Sony ha annunciato la cessazione della distribuzione sul territorio giapponese nel 2013.;https://it.wikipedia.org/wiki/PlayStation_2
17;it;Quanti processori principali includevano la PlayStation 2 ?;Tre;Due;Quattro;Cinque;Confirmé;La PlayStation 2 aveva molti processori da utilizzare in parallelo, il che rendeva una console piuttosto difficile da programmare.;https://it.wikipedia.org/wiki/PlayStation_2
18;it;Come venivano chiamate le cosiddette versioni degli editori di giochi PS2 ?;Blue Disc;Ed Disc;Disco di ricambio;Vai a disco;Confirmé;Queste versioni speciali dei giochi PS2 erano riservate ai professionisti e soprattutto alle dimostrazioni in negozio.;https://it.wikipedia.org/wiki/PlayStation_2
19;it;Quale sistema operativo potrebbe essere installato su PS2 ?;Linux;Windows;Mac OS;Android;Confirmé;Sony ha rilasciato un kit che include un disco rigido da 20 GB, un mouse, una tastiera, una scheda etere, due DVD e una distribuzione Linux.;https://it.wikipedia.org/wiki/PlayStation_2
20;it;Qual era il peso del modello slim di PlayStation 2 ?;900 g;1200 g;600 g;1500 g;Confirmé;Questa modifica è associata all'esternalizzazione dell'alimentatore e alla rimozione del pulsante ON / OFF sul retro.;https://it.wikipedia.org/wiki/PlayStation_2
21;it;Qual è stato il primo titolo di « FIFA » a non essere rilasciato su PlayStation ?;« FIFA 06 »;« FIFA 07 »;« FIFA 07 »;« FIFA 09 »;Expert;Il gioco era disponibile su PlayStation 2, Xbox, GameCube, Microsoft Windows, Gameboy Advance, Nintendo DS e PlayStation Portable.;https://it.wikipedia.org/wiki/FIFA_06
22;it;Quale tecnologia era la scheda di memoria da 8 MB per PS2 ?;MagicGate;CGMS;Denuvo;Viaccess;Expert;MagicGate è un sistema di protezione creato e introdotto nel 1999 da Sony nelle sue schede di memoria, in particolare nella sua Memory Stick.;https://it.wikipedia.org/wiki/MagicGate
23;it;Qual era la capacità della memoria interna di PlayStation 2 ?;32 MB;16 MB;8 MB;4 MB;Expert;La tecnologia avanzata per l'era di PlayStation 2 ha permesso a Sony di eseguire poco meno di 2 miliardi di giochi.;https://it.wikipedia.org/wiki/PlayStation_2
24;it;Quale ingegnere giapponese ha guidato lo sviluppo di PlayStation 2 ?;Ken Kutaragi;Hideo Shima;Hiromu Naruse;Yamao Yozo;Expert;Ha aperto lo studioCellius, filiale 51 % di Namco Bandai e 49 % di Sony, le cui attività sono incentrate sul processoreCell.;https://it.wikipedia.org/wiki/Ken_Kutaragi
25;it;Quale gioco sparatutto pubblicato da Konami è stato rilasciato nel 2000 su PS2 ?;« Ambito silenzioso »;« Castlevania »;« Frogger »;« Parodius »;Expert;Giocando con un fucile arcade, le versioni console erano prive di tale accessorio, il che ridurrebbe l'interesse.;https://it.wikipedia.org/wiki/Silent_Scope
26;it;Quale nome era il processore centrale della Sony PlayStation 2 ?;Motore delle emozioni;Sintetizzatore grafico;Processore I / O;Dispositivo Mach;Expert;Contiene numerosi sub-processori e circuiti specializzati che sono collegati da un bus interno a 128 bit, con clock a 150Mhz.;https://it.wikipedia.org/wiki/PlayStation_2
27;it;Quanti poligoni potrebbe calcolare PS2 al secondo ?;66.000.000;800;7.000;40.000;Expert;La FPU e le unità di elaborazione vettoriale VU0 e VU1 a 128 bit hanno consentito alla console di raggiungere 6,2 GFLOPS.;https://it.wikipedia.org/wiki/PlayStation_2
28;it;Quale stazione multimediale è stata lanciata da Sony in Giappone nel 2003 ?;PSX;PSG;PSM;PSR;Expert;Ha funzionato come console di gioco per PlayStation e PlayStation 2, masterizzatore DVD, sintonizzatore TV e lettore digitale tramite il suo disco rigido.;
29;it;Quale piccola fotocamera adattabile per PS2 è stata sviluppata da Sony ?;EyeToy;SmallCam;FunPlay;Kinect;Expert;EyeToy è stato prodotto principalmente da Logitech, sebbene le nuove versioni siano state successivamente sviluppate da Nam Tai.;https://it.wikipedia.org/wiki/EyeToy
30;it;In quale saga usiamo una macchina fotografica con poteri mistici ?;« Progetto Zero »;« BioShock »;« Sirena proibita »;« Dead Rising »;Expert;Uno dei migliori giochi horror o il migliore ? Ad ogni modo, è molto spaventoso anche se giochi alla luce del giorno.;
1;nl;Welk bedrijf heeft de PlayStation 2-gameconsole op de markt gebracht ?;Sony;Microsoft;Nintendo;Sega;Débutant;Sony Interactive Entertainment is een dochteronderneming van Sony, gespecialiseerd in de video-industrie, gevestigd in San Mateo.;https://nl.wikipedia.org/wiki/Sony_Interactive_Entertainment
2;nl;In welk jaar werd de PlayStation 2-gameconsole op de markt gebracht in Frankrijk ?;2000;2002;2004;2006;Débutant;De console concurreerde rechtstreeks met de Sega Dreamcast, de Nintendo GameCube en de Microsoft Xbox.;https://nl.wikipedia.org/wiki/PlayStation_2
3;nl;In welke generatie consoles van Sony-merken bevindt de PS2 zich ?;Zesde;Vijfde;Vierde;Derde;Débutant;Deze generatie begon in 1998 en eindigde in januari 2013 met de stopzetting van de PlayStation 2-distributie.;
4;nl;Op welke andere console van Sony de PlayStation 2 is ze geslaagd ?;PlayStation;Saturnus;Neo-Geo;Mega Drive;Débutant;Op 18 mei 2004, bijna tien jaar na de lancering, kondigt Sony aan dat het wereldwijd 100 miljoen PlayStation heeft gedistribueerd.;https://nl.wikipedia.org/wiki/PlayStation (spelcomputer)
5;nl;Toen het uitkwam, welke media kon de PlayStation 2 op een innovatieve manier lezen ?;DVD;Blue-ray;Midi Disc;Optische schijf;Débutant;In die tijd was het opnemen van seriële dvd's (toen geheel nieuw formaat) in dit type apparaat een belangrijke innovatie.;https://nl.wikipedia.org/wiki/PlayStation_2
6;nl;Welke esthetische variant van de PlayStation 2 is er in 2004 uitgekomen ?;PS2 Slim;PS2 Vet;PS2 Boy;PS2-raster;Débutant;Dit nieuwe slanke silhouetmodel werd op 1 november 2004 geïntroduceerd in Noord-Amerika en Europa.;https://nl.wikipedia.org/wiki/PlayStation_2
7;nl;Welke saga was het meest verkocht onder de videogames die beschikbaar zijn op de PS2 ?;« Gran Theft Auto »;« Dragon Quest »;« God of War »;« Laatste fantasie »;Débutant;Vanwege de gewelddadige inhoud en de aanwezigheid van een seksueel minigame is het spel verboden onder de 18 jaar oud.;https://nl.wikipedia.org/wiki/Grand_Theft_Auto:_San_Andreas
8;nl;Hoe was de PS2 gekwalificeerd en aanvaardde PlayStation-games ?;Opknapbaar;Automatische piloot;Ontvankelijk;Ascensionaal;Débutant;Compatibiliteitsproblemen komen veel voor bij computers vanwege de snelle evolutie van hardware en software.;
9;nl;Welke offici ?le gamepad zag eruit als de DualShock ?;DualShock 2;Bongo DK;Kinect;Wavebird;Débutant;De knoppen werden analoog (behalve L3, R3 en Analoog) en de controller produceerde twee extra trillingsniveaus.;https://nl.wikipedia.org/wiki/DualShock
10;nl;Welke microfoons kun je op de PS2 aansluiten om er een karaoke-apparaat van te maken ?;SingStar;Kinec;DualShock;KaraMic;Débutant;« SingStar » is een reeks videogames van karaoke ontwikkeld door SCE London Studio en uitgegeven door Sony Computer Entertainment.;https://nl.wikipedia.org/wiki/SingStar
11;nl;Met welke console van Sega concurreerde de PlayStation 2 rechtstreeks ?;Dreamcast;GameCube;Xbox;Saturnus;Confirmé;Opvolger van de Saturnus, de Dreamcast was de eerste zes-generatie console op de markt, vóór zijn concurrenten.;https://nl.wikipedia.org/wiki/Dreamcast
12;nl;Hoeveel PS2 werden er slechts twee dagen na de release in Japan verkocht ?;980 000;790 000;560 000;360.000;Confirmé;De PlayStation 2, de best verkochte thuisconsole, heeft per 31 januari 2011 in totaal 150 miljoen exemplaren verzonden.;https://nl.wikipedia.org/wiki/PlayStation_2
13;nl;Hoeveel titels van videogames zijn er beschikbaar in de PS2-catalogus ?;10 828;8 627;6 742;4 996;Confirmé;Sony beweert dat 1,52 miljard exemplaren van deze titels zijn verkocht sinds de lancering van de console op 4 maart 2000.;https://nl.wikipedia.org/wiki/PlayStation_2
14;nl;Wat was de lanceringsprijs van de PlayStation 2 in Frankrijk ?;450 ;560 ;620 ;740 ;Confirmé;De prijs van de console werd verlaagd tot 300 in 2001, 249 in 2003, 199 in 2004, 149 in 2005, 129 in 2006 en99 in 2009.;https://nl.wikipedia.org/wiki/PlayStation_2
15;nl;Hoeveel games waren er beschikbaar bij de release van de PS2 in Japan ?;Tien;Twintig;Trento;Veertig;Confirmé;Op noot « Dead or Alive 2 », « Dynasty Warriors 2 », « FIFA 2001 », « Kessen », « Madden NFL 2001 », « Midnight Club » en « Ridge Racer V ».;https://nl.wikipedia.org/wiki/PlayStation_2
16;nl;In welk jaar werd de productie van PS2 ter wereld stopgezet ?;2013;2014;2015;2016;Confirmé;De productie van de console werd gestopt op 30 november 2012 en Sony kondigde aan dat alle distributie op het Japanse grondgebied vanaf 2013 wordt stopgezet.;https://nl.wikipedia.org/wiki/PlayStation_2
17;nl;Hoeveel hoofdprocessors bevatten de PlayStation 2 ?;Drie;Twee;Vier;Vijf;Confirmé;De PlayStation 2 moest veel processors parallel gebruiken, waardoor het een console was die vrij moeilijk te programmeren was.;https://nl.wikipedia.org/wiki/PlayStation_2
18;nl;Hoe werden de zogenaamde PS2-gamesuitgeversversies genoemd ?;Blauwe schijf;Ed Disc;Reserve schijf;Ga disc;Confirmé;Deze speciale versies van PS2-games waren gereserveerd voor professionals en vooral voor demonstraties in de winkel.;https://nl.wikipedia.org/wiki/PlayStation_2
19;nl;Welk besturingssysteem kan op de PS2 worden geïnstalleerd ?;Linux;Windows;Mac OS;Android;Confirmé;Sony heeft een kit uitgebracht met een harde schijf van 20 GB, een muis, toetsenbord, etherkaart, twee dvd's en een Linux-distributie.;https://nl.wikipedia.org/wiki/PlayStation_2
20;nl;Wat was het gewicht van het slanke model van de PlayStation 2 ?;900 g;1200 g;600 g;1500 g;Confirmé;Deze wijziging hangt samen met de externalisering van de powerbox en het verwijderen van de AAN / UIT-knop aan de achterkant.;https://nl.wikipedia.org/wiki/PlayStation_2
21;nl;Wat was de eerste titel van « FIFA » die niet op PlayStation werd uitgebracht ?;« FIFA 06 »;« FIFA 07 »;« FIFA 07 »;« FIFA 09 »;Expert;De game was beschikbaar op PlayStation 2, Xbox, GameCube, Microsoft Windows, Game Boy Advance, Nintendo DS en PlayStation Portable.;https://nl.wikipedia.org/wiki/FIFA_06
22;nl;Welke technologie integreert de 8 MB geheugenkaart voor de PS2 ?;MagicGate;CGMS;Denuvo;Viaccess;Expert;MagicGate is een beveiligingssysteem gecreëerd en geïntroduceerd in 1999 door Sony in zijn geheugenkaarten, vooral zijn Memory Stick.;
23;nl;Wat was de capaciteit van het interne geheugen van de PlayStation 2 ?;32 MB;16 MB;8 MB;4 MB;Expert;Dankzij geavanceerde technologie voor de tijd van de PlayStation 2 kon Sony iets minder dan 2 miljard games spelen.;https://nl.wikipedia.org/wiki/PlayStation_2
24;nl;Welke Japanse ingenieur leidde de ontwikkeling van PlayStation 2 ?;Ken Kutaragi;Hideo Shima;Hiromu Naruse;Yamao Yozo;Expert;Hij opende de studio Cellius, een 51 % dochteronderneming van Namco Bandai en 49 % van Sony, wiens activiteiten gericht zijn op de Cell-processor.;
25;nl;Welk schietspel is in 2000 door PSAM op PS2 uitgebracht ?;« Silent Scope »;« Castlevania »;« Frogger »;« Parodius »;Expert;Bij het spelen met een arcade geweer ontbrak de console-versie zo'n accessoire, wat de interesse zal verminderen.;
26;nl;Welke naam was de centrale processor van de Sony PlayStation 2 ?;Emotion Engine;Grafische synthetiser;I / O-processor;Mach apparaat;Expert;Het bevat verschillende sub-processors en gespecialiseerde circuits die zijn verbonden door een 128-bit interne bus, geklokt op 150MHz.;https://nl.wikipedia.org/wiki/PlayStation_2
27;nl;Hoeveel polygonen kan PS2 per seconde berekenen ?;66.000.000;800;7.000;40.000;Expert;Dankzij de FPU en de 128-bit VU0 en VU1 vector computing-eenheden kon de console 6.2 GFLOPS bereiken.;https://nl.wikipedia.org/wiki/PlayStation_2
28;nl;Welk multimediastation werd in 2003 door Sony in Japan gelanceerd ?;PSX;PSG;PSM;PSR;Expert;Het diende als een PlayStation en PlayStation 2 gameconsole, dvd-brander, tv-tuner en digitale speler via de harde schijf.;
29;nl;Welke kleine aanpasbare camera voor de PS2 is ontwikkeld door Sony ?;EyeToy;SmallCam;FunPlay;Kinect;Expert;De EyeToy werd hoofdzakelijk vervaardigd door Logitech, hoewel nieuwe versies later werden ontwikkeld door Nam Tai.;https://nl.wikipedia.org/wiki/EyeToy
30;nl;In welke sage gebruiken we een camera met mystieke krachten ?;« Project Zero »;« BioShock »;« Verboden sirene »;« Dead Rising »;Expert;Een van de beste horrorspellen of de beste ? Hoe dan ook, het is heel eng, zelfs als je in het daglicht speelt.;
