30;de;Sado ist die Vorbereitungszeremonie für welches Getränk ?;Grüner Tee;Sake;Kaffee;Kirschsaft;Expert;Sado wurde zum Teil vom Zen-Buddhismus inspiriert und verwendet Matcha, ein gemahlenes Grüntee-Pulver.;
1;es;¿Cómo se llama el vestido tradicional japonés en forma de T hoy en día ?;Kimono;Keikogi;Tabi;Haori;Débutant;Antes de la introducción de la ropa occidental en Japón, el término kimono se refería a todo tipo de ropa según las estaciones.;https://es.wikipedia.org/wiki/Kimono
2;es;Además del sintoísmo, ¿cuál es la religión más practicada en Japón ?;Budismo;Cristianismo;Kamiteísmo;Shenismo;Débutant;El budismo, desde un punto de vista religioso o filosófico, fue importado de China y Corea a partir de los siglos quinto y sexto.;https://es.wikipedia.org/wiki/Budismo
3;es;¿Qué significa o representa un Yokai en el folklore japonés ?;Espíritu;Perro;Alcohol;Arbol;Débutant;Un yokai se representa como un espíritu maligno o simplemente malicioso que demuestra molestias cotidianas o inusuales.;
4;es;¿Qué comida japonesa se hace con rodajas de pescado fresco que se come crudo ?;Sashimi;Sushi;Maki;Nigiri;Débutant;Este plato tradicional a menudo se equipara con sushi, que también se come con wasabi y salsa de soja.;https://es.wikipedia.org/wiki/Sashimi
5;es;¿Qué ideogramas de origen chino se usan en el idioma japonés ?;Kanji;Romaji;Katakanas;Hiraganas;Débutant;Con un número de 2,000 y, aunque vinculados, cada kanji tiene una o más posibles expresiones fonológicas, llamadas lecturas.;https://es.wikipedia.org/wiki/Kanji
6;es;¿Qué animal y símbolo japonés a menudo se representa en forma de origami ?;Grúa;Mono;Gato;Dragón;Débutant;La leyenda de las mil grullas dice en Japón que si doblas mil grullas de papel en el año, podrías cumplir tu deseo.;https://es.wikipedia.org/wiki/Origami
7;es;¿Cuál es el nombre del jefe de estado japonés, heredero de una sucesión ininterrumpida ?;Emperador;Soberano;Guía;Presidente;Débutant;De acuerdo con la Constitución de 1947, el Emperador solo tiene un papel simbólico, el poder ejecutivo está en manos del Primer Ministro.;https://es.wikipedia.org/wiki/Emperador_de_Japón
8;es;¿Qué árbol ornamental, también llamado Sakura, celebran los japoneses la floración ?;Cerezo;Si;Arce;Pino;Débutant;Usados como árboles ornamentales, estos cerezos que marcan el regreso de la primavera no se plantan para su fruto.;https://es.wikipedia.org/wiki/Prunus_serrulata
9;es;¿Qué arte japonés tradicional consiste en el cultivo miniaturizante de plantas ?;Bonsai;Niwaki;Bankan;Oden;Débutant;Bonsai, literalmente planta cultivada en una maceta, es un arte tradicional japonés derivado del arte chino original de penjing.;
10;es;¿Cuál de estas artes marciales no es de origen japonés ?;Kung-fu;Judo;Karate;Ju-jitsu;Débutant;El término Kung fu, introducido en Europa en la década de 1970, es utilizado por los occidentales para referirse a las artes marciales chinas.;https://es.wikipedia.org/wiki/Artes_marciales_de_China
11;es;¿Cómo se llaman los miembros de la mafia japonesa ?;Yakuza;Onizuka;Udon;Onigiri;Confirmé;El universo de yakuza es una importante fuente de inspiración para la cultura japonesa, y también sirve de base para algunos guionistas.;https://es.wikipedia.org/wiki/Yakuza
12;es;¿Cuál es el deporte más popular y practicado en Japón ?;Beisbol;Sumo;Pie;Tenis;Confirmé;El béisbol, comúnmente conocido como yakyu, es un deporte que requiere trabajo en equipo y concentración, lo que realmente le gusta a los japoneses.;
13;es;¿Qué trabajo hizo un terrorista suicida durante la Guerra del Pacífico ?;Piloto;Cocinero;Navegador;Doctor;Confirmé;El kamikaze o viento divino era miembro de una unidad militar del Imperio de Japón que realizaba misiones suicidas durante la Guerra del Pacífico.;https://es.wikipedia.org/wiki/Kamikaze
14;es;¿Qué damas de la casa dedican sus vidas al arte tradicional japonés ?;Geisha;Zashiki;Hanamachi;Geta;Confirmé;Cultivando el refinamiento, las geishas ofrecen servicios de soporte y entretenimiento para una clientela muy acomodada.;https://es.wikipedia.org/wiki/Geisha
15;es;Hasta el siglo XIX, ¿quién tenía el poder militar y civil en Japón ?;Shogun;Edo;Azuchi;Daimyo;Confirmé;El título de gran pacificador general de los bárbaros fue abolido en 1868, el poder efectivo fue restaurado para el emperador y sus delegados.;https://es.wikipedia.org/wiki/Sh ?gun
16;es;¿Qué alimento es el queso de soja tofu de la cuajada ?;Soja;Arroz;Miso;Cebada;Confirmé;El tofu es una pasta blanca, suave y poco olorosa con un sabor bastante neutro, que constituye una base importante de la dieta asiática.;https://es.wikipedia.org/wiki/Tofu
17;es;¿Qué son Onsen, lugares de relajación arraigados en la tradición japonesa ?;Baños termales;Salones de te;Jardines de flores;Templos grises;Confirmé;El agua para estos baños calientes generalmente comunes proviene de fuentes volcánicas a veces reconocidas por sus propiedades terapéuticas.;https://es.wikipedia.org/wiki/Onsen
18;es;¿Qué sufijo honorario se usa para dirigirse a un profesor o artista ?;Sensei;Senpai;San;Kun;Confirmé;Por defecto, usamos San, que es el sufijo más básico en japonés, estos sufijos generalmente se pueden traducir como Monsieur.;https://es.wikipedia.org/wiki/Sensei
19;es;¿Cómo se recomienda celebrar la Navidad en Japón ?;En el amor;Con la familia;Entre colegas;Solo;Confirmé;La fiesta de Navidad importada de Occidente, por lo tanto, es puramente comercial y se considera como una especie de segundo Día de San Valentín.;
20;es;¿De qué es Raijin (o Raiden) el dios de la mitología japonesa ?;Trueno;Muerte;Coraje;Sol;Confirmé;Fue Raiden quien se dijo que estaba detrás de la bancarrota del intento de invasión mongol de Japón en 1274 cuando creó el tifón Kamikaze.;
21;es;En Japón, ¿qué arriesgas al meter los palillos en la comida durante una comida ?;Mal presagio;Descontento;Prisión;Exclusión;Expert;Los palillos japoneses, cortos, con punta puntiaguda, generalmente de madera lacada, se consumen a razón de 400 palillos desechables por año.;https://es.wikipedia.org/wiki/Palillos
22;es;¿Cómo se arregla para saludarse cordialmente en Japón ?;Reverencia;Gritos;Besándose;Arrodillándose;Expert;El grado de inclinación depende de la persona que desea saludar, con el objetivo de evitar el contacto físico tanto como sea posible.;https://es.wikipedia.org/wiki/Japón
23;es;¿Qué estudio de cine de animación fue fundado por Hayao Miyazaki ?;Ghibli;Madhouse;Toei;Pierrot;Expert;Bien conocido por el público en general, sus principales obras son « Howl's Moving Castle », « Spirited Away » o incluso « Princess Mononoke ».;https://es.wikipedia.org/wiki/Studio_Ghibli
24;es;¿Qué son hara-kiri y seppuku, utilizados por una persona deshonrada ?;Suicidio;Teatro;Prisión;Sable;Expert;El hara-kiri fue utilizado por una persona deshonrada (adulterio, traición, ...) y luego hizo posible recuperar y lavar su honor.;https://es.wikipedia.org/wiki/Harakiri
25;es;En Japón, ¿qué número tiene la misma reputación que el número 13 en Occidente ?;Cuatro;Siete;Tres;Nuevo;Expert;En China, Japón y Corea, existe una superstición muy común, la tetrafobia o el miedo al número 4 (que se declara muerto).;https://es.wikipedia.org/wiki/Cuatro
26;es;¿Qué te dice un japonés que dice las palabras « Ohayou gozaimasu » ?;Hola;Adios;Muchas gracias;Hasta mañana;Expert;En Japón, las palabras « Ohayou gozaimasu » se usan antes del mediodía, mientras que la palabra « Konichiha » se usa principalmente durante la tarde.;
27;es;¿Qué es mejor eliminar en Japón antes de entrar a una casa ?;Sus zapatos;Sus pantalones;Su sombrero;Sus gafas;Expert;La entrada a una casa también se levanta muy a menudo, lo que permite distinguir el lugar donde debe quitarse los zapatos.;https://es.wikipedia.org/wiki/Japón
28;es;¿Qué animal es el Kitsune, una criatura sobrenatural con varias colas ?;Zorro;Mapache;Gato;Perro;Expert;Tanto un personaje del folklore japonés como un espíritu sobrenatural, se dice que el número de colas del Kitsune es proporcional a su edad.;https://es.wikipedia.org/wiki/Kitsune
29;es;¿Qué tiene de especial el lanzamiento de los videojuegos « Dragon Quest » en Japón ?;Sale los fines de semana;Es gratis;Lanzado el 1 de enero;Está en francés;Expert;Se llegó a un acuerdo entre el gobierno y la compañía de producción, la tasa de absentismo es demasiado alta en los días de lanzamiento.;https://es.wikipedia.org/wiki/Dragon_Quest_(serie)
30;es;Sado es la ceremonia de preparación para qué bebida ?;Té verde;Sake;Café;Jugo de cereza;Expert;Inspirado en parte por el budismo zen, usando matcha, un polvo de té verde molido, Sado es un verdadero arte tradicional en Japón.;
1;it;Come si chiama oggi il tradizionale abito a forma di T giapponese ?;Kimono;Keikogi;Tabi;Haori;Débutant;Prima dell'introduzione dell'abbigliamento occidentale in Giappone, il termine kimono si riferiva a tutti i tipi di abbigliamento in base alle stagioni.;https://it.wikipedia.org/wiki/Kimono
2;it;Oltre allo shintoismo, qual è la religione più praticata in Giappone ?;Buddismo;Cristianesimo;Kamitheism;Shenismo;Débutant;Il buddismo, da un punto di vista religioso o filosofico, fu importato dalla Cina e dalla Corea dal 5 ° e 6 ° secolo.;https://it.wikipedia.org/wiki/Buddhismo
3;it;Cosa significa o rappresenta uno Yokai nel folklore giapponese ?;Spirito;Cane;Alcool;Albero;Débutant;Uno yokai è raffigurato come uno spirito malvagio o semplicemente malizioso che dimostra fastidi quotidiani o insoliti.;
4;it;Quale cibo giapponese è fatto con fette di pesce fresco mangiate crude ?;Sashimi;Sushi;Maki;Nigiri;Débutant;Questo piatto tradizionale è troppo spesso equiparato al sushi, che viene anche mangiato con wasabi e salsa di soia.;https://it.wikipedia.org/wiki/Sashimi
5;it;Quali ideogrammi di origine cinese sono usati nella lingua giapponese ?;Kanji;Romaji;Katakanas;Hiraganas;Débutant;Numero 2000 e sebbene correlati, ogni kanji ha una o più possibili espressioni fonologiche, chiamate letture.;https://it.wikipedia.org/wiki/Kanji
6;it;Quale animale e simbolo giapponese è spesso rappresentato in forma di origami ?;Gru;Scimmia;Gatto;Drago;Débutant;La leggenda delle mille gru racconta in Giappone che se pieghi un migliaio di gru di carta durante l'anno, potresti realizzare il tuo desiderio.;https://it.wikipedia.org/wiki/Origami
7;it;Qual è il nome del capo di stato giapponese, erede di una successione ininterrotta ?;Imperatore;Sovrano;Guida;Presidente;Débutant;Secondo la Costituzione del 1947, l'imperatore ha solo un ruolo simbolico, il potere esecutivo è detenuto dal Primo Ministro.;https://it.wikipedia.org/wiki/Imperatore_del_Giappone
8;it;Quale albero ornamentale, chiamato anche Sakura, celebra la fioritura dei giapponesi ?;Ciliegio;Se;Acero;Pino;Débutant;Utilizzati come alberi ornamentali, questi ciliegi che segnano il ritorno della primavera non vengono piantati per i loro frutti.;https://it.wikipedia.org/wiki/Prunus_serrulata
9;it;Quale arte tradizionale giapponese consiste nella coltivazione miniaturizzante di piante ?;Bonsai;Niwaki;Bankan;Oden;Débutant;Il bonsai, letteralmente pianta coltivata in vaso, è un'arte giapponese tradizionale derivata dall'arte cinese originale del penjing.;
10;it;Quale di queste arti marziali non è di origine giapponese ?;Kung-fu;Judo;Karate;Ju-jitsu;Débutant;Il termine Kung fu, introdotto in Europa negli anni '70, viene usato dagli occidentali per riferirsi alle arti marziali cinesi.;https://it.wikipedia.org/wiki/Arti_marziali_cinesi
11;it;Come si chiamano i membri della mafia giapponese ?;Yakuza;Onizuka;Udon;Onigiri;Confirmé;L'universo di Yakuza è un'importante fonte di ispirazione per la cultura giapponese, che funge anche da base per alcuni sceneggiatori.;https://it.wikipedia.org/wiki/Yakuza
12;it;Qual è lo sport più popolare e praticato in Giappone ?;Baseball;Sumo;Piede;Tennis;Confirmé;Il baseball, comunemente noto come yakyu, è uno sport che richiede lavoro di squadra e concentrazione, che ai giapponesi piace molto.;
13;it;Che lavoro ha fatto un attentatore suicida durante la guerra del Pacifico ?;Pilota;Cook;Browser;Dottore;Confirmé;Il kamikaze o vento divino era un membro di un'unità militare dell'Impero del Giappone che svolgeva missioni suicide durante la guerra del Pacifico.;https://it.wikipedia.org/wiki/Kamikaze
14;it;Quali donne della casa dedicano la loro vita alle arti tradizionali giapponesi ?;Geisha;Zashiki;Hanamachi;Geta;Confirmé;Coltivando raffinatezza, le geishe offrono supporto e servizi di intrattenimento per una clientela molto ricca.;https://it.wikipedia.org/wiki/Geisha
15;it;Fino al XIX secolo, chi deteneva il potere militare e civile in Giappone ?;Shogun;Edo;Azuchi;Daimyo;Confirmé;Il titolo di grande pacificatore generale dei barbari fu abolito nel 1868, il potere effettivo fu restituito all'imperatore e ai suoi delegati.;https://it.wikipedia.org/wiki/Sh ?gun
16;it;Quale cibo è tofu il formaggio dalla cagliata ?;Fagioli di soia;Riso;Miso;Orzo;Confirmé;Il tofu è una pasta bianca, morbida, poco odorifera dal gusto piuttosto neutro, che costituisce una base importante della dieta asiatica.;https://it.wikipedia.org/wiki/Tofu
17;it;Quali sono gli Onsen, luoghi di relax radicati nella tradizione giapponese ?;Bagni termali;Sale da tè;Giardini fioriti;Aste grigie;Confirmé;L'acqua per questi bagni caldi generalmente comuni proviene da fonti vulcaniche a volte rinomate per le loro proprietà terapeutiche.;https://it.wikipedia.org/wiki/Onsen
18;it;Quale suffisso onorario viene utilizzato per rivolgersi a un professore o un artista ?;Sensei;Senpai;San;Kun;Confirmé;Per impostazione predefinita, usiamo San, che è il suffisso più elementare in giapponese, questi suffissi possono generalmente essere tradotti come Monsieur.;https://it.wikipedia.org/wiki/Sensei
19;it;Come si raccomanda di festeggiare il Natale in Giappone ?;In amore;Con la famiglia;Tra colleghi;Solo;Confirmé;La festa di Natale viene importata dall'Occidente, quindi è puramente commerciale e considerata come una sorta di secondo San Valentino.;
20;it;Qual è Raijin (o Raiden) il dio nella mitologia giapponese ?;Tuono;Morte;Coraggio;Sole;Confirmé;Fu Raiden a essere ritenuto responsabile del fallimento del tentativo di invasione mongola in Giappone nel 1274 quando creò il tifone Kamikaze.;
21;it;In Giappone, cosa stai rischiando attaccando le bacchette nel cibo durante un pasto ?;Cattivo presagio;Malcontento;Prigione;Esclusione;Expert;Le bacchette giapponesi, corte, con punta appuntita, generalmente realizzate in legno laccato, vengono consumate al ritmo di 400 bacchette usa e getta all'anno.;https://it.wikipedia.org/wiki/Bacchette_per_il_cibo
22;it;Come è organizzato a salutarsi cordialmente in Giappone ?;Inchino;Gridare;Baciando;In ginocchio;Expert;Il grado di inclinazione dipende dalla persona che desideri salutare, con l'obiettivo di evitare il più possibile il contatto fisico.;https://it.wikipedia.org/wiki/Giappone
23;it;Quale studio cinematografico animato è stato fondato da Hayao Miyazaki ?;Ghibli;Madhouse;Toei;Pierrot;Expert;Ben noti al grande pubblico, le sue opere principali sono « Il castello errante di Howl », « Spirited Away » o persino « Principessa Mononoke ».;https://it.wikipedia.org/wiki/Studio_Ghibli
24;it;Cosa sono l'hara-kiri e il seppuku, usati da una persona disonorata ?;Suicidio;Teatro;Prigione;Sabre;Expert;L'hara-kiri fu usato da una persona disonorata (adulterio, tradimento, ...) e poi rese possibile riconquistare e lavare il suo onore.;https://it.wikipedia.org/wiki/Seppuku
25;it;In Giappone, quale numero ha la stessa reputazione del numero 13 in Occidente ?;Quattro;Sette;Tre;Novità;Expert;In Cina, Giappone e Corea, c'è una superstizione molto comune, la tetrafobia o la paura del numero 4 (che è dichiarato morto).;https://it.wikipedia.org/wiki/4_(numero)
26;it;Cosa ti dice un giapponese che dice le parole « Ohayou gozaimasu » ?;Ciao;Addio;Mille Grazie;A domani;Expert;In Giappone, le parole « Ohayou gozaimasu » vengono utilizzate prima di mezzogiorno, mentre la parola « Konichiha » viene utilizzata principalmente nel pomeriggio.;
27;it;Cosa è meglio rimuovere in Giappone prima di entrare in una casa ?;Le sue scarpe;I suoi pantaloni;Il suo cappello;I suoi occhiali;Expert;Anche l'ingresso di una casa è molto spesso rialzato, il che rende possibile distinguere il luogo in cui è necessario rimuovere le scarpe.;https://it.wikipedia.org/wiki/Giappone
28;it;Quale animale è il Kitsune, una creatura soprannaturale con diverse code ?;Fox;Procione;Gatto;Cane;Expert;Sia un personaggio del folklore giapponese che uno spirito soprannaturale, si dice che il numero di code del Kitsune sia proporzionale alla sua età.;https://it.wikipedia.org/wiki/Kitsune
29;it;Cosa rende speciale l'uscita dei videogiochi « Dragon Quest » in Giappone ?;Esce nei fine settimana;È gratis;Rilasciato il 1 gennaio;È in francese;Expert;È stato raggiunto un accordo tra il governo e la società di produzione, il tasso di assenteismo è troppo alto nei giorni di rilascio.;https://it.wikipedia.org/wiki/Dragon_Quest
30;it;Sado è la cerimonia di preparazione per quale bevanda ?;Tè verde;Sake;Caffè;Succo di ciliegia;Expert;Ispirato in parte al buddismo Zen, usando il matcha, una polvere di tè verde macinato, Sado è una vera arte tradizionale in Giappone.;
1;nl;Hoe heet de traditionele Japanse T-vormige jurk tegenwoordig ?;Kimono;Keikogi;Tabi;Haori;Débutant;Vóór de introductie van westerse kleding in Japan, verwijst de term kimono naar alle soorten kleding volgens de seizoenen.;https://nl.wikipedia.org/wiki/Kimono
2;nl;Wat is naast het shintoïsme de meest beoefende religie in Japan ?;Boeddhisme;Christendom;Kamitheïsme;Shenisme;Débutant;Het boeddhisme werd vanuit religieus of filosofisch oogpunt uit de 5e en 6e eeuw geïmporteerd uit China en Korea.;https://nl.wikipedia.org/wiki/Boeddhisme
3;nl;Wat betekent een Yokai in de Japanse folklore ?;Geest;Hond;Alcohol;Boom;Débutant;Een yokai wordt afgebeeld als een boze of gewoon kwaadaardige geest die alledaagse of ongebruikelijke gedoe demonstreert.;
4;nl;Welk Japans eten wordt gemaakt met rauwe plakjes verse vis ?;Sashimi;Sushi;Maki;Nigiri;Débutant;Dit traditionele gerecht wordt te vaak gelijkgesteld met sushi, dat ook wordt gegeten met wasabi en sojasaus.;https://nl.wikipedia.org/wiki/Sashimi
5;nl;Welke ideogrammen van Chinese oorsprong worden in de Japanse taal gebruikt ?;Kanji;Romaji;Katakanas;Hiraganas;Débutant;Met een nummer van 2.000 en hoewel gekoppeld, heeft elke kanji een of meer mogelijke fonologische uitdrukkingen, de zogenaamde metingen.;https://nl.wikipedia.org/wiki/Kanji
6;nl;Welk Japans dier en symbool wordt vaak weergegeven in origami-vorm ?;Kraan;Aap;Kat;Draak;Débutant;De legende van de duizend kranen vertelt in Japan dat als je duizend papierkranen per jaar vouwt, je wens uit kan komen.;https://nl.wikipedia.org/wiki/Origami
7;nl;Wat is de naam van het Japanse staatshoofd, erfgenaam van een ononderbroken opvolging ?;Keizer;Soeverein;Gids;Voorzitter;Débutant;Volgens de grondwet van 1947 heeft de keizer alleen een symbolische rol, de uitvoerende macht van de premier.;https://nl.wikipedia.org/wiki/Keizer_van_Japan
8;nl;Welke sierboom, ook wel Sakura genoemd, vieren de Japanners de bloei ?;Kersenboom;Als;Esdoorn;Den;Débutant;Gebruikt als sierbomen, deze kersenbomen die de terugkeer van de lente markeren, worden niet geplant voor hun fruit.;https://nl.wikipedia.org/wiki/Japanse_sierkers
9;nl;Welke traditionele Japanse kunst bestaat uit het miniaturiseren van planten ?;Bonsai;Niwaki;Bankan;Oden;Débutant;Bonsai, letterlijk plant gekweekt in een pot, is een traditionele Japanse kunst die is afgeleid van de originele Chinese penjing-kunst.;
10;nl;Welke van deze vechtsporten is niet van Japanse afkomst ?;Kung-fu;Judo;Karate;Ju-jitsu;Débutant;De term Kung fu, geïntroduceerd in Europa in de jaren zeventig, wordt door westerlingen gebruikt om te verwijzen naar Chinese vechtsporten.;
11;nl;Wat zijn de namen van de leden van de Japanse maffia ?;Yakuza;Onizuka;Udon;Onigiri;Confirmé;Het universum van yakuza is een belangrijke inspiratiebron voor de Japanse cultuur en dient ook als basis voor sommige scenarioschrijvers.;https://nl.wikipedia.org/wiki/Yakuza
12;nl;Wat is de meest populaire en beoefende sport in Japan ?;Honkbal;Sumo;Voet;Tennis;Confirmé;Honkbal, gewoonlijk yakyu genoemd, is een sport die teamwerk en focus vereist, wat Japanners erg leuk vinden.;
13;nl;Welke taak deed een zelfmoordterrorist tijdens de Pacific War ?;Piloot;Cook;Browser;Dokter;Confirmé;De kamikaze of goddelijke wind was lid van een militaire eenheid van het Japanse rijk die zelfmoordmissies uitvoerde tijdens de Pacific War.;https://nl.wikipedia.org/wiki/Kamikaze
14;nl;Welke dames van het huis wijden hun leven aan traditionele Japanse kunst ?;Geisha;Zashiki;Hanamachi;Geta;Confirmé;Geisha's cultiveren verfijning en bieden ondersteuning en entertainmentdiensten voor een zeer welvarende klantenkring.;https://nl.wikipedia.org/wiki/Geisha
15;nl;Wie had tot de 19e eeuw de militaire en civiele macht in Japan ?;Shogun;Edo;Azuchi;Daimyo;Confirmé;De titel van groot-generaal vredestichter van de barbaren werd afgeschaft in 1868, nadat de keizer en zijn afgevaardigden de effectieve macht hadden teruggegeven.;https://nl.wikipedia.org/wiki/Shogun (titel)
16;nl;Welk voedsel is tofu de kaas van de wrongel ?;Sojabonen;Rijst;Miso;Gerst;Confirmé;Tofu is een witte, zachte, weinig geurige pasta met een vrij neutrale smaak en vormt een belangrijke basis van het Aziatische dieet.;https://nl.wikipedia.org/wiki/Tofoe
17;nl;Wat zijn Onsen, ontspanningsplekken die geworteld zijn in de Japanse traditie ?;Thermale baden;Theesalons;Bloementuinen;Grijze tempels;Confirmé;Het water voor deze veel voorkomende hete baden komt uit vulkanische bronnen die soms bekend staan om hun therapeutische eigenschappen.;https://nl.wikipedia.org/wiki/Onsen
18;nl;Welk ere-achtervoegsel wordt gebruikt om een professor of een kunstenaar aan te spreken ?;Sensei;Senpai;San;Kun;Confirmé;Standaard gebruiken we San, het meest basale achtervoegsel in het Japans, deze achtervoegsels kunnen over het algemeen worden vertaald als Monsieur.;https://nl.wikipedia.org/wiki/Sensei
19;nl;Hoe wordt het aangeraden om Kerstmis in Japan te vieren ?;Verliefd;Bij familie;Tussen collega's;Alleen;Confirmé;Het kerstfeest wordt geïmporteerd uit het Westen en is daarom puur commercieel en wordt beschouwd als een soort tweede Valentijnsdag.;
20;nl;Waar is Raijin (of Raiden) de god van in de Japanse mythologie ?;Donder;Dood;Moed;Zo;Confirmé;Het was Raiden die naar verluidt achter het faillissement van de Mongoolse invasiepoging van Japan in 1274 stond toen hij Typhoon Kamikaze creëerde.;
21;nl;Wat riskeert u in Japan door uw eetstokjes tijdens een maaltijd in voedsel te steken ?;Slecht voorteken;Ontevredenheid;Gevangenis;Uitsluiting;Expert;Japanse eetstokjes, kort, met een spitse punt, meestal gemaakt van gelakt hout, worden geconsumeerd met een snelheid van 400 wegwerp-eetstokjes per jaar.;https://nl.wikipedia.org/wiki/Eetstokjes
22;nl;Hoe is het geregeld om elkaar hartelijk te begroeten in Japan ?;Buigen;Schreeuwen;Door te zoenen;Door te knielen;Expert;De mate van kanteling is afhankelijk van de persoon die u wilt begroeten, met als doel lichamelijk contact zoveel mogelijk te vermijden.;https://nl.wikipedia.org/wiki/Japan
23;nl;Welke animatiefilmstudio is opgericht door Hayao Miyazaki ?;Ghibli;Madhouse;Toei;Pierrot;Expert;Bekend bij het grote publiek, haar belangrijkste werken zijn « Howl's Moving Castle », « Spirited Away » of zelfs « Princess Mononoke ».;https://nl.wikipedia.org/wiki/Studio_Ghibli
24;nl;Wat zijn hara-kiri en seppuku, gebruikt door een onteerde persoon ?;Zelfmoord;Theater;Gevangenis;Sabel;Expert;De hara-kiri werd gebruikt door een onteerd persoon (overspel, verraad, ...) en maakte het toen mogelijk om zijn eer te herwinnen en te wassen.;https://nl.wikipedia.org/wiki/Seppuku
25;nl;Welk nummer heeft in Japan dezelfde reputatie als het nummer 13 in het Westen ?;Vier;Zeven;Drie;Nieuw;Expert;In China, Japan en Korea is er een veel voorkomend bijgeloof, tetrafobie of de angst voor het getal 4 (dat dood wordt uitgesproken).;https://nl.wikipedia.org/wiki/4_(getal)
26;nl;Wat zegt een Japanner tegen jou die de woorden « Ohayou gozaimasu » zegt ?;Hallo;Tot ziens;Heel erg bedankt;Tot morgen;Expert;In Japan worden de woorden « Ohayou gozaimasu » vóór de middag gebruikt, terwijl het woord « Konichiha » meestal 's middags wordt gebruikt.;
27;nl;Wat is beter om in Japan te verwijderen voordat je een huis binnengaat ?;Zijn schoenen;Zijn broek;Zijn hoed;Zijn bril;Expert;De ingang van een huis wordt ook heel vaak verhoogd, wat het mogelijk maakt om de plaats te onderscheiden waar je je schoenen moet uittrekken.;https://nl.wikipedia.org/wiki/Japan
28;nl;Welk dier is de Kitsune, een bovennatuurlijk wezen met meerdere staarten ?;Fox;Wasbeer;Kat;Hond;Expert;Zowel een personage in de Japanse folklore als een bovennatuurlijke geest, er wordt gezegd dat het aantal staarten van de Kitsune evenredig is met zijn leeftijd.;https://nl.wikipedia.org/wiki/Kitsune
29;nl;Wat is er speciaal aan de release van « Dragon Quest » videospellen in Japan ?;Komt uit in het weekend;Is gratis;Uitgebracht op 1 januari;Is in het Frans;Expert;Er is overeenstemming bereikt tussen de overheid en het productiebedrijf, waarbij het verzuimpercentage op de releasedagen te hoog is.;https://nl.wikipedia.org/wiki/Dragon_Quest_(computerspelserie)
30;nl;Sado is de voorbereidingsceremonie voor welk drankje ?;Groene thee;Sake;Koffie;Kersensap;Expert;Gedeeltelijk geïnspireerd door het zenboeddhisme, met behulp van matcha, een gemalen groene theepoeder, is Sado een echte traditionele kunst in Japan.;
