1;fr;Combien de travaux Hercule dut-il exécuter pour Eurysthée, roi de Tirynthe ?;12;10;100;40;Débutant;Héraclès correspond à l'Hercule romain, au Melqart phénicien, à l'Hercle étrusque et au Kakasbos en Asie Mineure.;https://fr.wikipedia.org/wiki/Héraclès
2;fr;À quel âge Nadia Comaneci a-t-elle obtenu la note parfaite de 10 aux Jeux olympiques ?;14 ans;15 ans;13 ans;16 ans;Débutant;Nadia Comaneci a été naturalisée américaine après sa carrière sportive, n'ayant donc jamais représenté ce pays en compétition.;https://fr.wikipedia.org/wiki/Nadia_Comaneci
3;fr;Quelle est la différence chiffrée entre le carré de 87 et le carré de 86 ?;173;87;86;1;Débutant;Tout nombre réel strictement positif est le carré d'exactement deux nombres, l'un strictement positif, l'autre strictement négatif.;https://fr.wikipedia.org/wiki/Carré_(algèbre)
4;fr;Combien de milliers de passagers le Titanic pouvait-il contenir à son bord ?;3 000;2 000;1 000;4 000;Débutant;La coque du Titanic était pourvue de seize compartiments étanches servant à protéger le navire en cas de voies d'eau.;https://fr.wikipedia.org/wiki/Titanic
5;fr;En quelle année Charlemagne a-t-il été couronné empereur à Rome ?;800;900;700;600;Débutant;Souverain réformateur, soucieux de culture, il protège les arts et lettres et est à l'origine de la renaissance carolingienne.;https://fr.wikipedia.org/wiki/Charlemagne
6;fr;En mesure, quelle est la valeur en millimètres d'un pouce anglais ?;25 mm;32 mm;16 mm;45 mm;Débutant;Le pouce est une unité de longueur datant du Moyen Âge, aujourd'hui utilisée pour les tailles des pneus ou des écrans d'ordinateurs.;https://fr.wikipedia.org/wiki/Pouce_(unité)
7;fr;Quel âge avait Mozart lorsque son premier opéra fut joué en public ?;13 ans;15 ans;11 ans;17 ans;Débutant;Mort à 35 ans, Mozart laisse derrière lui 626 œuvres répertoriées qui embrassent tous les genres musicaux de son époque.;https://fr.wikipedia.org/wiki/Wolfgang_Amadeus_Mozart
8;fr;Dans la mythologie grecque, combien d'Argonautes ont accompagné Jason ?;50;40;100;500;Débutant;Le périple des Argonautes a donné lieu à plusieurs péplums qui s'inspirent assez librement des différentes sources du mythe.;https://fr.wikipedia.org/wiki/Argonautes
9;fr;En quelle année a eu lieu le tout premier Festival de Cannes ?;1946;1956;1966;1976;Débutant;Le Festival fut fondé en 1946 sur un projet de Jean Zay, ministre de l'Éducation nationale et des Beaux-arts du Front populaire.;https://fr.wikipedia.org/wiki/Festival_de_Cannes
10;fr;Combien d'année Robinson Crusoé a-t-il passées sur son île ?;28;24;20;16;Débutant;Robinson Crusoé est un roman anglais écrit par Daniel Defoe dont l'histoire s'inspire très librement de la vie d'Alexandre Selkirk.;https://fr.wikipedia.org/wiki/Robinson_Crusoé
11;fr;En informatique, combien y a-t-il d'octets dans un kilooctet ?;1 024;256;512;32;Confirmé;Le terme est utilisé comme unité de mesure en informatique pour indiquer la capacité de mémorisation des mémoires.;https://fr.wikipedia.org/wiki/Octet
12;fr;En quelle année Michel Preud'homme a-t-il décroché le Prix Lev Yachine ?;1994;1992;1990;1988;Confirmé;Michel Preud'homme a occupé le poste d'entraîneur au Standard de Liège, après avoir été le directeur sportif du même club.;https://fr.wikipedia.org/wiki/Michel_Preud'homme
13;fr;Combien le site de Carnac compte-t-il de menhirs dans ses alignements ?;2 934;2 394;1 934;1 394;Confirmé;Le site de Carnac est située sur la limite nord de Mor braz, entre le golfe du Morbihan à l'est et la presqu'île de Quiberon à l'ouest.;https://fr.wikipedia.org/wiki/Carnac
14;fr;Combien dénombre-t-on à ce jour de satellites naturels connus autour de Jupiter ?;69;59;49;39;Confirmé;Jupiter est la deuxième planète du Système solaire, après Saturne, avec le plus grand nombre de satellites naturels observés.;https://fr.wikipedia.org/wiki/Satellites_naturels_de_Jupiter
15;fr;Quelle distance sépare la ligne de départ de la première haie au 400m haie ?;45 m;37 m;29 m;18 m;Confirmé;Les meilleurs athlètes masculins finissent la course en environ 47 secondes et les athlètes féminines en environ 53 secondes.;https://fr.wikipedia.org/wiki/400_mètres_haies
16;fr;Combien de matchs l'équipe nationale de foot belge a-t-elle disputés avec Guy Thys ?;100;80;120;140;Confirmé;Né à Anvers et fils de Ivan Thys, Guy Thys a été l'entraîneur de l'équipe nationale belge de football le plus couronné de succès.;https://fr.wikipedia.org/wiki/Guy_Thys
17;fr;Quel est le pourcentage de silicium entrant dans la composition de l'écorce terrestre ?;25 %;19 %;8 %;32 %;Confirmé;Le silicium n'est comparativement présent qu'en relativement faible quantité dans la matière constituant le vivant.;https://fr.wikipedia.org/wiki/Silicium
18;fr;Combien d'années Ferdinand Marcos a-t-il été président des Philippines ?;21;17;25;19;Confirmé;Marcos peut être considéré comme un expert du détournement de fonds: il aurait détourné des milliards de dollars du Trésor philippin.;https://fr.wikipedia.org/wiki/Ferdinand_Marcos
19;fr;Combien de spectateurs peuvent aujourd'hui accueillir les arènes de Vérone ?;22 000;19 000;16 000;13 000;Confirmé;Presque tous les soirs de mars à septembre environ, des spectacles ont lieu et ont pour thème les anciens combats de gladiateurs.;https://fr.wikipedia.org/wiki/Arènes_de_Vérone
20;fr;Combien de pièces contenait le palais impérial dans la Cité interdite ?;9 999;8 888;7 777;6 666;Confirmé;Le chiffre de 9 999 s'explique par le fait que seules leurs divinités avaient le droit de construire un palais comprenant 10 000 pièces.;https://fr.wikipedia.org/wiki/Cité_interdite
21;fr;Quelle est la longueur totale du pont du Golden Gate de San Francisco ?;1 280 m;1 146 m;1 073 m;996 m;Expert;Le pont du Golden Gate fut, jusqu'en 1964, le pont suspendu le plus long du monde et reste un célèbre monument de San Francisco.;https://fr.wikipedia.org/wiki/Pont_du_Golden_Gate
22;fr;Combien de chansons d'Elvis Presley ont été numéro un au hit-parade américain ?;18;16;14;12;Expert;Elvis a contribué à populariser le genre naissant du rockabilly, un mélange énergique de musique country et de rhythm and blues.;https://fr.wikipedia.org/wiki/Elvis_Presley
23;fr;Dans la mythologie grecque, combien le géant Argos avait-il d'yeux ?;100;80;60;40;Expert;Il y en a en permanence cinquante qui dorment et cinquante qui veillent, de sorte qu'il soit impossible de tromper sa vigilance.;https://fr.wikipedia.org/wiki/Argos_(Panoptès)
24;fr;De combien de fois la superficie de la Chine est-elle plus grande que celle du Japon ?;39;29;19;9;Expert;Le Japon forme, depuis 1945, un archipel de 6 852 îles dont les quatre plus grandes sont Hokkaido, Honshu, Shikoku, et Kyushu.;https://fr.wikipedia.org/wiki/Japon
25;fr;Quelle est la longueur de la cordillère des Andes culminant à 6 962 mètres ?;7 100 km;6 700 km;8 300 km;9 700 km;Expert;La cordillère des Andes débute au Venezuela puis traverse la Colombie, l'Équateur, le Pérou, la Bolivie, le Chili et l'Argentine.;https://fr.wikipedia.org/wiki/Cordillère_des_Andes
26;fr;Quelle est la longueur du tunnel ferroviaire japonais du Seikan ?;53 km;42 km;37 km;29 km;Expert;Le tunnel du Seikan est légèrement plus long que le tunnel sous la Manche et comporte un tronçon de 23.3 km sous le fond marin.;https://fr.wikipedia.org/wiki/Tunnel_du_Seikan
27;fr;Combien de confettis ont été lancés sur John Glenn après son voyage célèbre spatial ?;3 474 tonnes;2 828 tonnes;1 732 tonnes;4 437 tonnes;Expert;Après avoir quitté la NASA en 1963, il entame une carrière politique infructueuse qui l'oblige à se tourner vers le monde des affaires.;https://fr.wikipedia.org/wiki/John_Glenn
28;fr;Combien de soldats environ compte l'armée enterrée de l'empereur Qin ?;8 000;6 000;4 000;10 000;Expert;Des couleurs minérales étaient appliquées après cuisson sur les statues permettant ainsi de distinguer les différentes unités.;https://fr.wikipedia.org/wiki/Mausolée_de_l'empereur_Qin
29;fr;En quelle année Nicolas Appert a-t-il découvert la boîte de conserve ?;1795;1829;1847;1902;Expert;L'appertisation peut être définie comme un procédé de conservation qui consiste à stériliser par la chaleur des denrées périssables.;https://fr.wikipedia.org/wiki/Nicolas_Appert
30;fr;Quel est le nombre d'îles présentes sur l'ensemble du territoire finlandais ?;180 000;160 000;140 000;120 000;Expert;La plupart des îles sont dans le Sud-Ouest, dans l'archipel d'Aland, et le long de la côte méridionale du golfe de Finlande.;https://fr.wikipedia.org/wiki/Finlande
31;en;How many works did Hercules execute for Eurystheus, King of Tiryns ?;12;10;100;40;Beginner;Hebrew corresponds to Roman Hercules, Phenician Melqart, Artifical Circle and Kakasbos in Asia Minor.;https://en.wikipedia.org/wiki/Heracles
32;en;At what age did Nadia Comaneci get the perfect score of 10 at the Olympics ?;14 years old;15 years old;13 years old;16 years old;Beginner;Nadia Comaneci was naturalized American after her sports career, having never represented this country in competition.;https://en.wikipedia.org/wiki/Nadia_Com?neci
33;en;What is the difference between the 87 and the 86 square ?;173;87;86;1;Beginner;Every strictly positive real number is the square of exactly two numbers, one strictly positive, the other strictly negative.;https://en.wikipedia.org/wiki/Square_(algebra)
34;en;How many thousands of passengers could the Titanic hold on board ?;3,000;2,000;1,000;4,000;Beginner;The Titanic's hull was equipped with sixteen watertight compartments to protect the ship from waterways.;https://en.wikipedia.org/wiki/RMS Titanic
35;en;In which year was Charlemagne crowned emperor in Rome ?;800;900;700;600;Beginner;Sovereign reformer, culturally conscious, he protects the arts and letters and is at the origin of the Carolingian renaissance.;https://en.wikipedia.org/wiki/Charlemagne
36;en;In measure, what is the value in millimeters of an inch ?;25 mm;32 mm;16 mm;45 mm;Beginner;The thumb is a unit dating back to the Middle Ages, now used for tire sizes or computer screens.;https://en.wikipedia.org/wiki/Inch
37;en;What age had Mozart when his first opera was performed in public ?;13 years old;15 years old;11 years old;17 years old;Beginner;Died at the age of 35, Mozart leaves behind him 626 works of art that embrace all the musical genres of his time.;https://en.wikipedia.org/wiki/Wolfgang_Amadeus_Mozart
38;en;In Greek mythology, how many Argonauts accompanied Jason ?;50;40;100;500;Beginner;The Argonauts plague has given rise to several pleas that are inspired quite freely from different sources of myth.;https://en.wikipedia.org/wiki/Argonauts
39;en;In which year did the first Cannes Film Festival take place ?;1946;1956;1966;1976;Beginner;The Festival was founded in 1946 on a project by Jean Zay, Minister of National Education and Fine Arts of the Popular Front.;https://en.wikipedia.org/wiki/Cannes_Film_Festival
40;en;How many years has Robinson Crusoe spent on his island ?;28;24;20;16;Beginner;Robinson Crusoe is an English novel written by Daniel Defoe whose story is very freely inspired by the life of Alexander Selkirk.;https://en.wikipedia.org/wiki/Robinson_Crusoe
41;en;In computing, how many bytes are in a kilobyte ?;1 024;256;512;32;Confirmed;The term is used as a computer measurement unit to indicate memory memorization ability.;https://en.wikipedia.org/wiki/Octet (computing)
42;en;In which year did Michel Preud'homme win the Lev Yachine Prize ?;1994;1992;1990;1988;Confirmed;Michel Preud'homme held the coaching post at Standard de Liege, after being the sports director of the same club.;https://en.wikipedia.org/wiki/Michel_Preud'homme
43;en;How much does the site of Carnac have menhirs in its alignments ?;2 934;2 394;1 934;1 394;Confirmed;The Carnac site is located on the northern limit of Mor Braz, between the Gulf of Morbihan to the east and the Quiberon peninsula to the west.;https://en.wikipedia.org/wiki/Carnac
44;en;How many so far are known natural satellites around Jupiter ?;69;59;49;39;Confirmed;Jupiter is the second planet of the Solar System, after Saturn, with the largest number of natural satellites observed.;https://en.wikipedia.org/wiki/Moons_of_Jupiter
45;en;How far is the departure line from the first hurdle to the 400m hurdle ?;45 m;37 m;29 m;18 m;Confirmed;The best male athletes finish the race in about 47 seconds and the female athletes in about 53 seconds.;https://en.wikipedia.org/wiki/400_metres_hurdles
46;en;How many matches has the Belgian national football team played with Guy Thys ?;100;80;120;140;Confirmed;Born in Antwerp and son of Ivan Thys, Guy Thys was the coach of the most successful Belgian national football team.;https://en.wikipedia.org/wiki/Guy_Thys
47;en;What is the percentage of silicon used in the composition of the terrestrial bark ?;25%;19%;8%;32%;Confirmed;Silicon is comparatively only present in relatively small amounts in the matter constituting the living.;https://en.wikipedia.org/wiki/Silicon
48;en;How many years has Ferdinand Marcos been President of the Philippines ?;21;17;25;19;Confirmed;Marcos may be considered as an expert on the disbursement of funds: he would have turned away billions of dollars from the Philippine Treasury.;https://en.wikipedia.org/wiki/Ferdinand_Marcos
49;en;How many spectators can today welcome the arenas of Verona ?;22,000;19,000;16,000;13 000;Confirmed;Almost every night from March to September, shows take place and have the theme of ancient gladiatorial fights.;https://en.wikipedia.org/wiki/Verona_Arena
50;en;How many pieces contained the imperial palace in the Forbidden City ?;9,999;8,888;7,777;6,666;Confirmed;The figure of 9,999 is explained by the fact that only their divinities were allowed to build a palace with 10,000 pieces.;https://en.wikipedia.org/wiki/Forbidden_City
51;en;What is the total length of the Golden Gate Bridge in San Francisco ?;1 280 m;1 146 m;1 073 m;996 m;Expert;The Golden Gate Bridge was, until 1964, the longest suspension bridge in the world and remains a famous monument of San Francisco.;https://en.wikipedia.org/wiki/Golden_Gate_Bridge
52;en;How many songs of Elvis Presley were number one in the American hit parade ?;18;16;14;12;Expert;Elvis has helped popularize the nascent rockabilly genre, an energetic mix of country music and rhythm and blues.;https://en.wikipedia.org/wiki/Elvis_Presley
53;en;In Greek mythology, how much did the giant Argos have eyes ?;100;80;60;40;Expert;There are always fifty who sleep and fifty who watch, so that it is impossible to deceive his vigilance.;https://en.wikipedia.org/wiki/Argus_Panoptes
54;en;How often is China's area larger than Japan's ?;39;29;19;9;Expert;Since 1945, Japan has formed an archipelago of 6,852 islands, the four largest of which are Hokkaido, Honshu, Shikoku, and Kyushu.;https://en.wikipedia.org/wiki/Japan
55;en;What is the length of the Andes mountain range at 6,962 meters ?;7,100 km;6,700 km;8,300 km;9,700 km;Expert;The Andes cordillera begins in Venezuela and then crosses Colombia, Ecuador, Peru, Bolivia, Chile and Argentina.;https://en.wikipedia.org/wiki/Andes
56;en;How long is the Seikan Japanese Railway Tunnel ?;53 km;42 km;37 km;29 km;Expert;The Seikan tunnel is slightly longer than the Channel Tunnel and has a 23.3 km section under the seabed.;https://en.wikipedia.org/wiki/Seikan_Tunnel
57;en;How many confetti were thrown at John Glenn after his famous space trip ?;3,474 tonnes;2,828 tonnes;1,732 tonnes;4,437 tonnes;Expert;After leaving NASA in 1963, he began an unsuccessful political career that forced him to turn to the business world.;https://en.wikipedia.org/wiki/John_Glenn
58;en;How many soldiers does the Emperor Qin's buried army have ?;8,000;6,000;4,000;10,000;Expert;Mineral colors were applied after cooking on the statues thus making it possible to distinguish the different units.;https://en.wikipedia.org/wiki/Mausoleum_of_the_First_Qin_Emperor
59;en;In which year did Nicolas Appert discover the tin can ?;1795;1829;1847;1902;Expert;Canning can be defined as a process of conservation which consists in sterilizing by heat the perishable goods.;https://en.wikipedia.org/wiki/Nicolas_Appert
60;en;What is the number of islands present in all of Finland ?;180,000;160,000;140,000;120,000;Expert;Most of the islands are in the South West, in the Aland Archipelago, and along the southern coast of the Gulf of Finland.;https://en.wikipedia.org/wiki/Finland
61;de;Wie viele Werke hat Herkules für Eurystheus, König von Tiryns, ausgeführt ?;12;10;100;40;Newbie;Hebräisch entspricht Roman Hercules, Phönizier Melqart, Künstlicher Kreis und Kakasbos in Kleinasien.;https://de.wikipedia.org/wiki/Herakles
62;de;In welchem Alter erreichte Nadia Comaneci bei den Olympischen Spielen die perfekte Punktzahl von 10 ?;14 Jahre alt;15 Jahre alt;13 Jahre alt;16 Jahre alt;Newbie;Nadia Comaneci wurde nach ihrer Sportkarriere in den USA eingebürgert, nachdem sie dieses Land noch nie im Wettbewerb vertreten hatte.;https://de.wikipedia.org/wiki/Nadia_Com?neci
63;de;Was ist der Unterschied zwischen dem 87er und dem 86er Quadrat ?;173;87;86;1;Newbie;Jede streng positive reelle Zahl ist das Quadrat aus genau zwei Zahlen, eine streng positive und eine streng negative.;https://de.wikipedia.org/wiki/Quadrat_(Mathematik)
64;de;Wie viele tausend Passagiere konnte die Titanic an Bord halten ?;3.000;2.000;1.000;4.000;Newbie;Der Rumpf der Titanic war mit sechzehn wasserdichten Fächern ausgestattet, um das Schiff vor Wasserstraßen zu schützen.;https://de.wikipedia.org/wiki/RMS Titanic
65;de;In welchem Jahr wurde Karl der Große in Rom zum Kaiser gekrönt ?;800;900;700;600;Newbie;Souveräner Reformer, kulturbewusst, beschützt die Künste und Briefe und steht am Ursprung der karolingischen Renaissance.;https://de.wikipedia.org/wiki/Karl_der_Große
66;de;Was ist der Millimeter-Zoll-Wert ?;25 mm;32 mm;16 mm;45 mm;Newbie;Der Daumen ist eine Einheit aus dem Mittelalter, die heute für Reifengrößen oder Computerbildschirme verwendet wird.;https://de.wikipedia.org/wiki/Zoll_(Einheit)
67;de;In welchem Alter war Mozart, als seine erste Oper öffentlich aufgeführt wurde ?;13 Jahre;15 Jahre;11 Jahre;17 Jahre;Newbie;Mozart ist 35 Jahre alt und hinterlässt 626 Kunstwerke, die alle musikalischen Genres seiner Zeit umfassen.;https://de.wikipedia.org/wiki/Wolfgang_Amadeus_Mozart
68;de;Wie viele Argonauten begleiteten Jason in der griechischen Mythologie ?;50;40;100;500;Newbie;Die Argonautenpest hat zu mehreren Klagegründen geführt, die sich ganz frei von verschiedenen Mythosquellen inspirieren lassen.;https://de.wikipedia.org/wiki/Argonautensage
69;de;In welchem Jahr fanden die ersten Filmfestspiele von Cannes statt ?;1946;1956;1966;1976;Newbie;Das Festival wurde 1946 auf der Grundlage eines Projekts von Jean Zay, Minister für nationale Bildung und Bildende Kunst der Volksfront, gegründet.;https://de.wikipedia.org/wiki/Internationale_Filmfestspiele_von_Cannes
70;de;Wie viele Jahre hat Robinson Crusoe auf seiner Insel verbracht ?;28;24;20;16;Newbie;Robinson Crusoe ist ein englischer Roman von Daniel Defoe, dessen Geschichte sehr frei vom Leben von Alexander Selkirk inspiriert ist.;https://de.wikipedia.org/wiki/Robinson_Crusoe
71;de;Wie viele Bytes enthält ein Kilobyte ?;1 024;256;512;32;Bestätigt;Der Begriff wird als Computermesseinheit verwendet, um die Fähigkeit zum Speichern von Speichern anzuzeigen.;https://de.wikipedia.org/wiki/Oktett (Informatik)
72;de;In welchem Jahr hat Michel Preud'homme den Lev Yachine-Preis gewonnen ?;1994;1992;1990;1988;Bestätigt;Michel Preud'homme bekleidete den Trainerposten bei Standard de Liège, nachdem er der Sportdirektor desselben Vereins war.;https://de.wikipedia.org/wiki/Michel_Preud?homme
73;de;Wie viel Menhire hat der Standort Carnac in seinen Ausrichtungen ?;2 934;2 394;1 934;1 394;Bestätigt;Der Standort Carnac befindet sich an der Nordgrenze von Mor Braz, zwischen dem Golf von Morbihan im Osten und der Halbinsel Quiberon im Westen.;https://de.wikipedia.org/wiki/Carnac
74;de;Wie viele natürliche Satelliten sind bisher rund um Jupiter bekannt ?;69;59;49;39;Bestätigt;Jupiter ist nach Saturn der zweite Planet des Sonnensystems, auf dem die meisten natürlichen Satelliten beobachtet werden.;https://de.wikipedia.org/wiki/Liste_der_Jupitermonde
75;de;Wie weit ist die Abfahrtslinie von der ersten Hürde bis zur 400-m-Hürde ?;45 m;37 m;29 m;18 m;Bestätigt;Die besten männlichen Athleten beenden das Rennen in ca. 47 Sekunden und die weiblichen Athleten in ca. 53 Sekunden.;https://de.wikipedia.org/wiki/400-Meter-Hürdenlauf
76;de;Wie viele Spiele hat die belgische Fußballnationalmannschaft mit Guy Thys gespielt ?;100;80;120;140;Bestätigt;Guy Thys wurde in Antwerpen als Sohn von Ivan Thys geboren und war der Trainer der erfolgreichsten belgischen Fußballnationalmannschaft.;https://de.wikipedia.org/wiki/Guy_Thys
77;de;Wie viel Prozent Silizium werden für die Zusammensetzung der Erdrinde verwendet ?;25%;19%;8%;32%;Bestätigt;Silizium ist in der Materie der Lebenden vergleichsweise nur in relativ geringen Mengen vorhanden.;https://de.wikipedia.org/wiki/Silicium
78;de;Wie viele Jahre war Ferdinand Marcos Präsident der Philippinen ?;21;17;25;19;Bestätigt;Marcos kann als Experte für die Auszahlung von Geldern gelten: Er hätte Milliarden von Dollar vom philippinischen Finanzministerium abgewiesen.;https://de.wikipedia.org/wiki/Ferdinand_Marcos
79;de;Wie viele Zuschauer können heute die Arenen von Verona begrüßen ?;22.000;19.000;16.000;13 000;Bestätigt;Fast jede Nacht von März bis September finden Shows statt, die das Thema antiker Gladiatorenkämpfe haben.;https://de.wikipedia.org/wiki/Arena_von_Verona
80;de;Wie viele Stücke enthielten den Kaiserpalast in der Verbotenen Stadt ?;9.999;8.888;7.777;6 666;Bestätigt;Die Zahl von 9.999 erklärt sich aus der Tatsache, dass nur ihre Gottheiten einen Palast mit 10.000 Stücken errichten durften.;https://de.wikipedia.org/wiki/Verbotene_Stadt
81;de;Wie lang ist die Golden Gate Bridge in San Francisco insgesamt ?;1 280 m;1 146 m;1 073 m;996 m;Expert;Die Golden Gate Bridge war bis 1964 die längste Hängebrücke der Welt und ist bis heute ein berühmtes Denkmal von San Francisco.;https://de.wikipedia.org/wiki/Golden_Gate_Bridge
82;de;Wie viele Songs von Elvis Presley waren die Nummer eins in der amerikanischen Hitparade ?;18;16;14;12;Expert;Elvis hat geholfen, das aufkeimende Rockabilly-Genre, eine energiegeladene Mischung aus Country-Musik und Rhythmus und Blues, bekannt zu machen.;https://de.wikipedia.org/wiki/Elvis_Presley
83;de;Wie viele Augen hatte der Riese Argos in der griechischen Mythologie ?;100;80;60;40;Expert;Es gibt immer fünfzig, die schlafen und fünfzig, die zuschauen, so dass es unmöglich ist, seine Wachsamkeit zu täuschen.;https://de.wikipedia.org/wiki/Argos_(Riese)
84;de;Wie oft ist Chinas Fläche größer als die Japans ?;39;29;19;9;Expert;Seit 1945 hat Japan ein Archipel von 6.852 Inseln gebildet, von denen die vier größten Hokkaido, Honshu, Shikoku und Kyushu sind.;https://de.wikipedia.org/wiki/Japan
85;de;Wie lang sind die Anden mit 6.962 Metern ?;7.100 km;6.700 km;8.300 km;9.700 km;Expert;Die Andenkordillere beginnt in Venezuela und durchquert dann Kolumbien, Ecuador, Peru, Bolivien, Chile und Argentinien.;
86;de;Wie lang ist der japanische Eisenbahntunnel von Seikan ?;53 km;42 km;37 km;29 km;Expert;Der Seikan-Tunnel ist etwas länger als der Kanaltunnel und hat einen Abschnitt von 23,3 km unter dem Meeresboden.;https://de.wikipedia.org/wiki/Seikan-Tunnel
87;de;Wie viele Konfetti wurden nach seiner berühmten Raumfahrt auf John Glenn geworfen ?;3,474 Tonnen;2,828 Tonnen;1,732 Tonnen;4,437 Tonnen;Expert;Nachdem er die NASA 1963 verlassen hatte, begann eine erfolglose politische Karriere, die ihn zwang, sich der Geschäftswelt zuzuwenden.;https://de.wikipedia.org/wiki/John_Glenn
88;de;Wie viele Soldaten hat die beerdigte Armee des Kaisers Qin ?;8.000;6.000;4.000;10.000;Expert;Nach dem Garen der Statuen wurden Mineralfarben aufgetragen, wodurch die verschiedenen Einheiten unterschieden werden konnten.;https://de.wikipedia.org/wiki/Mausoleum_Qin_Shihuangdis
89;de;In welchem Jahr entdeckte Nicolas Appert die Blechdose ?;1795;1829;1847;1902;Expert;Einmachen kann als ein Konservierungsprozess definiert werden, der darin besteht, die verderblichen Waren durch Erhitzen zu sterilisieren.;https://de.wikipedia.org/wiki/Nicolas_Appert
90;de;Wie viele Inseln gibt es in ganz Finnland ?;180.000;160.000;140.000;120.000;Expert;Die meisten Inseln liegen im Südwesten, im Aland-Archipel und an der Südküste des Finnischen Meerbusens.;https://de.wikipedia.org/wiki/Finnland
91;es;¿Cuántas obras ejecutó Hércules para Eurystheus, el rey de Tiryns ?;12;10;100;40;Novato;El hebreo corresponde a Roman Hercules, Phenician Melqart, Artifical Circle y Kakasbos in Asia Minor.;https://es.wikipedia.org/wiki/Heracles
92;es;¿A qué edad obtuvo Nadia Comaneci la puntuación perfecta de 10 en los Juegos Olímpicos ?;14 años;15 años;13 años;16 años;Novato;Nadia Comaneci se naturalizó en Estados Unidos después de su carrera deportiva, ya que nunca representó a este país en la competencia.;https://es.wikipedia.org/wiki/Nadia_Com?neci
93;es;¿Cuál es la diferencia entre el 87 y el 86 cuadrado ?;173;87;86;1;Novato;Cada número real estrictamente positivo es el cuadrado de exactamente dos números, uno estrictamente positivo y el otro estrictamente negativo.;https://es.wikipedia.org/wiki/Cuadrado_(álgebra)
