23;de;Wer ist einer der drei besten französischen Fußballtrainer des 20. Jahrhunderts ?;Albert Batteux;Albert Finney;Albert Dieudonné;Albert Lebrun;Expert;Als Batteux Trainer des Stade de Reims wurde, entwickelte er einen Spielstil, den wir das Reims-Spiel nennen würden.;https://de.wikipedia.org/wiki/Albert_Batteux
24;de;Wer war Monsieur Loyal im ersten Zirkus von Jean Richard ?;Albert Préjean;Albert Ducrocq;Albert Costa;Albert Kahn;Expert;Er vertraute seine Erinnerungen seinem Sohn Patrick Préjean in einem 1979 veröffentlichten Buch an.;
25;de;Welchen Preis haben die besten französischsprachigen Journalisten seit 1933 erhalten ?;Albert London;Albert Finney;Albert Decourtray;Albert Spaggiari;Expert;Albert Londres wird sagen : Unsere Aufgabe ist es nicht, zu gefallen oder Schaden anzurichten, sondern die Feder in der Wunde zu tragen.;https://de.wikipedia.org/wiki/Albert_Londres
26;de;Wer ist der Erfinder eines Luftbildsystems, der Hélivision ?;Albert Lamorisse;Albert Decourtray;Albert Calmette;Albert Lebrun;Expert;Diese bahnbrechende Technik von Antivibrationssystemen für Luftaufnahmen wurde im ersten « James Bond » verwendet.;https://de.wikipedia.org/wiki/Albert_Lamorisse
27;de;Welcher Albert war 1945 französischer Rugby-Union-Champion ?;Albert Ferrasse;Albert Samain;Albert Batteux;Albert Calmette;Expert;Albert Ferrasse, der bei SU Agen in der zweiten linken Reihe spielte, war aufgrund seiner Entspannung ein ausgezeichneter Touchdown-Empfänger.;
28;de;Welchem Kybernetiker schulden wir unter anderem den elektronischen Fuchs ?;Albert Ducrocq;Albert Jacquard;Albert Spaggiari;Albert Kahn;Expert;Ducrocq hatte es mit einem von einem Minensuchgerät geborgenen Massendetektionsgerät mit einem kapazitiven Sinn ausgestattet.;https://de.wikipedia.org/wiki/Albert_Ducrocq
29;de;Welcher französische symbolistische Dichter verwendete Sonette mit fünfzehn Zeilen ?;Albert Samain;Albert London;Albert Spaggiari;Albert Jacquard;Expert;Viele Musiker komponieren Melodien zu seinen Texten, wie « Arpège » von Gabriel Fauré oder « La Maison du matin ».;https://de.wikipedia.org/wiki/Albert_Samain
30;de;Welcher Serienmörder hat zwischen 1962 und 1964 dreizehn Frauen erwürgt ?;Albert DeSalvo;Albert Ducrocq;Albert Dieudonné;Albert Kahn;Expert;Er wurde auch der Mann in Grün genannt, in Bezug auf die Farbe des Outfits seines Arbeiters, das Reparaturen durchführt.;https://de.wikipedia.org/wiki/Albert_Henry_DeSalvo
1;es;¿Qué humorista francés es conocido por sus bocetos en el canal Canal + ?;Albert Algoud;Albert Spaggiari;Albert Préjean;Albert Ferrasse;Débutant;En « Nulle part ailleurs », apareció en la banda de actores que participaron en la filmación de los bocetos de Karl Zero.;
2;es;¿Qué Albert escribió obras de teatro, novelas, cuentos y poemas ?;Albert Camus;Albert Uderzo;Albert Ducrocq;Albert Samain;Débutant;El premio Nobel Albert Camus desarrolló un humanismo basado en la conciencia del absurdo de la condición humana.;https://es.wikipedia.org/wiki/Albert_Camus
3;es;¿Qué príncipe de Mónaco se casó con la nadadora Charlène Wittstock ?;Albert II;Albert I;Albert III;Albert IV;Débutant;El príncipe Alberto II es hijo del príncipe Rainiero III (1923-2005) y Grace Kelly (1929-1982), una actriz estadounidense internacional.;https://es.wikipedia.org/wiki/Alberto_II_de_Mónaco
4;es;¿Quiénes fueron sucesivamente alemanes, apátridas, suizos y suizoamericanos ?;Albert Einstein;Albert Schweitzer;Albert Batteux;Albert Fratellini;Débutant;Albert Einstein publicó su teoría de la relatividad especial en 1905 y su teoría de la gravedad conocida como relatividad general en 1915.;https://es.wikipedia.org/wiki/Albert_Einstein
5;es;¿Quién se convirtió en el tercer rey de los belgas el 23 de diciembre de 1909 ?;Albert I;Albert II;Albert III;Albert IV;Débutant;Apasionado del montañismo y autor de grandes escaladas, murió en 1934 en un accidente de escalada en Marche-les-Dames.;https://es.wikipedia.org/wiki/Alberto_I_de_Bélgica
6;es;¿Quién es el creador, con el guionista René Goscinny, de la serie « Asterix »;Albert Uderzo;Albert Calmette;Albert Ferrasse;Albert Ducrocq;Débutant;Albert Uderzo, que es daltónico, la coloración de los álbumes de « Asterix » fue proporcionada durante mucho tiempo por su hermano Marcel Uderzo.;https://es.wikipedia.org/wiki/Albert_Uderzo
7;es;¿Quién era con sus dos hermanos un payaso de fama mundial ?;Albert Fratellini;Albert Ferrasse;Albert Dieudonné;Albert Dupontel;Débutant;Albert se casó con Amalia di Palma. Tuvieron una hija, Alberta-Luisa, casada con el director de circo holandés Ernest Carré.;
8;es;¿Qué Albert ha propuesto bocetos de culto como « Le Bac » o « Rambo » ?;Albert Dupontel;Albert Algoud;Alberto Contador;Albert Canet;Débutant;Deseando preservar a su familia y particularmente a su padre, Philippe Guillaume eligió Albert Dupontel como su nombre artístico.;https://es.wikipedia.org/wiki/Albert_Dupontel
9;es;¿Qué biólogo es especialista en genética de poblaciones ?;Albert Jacquard;Albert Samain;Albert Schweitzer;Albert Algoud;Débutant;También es miembro del comité de patrocinio de la Coordinación francesa para la Década de la Cultura de Paz y No Violencia.;https://es.wikipedia.org/wiki/Albert_Jacquard
10;es;¿Quién fue presidente de la República Francesa de 1932 a 1940 ?;Albert Lebrun;Albert Decourtray;Albert Batteux;Albert London;Débutant;Persuadido de ser un recurso frente a peligros eminentes, aceptó en 1939 postularse para un segundo mandato.;https://es.wikipedia.org/wiki/Albert_Lebrun
11;es;¿Qué médico y pastor recibió el Premio Nobel de la Paz en 1952 ?;Albert Schweitzer;Albert Costa;Albert Lamorisse;Albert Finney;Confirmé;El hospital que desarrolló en el bosque ecuatorial en el borde del Ogooué desde 1913 lo dio a conocer en todo el mundo.;https://es.wikipedia.org/wiki/Albert_Schweitzer
12;es;¿Quién se sabe que fue el autor intelectual del atraco del siglo en 1976 ?;Albert Spaggiari;Albert Costa;Albert Jacquard;Albert Canet;Confirmé;Partidario de la OEA, escritor y fotógrafo, escapó de la policía francesa durante su carrera que duró hasta su muerte.;https://es.wikipedia.org/wiki/Albert_Spaggiari
13;es;¿Cuál de estas proposiciones no designa una novela de Albert Cohen ?;« Mission »;« Solal »;« Mangeclous »;« Les Valeureux »;Confirmé;Al principio diplomático, publicó su primera novela en 1930, pero no fue hasta 1968 que se hizo famoso con « Belle du Seigneur ».;https://es.wikipedia.org/wiki/Albert_Cohen
14;es;¿Qué tenista español fue el ganador de Roland Garros en 2002 ?;Albert Costa;Albert Préjean;Albert Samain;Albert DeSalvo;Confirmé;Especialista en tierra batida, ganó 12 torneos ATP, todos en esta superficie, superando a Juan Carlos Ferrero en la final de 2002.;https://es.wikipedia.org/wiki/Albert_Costa
15;es;¿A quién le debemos la vacuna antituberculosa con BCG ?;Albert Calmette;Albert Spaggiari;Albert Schweitzer;Albert Einstein;Confirmé;Era hermano de Émile Calmette, inspector médico general de las fuerzas armadas, y Gaston Calmette, director de Le Figaro.;https://es.wikipedia.org/wiki/Albert_Calmette
16;es;¿Qué presentador de televisión está asociado con « Tender Age y Wood Head » ?;Albert Raisner;Albert Préjean;Albert London;Albert Algoud;Confirmé;Fue una figura emblemática del panorama audiovisual francés de los años sesenta y un pionero de la era del yé-yés.;
17;es;¿Quién interpretó a Ernest Hemingway y Winston Churchill en televisión ?;Albert Finney;Albert Algoud;Albert Canet;Albert Samain;Confirmé;Comediante, director, productor y cantante, ha sido nominado en dos ocasiones a los premios Tony por el papel de Martín Lutero.;https://es.wikipedia.org/wiki/Albert_Finney
18;es;¿Quién es el actor principal de « Napoleón », una película de Abel Gance ?;Albert Dieudonné;Albert Calmette;Albert Dupontel;Albert Algoud;Confirmé;Según Jean Tulard, habría estado tan marcado por su papel que a lo largo de los años habría llegado a pensar en sí mismo como el emperador.;
19;es;¿Qué Albert fue presidente de la Federación Francesa de Tenis ?;Albert Canet;Albert Jacquard;Albert Lebrun;Albert Decourtray;Confirmé;Hijo del ingeniero Gustave Canet, diseñador del famoso cañón Canet, Albert Canet fue presidente de la FFT desde 1925 hasta 1930.;
20;es;¿En qué arte se ilustra el francés Albert Marquet con sus colores vivos ?;Pintura;Fotografía;Escultura;Cine;Confirmé;La obra de Albert Marquet se compone de planos simplificados, en colores vivos y degradados, con un consumado arte de enmarcar.;https://es.wikipedia.org/wiki/Albert_Marquet
21;es;¿Quién recopiló una colección iconográfica titulada « Archivos del Planeta » ?;Albert Kahn;Albert Calmette;Albert Jacquard;Albert Lamorisse;Expert;Esta colección compuesta por autocromos (fotografías en color sobre placas de vidrio) es la más grande del mundo.;https://es.wikipedia.org/wiki/Albert_Kahn_(banquero)
22;es;¿Qué cardenal fue también arzobispo de Lyon y académico francés ?;Albert Decourtray;Albert Raisner;Albert London;Albert Ducrocq;Expert;Si fue creado cardenal por Juan Pablo II durante el consistorio del 25 de mayo de 1985 con el título de cardenal-sacerdote de Trinité-des-Monts.;https://es.wikipedia.org/wiki/Albert_Decourtray
23;es;¿Quién es uno de los tres mejores entrenadores de fútbol franceses del siglo XX ?;Albert Batteux;Albert Finney;Albert Dieudonné;Albert Lebrun;Expert;Cuando Batteux se convirtió en entrenador del Stade de Reims, estableció un estilo de juego que llamaríamos el juego de Reims.;https://es.wikipedia.org/wiki/Albert_Batteux
24;es;¿Quién fue Monsieur Loyal en el primer circo de Jean Richard ?;Albert Préjean;Albert Ducrocq;Albert Costa;Albert Kahn;Expert;Confió sus recuerdos a su hijo Patrick Préjean, en un libro publicado en 1979.;
25;es;¿Qué premio se otorga a los mejores periodistas francófonos desde 1933 ?;Albert London;Albert Finney;Albert Decourtray;Albert Spaggiari;Expert;Albert Londres dirá : Nuestro trabajo no es agradar, ni hacer daño, es llevar la pluma en la herida.;https://es.wikipedia.org/wiki/Albert_Londres
26;es;¿Quién es el inventor de un sistema de fotografía aérea, el Hélivision ?;Albert Lamorisse;Albert Decourtray;Albert Calmette;Albert Lebrun;Expert;Esta técnica pionera de sistemas antivibración para tomas aéreas se utilizó en el primer « James Bond \u003c/I\u003e.;https://es.wikipedia.org/wiki/Albert_Lamorisse
27;es;¿Qué Albert fue campeón de la unión francesa de rugby en 1945 ?;Albert Ferrasse;Albert Samain;Albert Batteux;Albert Calmette;Expert;Habiendo jugado en la segunda línea izquierda en SU Agen, Albert Ferrasse fue un excelente receptor de touchdown debido a su relajación.;
28;es;¿A qué cibernético, entre otros, le debemos el zorro electrónico ?;Albert Ducrocq;Albert Jacquard;Albert Spaggiari;Albert Kahn;Expert;Ducrocq lo había dotado de un sentido capacitivo mediante un dispositivo de detección de masas recuperado de un detector de minas.;
29;es;¿Qué poeta simbolista francés utilizó sonetos de quince versos ?;Albert Samain;Albert London;Albert Spaggiari;Albert Jacquard;Expert;Muchos músicos componen melodías en sus textos, como « Arpège » de Gabriel Fauré o « La Maison du matin ».;https://es.wikipedia.org/wiki/Albert_Samain
30;es;¿Qué asesino en serie estranguló a trece mujeres entre 1962 y 1964 ?;Albert DeSalvo;Albert Ducrocq;Albert Dieudonné;Albert Kahn;Expert;También fue apodado el Hombre de Verde en referencia al color de su atuendo de trabajador que realiza reparaciones.;https://es.wikipedia.org/wiki/Albert_DeSalvo
1;it;Quale umorista francese è noto per i suoi schizzi sul canale Canal + ?;Albert Algoud;Albert Spaggiari;Albert Préjean;Albert Ferrasse;Débutant;In « Nulle part ailleurs », è apparso nella banda di attori che hanno preso parte alle riprese degli schizzi di Karl Zero.;
2;it;Quale Albert ha scritto commedie, romanzi, racconti e poesie ?;Albert Camus;Albert Uderzo;Albert Ducrocq;Albert Samain;Débutant;Il vincitore del premio Nobel Albert Camus ha sviluppato un umanesimo basato sulla consapevolezza dell'assurdità della condizione umana.;https://it.wikipedia.org/wiki/Albert_Camus
3;it;Quale principe di Monaco ha sposato la nuotatrice Charlène Wittstock ?;Albert II;Albert I;Albert III;Albert IV;Débutant;Il principe Alberto II è il figlio del principe Ranieri III (1923-2005) e Grace Kelly (1929-1982), un'attrice americana internazionale.;https://it.wikipedia.org/wiki/Alberto_II_di_Monaco
4;it;Chi è stato successivamente tedesco, apolide, svizzero e svizzero americano ?;Albert Einstein;Albert Schweitzer;Albert Batteux;Albert Fratellini;Débutant;Albert Einstein pubblicò la sua teoria della relatività speciale nel 1905 e la sua teoria della gravità nota come relatività generale nel 1915.;https://it.wikipedia.org/wiki/Albert_Einstein
5;it;Chi divenne il terzo re dei belgi il 23 dicembre 1909 ?;Albert I;Albert II;Albert III;Albert IV;Débutant;Appassionato di alpinismo e autore di importanti salite, muore nel 1934 in un incidente di arrampicata a Marche-les-Dames.;https://it.wikipedia.org/wiki/Alberto_I_del_Belgio
6;it;Chi è l'ideatore, con lo sceneggiatore René Goscinny, della serie « Asterix » ?;Albert Uderzo;Albert Calmette;Albert Ferrasse;Albert Ducrocq;Débutant;Essendo Albert Uderzo daltonico, la colorazione degli album di « Asterix » è stata fornita a lungo da suo fratello Marcel Uderzo.;https://it.wikipedia.org/wiki/Albert_Uderzo
7;it;Chi era con i suoi due fratelli un clown di fama mondiale ?;Albert Fratellini;Albert Ferrasse;Albert Dieudonné;Albert Dupontel;Débutant;Albert si è sposato con Amalia di Palma. Avevano una figlia Alberta-Luisa, sposata con il regista di circo olandese Ernest Carré.;https://it.wikipedia.org/wiki/Fratellini_(famiglia)
8;it;Quale Albert ha proposto schizzi di culto come « Le Bac » o « Rambo » ?;Albert Dupontel;Albert Algoud;Alberto Contador;Albert Canet;Débutant;Desiderando preservare la sua famiglia e in particolare suo padre, Philippe Guillaume ha scelto Albert Dupontel come nome d'arte.;https://it.wikipedia.org/wiki/Albert_Dupontel
9;it;Quale biologo è uno specialista in genetica delle popolazioni ?;Albert Jacquard;Albert Samain;Albert Schweitzer;Albert Algoud;Débutant;È anche membro del comitato di sponsorizzazione del Coordinamento francese per il decennio della cultura della pace e della non violenza.;
10;it;Chi è stato Presidente della Repubblica francese dal 1932 al 1940 ?;Albert Lebrun;Albert Decourtray;Albert Batteux;Albert London;Débutant;Persuaso ad essere un ricorso di fronte a pericoli eminenti, nel 1939 accetta di presentare la sua candidatura per un secondo mandato.;https://it.wikipedia.org/wiki/Albert_Lebrun
11;it;Quale medico e pastore ha ricevuto il Premio Nobel per la Pace nel 1952 ?;Albert Schweitzer;Albert Costa;Albert Lamorisse;Albert Finney;Confirmé;L'ospedale che ha sviluppato nella foresta equatoriale sulle rive dell'Ogooué dal 1913 lo ha reso noto in tutto il mondo.;https://it.wikipedia.org/wiki/Albert_Schweitzer
12;it;Chi è noto per essere stato l'artefice della rapina del secolo nel 1976 ?;Albert Spaggiari;Albert Costa;Albert Jacquard;Albert Canet;Confirmé;Sostenitore dell'OAS, scrittore e fotografo, è fuggito dalla polizia francese durante la sua corsa che è durata fino alla morte.;https://it.wikipedia.org/wiki/Albert_Spaggiari
13;it;Quale di queste proposizioni non designa un romanzo di Albert Cohen ?;« Mission »;« Solal »;« Mangeclous »;« Les Valeureux »;Confirmé;Dapprima diplomatico, pubblicò il suo primo romanzo nel 1930, ma fu solo nel 1968 che divenne famoso con « Belle du Seigneur ».;https://it.wikipedia.org/wiki/Albert_Cohen_(scrittore)
14;it;Quale tennista spagnolo ha vinto al Roland Garros nel 2002 ?;Albert Costa;Albert Préjean;Albert Samain;Albert DeSalvo;Confirmé;Specialista in terra battuta, ha vinto 12 tornei ATP, tutti su questa superficie, battendo Juan Carlos Ferrero in finale nel 2002.;https://it.wikipedia.org/wiki/Albert_Costa
15;it;A chi si deve la vaccinazione contro la tubercolosi con BCG ?;Albert Calmette;Albert Spaggiari;Albert Schweitzer;Albert Einstein;Confirmé;Era il fratello di Émile Calmette, ispettore medico generale delle forze armate, e Gaston Calmette, direttore di Le Figaro.;https://it.wikipedia.org/wiki/Albert_Calmette
16;it;Quale conduttore televisivo è associato a « Tender Age e Wood Head » ?;Albert Raisner;Albert Préjean;Albert London;Albert Algoud;Confirmé;È stato una figura emblematica del panorama audiovisivo francese negli anni '60 e un pioniere dell'era yé-yés.;
17;it;Chi ha interpretato Ernest Hemingway e Winston Churchill in televisione ?;Albert Finney;Albert Algoud;Albert Canet;Albert Samain;Confirmé;Attore, regista, produttore e cantante, è stato nominato due volte ai Tony Awards per il ruolo di Martin Luther.;https://it.wikipedia.org/wiki/Albert_Finney
18;it;Chi è l'attore principale di « Napoleon », un film di Abel Gance ?;Albert Dieudonné;Albert Calmette;Albert Dupontel;Albert Algoud;Confirmé;Secondo Jean Tulard, sarebbe stato così segnato dal suo ruolo che negli anni sarebbe arrivato a pensare a se stesso come all'imperatore.;
19;it;Quale Albert era presidente della Federazione francese di tennis ?;Albert Canet;Albert Jacquard;Albert Lebrun;Albert Decourtray;Confirmé;Figlio dell'ingegnere Gustave Canet, progettista del famoso cannone Canet, Albert Canet fu presidente della FFT dal 1925 al 1930.;https://it.wikipedia.org/wiki/Albert_Canet
20;it;In quale arte è illustrato il francese Albert Marquet con i suoi colori vivaci ?;Pittura;Fotografia;Scultura;Cinema;Confirmé;Il lavoro di Albert Marquet è costituito da piani semplificati, in colori brillanti e degradati, con un'arte compiuta dell'inquadratura.;https://it.wikipedia.org/wiki/Pierre-Albert_Marquet
21;it;Chi ha raccolto una collezione iconografica intitolata « Archivi del Pianeta » ?;Albert Kahn;Albert Calmette;Albert Jacquard;Albert Lamorisse;Expert;Questa collezione composta da autocromi (fotografie a colori su lastre di vetro) è la più grande del mondo.;
22;it;Quale cardinale era anche arcivescovo di Lione e accademico francese ?;Albert Decourtray;Albert Raisner;Albert London;Albert Ducrocq;Expert;Se è stato creato cardinale da Giovanni Paolo II durante il concistoro del 25 maggio 1985 con il titolo di cardinale-sacerdote di Trinité-des-Monts.;https://it.wikipedia.org/wiki/Albert_Decourtray
23;it;Chi è uno dei tre migliori allenatori di calcio francesi del XX secolo ?;Albert Batteux;Albert Finney;Albert Dieudonné;Albert Lebrun;Expert;Quando Batteux divenne allenatore dello Stade de Reims, creò uno stile di gioco che chiameremmo gioco di reims.;https://it.wikipedia.org/wiki/Albert_Batteux
24;it;Chi era Monsieur Loyal nel primo circo Jean Richard ?;Albert Préjean;Albert Ducrocq;Albert Costa;Albert Kahn;Expert;Ha confidato i suoi ricordi al figlio Patrick Préjean, in un libro pubblicato nel 1979.;
25;it;Quale premio è stato assegnato ai migliori giornalisti francofoni dal 1933 ?;Albert London;Albert Finney;Albert Decourtray;Albert Spaggiari;Expert;Albert Londres dirà : Il nostro lavoro non è piacere, né fare del male, è portare la penna nella ferita.;
26;it;Chi è l'inventore di un sistema di fotografia aerea, l'Hélivision ?;Albert Lamorisse;Albert Decourtray;Albert Calmette;Albert Lebrun;Expert;Questa tecnica pionieristica dei sistemi antivibranti per riprese aeree è stata utilizzata nel primo « James Bond \u003c/I\u003e.;https://it.wikipedia.org/wiki/Albert_Lamorisse
27;it;Quale Albert fu campione francese di rugby nel 1945 ?;Albert Ferrasse;Albert Samain;Albert Batteux;Albert Calmette;Expert;Dopo aver giocato sulla seconda linea a sinistra a SU Agen, Albert Ferrasse è stato un eccellente ricevitore di touchdown a causa del suo relax.;
28;it;A quale cibernetico, tra gli altri, dobbiamo la volpe elettronica ?;Albert Ducrocq;Albert Jacquard;Albert Spaggiari;Albert Kahn;Expert;Ducrocq lo aveva dotato di un senso capacitivo per mezzo di un dispositivo di rilevamento di massa recuperato da un rilevatore di mine.;
29;it;Quale poeta simbolista francese ha usato sonetti di quindici versi ?;Albert Samain;Albert London;Albert Spaggiari;Albert Jacquard;Expert;Molti musicisti compongono melodie sui suoi testi, come « Arpège » di Gabriel Fauré o « La Maison du matin ».;https://it.wikipedia.org/wiki/Albert_Samain
30;it;Quale serial killer ha strangolato tredici donne tra il 1962 e il 1964 ?;Albert DeSalvo;Albert Ducrocq;Albert Dieudonné;Albert Kahn;Expert;È stato anche soprannominato l'Uomo in Verde in riferimento al colore del suo vestito da operaio che effettua le riparazioni.;https://it.wikipedia.org/wiki/Albert_DeSalvo
1;nl;Welke Franse humorist staat bekend om zijn sketches op Canal + ?;Albert Algoud;Albert Spaggiari;Albert Préjean;Albert Ferrasse;Débutant;In « Nulle part ailleurs » trad hij op in de bende acteurs die deelnamen aan het filmen van Karl Zero's sketches.;
2;nl;Welke Albert schreef toneelstukken, romans, korte verhalen en gedichten ?;Albert Camus;Albert Uderzo;Albert Ducrocq;Albert Samain;Débutant;Nobelprijswinnaar Albert Camus ontwikkelde een humanisme gebaseerd op het besef van de absurditeit van de menselijke conditie.;https://nl.wikipedia.org/wiki/Albert_Camus
3;nl;Welke prins van Monaco trouwde met zwemster Charlène Wittstock ?;Albert II;Albert I;Albert III;Albert IV;Débutant;Prins Albert II is de zoon van Prins Rainier III (1923-2005) en Grace Kelly (1929-1982), een internationale Amerikaanse actrice.;https://nl.wikipedia.org/wiki/Albert_II_van_Monaco
4;nl;Wie was achtereenvolgens Duits, staatloos, Zwitsers en Zwitsers-Amerikaans ?;Albert Einstein;Albert Schweitzer;Albert Batteux;Albert Fratellini;Débutant;Albert Einstein publiceerde zijn speciale relativiteitstheorie in 1905 en zijn zwaartekrachttheorie die bekend staat als de algemene relativiteitstheorie in 1915.;https://nl.wikipedia.org/wiki/Albert_Einstein
5;nl;Wie werd op 23 december 1909 de derde koning der Belgen ?;Albert I;Albert II;Albert III;Albert IV;Débutant;Gepassioneerd door bergbeklimmen en auteur van grote beklimmingen, stierf hij in 1934 bij een klimongeval in Marche-les-Dames.;https://nl.wikipedia.org/wiki/Albert_I_van_België
6;nl;Wie is de maker, met scenarioschrijver René Goscinny, van de serie « Asterix » ?;Albert Uderzo;Albert Calmette;Albert Ferrasse;Albert Ducrocq;Débutant;Omdat Albert Uderzo kleurenblind was, werd de inkleuring van « Asterix » albums lange tijd verzorgd door zijn broer Marcel Uderzo.;https://nl.wikipedia.org/wiki/Albert_Uderzo
7;nl;Wie was met zijn twee broers een wereldberoemde clown ?;Albert Fratellini;Albert Ferrasse;Albert Dieudonné;Albert Dupontel;Débutant;Albert trouwde met Amalia di Palma. Ze kregen een dochter Alberta-Luisa, getrouwd met de Nederlandse circusdirecteur Ernest Carré.;
8;nl;Welke Albert heeft cultschetsen voorgesteld, zoals « Le Bac » of « Rambo » ?;Albert Dupontel;Albert Algoud;Alberto Contador;Albert Canet;Débutant;Philippe Guillaume wilde zijn familie en in het bijzonder zijn vader beschermen en koos Albert Dupontel als zijn artiestennaam.;https://nl.wikipedia.org/wiki/Albert_Dupontel
9;nl;Welke bioloog is specialist in populatiegenetica ?;Albert Jacquard;Albert Samain;Albert Schweitzer;Albert Algoud;Débutant;Hij is ook lid van het sponsorcomité van de Franse Coördinatie voor het decennium van de cultuur van vrede en geweldloosheid.;
10;nl;Wie was de president van de Franse Republiek van 1932 tot 1940 ?;Albert Lebrun;Albert Decourtray;Albert Batteux;Albert Londen;Débutant;Overtuigd om een \u200b\u200btoevlucht te zijn in het licht van grote gevaren, accepteerde hij in 1939 zijn kandidatuur voor een tweede termijn.;https://nl.wikipedia.org/wiki/Albert_Lebrun
11;nl;Welke dokter en pastoor ontving in 1952 de Nobelprijs voor de Vrede ?;Albert Schweitzer;Albert Costa;Albert Lamorisse;Albert Finney;Confirmé;Het ziekenhuis dat hij vanaf 1913 in het equatoriale woud aan de oevers van de Ogooué ontwikkelde, maakte hem bekend over de hele wereld.;https://nl.wikipedia.org/wiki/Albert_Schweitzer
12;nl;Van wie is bekend dat hij in 1976 het brein was van de overval van de eeuw ?;Albert Spaggiari;Albert Costa;Albert Jacquard;Albert Canet;Confirmé;Als aanhanger van de OAS, schrijver en fotograaf, ontsnapte hij aan de Franse politie tijdens zijn vlucht die duurde tot aan zijn dood.;https://nl.wikipedia.org/wiki/Albert_Spaggiari
13;nl;Welke van deze stellingen duidt niet op een roman van Albert Cohen ?;« Mission »;« Solal »;« Mangeclous »;« Les Valeureux »;Confirmé;Aanvankelijk als diplomaat, publiceerde hij zijn eerste roman in 1930, maar pas in 1968 werd hij beroemd met « Belle du Seigneur ».;https://nl.wikipedia.org/wiki/Albert_Cohen
14;nl;Welke Spaanse tennisser was de winnaar op Roland Garros in 2002 ?;Albert Costa;Albert Préjean;Albert Samain;Albert DeSalvo;Confirmé;Als gravelspecialist won hij 12 ATP-toernooien, allemaal op dit oppervlak, en versloeg Juan Carlos Ferrero in de finale in 2002.;https://nl.wikipedia.org/wiki/Albert_Costa_(tennisser)
15;nl;Aan wie hebben we de tuberculose-vaccinatie met BCG te danken ?;Albert Calmette;Albert Spaggiari;Albert Schweitzer;Albert Einstein;Confirmé;Hij was de broer van Émile Calmette, medisch inspecteur-generaal van de strijdkrachten, en Gaston Calmette, directeur van Le Figaro.;
16;nl;Welke tv-presentator wordt geassocieerd met « Tender Age en Wood Head » ?;Albert Raisner;Albert Préjean;Albert Londen;Albert Algoud;Confirmé;Hij was een symbolische figuur van het Franse audiovisuele landschap in de jaren zestig en een pionier in het yé-yés-tijdperk.;
