28;de;Welche Designerin hat Naomi Campbell und Dita Von Teese für ihre T-Shirts nackt ?;Marc Jacobs;Ralph Lauren;Tom Ford;Mike Ness;Expert;Der amerikanische Modedesigner Marc Jacobs war von 1997 bis 2013 künstlerischer Leiter der Louis Vuitton Collections.;https://de.wikipedia.org/wiki/Marc_Jacobs
29;de;Welches Parfüm in einer Spiegelkugel wurde von Cathy Guetta vorgestellt ?;« Ibiza »;« Saint-Tropez »;« Palast »;« Paris »;Expert;Cathy Guetta ist Veranstalterin von Parties und Shows sowie einer französischen Fernsehpersönlichkeit.;
30;de;Welcher Designer entwarf für Lenôtre die Weihnachtsbohne 2007 ?;Karl Lagerfeld;Paco Rabanne;Gianni Versace;Pierre Cardin;Expert;Das Unternehmen Lenôtre hat derzeit 15 Geschäfte in Frankreich, 13 in Paris und 2 an der Cote d'Azur, in Cannes und Nizza.;https://de.wikipedia.org/wiki/Lenôtre
1;es;¿Qué icono de la moda siempre lleva una catogan y unas gafas oscuras ?;Karl Lagerfeld;Paco Rabanne;Pierre Cardin;Thierry Mugler;Débutant;Además de sus trabajos de alta costura, Karl Lagerfeld publica libros en Alemania y posee una librería.;https://es.wikipedia.org/wiki/Karl_Lagerfeld
2;es;¿Para qué marca lleva la famosa supermodelo Kate Moss la colección de bolsos ?;Longchamp;Chanel;Gucci;Mango;Débutant;Fue la campaña publicitaria de la marca estadounidense Calvin Klein la que impulsó a Kate Moss al frente del escenario.;https://es.wikipedia.org/wiki/Kate_Moss
3;es;¿Qué modelo mítico de Ray-Ban está asociado con los Blues Brothers ?;Wayfarer;Vuarnet;Ekoï;Cébé;Débutant;Los Wayfarer a veces son citados como uno de los diseños de gafas de sol más vendidos en la historia.;https://es.wikipedia.org/wiki/Ray-Ban_Wayfarer
4;es;¿Qué nombre ha podido el señor Takada irradiar en el mundo de la moda ?;Kenzo;Karl;Kalvin;Kyrio;Débutant;En 1993, Kenzo Takada vendió la marca Kenzo al grupo LVMH, con el nombre completo.;https://es.wikipedia.org/wiki/Kenzo_Takada
5;es;¿Para qué marca de lujo se sentó Catherine Deneuve en una maleta ?;Louis Vuitton;Boucheron;Cerruti;Ralph Lauren;Débutant;Durante seis años consecutivos (de 2006 a 2012), Louis Vuitton ha sido nombrada la marca de lujo más valiosa del mundo.;https://es.wikipedia.org/wiki/Louis_Vuitton
6;es;¿Qué estrella de « Loft Story » ha lanzado un aroma a fresa de madera y pastel ?;Loana;Afida Turner;Laure de Lattre;Kenza Braiga;Débutant;La fama de Loana le ha dado la oportunidad de trabajar como estilista, cantante y presentadora de televisión francesa.;
7;es;¿Qué viejo diseñador de moda de Dior inventó el esmoquin de mujer ?;Yves Saint Laurent;André Courrèges;Christian Dior;Pierre Balmain;Débutant;Saint Laurent inventó la gabardina de 1962, introdujo el esmoquin de mujer en 1966 y el traje de pantalón en 1967.;https://es.wikipedia.org/wiki/Yves_Saint_Laurent
8;es;¿A qué marca de moda francesa está unida la salamandra ?;Agnès b.;Naf Naf;Lacoste;Dim;Débutant;Tarantino apeló a Agnès b. para crear todos los trajes traídos a la pantalla por Uma Thurman en « Pulp Fiction ».;
9;es;¿De qué color son las suelas de los zapatos Louboutin ?;Rojo;Verde;Azul;Malva;Débutant;Christian Louboutin, inspirado en el arte pop, ha basado su especificidad en la suela de cuero roja para convertirse en su sello distintivo.;
10;es;¿Qué flor se ha convertido en un símbolo de la casa de moda Coco Chanel ?;La camara;La rosa;La amapola;La margarita;Débutant;Coco Chanel ha hecho de la cámara su emblema y ha lanzado la moda de la camelia blanca en el ojal, que se ha convertido en una locura.;https://es.wikipedia.org/wiki/Camellia
11;es;¿Qué marca de lujo patrocinó el Prix de Diane desde 1983 hasta 2007 ?;Hermès;Dior;Courrèges;Cardin;Confirmé;La carrera coronó a Chantilly como la mejor potra de tres años en un ambiente de fervor deportivo y un picnic elegante.;
12;es;¿Qué italiano asumió John Galliano a la cabeza de Dior ?;Gianfranco Ferré;Ottavio Missoni;Riccardo tisci;Enrico Coveri;Confirmé;Originalmente destinado a la profesión arquitectónica, Gianfranco Ferré comenzó la moda en 1970 diseñando accesorios.;https://es.wikipedia.org/wiki/Gianfranco_Ferré
13;es;¿Qué estilista británico ganó en 2007 sus 35 años bajo tierra ?;Vivienne Westwood;Stella McCartney;Zandra Rhodes;Sarah Burton;Confirmé;En la década de 1970, Vivienne Westwood creó una tienda de moda que ayudó a lanzar la moda punk.;https://es.wikipedia.org/wiki/Vivienne_Westwood
14;es;¿Qué marca Laetitia Casta, Lindsay Lohan y Kirsten Dunst fueron las más exitosas ?;Miu Miu;Berluti;Rodeo Drive;Moncler;Confirmé;Miu Miu, marca lanzada en 1993 y llamada a menudo la hermana pequeña de Prada, es buscada más joven y más asequible.;https://es.wikipedia.org/wiki/Prada_(casa_de_moda)
15;es;¿Qué diseñador ha creado los perfumes « Red » y « Black » para Avon ?;Christian Lacroix;Franck Sorbier;Raf Simons;Thierry Mugler;Confirmé;Christian Lacroix ha recurrido a varios mundos, como la decoración de hoteles o medios de transporte.;https://es.wikipedia.org/wiki/Christian_Lacroix
16;es;¿Qué estilista italiano fue consultor de moda en « Dos policías en Miami » ?;Gianni Versace;Valentino;Paco Rabanne;John Galliano;Confirmé;En el apogeo de la gloria y el éxito artístico, Gianni Versace fue asesinado en Miami a la edad de 50 años por dos balas en la cabeza.;https://es.wikipedia.org/wiki/Gianni_Versace
17;es;¿A qué modisto español fue apodado el metalúrgico por Chanel ?;Paco Rabanne;Antonio del castillo;Mariano madrazo;Cristobal balenciaga;Confirmé;Paco Rabanne también se ha ilustrado en los medios de comunicación a través de predicciones (la mayoría de las veces se revela como falso).;https://es.wikipedia.org/wiki/Paco_Rabanne
18;es;¿Para qué marca de bolsos se encontró Laure Manaudou en una fuente ?;Lancel;Gucci;Pliage;Fendi;Confirmé;Al principio, Lancel comercializó pipas y accesorios para fumar y presentó la patente del encendedor automático.;
19;es;¿Qué diseñador creó el vestuario para el Elton John World Tour de 1992 ?;Gianni Versace;Rocco Barocco;Romeo Gigli;Giuseppe Zanotti;Confirmé;El 3 de diciembre de 1995, Elton John le entregó a Gianni Versacele el Premio VHI de Moda y Música en Nueva York.;https://es.wikipedia.org/wiki/Gianni_Versace
20;es;La mahina es una modelo de big bag firmada de qué marca ?;Vuitton;Hermès;Gucci;Chanel;Confirmé;Desde el principio, su diseño voluptuoso y generoso y su suave cuero, como la piel de un bebé, llaman la atención y la mano.;https://es.wikipedia.org/wiki/Louis_Vuitton
21;es;¿Quién creó un colgante en forma de pierna para lanzar su línea de joyería ?;Stella McCartney;Mary Quant;Zandra Rhodes;Sarah Burton;Expert;Como una venérea como su madre Linda Eastman, Stella McCartney no usa piel ni cuero en sus colecciones.;https://es.wikipedia.org/wiki/Stella_McCartney
22;es;¿Qué dúo lanzó una colección en una tienda con sillas en el techo ?;Viktor y Rolf;H y M;Dolce y Gabbana;Paul y Shark;Expert;En 2015, Viktor y Rolf anunciaron el final de su línea de ropa lista para usar, prefiriendo centrarse en el perfume y la alta costura.;https://es.wikipedia.org/wiki/Viktor_y_Rolf
23;es;¿De qué país proviene la marca Uniqlo que ofrece ropa básica ?;De japon;De suecia;De la india;De canada;Expert;Disney ha firmado un contrato con Uniqlo para comercializar los productos « Star Wars », « Avengers » y « The Frozen » de China.;https://es.wikipedia.org/wiki/Uniqlo
24;es;¿Qué danés viviendo en París ha creado una moda para la vida real ?;Vanessa Bruno;Louise Chéruit;Nina Ricci;Madeleine vionnet;Expert;La moda de Vanessa Bruno se compone de capas gruesas de leotardos de punto y leggings, en colores sobrios o pastel.;
25;es;En 2008, ¿dónde era elegante llevar el mini bolso Chanel ?;En el tobillo;En la cintura;La muñeca;Alrededor del cuello;Expert;Gabrielle Chasnel, conocida como Coco Chanel, nacida en 1883, está en el origen de la Maison Chanel, un símbolo de la elegancia francesa.;https://es.wikipedia.org/wiki/Coco_Chanel
26;es;¿Cuál es el país de origen de la cadena de tiendas Hennes y Mauritz ?;Suecia;Francia;España;Reino Unido;Expert;Hennes y Mauritz está presente en 61 países y emplea a unas 148,000 personas y posee 4,000 tiendas.;
27;es;¿Qué franco-tunecino esculpió las siluetas de Grace Jones y Tina Turner ?;Azzedine Alaïa;Bouchra Jarrar;Emanuel ungaro;Izet Curi;Expert;Muchos artistas y personalidades han servido a Azzedine Alaïa, pero es Grace Jones la que se convertirá en su musa.;https://es.wikipedia.org/wiki/Azzedine_Alaïa
28;es;¿Qué diseñadora puso a Naomi Campbell y Dita Von Teese desnudas para sus camisetas ?;Marc jacobs;Ralph Lauren;Tom Ford;Mike Ness;Expert;El diseñador de moda estadounidense, Marc Jacobs, fue director artístico de las Colecciones Louis Vuitton de 1997 a 2013.;https://es.wikipedia.org/wiki/Marc_Jacobs
29;es;¿Qué perfume propuesto en una bola de espejos fue lanzado por Cathy Guetta ?;« Ibiza »;« Saint-Tropez »;« Palacio »;« París »;Expert;Cathy Guetta es una organizadora de fiestas y espectáculos, así como una personalidad de la televisión francesa.;
30;es;¿Qué diseñador diseñó para Lenôtre el frijol navideño 2007 ?;Karl Lagerfeld;Paco Rabanne;Gianni Versace;Pierre Cardin;Expert;Actualmente, la empresa Lenôtre tiene 15 tiendas en Francia, 13 en París y 2 en la Costa Azul, en Cannes y Niza.;
1;it;Quale icona della moda indossa sempre un catogan e occhiali scuri ?;Karl Lagerfeld;Paco Rabanne;Pierre Cardin;Thierry Mugler;Débutant;Oltre ai suoi lavori di alta moda, Karl Lagerfeld pubblica libri in Germania e possiede una libreria.;https://it.wikipedia.org/wiki/Karl_Lagerfeld
2;it;Per quale marca la famosa supermodella Kate Moss indossa le borse della collezione ?;Longchamp;Chanel;Gucci;Mango;Débutant;È stata la campagna pubblicitaria del marchio americano Calvin Klein a spingere Kate Moss sul palco.;https://it.wikipedia.org/wiki/Kate_Moss
3;it;Quale modello mitico di Ray-Ban è associato ai Blues Brothers ?;Wayfarer;Vuarnet;Ekoï;Cébé;Débutant;Il Wayfarer viene a volte citato come uno dei migliori occhiali da sole di design della storia.;https://it.wikipedia.org/wiki/Ray-Ban_Wayfarer
4;it;Che nome ha avuto il signor Takada in grado di irradiare nel mondo della moda ?;Kenzo;Karl;Kalvin;Kyrio;Débutant;Nel 1993, Kenzo Takada vendette il marchio Kenzo al gruppo LVMH, possedendo il nome completo.;https://it.wikipedia.org/wiki/Kenzo_Takada
5;it;Per quale marchio di lusso Catherine Deneuve si è seduta su una valigia ?;Louis Vuitton;Boucheron;Cerruti;Ralph Lauren;Débutant;Per sei anni consecutivi (dal 2006 al 2012), Louis Vuitton è stata nominata la marca di lusso più preziosa al mondo.;https://it.wikipedia.org/wiki/Louis_Vuitton
6;it;Quale star di « Loft Story » ha lanciato un profumo di fragola di legno e pastello ?;Loana;Afida Turner;Laure de Lattre;Kenza Braiga;Débutant;La fama di Loana le ha dato la possibilità di lavorare come stilista, cantante e presentatrice televisiva francese.;
7;it;Quale vecchia stilista di Dior ha inventato lo smoking femminile ?;Yves Saint Laurent;André Courrèges;Christian Dior;Pierre Balmain;Débutant;Saint Laurent ha inventato il trench del 1962, ha introdotto lo smoking femminile nel 1966 e il tailleur nel 1967.;https://it.wikipedia.org/wiki/Yves_Saint_Laurent
8;it;A quale marca di moda francese è collegata la salamandra ?;Agnès b.;Naf Naf;Lacoste;Dim;Débutant;Tarantino fece appello ad Agnès b. per creare tutti gli abiti portati sullo schermo da Uma Thurman in « Pulp Fiction ».;
9;it;Di che colore sono le suole delle scarpe Louboutin ?;Rosso;Verde;Blu;Malva;Débutant;Christian Louboutin, ispirato alla pop art, ha basato la sua specificità sulla suola in cuoio rosso per diventare il suo segno distintivo.;https://it.wikipedia.org/wiki/Christian_Louboutin
10;it;Quale fiore è diventato un simbolo della casa di moda di Coco Chanel ?;La macchina fotografica;La rosa;Il papavero;La margherita;Débutant;Coco Chanel ha fatto della camelia il suo emblema e ha lanciato la moda della camelia bianca all'occhiello, diventando una mania.;https://it.wikipedia.org/wiki/Camellia
11;it;Quale marchio di lusso ha sponsorizzato il Prix de Diane dal 1983 al 2007 ?;Hermès;Dior;Courrèges;Cardin;Confirmé;La corsa incoronò Chantilly la miglior puledra di tre anni in un'atmosfera di fervore sportivo e picnic chic.;
12;it;Quale italiano ha assunto John Galliano alla testa di Dior ?;Gianfranco Ferré;Ottavio Missoni;Riccardo Tisci;Enrico Coveri;Confirmé;Originariamente destinato alla professione di architetto, Gianfranco Ferré ha iniziato la moda nel 1970 progettando accessori.;https://it.wikipedia.org/wiki/Gianfranco_Ferré
13;it;Quale stilista inglese ha festeggiato nel 2007 i suoi 35 anni underground ?;Vivienne Westwood;Stella McCartney;Zandra Rhodes;Sarah Burton;Confirmé;Negli anni '70, Vivienne Westwood ha creato un negozio di moda che ha contribuito a lanciare la moda punk.;https://it.wikipedia.org/wiki/Vivienne_Westwood
14;it;Quale marca Laetitia Casta, Lindsay Lohan e Kirsten Dunst hanno avuto il maggior successo ?;Miu Miu;Berluti;Rodeo Drive;Moncler;Confirmé;Miu Miu, marchio lanciato nel 1993 e spesso chiamato la sorellina di Prada, è ricercato più giovane e più accessibile.;https://it.wikipedia.org/wiki/Prada
15;it;Quale designer ha creato i profumi « Rosso » e « Nero » di Avon ?;Christian Lacroix;Franck Sorbier;Raf Simons;Thierry Mugler;Confirmé;Christian Lacroix si è rivolto a vari mondi, come la decorazione di alberghi o mezzi di trasporto.;https://it.wikipedia.org/wiki/Christian_Lacroix
16;it;Quale stilista italiana è stata consulente di moda su « Due poliziotti a Miami » ?;Gianni Versace;Valentino;Paco Rabanne;John Galliano;Confirmé;Al culmine della gloria e del successo artistico, Gianni Versace fu assassinato a Miami all'età di 50 anni da due proiettili in testa.;https://it.wikipedia.org/wiki/Gianni_Versace
17;it;Quale couturier spagnolo è stato soprannominato il metallurgista da Chanel ?;Paco Rabanne;Antonio del Castillo;Mariano Madrazo;Cristobal Balenciaga;Confirmé;Paco Rabanne si è anche illustrato nei media attraverso le previsioni (il più delle volte viene rivelato falso).;https://it.wikipedia.org/wiki/Paco_Rabanne
18;it;Per quale marca di borse Laure Manaudou si è ritrovata in una fontana ?;Lancel;Gucci;Pliage;Fendi;Confirmé;All'inizio, Lancel commercializzava pipe e accessori e depositava il brevetto per l'accendino automatico.;
19;it;Quale designer ha creato i costumi per l'Elton John World Tour del 1992 ?;Gianni Versace;Rocco Barocco;Romeo Gigli;Giuseppe Zanotti;Confirmé;Il 3 dicembre 1995, Elton John ha presentato a New York 'VHI Fashion and Music Award' di Gianni Versacele.;https://it.wikipedia.org/wiki/Gianni_Versace
20;it;La Mahina è un modello di big bag firmato di quale marca ?;Vuitton;Hermès;Gucci;Chanel;Confirmé;Sin dall'inizio, il suo design voluttuoso e generoso e la pelle morbida come una pelle di bambino catturano l'occhio e la mano.;https://it.wikipedia.org/wiki/Louis_Vuitton
21;it;Chi ha creato un ciondolo a forma di gamba per lanciare la sua linea di gioielli ?;Stella McCartney;Mary Quant;Zandra Rhodes;Sarah Burton;Expert;Come venerea come sua madre Linda Eastman, Stella McCartney non usa pellicce o pellicce nelle sue collezioni.;https://it.wikipedia.org/wiki/Stella_McCartney
22;it;Quale duo ha lanciato una collezione in un negozio con sedie sul soffitto ?;Viktor e Rolf;H e M;Dolce e Gabbana;Paul e Shark;Expert;Nel 2015 Viktor e Rolf hanno annunciato la fine della loro linea di prêt-à-porter, preferendo concentrarsi sul profumo e l'alta moda.;https://it.wikipedia.org/wiki/Viktor_e_Rolf
23;it;Da quale paese proviene il marchio Uniqlo che offre abbigliamento di base ?;Dal Giappone;Dalla Svezia;Dall'India;Dal Canada;Expert;Disney ha firmato un contratto con Uniqlo per commercializzare i prodotti « Star Wars », « Avengers » e « The Frozen » della Cina.;https://it.wikipedia.org/wiki/Uniqlo
24;it;Che vita danese a Parigi ha creato una moda per la vita reale ?;Vanessa Bruno;Louise Chéruit;Nina Ricci;Madeleine Vionnet;Expert;La moda di Vanessa Bruno è composta da spessi strati di body in maglia e leggings, in colori sobri o pastello.;
25;it;Nel 2008, dov'era chic indossare la minigonna Chanel ?;Alla caviglia;Alla vita;Polso;Intorno al collo;Expert;Gabrielle Chasnel, conosciuta come Coco Chanel, nata nel 1883, è all'origine della Maison Chanel, un simbolo dell'eleganza francese.;https://it.wikipedia.org/wiki/Coco_Chanel
26;it;Qual è il paese di origine della catena di negozi Hennes e Mauritz ?;Svezia;Francia;Spagna;Regno Unito;Expert;Hennes e Mauritz è presente in 61 paesi, impiega circa 148.000 persone e ha più di 4.000 negozi.;
27;it;Quale franco-tunisino ha scolpito le sagome di Grace Jones e Tina Turner ?;Azzedine Alaïa;Bouchra Jarrar;Emanuel Ungaro;Izet Curi;Expert;Molti artisti e personalità hanno servito Azzedine Alaïa, ma è Grace Jones che diventerà la sua musa.;https://it.wikipedia.org/wiki/Azzedine_Alaïa
28;it;Quale designer ha messo a nudo Naomi Campbell e Dita Von Teese per le sue T-shirt ?;Marc Jacobs;Ralph Lauren;Tom Ford;Mike Ness;Expert;Marc Jacobs, stilista americano, è stato direttore artistico delle collezioni Louis Vuitton dal 1997 al 2013.;https://it.wikipedia.org/wiki/Marc_Jacobs
29;it;Quale profumo proposto in una sfera a specchio è stato lanciato da Cathy Guetta ?;« Ibiza »;« Saint-Tropez »;« Palazzo »;« Parigi »;Expert;Cathy Guetta è un'organizzatrice di feste e spettacoli, oltre a un personaggio televisivo francese.;https://it.wikipedia.org/wiki/Cathy_Guetta
30;it;Quale designer ha disegnato per Lenôtre il fagiolo di Natale 2007 ?;Karl Lagerfeld;Paco Rabanne;Gianni Versace;Pierre Cardin;Expert;La società Lenôtre ha attualmente 15 negozi in Francia, 13 a Parigi e 2 in Costa Azzurra, a Cannes e Nizza.;https://it.wikipedia.org/wiki/Lenôtre
1;nl;Welk mode-icoon draagt altijd een catogan en een donkere bril ?;Karl Lagerfeld;Paco Rabanne;Pierre Cardin;Thierry Mugler;Débutant;Naast zijn high fashion jobs, publiceert Karl Lagerfeld boeken in Duitsland en bezit hij een boekwinkel.;https://nl.wikipedia.org/wiki/Karl_Lagerfeld
2;nl;Voor welk merk draagt het beroemde supermodel Kate Moss de tassen van de collectie ?;Longchamp;Chanel;Gucci;Mango;Débutant;Het was de reclamecampagne voor het Amerikaanse merk Calvin Klein die Kate Moss naar voren bracht.;https://nl.wikipedia.org/wiki/Kate_Moss
3;nl;Welk mythisch model van Ray-Ban wordt geassocieerd met de Blues Brothers ?;Wayfarer;Vuarnet;Ekoï;Cébé;Débutant;De Wayfarer worden soms genoemd als een van de best verkochte zonnebrillen in de geschiedenis.;
4;nl;Welke naam heeft meneer Takada kunnen uitstralen in de modewereld ?;Kenzo;Karl;Kalvin;Kyrio;Débutant;In 1993 verkocht Kenzo Takada het merk Kenzo aan de LVMH-groep, die de volledige naam bezat.;https://nl.wikipedia.org/wiki/Kenzo_Takada
5;nl;Voor welk luxe merk heeft Catherine Deneuve op een koffer gezeten ?;Louis Vuitton;Boucheron;Cerruti;Ralph Lauren;Débutant;Gedurende zes opeenvolgende jaren (van 2006 tot 2012) werd Louis Vuitton het meest waardevolle luxemerk ter wereld genoemd.;https://nl.wikipedia.org/wiki/Louis_Vuitton_(merk)
6;nl;Welke ster van « Loft Story » heeft een aardbeiengeur van hout en pastel op de markt gebracht ?;Loana;Afida Turner;Laure de Lattre;Kenza Braiga;Débutant;De roem van Loana heeft haar de kans gegeven om als stylist, zanger en presentator van de Franse televisie te werken.;
7;nl;Welke ouderwetse modeontwerper van Dior vond de smoking voor dames uit ?;Yves Saint Laurent;André Courrèges;Christian Dior;Pierre Balmain;Débutant;Saint Laurent vond de trenchcoat uit 1962 uit, introduceerde de dames smoking in 1966 en het broekpak in 1967.;https://nl.wikipedia.org/wiki/Yves_Saint_Laurent_(modeontwerper)
8;nl;Met welk Frans modemerk is de salamander verbonden ?;Agnès b.;Naf Naf;Lacoste;Dim;Débutant;Tarantino deed een beroep op Agnès b. om alle outfits te maken die door Uma Thurman naar het scherm zijn gebracht in « Pulp Fiction ».;
9;nl;Welke kleur hebben de zolen van Louboutin-schoenen ?;Rood;Groen;Blauw;Mauve;Débutant;Christian Louboutin, geïnspireerd door de pop-art, heeft zijn specificiteit op de rode leren zool gebaseerd om het handelsmerk te worden.;https://nl.wikipedia.org/wiki/Christian_Louboutin
10;nl;Welke bloem is een symbool geworden van het modehuis Coco Chanel ?;De camera;De roos;De klaproos;Het madeliefje;Débutant;Coco Chanel heeft de camera tot een embleem gemaakt en heeft de mode van de witte camelia op het knoopsgat geïntroduceerd, wat een rage is geworden.;https://nl.wikipedia.org/wiki/Camellia
11;nl;Welk luxe merk sponsorde de Prix de Diane van 1983 tot 2007 ?;Hermès;Dior;Courrèges;Cardin;Confirmé;De race bekroond Chantilly de beste merrie van drie jaar in een sfeer van sportieve fervor en chique picknick.;
12;nl;Welke Italia heeft John Galliano aan het hoofd van Dior overgenomen ?;Gianfranco Ferré;Ottavio Missoni;Riccardo Tisci;Enrico Coveri;Confirmé;Gianfranco Ferré, oorspronkelijk bedoeld voor het architectenberoep, begon in 1970 met mode door accessoires te ontwerpen.;https://nl.wikipedia.org/wiki/Gianfranco_Ferré
13;nl;Welke Britse stylist heeft in 2007 haar 35-jarige underground gefeliciteerd ?;Vivienne Westwood;Stella McCartney;Zandra Rhodes;Sarah Burton;Confirmé;In de jaren zeventig creëerde Vivienne Westwood een modewinkel die punk-mode lanceerde.;https://nl.wikipedia.org/wiki/Vivienne_Westwood
14;nl;Welk merk Laetitia Casta, Lindsay Lohan en Kirsten Dunst waren het meest succesvol ?;Miu Miu;Berluti;Rodeo Drive;Moncler;Confirmé;Miu Miu, merk gelanceerd in 1993 en vaak Prada's kleine zusje genoemd, wordt jonger en betaalbaarder.;https://nl.wikipedia.org/wiki/Prada
15;nl;Welke ontwerper heeft « Red » en « Black » parfums gemaakt voor Avon ?;Christian Lacroix;Franck Sorbier;Raf Simons;Thierry Mugler;Confirmé;Christian Lacroix heeft zich tot verschillende werelden gewend, zoals de decoratie van hotels of vervoermiddelen.;https://nl.wikipedia.org/wiki/Christian_Lacroix
16;nl;Welke Italiaanse stylist was modeconsulent bij « Twee agenten in Miami » ?;Gianni Versace;Valentino;Paco Rabanne;John Galliano;Confirmé;Op het hoogtepunt van glorie en artistiek succes werd Gianni Versace op 50-jarige leeftijd vermoord in Miami met twee kogels in zijn hoofd.;https://nl.wikipedia.org/wiki/Gianni_Versace
17;nl;Welke Spaanse couturier kreeg de bijnaam de metaalbewerker van Chanel ?;Paco Rabanne;Antonio del Castillo;Mariano Madrazo;Cristobal Balenciaga;Confirmé;Paco Rabanne heeft zichzelf ook in de media geïllustreerd aan de hand van voorspellingen (het merendeel van de tijd wordt onjuist onthuld).;https://nl.wikipedia.org/wiki/Paco_Rabanne
18;nl;Voor welk tasmerk heeft Laure Manaudou een fontein gevonden ?;Lancel;Gucci;Pliage;Fendi;Confirmé;In het begin verkocht Lancel rookpijpen en accessoires en deponeerde het patent voor de automatische aansteker.;
19;nl;Welke ontwerper heeft de kostuums voor de 1992 Elton John World Tour gemaakt ?;Gianni Versace;Rocco Barocco;Romeo Gigli;Giuseppe Zanotti;Confirmé;Op 3 december 1995 presenteerde Elton John de 'VHI Fashion and Music Award' van Gianni Versacele in New York.;https://nl.wikipedia.org/wiki/Gianni_Versace
20;nl;De Mahina is een model van grote tas ondertekend van welk merk ?;Vuitton;Hermès;Gucci;Chanel;Confirmé;Vanaf het begin vangen het weelderige en genereuze ontwerp en zacht leer als een babyhuid het oog en de hand.;https://nl.wikipedia.org/wiki/Louis_Vuitton_(merk)
21;nl;Wie heeft een pootvormige hanger gemaakt om zijn sieradenlijn te lanceren ?;Stella McCartney;Mary Quant;Zandra Rhodes;Sarah Burton;Expert;Als een geslachtsorgaan zoals haar moeder Linda Eastman, gebruikt Stella McCartney geen bont of leer in haar collecties.;https://nl.wikipedia.org/wiki/Stella_McCartney
22;nl;Welk duo lanceerde een collectie in een winkel met stoelen aan het plafond ?;Viktor en Rolf;H en M;Dolce en Gabbana;Paul en Shark;Expert;In 2015 kondigden Viktor en Rolf het einde van hun confectiekledinglijn aan, waarbij ze de voorkeur gaven aan parfum en haute couture.;https://nl.wikipedia.org/wiki/Viktor_en_Rolf
23;nl;Welk land komt het merk Uniqlo dat basiskleding biedt ?;Uit Japan;Uit Zweden;Uit India;Uit Canada;Expert;Disney heeft een contract getekend met Uniqlo om de « Star Wars », « Avengers » en « The Frozen » producten van China op de markt te brengen.;
24;nl;Welke Deen die in Parijs woont, heeft een mode voor het echte leven gecreëerd ?;Vanessa Bruno;Louise Chéruit;Nina Ricci;Madeleine Vionnet;Expert;De mode van Vanessa Bruno bestaat uit dikke lagen maillots van maillots en legging, in sobere of pastelkleuren.;
25;nl;In 2008, waar was het chic om de Chanel mini-tas te dragen ?;Bij de enkel;In de taille;Pols;Rond de nek;Expert;Gabrielle Chasnel, bekend als Coco Chanel, geboren in 1883, is de oorsprong van het Maison Chanel, een symbool van Franse elegantie.;https://nl.wikipedia.org/wiki/Coco_Chanel
26;nl;Wat is het land van herkomst van de Hennes en Mauritz ?;Zweden;Frankrijk;Spanje;Verenigd Koninkrijk;Expert;Hennes en Mauritz zijn aanwezig in 61 landen, stellen ongeveer 148.000 mensen tewerk en hebben meer dan 4.000 winkels.;
27;nl;Wat Franco-Tunesi sneed de silhouetten van Grace Jones en Tina Turner ?;Azzedine Alaïa;Bouchra Jarrar;Emanuel Ungaro;Izet Curi;Expert;Vele artiesten en persoonlijkheden hebben Azzedine Alaïa bediend, maar het is Grace Jones die haar muze zal worden.;https://nl.wikipedia.org/wiki/Azzedine_Alaïa
28;nl;Welke ontwerper zette Naomi Campbell en Dita Von Teese naakt voor haar T-shirts ?;Marc Jacobs;Ralph Lauren;Tom Ford;Mike Ness;Expert;Amerikaanse modeontwerper, Marc Jacobs was artistiek directeur van de Louis Vuitton-collecties van 1997 tot 2013.;https://nl.wikipedia.org/wiki/Marc_Jacobs_(modeontwerper)
