1;fr;Quel évêque est mis en scène durant la fête de Saint-Nicolas ?;Nicolas de Myre;Benoît de Nursie;Alexis de Rome;Martin de Tours;Débutant;Évêque de Myre en Lycie, il a probablement participé au premier Concile de Nicée au cours duquel il combat l'arianisme.;https://fr.wikipedia.org/wiki/Nicolas_de_Myre
2;fr;Quel jour fête-t-on Saint-Nicolas pour l'Église catholique ?;6 décembre;19 décembre;24 décembre;11 décembre;Débutant;La fête de Saint-Nicolas est une tradition vivace dans plusieurs pays européens ainsi que dans le nord et l'est de la France.;https://fr.wikipedia.org/wiki/Saint-Nicolas_(fête)
3;fr;Dans certaines régions d'Europe, de qui Saint Nicolas est-il accompagné ?;Père Fouettard;Jack Frost;Casse-noisette;Julbock;Débutant;Vêtu d'un grand manteau noir avec un grand capuchon et de grosses bottes, le Père Fouettard porte parfois un fouet et un sac.;https://fr.wikipedia.org/wiki/Père_Fouettard
4;fr;Outre le blanc, quelle couleur est souvent associée à Saint Nicolas ?;Rouge;Noir;Bleu;Jaune;Débutant;Il était en mauve et blanc, avec une crosse, dorée à l'origine, puis en rouge et blanc, ce qui le rapproche du Père Noël actuel.;https://fr.wikipedia.org/wiki/Saint-Nicolas_(fête)
5;fr;Sur quoi Saint Nicolas se déplace-t-il en Belgique francophone ?;Âne magique;Rêne volant;Éléphant royal;Cheval blanc;Débutant;Au nord comme au sud du pays, Saint Nicolas se déplace la nuit du 5 au 6 décembre pour déposer cadeaux et friandises.;https://fr.wikipedia.org/wiki/Saint-Nicolas_(fête)
6;fr;Que retrouve-t-on dans les souliers des enfants belges à la Saint Nicolas ?;Spéculoos;Cougnou;Faluche;Tarte au sucre;Débutant;Traditionnellement, le spéculoos est le plus souvent consommé lors de l'avent et plus particulièrement lors de la fête de saint Nicolas.;https://fr.wikipedia.org/wiki/Spéculoos
7;fr;Dans quel pays a lieu la soirée des paquets-surprises, la veille de la Saint-Nicolas ?;Pays-Bas;Suisse;Luxembourg;Pologne;Débutant;Les paquets-surprises, donnés par Sinterklaas par la cheminée ou sur le pallier, sont souvent accompagnés de poèmes.;https://fr.wikipedia.org/wiki/Saint-Nicolas_(fête)
8;fr;Comment se nomme l'acolyte de Saint-Nicolas dans le folklore alsacien ?;Hans Trapp;Hermann Gessler;Guifred Estruch;Bos de Bénac;Débutant;À l'origine de ce personnage, il y aurait le maréchal Jean de Dratt (Hans von Trotha), brute sanguinaire qui terrorisait la population.;https://fr.wikipedia.org/wiki/Père_Fouettard
9;fr;Dans quelle ville du sud de Nancy une grande basilique est-elle dédiée à Saint Nicolas ?;Saint-Nicolas-de-Port;Val de Briey;Mont-Saint-Martin;Villerupt;Débutant;En 1193, une seconde église y sera construite. C'est d'ailleurs dans celle-ci que viendra prier Jeanne d'Arc en 1429.;https://fr.wikipedia.org/wiki/Saint-Nicolas-de-Port
10;fr;De quel dieu scandinave une partie des attributs de Saint Nicolas serait-elle inspirée ?;Odin;Loki;Thor;Vali;Débutant;En effet, Odin est toujours accompagné de ses deux corbeaux qui voient tout et de son fidèle cheval Sleipnir.;https://fr.wikipedia.org/wiki/Odin
11;fr;Aux Pays-Bas, de quel engin Saint Nicolas débarque-t-il venu d'Espagne ?;Bateau;Avion;Montgolfière;Planeur;Confirmé;Il arrive depuis l'Espagne sur un bateau à vapeur (stoomboot) que l'on appelle Pakjesboot 12 (Bateau des petits paquets 12).;https://fr.wikipedia.org/wiki/Saint-Nicolas_(fête)
12;fr;De quelle région de France Saint Nicolas est-il le saint patron depuis 1477 ?;Lorraine;Limousin;Languedoc;Lyonnais;Confirmé;En effet, alors que la Lorraine était occupée par la Bourgogne, le duc René II demanda la victoire (qu'il reçut) à saint Nicolas.;https://fr.wikipedia.org/wiki/Lorraine
13;fr;À Nancy, sur combien de semaines sont étalées les fêtes de Saint-Nicolas ?;Deux semaines;Une semaine;Trois semaines;Quatre semaines;Confirmé;Dans toute la ville on trouve des courses, des spectacles de rue, un marché fermier ou encore « le village de la marmaille ».;https://fr.wikipedia.org/wiki/Saint-Nicolas_(fête)
14;fr;Combien de personnes sont venues écouter saint Nicolas à Fribourg en 2015 ?;25 000;15 000;5 000;35 000;Confirmé;Traditionnellement, il y tient un discours qui contient des passages satiriques sur les événements de la ville de l'année écoulée.;https://fr.wikipedia.org/wiki/Saint-Nicolas_(fête)
15;fr;En Hongrie, que dépose Saint Nicolas dans les bottes des méchants enfants ?;Bâton;Banane;Marteau;Faux rat;Confirmé;Saint Nicolas est souvent accompagné par le Krampusz, l'effrayant assistant qui est chargé d'enlever les méchants enfants.;https://fr.wikipedia.org/wiki/Saint-Nicolas_(fête)
16;fr;Quelle profession exerçait Pierre Lenoir, qui deviendra par la suite le Père Fouettard ?;Boucher;Charpentier;Maçon;Serrurier;Confirmé;Il coupa trois enfants en petits morceaux pour finalement les mettre dans son saloir afin d'en faire du petit salé.;https://fr.wikipedia.org/wiki/Saint-Nicolas_(fête)
17;fr;Quel jour fête-t-on Saint-Nicolas pour l'Église orthodoxe ?;19 décembre;11 décembre;2 janvier;24 décembre;Confirmé;L'Église orthodoxe utilise encore le calendrier julien qui était est un calendrier solaire utilisé dans la Rome antique.;https://fr.wikipedia.org/wiki/Calendrier_julien
18;fr;Outre les enfants, de qui Saint Nicolas est-il également le patron ?;Avocats;Charpentiers;Informaticiens;Secrétaires;Confirmé;Il est aujourd'hui le patron de nombreuses corporations comme les prisonniers, les avocats, les ergothérapeutes, ou les célibataires.;https://fr.wikipedia.org/wiki/Saint-Nicolas_(fête)
19;fr;En Autriche, quels personnages entourant Saint Nicolas font peur à la foule ?;Krampus;Kolobox;Curupira;Lagahoo;Confirmé;Portant un masque de diable cornu et de grosses fourrures, ils agitent des chaînes, poursuivant les gens avec des bâtons.;https://fr.wikipedia.org/wiki/Krampus
20;fr;Que représente la relique de saint Nicolas conservée à Saint-Nicolas-de-Port ?;Phalange;Cubitus;Humérus;Occipital;Confirmé;La basilique a été restaurée à partir de 1983 grâce au legs considérable de Mme Camille Croué-Friedman, originaire de la ville.;https://fr.wikipedia.org/wiki/Saint-Nicolas_(fête)
21;fr;Quel est le point de passage incontournable du défilé de Saint-Nicolas à Metz ?;Place d'Armes;Les Trinitaires;Fort de Queuleu;Fort Moselle;Expert;À Metz, de nombreuses festivités ont lieu comme le défilé du Saint-Nicolas, des spectacles et aussi un feu d'artifice.;https://fr.wikipedia.org/wiki/Place_d'Armes_(Metz)
22;fr;Dans quelle région de France le Père Fouettard est-il représenté comme mi-fée mi-sorcière ?;Franche-Comté;Gascogne;Touraine;Anjou;Expert;La Franche-Comté possède aussi ses brioches de la Saint-Nicolas, comme le Männele alsacien, aussi appelé Jean Bonhomme.;https://fr.wikipedia.org/wiki/Saint-Nicolas_(fête)
23;fr;Au Luxembourg, que distribue le père Fouettard aux vilains enfants ?;Brindilles;Chardons;Orties;Ronces;Expert;Au Luxembourg, le père Fouettard est un petit homme dont le visage n'est pas visible car il est caché par une énorme capuche.;https://fr.wikipedia.org/wiki/Saint-Nicolas_(fête)
24;fr;Dans quel pays les Iffelträger défilent-ils en portant d'énormes mitres éclairées ?;Suisse;Belgique;Hongrie;Pologne;Expert;Ils sont accompagnés de centaines de personnes qui agitent de grosses cloches et des grelots.;https://fr.wikipedia.org/wiki/Saint-Nicolas_(fête)
25;fr;Qui a peint « La Saint-Nicolas », tableau visible au Rijksmuseum d'Amsterdam ?;Jan Steen;Jacobus Vrel;Cornelis Vroom;Andries Stock;Expert;Représentant du baroque, Jan Steen figure parmi les peintres de genre néerlandais les plus importants de son époque.;https://fr.wikipedia.org/wiki/Jan_Steen
26;fr;Qui a sorti en 2004 la BD « Le saint patron », dans la collection Ciboulette ?;Jochen Gerner;Paul Gillon;Jean Graton;Alain Goutal;Expert;Né à Nancy en 1970, Jochen Gerner est diplômé de l'École nationale supérieure d'art de Nancy où il étudia de 1988 à 1993.;https://fr.wikipedia.org/wiki/Jochen_Gerner
27;fr;Que distribue Saint Nicolas aux enfants de Romont, dans le canton de Fribourg ?;Biscômes;Bricelets;Caracs;Cuchaules;Expert;Consommé dans le nord de la Suisse, le biscôme est une sorte de pain d'épice plat, de couleur brune et au goût épicé.;https://fr.wikipedia.org/wiki/Biscôme
28;fr;Qui a relancé la tradition de la Saint-Nicolas à Bulle, capitale du district de la Gruyère ?;Henri Gremaud;Nicolas Marchal;Joseph Bertrand;Ernest Bonnardel;Expert;Aujourd'hui, l'organisation et l'animation de la fête est aux mains de la troupe de théâtre des Trétaux de Chalamala.;https://fr.wikipedia.org/wiki/Saint-Nicolas_(fête)
29;fr;De quel chef-lieu du district de la Sarine Saint Nicolas est-il le patron ?;Fribourg;Corserey;Avry;Ponthaux;Expert;La ville Suisse se place sous le patronage de saint Nicolas de Myre, de sainte Barbe et de sainte Catherine d'Alexandrie.;https://fr.wikipedia.org/wiki/Fribourg_(ville_suisse)
30;fr;Dans quel pays d'Europe la Saint-Nicolas est-elle appelée Mikolajki ?;Pologne;Suisse;Pays-Bas;Luxembourg;Expert;À l'école, chacun offre un petit cadeau symbolique à un collègue dont le nom est tiré au sort quelques jours avant.;https://fr.wikipedia.org/wiki/Saint-Nicolas_(fête)
1;en;Which bishop is staged during the feast of Saint Nicholas ?;Nicolas de Myre;Benedict of Nursia;Alexis of Rome;Martin from Tours;Débutant;Bishop of Myra in Lycia, he probably participated in the First Council of Nicaea during which he fought Arianism.;https://en.wikipedia.org/wiki/Saint_Nicholas
2;en;What day do we celebrate Saint Nicholas for the Catholic Church ?;December 6;December 19;December 24;December 11;Débutant;The feast of Saint Nicholas is a long-lived tradition in several European countries as well as in the north and east of France.;
3;en;In certain regions of Europe, with whom is Saint Nicholas accompanied ?;Father Fouettard;Jack Frost;Nutcracker;Julbock;Débutant;Dressed in a large black coat with a large hood and thick boots, Father Fouettard sometimes carries a whip and a bag.;
4;en;Besides white, what color is often associated with Saint Nicholas ?;Red;Black;Blue;Yellow;Débutant;He was in mauve and white, with a butt, originally gold, then in red and white, which brings him closer to today's Santa Claus.;
5;en;What does Saint Nicolas travel to in French-speaking Belgium ?;Magic donkey;Flying Reindeer;Royal elephant;White horse;Débutant;In the north as in the south of the country, Saint Nicolas comes on the night of December 5 to 6 to drop off gifts and sweets.;
6;en;What do we find in the shoes of Belgian children on Saint Nicholas Day ?;Speculoos;Cougnou;Faluche;Sugar pie;Débutant;Traditionally, it is most often consumed during Advent and more particularly during the feast of Saint Nicholas.;
7;en;In which country does the evening of surprise packages take place on the eve of Saint-Nicolas ?;Netherlands;Switzerland;Luxembourg;Poland;Débutant;The surprise packages, given by Sinterklaas by the fireplace or on the landing, are often accompanied by poems.;
8;en;What is the name of Saint-Nicolas's acolyte in Alsatian folklore ?;Hans Trapp;Hermann Gessler;Guifred Estruch;Bos de Bénac;Débutant;At the origin of this character, there would be Marshal Jean de Dratt (Hans von Trotha), a bloodthirsty brute who terrorized the population.;
9;en;In which city in the south of Nancy is a large basilica dedicated to the Saint ?;Saint-Nicolas-de-Port;Val de Briey;Mont-Saint-Martin;Villerupt;Débutant;In 1193, a second church will be built there. It is in this one that will come to pray Joan of Arc in 1429.;https://en.wikipedia.org/wiki/Saint-Nicolas-de-Port
10;en;From which Scandinavian god would some of the attributes of Saint Nicholas be inspired ?;Odin;Loki;Thor;Vali;Débutant;Indeed, Odin is always accompanied by his two crows who see everything and his faithful horse Sleipnir.;https://en.wikipedia.org/wiki/Odin
11;en;In the Netherlands, which vehicle did Saint Nicolas land from Spain ?;Boat;Plane;Hot air balloon;Glider;Confirmé;It arrives from Spain on a stoomboot called Pakjesboot 12 (Small packet boat 12).;
12;en;From which region of France has Saint Nicolas been the patron saint since 1477 ?;Lorraine;Limousin;Languedoc;Lyonnais;Confirmé;Indeed, while Lorraine was occupied by Burgundy, Duke René II demanded the victory (which he received) from Saint Nicolas.;https://en.wikipedia.org/wiki/Lorraine
13;en;In Nancy, over how many weeks are the feasts of Saint-Nicolas spread out ?;Two weeks;One week;Three weeks;Four weeks;Confirmé;Throughout the city there are races, street shows, a farmer's market and even the village of La Marmaille.;
14;en;How many people came to listen to Saint Nicholas in Friborg in 2015 ?;25,000;15,000;5,000;35,000;Confirmé;Traditionally, he gives a speech there which contains satirical passages on the events of the city of the past year.;
15;en;In Hungary, what does Saint Nicholas put in the boots of wicked children ?;A stick;A banana;A hammer;A false rat;Confirmé;Saint Nicholas is often accompanied by the Krampusz, the frightening helper who is in charge of kidnapping the wicked children.;
16;en;What profession did Pierre Lenoir exercise, who would become Father Fouettard ?;Butcher;Carpenter;Mason;Locksmith;Confirmé;He cut three children into small pieces to finally put them in his salting tub to make a little salt.;
17;en;What day do we celebrate Saint Nicholas for the Orthodox Church ?;December 19;December 11;January 2;December 24;Confirmé;The Orthodox Church still uses the Julian calendar which was is a solar calendar used in ancient Rome.;https://en.wikipedia.org/wiki/Julian_calendar
18;en;Besides the children, of whom is Saint Nicholas also the patron ?;Lawyers;Carpenters;IT specialists;Secretaries;Confirmé;Today he is the patron of many corporations such as prisoners, lawyers, occupational therapists, and bachelors.;
19;en;In Austria, which characters surrounding Saint Nicholas scare the crowd ?;Krampus;Kolobox;Curupira;Lagahoo;Confirmé;Wearing a horned devil mask and thick furs, they wave chains, chasing people with sticks.;https://en.wikipedia.org/wiki/Krampus
20;en;What does the relic of Saint Nicolas represent in Saint-Nicolas-de-Port ?;Phalanx;Cubitus;Humerus;Occipital;Confirmé;The basilica was restored from 1983 thanks to the considerable bequest of Mrs. Camille Croué-Friedman, originally from the city.;
21;en;What is the essential point of passage of the parade of Saint-Nicolas in Metz ?;Place d'Armes;The Trinitarians;Fort de Queuleu;Fort Moselle;Expert;In Metz, many festivities take place such as the Saint-Nicolas parade, shows and also fireworks.;
22;en;In which region of France is Père Fouettard a woman, half fairy, half witch ?;Franche-Comté;Gascony;Touraine;Anjou;Expert;Franche-Comté also has its Saint-Nicolas brioches, such as the Alsatian Männele, also called Jean Bonhomme.;
23;en;In Luxembourg, what does Father Fouettard distribute to naughty children ?;Twigs;Thistles;Nettles;Brambles;Expert;In Luxembourg, Father Fouettard is a small man whose face is not visible because it is hidden by a huge hood.;
24;en;In which country do the Iffelträger march wearing huge lighted miters ?;Switzerland;Belgium;Hungary;Poland;Expert;They are accompanied by hundreds of people who wave big bells and bells.;
25;en;Who painted « La Saint-Nicolas », visible at the Rijksmuseum in Amsterdam ?;Jan Steen;Jacobus Vrel;Cornelis Vroom;Andries Stock;Expert;Representative of the Baroque, Jan Steen is one of the most important Dutch genre painters of his time.;https://en.wikipedia.org/wiki/Jan_Steen
26;en;In 2004, who released the « The patron saint » comic in the Ciboulette collection ?;Jochen Gerner;Paul Gillon;Jean Graton;Alain Goutal;Expert;Born in Nancy in 1970, Jochen Gerner graduated from the École nationale supérieure d'art de Nancy, where he studied from 1988 to 1993.;
27;en;What does Saint Nicolas distribute to the children of Romont, in the canton of Friborg ?;Biscomes;Bricelets;Caracs;Cuchaules;Expert;Consumed in northern Switzerland, biscôme is a kind of flat gingerbread, brown in color and with a spicy taste.;
28;en;Who revived the tradition of Saint-Nicolas in Bulle, capital of the district of Gruyère ?;Henri Gremaud;Nicolas Marchal;Joseph Bertrand;Ernest Bonnardel;Expert;Today, the organization and animation of the festival is in the hands of the Trétaux de Chalamala theater troupe.;
29;en;From which capital of the district of Sarine Saint Nicolas is he the patron of the city ?;Freiburg;Corserey;Avry;Ponthaux;Expert;The Swiss city is placed under the patronage of Saint Nicholas of Myra, Saint Barbara and Saint Catherine of Alexandria.;https://en.wikipedia.org/wiki/Fribourg
30;en;In which European country is Saint Nicholas called Mikolajki ?;Poland;Switzerland;Netherlands;Luxembourg;Expert;At school, everyone gives a small symbolic gift to a colleague whose name is drawn a few days before.;
1;de;Welcher Bischof wird beim Nikolausfest inszeniert ?;Nicolas de Myre;Benedikt von Nursia;Alexis von Rom;Martin aus Tours;Débutant;Er war Bischof von Myra in Lykien und nahm wahrscheinlich am Ersten Konzil von Nicäa teil, bei dem er gegen den Arianismus kämpfte.;https://de.wikipedia.org/wiki/Nikolaus_von_Myra
2;de;An welchem Tag feiern wir den Heiligen Nikolaus für die katholische Kirche ?;6. Dezember;19. Dezember;24. Dezember;11. Dezember;Débutant;Das Fest des Heiligen Nikolaus hat in mehreren europäischen Ländern sowie im Norden und Osten Frankreichs eine lange Tradition.;
3;de;Mit wem wird der Nikolaus in bestimmten Regionen Europas begleitet ?;Pater Fouettard;Jack Frost;Nussknacker;Julbock;Débutant;In einem großen schwarzen Mantel mit großer Kapuze und dicken Stiefeln trägt Pater Fouettard manchmal eine Peitsche und eine Tasche.;
4;de;Welche Farbe wird neben Weiß oft mit dem Heiligen Nikolaus in Verbindung gebracht ?;Rot;Schwarz;Blau;Gelb;Débutant;Er war in Mauve und Weiß, mit einem Kolben, ursprünglich gold, dann in Rot und Weiß, was ihn dem heutigen Weihnachtsmann näher bringt.;
5;de;Wohin reist Saint Nicolas im französischsprachigen Belgien ?;Magischer Esel;Fliegendes Rentier;Königlicher Elefant;Weißes Pferd;Débutant;Im Norden wie im Süden des Landes reist Saint Nicolas in der Nacht vom 5. auf den 6. Dezember, um Geschenke und Süßigkeiten abzugeben.;
6;de;Was finden wir am Nikolaustag in den Schuhen belgischer Kinder ?;Spekulatius;Cougnou;Faluche;Zuckerkuchen;Débutant;Traditionell wird es am häufigsten in der Adventszeit und insbesondere während des Nikolausfestes konsumiert.;
7;de;In welchem Land findet der Abend der Überraschungspakete am Vorabend von Saint-Nicolas statt ?;Niederlande;Schweiz;Luxemburg;Polen;Débutant;Die Überraschungspakete, die Sinterklaas am Kamin oder auf dem Treppenabsatz überreicht, werden oft von Gedichten begleitet.;
8;de;Wie heißt der Akolyth von Saint-Nicolas in der elsässischen Folklore ?;Hans Trapp;Hermann Gessler;Guifred Estruch;Bos de Benac;Débutant;Am Ursprung dieser Figur sollte Marschall Jean de Dratt (Hans von Trotha) stehen, ein blutrünstiges Tier, das die Bevölkerung terrorisierte.;
9;de;In welcher Stadt im Süden von Nancy ist dem Heiligen eine große Basilika geweiht ?;Saint-Nicolas-de-Port;Val de Briey;Mont-Saint-Martin;Villerupt;Débutant;1193 wird dort eine zweite Kirche gebaut. In diesem wird auch Jeanne d'Arc 1429 beten.;https://de.wikipedia.org/wiki/Saint-Nicolas-de-Port
10;de;Von welchem skandinavischen Gott wären einige der Attribute des Heiligen Nikolaus inspiriert ?;Odin;Loki;Thor;Vali;Débutant;Tatsächlich wird Odin immer von seinen beiden Krähen, die alles sehen, und seinem treuen Pferd Sleipnir begleitet.;https://de.wikipedia.org/wiki/Odin
11;de;Welches Fahrzeug landet in den Niederlanden von Saint Nicolas aus Spanien ?;Boot;Flugzeug;Heißluftballon;Segelflugzeug;Confirmé;Es kommt aus Spanien auf einem Stoomboot namens Pakjesboot 12 (Small Packet Boat 12).;
12;de;Aus welcher Region Frankreichs ist Saint Nicolas seit 1477 der Schutzpatron ?;Lothringen;Limousine;Languedoc;Lyon;Confirmé;Während Lothringen von Burgund besetzt war, forderte Herzog René II. den Sieg (den er erhielt) von Saint Nicolas.;https://de.wikipedia.org/wiki/Lothringen
13;de;Auf wie viele Wochen erstrecken sich die Feste von Saint-Nicolas in Nancy ?;Zwei Wochen;Eine Woche;Drei Wochen;Vier Wochen;Confirmé;In der ganzen Stadt gibt es Rennen, Straßenshows, einen Bauernmarkt und sogar das Dorf La Marmaille.;
14;de;Wie viele Menschen kamen 2015 nach Freiburg, um Sankt Nikolaus zu hören ?;25.000;15.000;5.000;35.000;Confirmé;Dort hält er traditionell eine Rede, die satirische Passagen zu den Ereignissen der Stadt des vergangenen Jahres enthält.;
15;de;Was steckt Sankt Nikolaus in Ungarn in die Stiefel der bösen Kinder ?;Ein Stock;Eine Banane;Ein Hammer;Eine falsche Ratte;Confirmé;Der heilige Nikolaus wird oft von den Krampusz begleitet, dem furchterregenden Helfer, der für die Entführung der bösen Kinder verantwortlich ist.;
16;de;Welchen Beruf übte Pierre Lenoir aus, wer wurde Pater Fouettard ?;Metzger;Zimmermann;Maurer;Schlosser;Confirmé;Er schnitt drei Kinder in kleine Stücke, um sie schließlich in seine Salzwanne zu legen, um ein wenig Salz herzustellen.;
17;de;An welchem Tag feiern wir den Heiligen Nikolaus für die orthodoxe Kirche ?;19. Dezember;11. Dezember;2. Januar;24. Dezember;Confirmé;Die orthodoxe Kirche verwendet immer noch den Julianischen Kalender, der im alten Rom ein Sonnenkalender war.;https://de.wikipedia.org/wiki/Julianischer_Kalender
18;de;Neben den Kindern, von wem ist der Heilige Nikolaus auch der Schutzpatron ?;Rechtsanwälte;Tischler;IT-Spezialisten;Sekretäre;Confirmé;Heute ist er der Schirmherr vieler Unternehmen wie Häftlinge, Anwälte, Ergotherapeuten und Junggesellen.;
19;de;Welche Charaktere rund um den Nikolaus erschrecken in Österreich die Menge ?;Krampus;Kolobox;Curupira;Lagahoo;Confirmé;Sie tragen eine gehörnte Teufelsmaske und dicke Felle, schwingen Ketten und jagen Menschen mit Stöcken.;https://de.wikipedia.org/wiki/Krampus
20;de;Was stellt die Reliquie von Saint Nicolas in Saint-Nicolas-de-Port dar ?;Phalanx;Kubitus;Humerus;Hinterhauptbein;Confirmé;Die Basilika wurde 1983 dank des beträchtlichen Vermächtnisses der aus der Stadt stammenden Frau Camille Croué-Friedman restauriert.;
21;de;Was ist der wesentliche Durchgangspunkt der Parade von Saint-Nicolas in Metz ?;Place d'Armes;Die Trinitarier;Fort de Queuleu;Festung Mosel;Expert;In Metz finden viele Feste wie der Saint-Nicolas-Umzug, Shows und auch Feuerwerke statt.;https://de.wikipedia.org/wiki/Place_d'Armes_(Metz)
22;de;In welcher Region Frankreichs ist Père Fouettard eine Frau, halb Fee, halb Hexe ?;Franche-Comté;Gascogne;Touraine;Anjou;Expert;In der Franche-Comté gibt es auch Saint-Nicolas-Brioches wie die elsässische Männele, auch Jean Bonhomme genannt.;
23;de;Was verteilt Pater Fouettard in Luxemburg an ungezogene Kinder ?;Zweige;Disteln;Brennnesseln;Brombeeren;Expert;In Luxemburg ist Pater Fouettard ein kleiner Mann, dessen Gesicht nicht sichtbar ist, weil es von einer riesigen Kapuze verdeckt wird.;
24;de;In welchem Land marschieren die Iffelträger mit riesigen beleuchteten Mitra ?;Schweiz;Belgien;Ungarn;Polen;Expert;Sie werden von Hunderten von Menschen begleitet, die große Glocken und Glocken schwenken.;
25;de;Wer hat « La Saint-Nicolas » gemalt, die im Rijksmuseum in Amsterdam zu sehen ist ?;Jan Steen;Jacobus Vrel;Cornelis Vroom;Andries Lager;Expert;Als Vertreter des Barock ist Jan Steen einer der bedeutendsten niederländischen Genremaler seiner Zeit.;https://de.wikipedia.org/wiki/Jan_Steen
26;de;Wer hat 2004 den Comic « Der Schutzpatron » in der Sammlung Ciboulette veröffentlicht ?;Jochen Gerner;Paul Gillon;Jean Graton;Alain Goutal;Expert;1970 in Nancy geboren, absolvierte Jochen Gerner die École nationale supérieure d'art de Nancy, wo er von 1988 bis 1993 studierte.;
27;de;Was verteilt Saint Nicolas an die Kinder von Romont im Kanton Freiburg ?;Biscome;Bricelets;Caracs;Cuchaules;Expert;Biscôme wird in der Nordschweiz konsumiert und ist eine Art flacher Lebkuchen, braun in der Farbe und mit einem würzigen Geschmack.;
28;de;Wer hat die Tradition von Saint-Nicolas in Bulle, der Hauptstadt des Bezirks Greyerz, wiederbelebt ?;Henri Gremaud;Nicolas Marchal;Joseph Bertrand;Ernest Bonnardel;Expert;Heute liegt die Organisation und Animation des Festivals in den Händen der Theatertruppe Trétaux de Chalamala.;
29;de;Aus welcher Hauptstadt des Bezirks Sarine Saint Nicolas ist er der Schutzpatron der Stadt ?;Freiburg;Korserey;Avry;Ponthaux;Expert;Die Schweizer Stadt steht unter dem Patronat des Heiligen Nikolaus von Myra, der Heiligen Barbara und der Heiligen Katharina von Alexandria.;https://de.wikipedia.org/wiki/Freiburg_im_Üechtland
30;de;In welchem europäischen Land heißt der heilige Nikolaus Mikolajki ?;Polen;Schweiz;Niederlande;Luxemburg;Expert;In der Schule überreicht jeder ein kleines symbolisches Geschenk an einen Kollegen, dessen Name einige Tage zuvor gezeichnet wurde.;
1;es;¿Qué obispo se representa durante la fiesta de San Nicolás ?;Nicolas de Myre;Benito de Nursia;Alexis de Roma;Martin de Tours;Débutant;Obispo de Myra en Licia, probablemente participó en el Primer Concilio de Nicea durante el cual luchó contra el arrianismo.;https://es.wikipedia.org/wiki/Nicolás_de_Bari
2;es;¿Qué día celebramos a San Nicolás para la Iglesia Católica ?;6 de diciembre;19 de diciembre;24 de diciembre;11 de diciembre;Débutant;La fiesta de San Nicolás es una tradición de larga data en varios países europeos, así como en el norte y este de Francia.;
