16;es;¿Quién se reservó por primera vez para embalsamar bajo el Antiguo Imperio Egipcio ?;A los faraones;A los escribas;A los sacerdotes;A los animales;Confirmé;El embalsamamiento se refiere a todas las técnicas destinadas a preservar los cuerpos de personas fallecidas.;https://es.wikipedia.org/wiki/Embalsamamiento
17;es;¿Cuántos escalones bajan hasta la puerta principal de la tumba de Tutankamón ?;Dieciséis;Treinta;Cuatro;Cincuenta;Confirmé;Desde allí, un pasillo conduce a una puerta que cierra la entrada a la primera habitación, llamada antecámara por Carter.;
18;es;¿Cómo se llamó la primera habitación de la tumba de Tutankhamon ?;Antecámara;Vestíbulo;Reserva;Dormitorio;Confirmé;Cuando se descubrió, la antecámara contenía más de 700 habitaciones amontonadas y revueltas.;
19;es;¿Cómo estuvo casi carbonizada la momia de Tutankamón ?;Ungüentos;Sufre;Natron;Bronce;Confirmé;De hecho, es por los ungüentos vertidos en el momento del entierro que la momia estaba casi carbonizada.;
20;es;¿Cuántas hijas que murieron prematuramente habría tenido el faraón Tutankamón ?;Dos;Tres;Cuatro;Cinco;Confirmé;El examen de sus momias en 2011 reveló que uno de los fetos murió a los cinco o seis meses de embarazo.;
21;es;¿Quién descubrió la tumba de Tutankhamon en 1922 ?;Howard Carter;Somers Clarke;Henry Salt;Alfred Lucas;Expert;En 1924, realizó muchas entrevistas en los Estados Unidos, donde fue visto como una verdadera estrella.;https://es.wikipedia.org/wiki/Howard_Carter
22;es;¿Qué designación egipcia se usa para la tumba de Tutankhamon ?;KV62;MC23;DS36;ZX44;Expert;La visita a la tumba KV62 está sujeta a un precio específico que puede variar según la temporada.;
23;es;¿Cuántas obras y muebles contenía la tumba de Tutankamón ?;2,099;1.245;3,627;4.830;Expert;La cámara del tesoro contenía modelos de barcos, numerosas estatuas y dos momias de fetos.;
24;es;¿Qué nombre lleva el tocado más emblemático de los faraones ?;Nemes;Pakol;Causia;Kippa;Expert;El nemes es una cubierta de tela, bastante compleja, formada por varias partes.;
25;es;¿Qué diosa protectora del faraón se encuentra en la máscara de Tutankamón ?;Nekhbet;Kekou;Miysis;Hathor;Expert;En su papel de protectora del faraón, Nekhbet está asociada con la diosa cobra Ouadjet, símbolo del Bajo Egipto.;https://es.wikipedia.org/wiki/Nejbet
26;es;¿Qué mineral se usaba a menudo para joyería funeraria entre los egipcios ?;Amatista;Circón;Granate;Opal;Expert;El color de la amatista solo permanece estable hasta 250 ° C. Más allá de eso, la mayoría de las amatistas se decolorarán.;
27;es;¿De qué están incrustados los ojos de la famosa máscara de Tutankamón ?;Lapislázuli;Ágata;Topacio;Turquesa;Expert;El lapislázuli es mejor conocido como piedra ornamental, opaca, de color azul.;https://es.wikipedia.org/wiki/Lapislázuli
28;es;¿Qué mineral permitió a los egipcios deshidratar el tejido humano ?;Natron;Níquel;Litio;Bismuto;Expert;Los egipcios observaron la similitud en la materia entre el natrón purificado, calentado y seco y la parte soluble en agua.;https://es.wikipedia.org/wiki/Natrón
29;es;¿Qué pusimos debajo de las caras de las momias para restaurar su forma ?;Clay;Yeso;Ocre;Carbón;Expert;Una momia es un cadáver que se ha preservado de la destrucción y la descomposición.;https://es.wikipedia.org/wiki/Momia
30;es;¿De qué enfermedad infecciosa era portadora la momia de Tutankamón ?;Paludismo;Sarampión;Tuberculosis;Paludismo;Expert;Cuatro de las momias del estudio, incluida la de Tutankamón, son portadoras de parásitos de la malaria.;
1;it;In quale città è esposta la maschera d'oro della bara di Tutankhamon ?;Il Cairo;Luxor;Boulaq;Alessandria;Débutant;Il Museo Egizio del Cairo è uno dei più grandi musei interamente dedicati all'antichità egizia.;
2;it;Che professione faceva Howard Carter, figlio del pittore di animali Samuel John Carter ?;Archeologo;Fisico;Giornalista;Decoratore;Débutant;Howard Carter è meglio conosciuto per aver scoperto la tomba di Tutankhamon nel 1922.;https://it.wikipedia.org/wiki/Howard_Carter
3;it;Quanti sarcofagi hanno protetto la mummia di Tutankhamon ?;Tre;Due;Quattro;Cinque;Débutant;Alla fine dei settanta giorni, Tutankhamon sarà sepolto, secondo i riti funebri reali.;
4;it;Di che materiale è fatta la maschera mortuaria di Tutankhamon ?;Oro;Bronzo;Intonaco;Denaro;Débutant;Sul volto di Tutankhamon è ripiegata una maschera d'oro fine i cui tratti ricordano il volto della regina Tiyi.;
5;it;Quale materiale prezioso ha evocato il dio Sole per gli egiziani ?;Oro;Platino;Titanio;Palladio;Débutant;Nella mitologia egizia, Ra (o Ra) è il dio del disco solare e il creatore dell'universo.;
6;it;Qual è il più grande museo dedicato alla civiltà dell'antico Egitto ?;Museo del Cairo;Museo di Giza;Museo Fayoum;Museo Banha;Débutant;Il Museo del Cairo ha ricevuto oltre cento milioni di visitatori durante il XX \u003csup\u003e secolo \u003c/sup\u003e.;
7;it;Di cosa è fatto il sarcofago esterno che protegge la mummia di Tutankhamon ?;Legno;Ferro;Rock;Papyrus;Débutant;Si dice che la tomba di Tutankhamon sia stata visitata due volte da ladri di tombe.;
8;it;Con quale tecnica gli egiziani aprirono all'anima il mondo sotterraneo ?;Imbalsamazione;Dissezione;Cremazione;Appeso;Débutant;Nell'antico Egitto, gli imbalsamatori sono anche chiamati taricheutes, che significa carne conservata, corpo imbalsamato.;https://it.wikipedia.org/wiki/Imbalsamazione
9;it;Nell'antico Egitto quale dimora era essenziale per la vita eterna ?;Sarcofago;Battistero;Mausoleo;Colombarium;Débutant;Molto spesso scolpito nella pietra e posto sopra il terreno, il sarcofago è talvolta sepolto.;https://it.wikipedia.org/wiki/Sarcofago
10;it;In quale valle fu scoperta la tomba del faraone Tutankhamon ?;Valle dei Re;Valle dei Principi;Valle dei Duchi;Valle degli Dei;Débutant;La Valle dei Re è una regione dell'Egitto situata sulla riva occidentale del Nilo all'altezza di Tebe (oggi Luxor).;
11;it;Qual è il peso della maschera funeraria in oro massiccio dalla bara di Tutankhamon ?;11 kg;8 kg;5 kg;2 kg;Confirmé;Questa scultura, scoperta nel 1925, è un vero capolavoro dell'oreficeria egizia.;
12;it;Sulla maschera di Tutankhamon, quale animale respinge i nemici con il suo respiro ?;Cobra;Cavallo;Dragon;Scorpione;Confirmé;Nella mitologia egizia, Wadjet è una dea cobra protettiva del Basso Egitto.;
13;it;Cosa simboleggia la falsa barba della maschera funebre di Tutankhamon ?;Immortalità;Potenza;Gloria;Posterità;Confirmé;Nell'antico Egitto, la barba finta è uno degli attributi che il faraone condivide con gli dei.;
14;it;Quale materiale prezioso simboleggia le ossa del faraone defunto ?;Denaro;Oro;Platino;Bronzo;Confirmé;Le mostre dedicate a Tutankhamon registrano molto regolarmente un notevole successo popolare.;
15;it;Quale mecenate ha finanziato lo scavo di Howard Carter della tomba di Tutankhamon ?;Lord Carnarvon;Thomas Young;Harry Burton;Geoffrey Martin;Confirmé;Lord Carnarvon si sposò nel 1895 con la ricchissima Almina Wombwell, figlia naturale del banchiere Alfred de Rothschild.;
16;it;Chi fu riservato per la prima volta all'imbalsamazione sotto l'antico impero egiziano ?;Ai faraoni;Agli scribi;Ai sacerdoti;Agli animali;Confirmé;L'imbalsamazione si riferisce a tutte le tecniche volte a preservare i corpi dei defunti.;https://it.wikipedia.org/wiki/Imbalsamazione
17;it;Quanti gradini scendono alla porta d'ingresso della tomba di Tutankhamon ?;Sedici;Trenta;Quattro;Cinquanta;Confirmé;Da lì, un corridoio conduce ad una porta che chiude l'ingresso alla prima stanza, chiamata anticamera da Carter.;
18;it;Come si chiamava la prima stanza della tomba di Tutankhamon ?;Anticamera;Vestibolo;Riserva;Dormitorio;Confirmé;Quando è stato scoperto, l'anticamera conteneva più di 700 stanze ammucchiate insieme.;
19;it;Come è stata quasi carbonizzata la mummia di Tutankhamon ?;Unguenti;Soffre;Natron;Bronzo;Confirmé;È infatti dagli unguenti versati al momento della sepoltura che la mummia era quasi carbonizzata.;
20;it;Quante figlie morte prematuramente avrebbe avuto il faraone Tutankhamon ?;Due;Tre;Quattro;Cinque;Confirmé;L'esame delle loro mummie nel 2011 ha rivelato che uno dei feti è morto a cinque o sei mesi di gravidanza.;
21;it;Chi ha scoperto la tomba di Tutankhamon nel 1922 ?;Howard Carter;Somers Clarke;Henry Salt;Alfred Lucas;Expert;Nel 1924 fece molte interviste negli Stati Uniti dove fu visto come una vera star.;https://it.wikipedia.org/wiki/Howard_Carter
22;it;Quale designazione egiziana è usata per la tomba di Tutankhamon ?;KV62;MC23;DS36;ZX44;Expert;La visita alla tomba KV62 è soggetta ad un prezzo specifico che può variare a seconda della stagione.;
23;it;Quante opere e mobili conteneva la tomba di Tutankhamon ?;2.099;1.245;3.627;4.830;Expert;La camera del tesoro conteneva modelli di navi, numerose statue e due mummie di feti.;
24;it;Quale nome porta il copricapo più emblematico dei faraoni ?;Nemes;Pakol;Causia;Kippa;Expert;Il nemes è un copricapo in tessuto, abbastanza complesso, composto da più parti.;
25;it;Quale dea protettrice del faraone si trova sulla maschera di Tutankhamon ?;Nekhbet;Kekou;Miysis;Hathor;Expert;Nel suo ruolo di protettrice del faraone, Nekhbet è associata alla dea cobra Ouadjet, simbolo del Basso Egitto.;https://it.wikipedia.org/wiki/Nekhbet
26;it;Quale minerale veniva spesso utilizzato per i gioielli funerari tra gli egiziani ?;Ametista;Zircone;Granato;Opale;Expert;Il colore dell'ametista rimane stabile solo fino a 250 ° C. Oltre a ciò, la maggior parte delle ametiste scolorirà.;
27;it;Di cosa sono incrostati gli occhi della famosa maschera di Tutankhamon ?;Lapislazzuli;Agata;Topaz;Turchese;Expert;Il lapislazzuli è meglio conosciuto come pietra ornamentale, opaca, di colore blu.;https://it.wikipedia.org/wiki/Lapislazzuli
28;it;Quale minerale ha permesso agli egiziani di disidratare i tessuti umani ?;Natron;Nickel;Litio;Bismuto;Expert;Gli egizi hanno osservato la somiglianza nella materia tra il natron purificato, riscaldato ed essiccato e la parte solubile in acqua.;https://it.wikipedia.org/wiki/Natron
29;it;Cosa abbiamo fatto scivolare sotto i volti delle mummie per ripristinare la loro forma ?;Argilla;Gesso;Ocra;Carbone;Expert;Una mummia è un cadavere che è stato preservato dalla distruzione e dalla decomposizione.;https://it.wikipedia.org/wiki/Mummia
30;it;Di quale malattia infettiva era portatrice la mummia di Tutankhamon ?;Malaria;Morbillo;Tubercolosi;Malaria;Expert;Quattro delle mummie incluse nello studio, compresa quella di Tutankhamon, sono portatrici di parassiti della malaria.;
1;nl;In welke stad is het gouden masker van de kist van Toetanchamon te zien ?;Caïro;Luxor;Boulaq;Alexandrië;Débutant;Het Egyptisch Museum in Caïro is een van de grootste musea die geheel gewijd is aan de Egyptische Oudheid.;
2;nl;Welk beroep deed Howard Carter, zoon van dierenschilder Samuel John Carter ?;Archeoloog;Fysicus;Journalist;Decorateur;Débutant;Howard Carter is vooral bekend omdat hij in 1922 het graf van Toetanchamon heeft ontdekt.;https://nl.wikipedia.org/wiki/Howard_Carter
3;nl;Hoeveel sarcofagen hebben de mummie van Toetanchamon beschermd ?;Drie;Twee;Vier;Vijf;Débutant;Aan het einde van de zeventig dagen zal Toetanchamon worden begraven, volgens de koninklijke begrafenisrituelen.;
4;nl;Van welk materiaal is het dodenmasker van Toetanchamon gemaakt ?;Goud;Brons;Gips;Geld;Débutant;Over het gezicht van Toetanchamon is een fijn gouden masker gevouwen waarvan de trekken doen denken aan het gezicht van koningin Tiyi.;
5;nl;Welk kostbaar materiaal riep de zonnegod op voor de Egyptenaren ?;Goud;Platina;Titanium;Palladium;Débutant;In de Egyptische mythologie is Ra (of Ra) de god van de zonneschijf en de schepper van het universum.;
6;nl;Wat is het grootste museum gewijd aan de beschaving van het oude Egypte ?;Cairo Museum;Gizeh-museum;Fayoum-museum;Banha Museum;Débutant;Het Cairo Museum ontving in de XX \u003csup\u003e e \u003c/sup\u003e eeuw meer dan honderd miljoen bezoekers.;
7;nl;Waar is de buitenste sarcofaag van die de mummie van Toetanchamon beschermt ?;Hout;IJzer;Rots;Papyrus;Débutant;Het graf van Toetanchamon zou twee keer zijn bezocht door grafrovers.;
8;nl;Met welke techniek openden de Egyptenaren de ondergrondse wereld voor de ziel ?;Balsemen;Dissectie;Crematie;Opknoping;Débutant;In het oude Egypte worden balsemers ook wel taricheutes genoemd, wat betekent geconserveerd vlees, gebalsemd lichaam.;https://nl.wikipedia.org/wiki/Balseming
9;nl;Welke verblijfplaats was in het oude Egypte essentieel voor het eeuwige leven ?;Sarcofaag;Baptisterium;Mausoleum;Colombarium;Débutant;Meestal in steen gehouwen en boven de grond geplaatst, wordt de sarcofaag soms begraven.;https://nl.wikipedia.org/wiki/Sarcofaag
10;nl;In welke vallei werd het graf van farao Toetanchamon ontdekt ?;Vallei der Koningen;Vallei van de Prinsen;Vallei van de hertogen;Vallei der goden;Débutant;De Vallei der Koningen is een regio van Egypte gelegen op de westelijke oever van de Nijl ter hoogte van Thebe (nu Luxor).;
11;nl;Wat is het gewicht van het massief gouden grafmasker uit de kist van Toetanchamon ?;11 kg;8 kg;5 kg;2 kg;Confirmé;Deze sculptuur, ontdekt in 1925, is een waar meesterwerk van de Egyptische goudsmid.;
12;nl;Welk dier weert vijanden af met zijn adem op het masker van Toetanchamon ?;Cobra;Paard;Draak;Schorpioen;Confirmé;In de Egyptische mythologie is Wadjet een beschermende cobra-godin van Beneden-Egypte.;
13;nl;Wat symboliseert de valse baard van het begrafenismasker van Toetanchamon ?;Onsterfelijkheid;Vermogen;Glorie;Nageslacht;Confirmé;In het oude Egypte is de valse baard een van de attributen die de farao deelt met de goden.;https://nl.wikipedia.org/wiki/Valse_baard
14;nl;Welk kostbaar materiaal symboliseert de beenderen van de overleden farao ?;Geld;Goud;Platina;Brons;Confirmé;De tentoonstellingen die aan Toetanchamon zijn gewijd, kennen zeer regelmatig aanzienlijk succes bij de bevolking.;
15;nl;Welke beschermheer financierde Howard Carter's opgraving van het graf van Toetanchamon ?;Heer Carnarvon;Thomas Young;Harry Burton;Geoffrey Martin;Confirmé;Lord Carnarvon trouwde in 1895 met de zeer rijke Almina Wombwell, natuurlijke dochter van de bankier Alfred de Rothschild.;
16;nl;Wie was er voor het eerst gereserveerd voor balsemen onder het Oud-Egyptische rijk ?;Aan de farao's;Aan de schriftgeleerden;Aan priesters;Aan dieren;Confirmé;Balsemen verwijst naar alle technieken die gericht zijn op het behoud van de lichamen van dode mensen.;https://nl.wikipedia.org/wiki/Balseming
17;nl;Hoeveel treden gaan er naar beneden naar de voordeur van de tombe van Toetanchamon ?;Zestien;Dertig;Vier;Vijftig;Confirmé;Van daaruit leidt een gang naar een deur die de ingang van de eerste kamer sluit, door Carter de antichambre genoemd.;
18;nl;Hoe heette de eerste kamer in het graf van Toetanchamon ?;Voorkamer;Vestibule;Reserveren;Slaapzaal;Confirmé;Toen het werd ontdekt, bevatte de voorkamer meer dan 700 op elkaar gestapelde kamers.;
19;nl;Hoe was de mummie van Toetanchamon bijna verkoold ?;Zalven;Lijdt;Natron;Brons;Confirmé;Het is inderdaad door de zalven die tijdens de begrafenis werden gegoten dat de mummie bijna verkoold was.;
20;nl;Hoeveel dochters die vroegtijdig stierven zouden farao Toetanchamon hebben gehad ?;Twee;Drie;Vier;Vijf;Confirmé;Onderzoek van hun mummies in 2011 onthulde dat een van de foetussen stierf na vijf of zes maanden zwangerschap.;
21;nl;Wie ontdekte het graf van Toetanchamon in 1922 ?;Howard Carter;Somers Clarke;Henry Salt;Alfred Lucas;Expert;In 1924 deed hij veel interviews in de Verenigde Staten, waar hij als een echte ster werd gezien.;https://nl.wikipedia.org/wiki/Howard_Carter
22;nl;Welke Egyptische aanduiding wordt gebruikt voor het graf van Toetanchamon ?;KV62;MC23;DS36;ZX44;Expert;Het bezoek aan de tombe van KV62 is onderworpen aan een specifieke prijs die kan variëren afhankelijk van het seizoen.;
23;nl;Hoeveel werken en meubels bevatte het graf van Toetanchamon ?;2.099;1.245;3627;4830;Expert;De schatkamer bevatte scheepsmodellen, talrijke standbeelden en twee mummies van foetussen.;
24;nl;Welke naam draagt de meest karakteristieke hoofdtooi van de farao's ?;Nemes;Pakol;Causia;Kippa;Expert;De nemes is een hoofdbedekking van stof, vrij complex, en bestaat uit verschillende delen.;
25;nl;Welke beschermende godin van de farao wordt gevonden op het masker van Toetanchamon ?;Nekhbet;Kekou;Miysis;Hathor;Expert;In haar rol van beschermer van de farao wordt Nekhbet geassocieerd met de cobra-godin Ouadjet, symbool van Beneden-Egypte.;https://nl.wikipedia.org/wiki/Nechbet
26;nl;Welk mineraal werd onder de Egyptenaren vaak gebruikt voor grafsieraden ?;Amethist;Zirkoon;Granaat;Opaal;Expert;De kleur van amethist blijft alleen stabiel tot 250 ° C. Verder zullen de meeste amethisten verkleuren.;
27;nl;Wat zijn de ogen van het beroemde masker van Toetanchamon ?;Lapis-lazuli;Agaat;Topaas;Turkoois;Expert;Lapis lazuli is vooral bekend als siersteen, ondoorzichtig, blauw van kleur.;https://nl.wikipedia.org/wiki/Lapis lazuli
28;nl;Met welk mineraal konden de Egyptenaren menselijk weefsel uitdrogen ?;Natron;Nikkel;Lithium;Bismut;Expert;De Egyptenaren zagen de gelijkenis in materie tussen de gezuiverde, verwarmde en gedroogde natron en het in water oplosbare deel.;https://nl.wikipedia.org/wiki/Natron
29;nl;Wat hebben we onder de gezichten van de mummies geglipt om hun vorm te herstellen ?;Klei;Gips;Oker;Steenkool;Expert;Een mummie is een lijk dat bewaard is gebleven voor vernietiging en verval.;https://nl.wikipedia.org/wiki/Mummie
30;nl;Van welke infectieziekte was de mummie van Toetanchamon drager ?;Malaria;Mazelen;Tuberculose;Malaria;Expert;Vier van de mummies in de studie, waaronder die van Toetanchamon, zijn drager van malariaparasieten.;
