1;fr;De quelle espèce animale font partie les fourmis, de l'ordre des hyménoptères ?;Insectes;Mammifères;Poissons;Invertébrés;Débutant;Certaines espèces de fourmis forment des supercolonies à plusieurs centaines de millions d'individus et à plus de 50 colonies.;https://fr.wikipedia.org/wiki/Fourmi
2;fr;Quel habitat des fourmis est généralement conçu par construction de dômes ?;Fourmilière;Nid;Cage;Niche;Débutant;La fourmilière a pour but de protéger la ou les reines et de garantir à la colonie une sécurité et un abri face aux intempéries.;https://fr.wikipedia.org/wiki/Fourmilière
3;fr;Dans quel film d'animation, sorti des studios Pixar, Tilt est-il un ouvrier fourmi ?;« 1001 pattes »;« Toy Story »;« Monstres et Cie »;« Ratatouille »;Débutant;Woody, le cow-boy héros du film d'animation « Toy Story », est apparu dans le bêtisier du générique de fin.;https://fr.wikipedia.org/wiki/1001_pattes
4;fr;Quels insectes sont parfois appelés « fourmis blanches » au sein de colonies hiérarchisées ?;Les termites;Les blattes;Les cafards;Les cancrelats;Débutant;Les termites se rencontrent surtout dans les pays chauds, où certaines espèces construisent de grands nids en terre mâchée.;https://fr.wikipedia.org/wiki/Termite
5;fr;Avec l'Antarctique, quelle région du monde n'est pas colonisée par les fourmis ?;Le Groenland;L'Afrique du Sud;La Russie;Le Japon;Débutant;En 2013, plus de 12 000 espèces ont été répertoriées, mais il en reste probablement des milliers encore à découvrir.;https://fr.wikipedia.org/wiki/Fourmi
6;fr;Au sein d'une colonie de fourmis, qui pond les oeufs dans la fourmilière ?;La reine;L'ouvrière;La guerrière;La tisserande;Débutant;Certaines espèces de fourmis peuvent tolérer plusieurs reines lorsque la colonie est conséquente.;https://fr.wikipedia.org/wiki/Fourmi
7;fr;Avec quoi les fourmis sentent-elles le repérage de pistes olfactives ?;Leurs antennes;Leurs pattes;Leur abdomen;Leur queue;Débutant;Les fourmis peuvent aussi détecter à quel groupe de travail (par exemple la recherche de nourriture) l'une ou l'autre appartient.;https://fr.wikipedia.org/wiki/Fourmi
8;fr;Avec quel autre insecte la fourmi partage-t-elle une célèbre fable de Jean de La Fontaine ?;La cigale;La mouche;La coccinelle;La libellule;Débutant;« La Cigale et la Fourmi » est la première fable du livre I de Jean de La Fontaine située dans le premier recueil des « Fables de La Fontaine ».;https://fr.wikipedia.org/wiki/La_Cigale_et_la_Fourmi_(La_Fontaine)
9;fr;Laquelle de ces méthodes semble radicale pour tenir éloigné les fourmis de son habitation ?;Le vinaigre;Le sucre;Le miel;Le riz;Débutant;Certaines odeurs fortes ont une action répulsive sur les fourmis, comme c'est notamment le cas du jus de citron et du vinaigre.;https://fr.wikipedia.org/wiki/Fourmi
10;fr;Quel film du studio Dreamworks sorti en 1998 relate la vie des fourmis ?;« Fourmiz »;« Chicken Run »;« Shrek »;« Madagascar »;Débutant;Seulement un mois après la sortie du film fut proposé le film d'animation « 1001 pattes » du « concurrent historique » Pixar.;https://fr.wikipedia.org/wiki/Fourmiz
11;fr;Quel écrivain français né à Toulouse a publié une célèbre trilogie sur les fourmis ?;Bernard Werber;Gaston Boca;Robert Merle;Alain Grousset;Confirmé;Son oeuvre, traduite dans une trentaine de langues, fait se rencontrer spiritualité, science-fiction, polar, biologie et mythologie.;https://fr.wikipedia.org/wiki/Bernard_Werber
12;fr;Quel terme est utilisé pour désigner une colonie de fourmis formées de plusieurs reines ?;Supercolonie;Métapopulation;Écotype;Épifaune;Confirmé;Les ouvrières s'y déplacent librement de nids en nids, comme si la population entière était une unique colonie.;https://fr.wikipedia.org/wiki/Supercolonie
13;fr;Chez les fourmis, comment appelle-t-on les femelles aptères et stériles ?;Ouvrières;Guerrières;Reines;Nettoyeuses;Confirmé;Les différences morphologiques majeures entre les castes d'ouvrières sont induites par le régime alimentaire au stade larvaire.;https://fr.wikipedia.org/wiki/Fourmi
14;fr;Quel sexe aura obligatoirement une fourmi si son oeuf a la chance d'être fécondé ?;Femelle;Mâle;Mâle ou femelle;On ne sait pas;Confirmé;Si l'oeuf est fécondé, l'individu est alors diploïde et l'oeuf donnera une femelle; s'il ne l'est pas, l'individu est haploïde et forme un mâle.;https://fr.wikipedia.org/wiki/Fourmi
15;fr;Quelles fourmis, pourtant parfois de petite taille, font leurs nids en creusant le bois ?;Charpentières;Pot-de-miel;Moissonneuses;Tisserandes;Confirmé;Les ouvrières varient en taille et certaines d'entre elles comptent parmi les plus grandes espèces d'Europe.;https://fr.wikipedia.org/wiki/Fourmi
16;fr;Comment sont parfois appelées les ouvrières géantes au sein d'une colonie de fourmis ?;Soldats;Ouvrières;Guêpes;Pondeuses;Confirmé;Les plus grandes ouvrières sont parfois appelées « soldats », bien que leur rôle défensif ne soit pas nécessairement prépondérant.;https://fr.wikipedia.org/wiki/Fourmi
17;fr;Quelles fourmis à l'abdomen gonflé deviennent des mets délicieux en Australie ?;Pot-de-miel;Tisserandes;Charpentières;Moissonneuses;Confirmé;Ces fourmis servent de réservoir vivant aux autres fourmis de la colonie qui viennent leur donner le miellat.;https://fr.wikipedia.org/wiki/Fourmi_pot-de-miel
18;fr;Quels produits chimiques sont utilisés pour faciliter la communication entre les fourmis ?;Les phéromones;Les neurotoxiques;Les biocides;Les glucides;Confirmé;Les phéromones agissent comme des messagers et jouent notamment un rôle dans l'attraction sexuelle.;https://fr.wikipedia.org/wiki/Phéromone
19;fr;Quelles fourmis sont chargées d'éliminer les cadavres du nid ?;Les nettoyeuses;Les guérisseuses;Les ouvrières;Les guerrières;Confirmé;Les nettoyeuses sont souvent des ouvrières en fin de vie ou des individus qui restent dans les endroits consacrés aux déchets.;https://fr.wikipedia.org/wiki/Fourmi
20;fr;Quel prédateur est également nommé le fourmilier géant ou grand fourmilier ?;Le tamanoir;Le hurleur;Le ragondin;Le saphir;Confirmé;Le tamanoir est surtout terrestre, contrairement à d'autres fourmiliers ou paresseux, qui sont arboricoles ou semi-arboricole.;https://fr.wikipedia.org/wiki/Tamanoir
21;fr;Environ combien d'espèces de fourmis ont été répertoriées en 2013 ?;12 600;10 500;8 400;6 700;Expert;Bien que les fourmis représentent moins d'un pour cent des espèces d'insectes, leur masse totale excède le poids de l'humanité.;https://fr.wikipedia.org/wiki/Fourmi
22;fr;Comment sont appelées les espèces de fourmis possédant une seule reine ?;Monogynes;Phytozoaires;Zoophytes;Euryapsides;Expert;Ce terme est également applicable chez les abeilles, les guêpes, les termites et rats-taupes nus.;https://fr.wikipedia.org/wiki/Monogyne
23;fr;Environ combien d'espèces de fourmis sont connues en Europe ?;400;4 000;40 000;400 000;Expert;En forêt tropicale en Malaisie, on peut compter jusqu'à 40 espèces différentes sur un seul mètre carré.;https://fr.wikipedia.org/wiki/Fourmi
24;fr;La piqûre répétée de quelle fourmi peut être mortelle pour l'homme ?;Bulldog;Veuve noire;Tigre;Taïpan;Expert;Même si les attaques sur l'être humain sont plutôt rares, les piqûres peuvent être mortelles en raison d'un possible choc anaphylactique.;https://fr.wikipedia.org/wiki/Fourmi
25;fr;Jusqu'à quelle profondeur a-t-on retrouvé des fourmis en Asie du Sud-Est ?;22 km;18 km;14 km;10 km;Expert;Les fourmis se sont adaptées à presque tous les milieux terrestres et souterrains mais pas aux milieux aquatiques et aux zones polaires.;https://fr.wikipedia.org/wiki/Fourmi
26;fr;Quel est le record de longévité détenu par une reine chez la fourmi noire des jardins ?;28 ans;25 ans;22 ans;19 ans;Expert;Les mâles ont une vie très brève et, ne sachant pas s'alimenter seuls, ils meurent dès qu'ils se sont reproduits.;https://fr.wikipedia.org/wiki/Fourmi
27;fr;Quel pourcentage des espèces de fourmis recensées dans le monde vivent sans reine ?;1 %;11 %;21 %;31 %;Expert;Ces fourmis vivent au sein de colonies très réduites dans lesquelles certaines ouvrières se reproduisent.;https://fr.wikipedia.org/wiki/Fourmi
28;fr;Quel terme utilise-t-on généralement pour désigner les sons émis par les fourmis ?;Stridulations;Percussions;Bourdonnements;Déformations;Expert;La stridulation permet d'émettre une large gamme de signaux sonores (sélection sexuelle, territorialité, etc...).;https://fr.wikipedia.org/wiki/Stridulation
29;fr;À combien de milliards d'individus estime-t-on le nombre de fourmis sur Terre ?;10 millions;7 millions;4 millions;1 million;Expert;Les fourmis représenteraient 1 à 2 % du nombre d'espèces d'insectes, mais constitueraient près de 20 % de leur biomasse.;https://fr.wikipedia.org/wiki/Fourmi
30;fr;Quel mammifère insectivore recouvert d'écailles est un prédateur pour les fourmis ?;Pangolin;Ragondin;Saphir;Tamanoir;Expert;Les pangolins peuplent les forêts et les savanes des régions tropicales et équatoriales d'Afrique et d'Asie du Sud-Est.;https://fr.wikipedia.org/wiki/Pangolin
