5;es;¿Qué fenómeno importante proporciona la abeja alimentándose ?;Polinización;Germinación;Esporulacion;Introgresión;Débutant;Las plantas contribuyen a la dieta de los polinizadores al proporcionarles un exceso de polen o néctar.;https://es.wikipedia.org/wiki/Polinización
6;es;¿Cuál de estos no es un producto de abeja ?;Mantequilla;Miel;Cera;Jalea;Débutant;Estos productos se almacenan en galerías para especies solitarias, conjuntos complejos para especies sociales.;https://es.wikipedia.org/wiki/Anthophila
7;es;¿Quién es el único individuo femenino fértil en una colonia de abejas ?;Reina;Trabajador;Avispa;Avispón;Débutant;La reina, con un abdomen más alargado, suele ser la madre de la mayoría, si no todas, las abejas en la colmena.;https://es.wikipedia.org/wiki/Abeja_reina
8;es;¿Qué abeja melífera es el producto de la eclosión de un huevo no fertilizado ?;Falso drone;Insecto palo;Garrapata;Escarabajo;Débutant;A diferencia de la abeja trabajadora, el dron no tiene aguijón y no cosecha néctar ni polen.;https://es.wikipedia.org/wiki/Abeja_zángano
9;es;¿Qué pequeña abeja deleitó a los niños en la televisión en la década de 1980 ?;Maya;Heidi;Tao Tao;Zigby;Débutant;Maya descubre el mundo en compañía de sus amigos Willy, la abeja, Flip the grasshopper, Max the earthworm y Alexander the mouse.;
10;es;¿Cuántas especies de abejas se enumeran hasta la fecha en el planeta ?;20,000;15,000;10,000;5,000;Débutant;Las abejas se pueden clasificar según su forma de vida: abejas domésticas, salvajes, solitarias o sociales.;https://es.wikipedia.org/wiki/Anthophila
11;es;¿Qué nombre se le da a un grupo de abejas que viven en la sociedad ?;Colonia;Ecotype;Nicho;Gremio;Confirmé;En biología, una colonia es un grupo de organismos vivos de la misma especie reunidos de acuerdo con una forma particular de vida.;https://es.wikipedia.org/wiki/Colonia_(biología)
12;es;¿Qué especie de abeja es probablemente la más conocida en Europa ?;Apis mellifera;Apis cerana;Apis florea;Apis dorsata;Confirmé;Semi-doméstico, el nombre de género Apis es el término latino para abeja, y mellifera significa que da miel.;https://es.wikipedia.org/wiki/Anthophila
13;es;¿Cuál es el promedio de vida de una abeja durante los meses de verano ?;Un mes;Dos meses;Tres meses;Cuatro meses;Confirmé;Al alimentarse del néctar de las flores, una abeja puede vivir hasta diez meses en invierno y solo un mes en verano.;https://es.wikipedia.org/wiki/Anthophila
14;es;¿Qué expresión denota una especie de abeja que vive en una colonia ?;Abeja social;Abeja parásita;Abeja solitaria;Miel de abeja;Confirmé;Otras especies son las abejas parásitas o las cuclillas que practican el cleptoparasitismo.;https://es.wikipedia.org/wiki/Anthophila
15;es;¿De qué se alimenta exclusivamente la larva de una futura abeja reina ?;Jalea real;Insectos;Sal;Sedimentos;Confirmé;La jalea real es el producto de secreción de las abejas obreras, entre el quinto y el decimocuarto día de su existencia.;
16;es;¿Cómo se llama una gran reunión de abejas ?;Enjambre;Cluster;Abrigo;Bolsa;Confirmé;El fenómeno conocido como sin nubes no tiene un origen meteorológico directo, pero es estacional y está relacionado con episodios de sequía.;https://es.wikipedia.org/wiki/Enjambre
17;es;¿Qué abeja es la gran favorita de la apicultura en Europa ?;Abeja negra;Abeja roja;Abeja azul;Abeja blanca;Confirmé;Su rango original se extendía desde el oeste de Rusia hasta el norte de Europa y posiblemente la Península Ibérica.;https://es.wikipedia.org/wiki/Apis_mellifera_mellifera
18;es;¿Qué sucede cuando una abeja usa su picadura con muesca para picar ?;Ella muere;Ella duerme;Se hincha;Ella bebe;Confirmé;La picadura involucra parte de los órganos internos de la abeja, incluido su saco de veneno, que casi siempre es fatal para la abeja.;https://es.wikipedia.org/wiki/Anthophila
19;es;¿Cómo llamas a todas las colmenas de un apicultor ?;Colmenar;Colonia;Enjambre;Cluster;Confirmé;La ubicación de los colmenares se realiza en particular de acuerdo con el entorno y la exposición (preferiblemente al sur o sureste).;https://es.wikipedia.org/wiki/Apiario
20;es;¿Qué película animada cuenta la vida de una abeja recién graduada ?;« Bee Movie »;« Rosa »;« Happy Feet »;« Le Lorax »;Confirmé;Esta película animada en gráficos de computadora lanzada en 2007 fue escrita y producida por Jerry Seinfeld para DreamWorks SKG.;
21;es;¿En qué resina se encontraron los fósiles de abejas más antiguos ?;Ámbar;Turquesa;Chorro;Ópalo;Expert;El fósil más antiguo hasta la fecha es Melittosphex burmensis, fechado hace 100 millones de años y descubierto en 2006 en Birmania.;https://es.wikipedia.org/wiki/Ámbar
22;es;¿En cuántas castas consiste una colonia de abejas ?;Tres;Cuatro;Cinco;Seis;Expert;La reina, la única mujer fértil del grupo, una mayoría de trabajadores y hombres (o zánganos) que fertilizan a las futuras reinas.;https://es.wikipedia.org/wiki/Anthophila
23;es;¿Qué abejas usan galerías excavadas en el bosque ?;Xylicoles;Rubicoles;Horticultura;Bodegas;Expert;Un xilófago es un organismo vivo cuya dieta consiste principalmente en albura, pero también en madera perfecta.;
24;es;¿Cuántos huevos puede poner la abeja reina aproximadamente en un año ?;400,000;300,000;200,000;100,000;Expert;Cuando su espermateca comienza a vaciarse, ya no puede poner huevos de trabajadores y su distribución de feromonas cambia.;https://es.wikipedia.org/wiki/Abeja_reina
25;es;¿Qué proceso produce una nueva reina madre para la colmena ?;Remage;Reinage;Posarse;Restauracion;Expert;Luego, la colonia comienza el peligroso proceso de alimentar a varias ninfas de jalea real, y la supervivencia de la colonia depende de ella.;https://es.wikipedia.org/wiki/Abeja_reina
26;es;¿En qué maternidad de la colmena se desarrollan las futuras abejas ?;Couvain;Vaso de precipitados;Dormitorio;Levante;Expert;Generalmente se encuentra en el centro de la colmena y está rodeada de panales y polen (pan de abeja) para alimentarlo.;
27;es;¿Cómo evitan las abejas crear un organismo sofocante ?;Enjambre;Remage;Polinización;Posarse;Expert;Este fenómeno ocurre cuando una parte de las abejas abandona la colmena con una reina (el enjambre) para formar una nueva colonia.;
28;es;¿Cuál es la práctica de tratar con productos de abejas ?;Apiterapia;Oligoterapia;Fitoterapia;Ayurveda;Expert;La apiterapia sugiere usar las supuestas propiedades de la miel, el propóleos, el veneno de abeja, la jalea real y el polen.;https://es.wikipedia.org/wiki/Reload this page
29;es;¿Qué shock puede causar una picadura de abeja a los humanos ?;Anafiláctico;Perforin;Antígeno;Macrófagos;Expert;Es una manifestación de hipersensibilidad inmediata debido a la liberación de mediadores vasoactivos en un sujeto sensibilizado.;
30;es;¿Qué ha reemplazado a las abejas imperiales de Napoleón Bonaparte ?;Flor de lirio;Miosotis;Arándano;Trébol;Expert;La flor de lis dorada en el campo azul se convirtió en los brazos de Francia y en el emblema específico de los reyes de Francia.;https://es.wikipedia.org/wiki/Flor_de_lis
1;it;Come si chiama una persona che alleva api da miele ?;Apicoltore;Coltivatore di ostriche;Allevatore avicolo;Raniculteur;Débutant;Praticata in tutti i continenti, questa attività differisce in base alle varietà di api, al clima e allo sviluppo economico.;
2;it;Quale succo secreto mangia la maggior parte delle api ?;Nettare;Cerchi;Bud;Lodge;Débutant;Questa sostanza possiede, per il suo gusto o odore, un potere di attrazione sugli insetti e su alcuni uccelli.;https://it.wikipedia.org/wiki/Nettare_(botanica)
3;it;Con quale altro insetto più aggressivo viene spesso confusa l'ape ?;Vespa;Calabrone;Tafano;Bumblebee;Débutant;La vespa è generalmente un insetto con un addome giallo striato di nero e la cui femmina porta un pungiglione velenoso.;https://it.wikipedia.org/wiki/Reload this page
4;it;Cosa fanno le api che volano da un fiore all'altro in cerca di cibo ?;Stanno foraggiando;Ruminano;Pattinano;Disegnano;Débutant;L'ape raccoglie in natura nettare, propoli, melata e polline.;https://it.wikipedia.org/wiki/Anthophila
5;it;Quale importante fenomeno fornisce l'ape foraggiando ?;Impollinazione;Germinazione;Sporulazione;Introgressione;Débutant;Le piante contribuiscono alla dieta degli impollinatori fornendo loro polline o nettare in eccesso.;https://it.wikipedia.org/wiki/Impollinazione
6;it;Quale di questi non è un prodotto delle api ?;Burro;Miele;Cera;Gelatina;Débutant;Questi prodotti sono immagazzinati in gallerie per specie solitarie, complessi complessi per specie sociali.;https://it.wikipedia.org/wiki/Anthophila
7;it;Chi è l'unica femmina fertile in una colonia di api ?;Regina;Lavoratore;Vespa;Calabrone;Débutant;La regina, con un addome più lungo, di solito è la madre della maggior parte, se non di tutte, le api nell'alveare.;https://it.wikipedia.org/wiki/Ape_regina
8;it;Quale ape da miele è il prodotto della schiusa di un uovo non fertilizzato ?;Falso drone;Insetto stecco;Spuntare;Scarabeo;Débutant;A differenza dell'ape operaia, il drone non ha pungiglione e non raccoglie nettare o polline.;https://it.wikipedia.org/wiki/Fuco
9;it;Quale piccola ape ha deliziato i bambini in televisione negli anni '80 ?;Maya;Heidi;Tao Tao;Zigby;Débutant;Maya scopre il mondo in compagnia dei suoi amici Willy l'ape, Capovolgi la cavalletta, Max il lombrico e Alessandro il topo.;
10;it;Quante specie di api sono elencate fino ad oggi sul pianeta ?;20.000;15.000;10.000;5.000;Débutant;Le api possono essere classificate in base al loro stile di vita: api domestiche, selvatiche, solitarie o sociali.;https://it.wikipedia.org/wiki/Anthophila
11;it;Quale nome viene dato a un gruppo di api che vivono nella società ?;Colonia;Ecotipo;Nicchia;Gilda;Confirmé;In biologia, una colonia è un gruppo di organismi viventi della stessa specie riuniti secondo un particolare stile di vita.;https://it.wikipedia.org/wiki/Colonia_(zoologia)
12;it;Quale specie di api è probabilmente la più conosciuta in Europa ?;Apis mellifera;Apis cerana;Apis florea;Apis dorsata;Confirmé;Semi-domestico, il genere Apis è il termine latino per ape, e mellifera significa che dà miele.;https://it.wikipedia.org/wiki/Anthophila
13;it;Qual è la durata media di un'ape durante i mesi estivi ?;Un mese;Due mesi;Tre mesi;Quattro mesi;Confirmé;Nutrendosi del nettare dei fiori, un'ape può vivere fino a dieci mesi in inverno e solo un mese in estate.;https://it.wikipedia.org/wiki/Anthophila
14;it;Quale espressione indica una specie di ape che vive in una colonia ?;Ape sociale;Ape parassita;Ape solitaria;Ape da miele;Confirmé;Altre specie sono api parassite o api a cucù che praticano il cleptoparassitismo.;https://it.wikipedia.org/wiki/Anthophila
15;it;Di cosa si nutre esclusivamente la larva di una futura ape regina ?;Pappa reale;Insetti;Sale;Sedimenti;Confirmé;La pappa reale è il prodotto della secrezione delle api operaie, tra il quinto e il quattordicesimo giorno della loro esistenza.;
16;it;Come si chiama un grande raduno di api ?;Sciame;Cluster;Cappotto;Borsa;Confirmé;Il fenomeno noto come senza nuvole non ha un'origine meteorologica diretta ma è stagionale e legato a episodi di siccità.;
17;it;Quale ape è la favorita dell'apicoltura in Europa ?;Ape nera;Ape rossa;Ape blu;Ape bianca;Confirmé;La sua area di distribuzione originale si estendeva dalla Russia occidentale al nord Europa e probabilmente alla penisola iberica.;https://it.wikipedia.org/wiki/Apis_mellifera_mellifera
18;it;Cosa succede quando un'ape usa la sua puntura dentellata per pungere ?;Lei muore;Lei dorme;Si gonfia;Beve;Confirmé;La puntura coinvolge parte degli organi interni dell'ape, incluso il suo sacco velenoso, che è quasi sempre fatale per l'ape.;https://it.wikipedia.org/wiki/Anthophila
19;it;Come si chiama tutti gli alveari di un apicoltore ?;Apiario;Colonia;Sciame;Cluster;Confirmé;La posizione degli apiari è determinata in particolare dall'ambiente e dall'esposizione (preferibilmente a sud o sud-est).;https://it.wikipedia.org/wiki/Apiario
20;it;Quale film d'animazione racconta la vita di un'ape appena laureata ?;« Bee Movie »;« Rosa »;« Happy Feet »;« Le Lorax »;Confirmé;Questo film d'animazione in computer grafica uscito nel 2007 è stato scritto e prodotto da Jerry Seinfeld per DreamWorks SKG.;
21;it;In quale resina sono stati trovati i più antichi fossili di api ?;Ambra;Turchese;Jet;Opale;Expert;Il fossile più antico fino ad oggi è il Melittosphex burmensis, risalente a 100 milioni di anni fa e scoperto nel 2006 in Birmania.;https://it.wikipedia.org/wiki/Ambra (resina)
22;it;In quante caste è composta una colonia di api ?;Tre;Quattro;Cinque;Sei;Expert;La regina, l'unica donna fertile nel gruppo, la maggioranza di operai e maschi (o droni) che fertilizzano le future regine.;https://it.wikipedia.org/wiki/Anthophila
23;it;Quali api usano le gallerie scavate nel bosco ?;Xylicole;Rubicole;Orticola;Cantine;Expert;Uno xilofago è un organismo vivente la cui dieta consiste principalmente di alburno, ma anche di legno perfetto.;https://it.wikipedia.org/wiki/Xilofago
24;it;Quante uova può depositare l'ape regina in circa un anno ?;400.000;300.000;200.000;100.000;Expert;Quando la sua spermatheca inizia a svuotarsi, non può più deporre le uova dei lavoratori e la sua distribuzione dei feromoni cambia.;https://it.wikipedia.org/wiki/Ape_regina
25;it;Quale processo produce una nuova madre regina per l'alveare ?;Remage;Reinage;Appollaiarsi;Restauro;Expert;La colonia inizia quindi il pericoloso processo di alimentazione di diverse ninfe di pappa reale, la sopravvivenza della colonia dipende da essa.;https://it.wikipedia.org/wiki/Ape_regina
26;it;In quale maternità dell'alveare si sviluppano le api future ?;Couvain;Becher;Dormitorio;Levante;Expert;Si trova generalmente al centro dell'alveare ed è circondato da favi e polline (pane d'api) per nutrirlo.;
27;it;Come possono le api evitare di creare un organismo soffocante ?;Sciamare;Remage;Impollinazione;Appollaiarsi;Expert;Questo fenomeno si verifica quando una parte delle api lascia l'alveare con una regina (lo sciame) per formare una nuova colonia.;https://it.wikipedia.org/wiki/Sciamatura (ape)
28;it;Qual è la pratica del trattamento con i prodotti delle api ?;Apiterapia;oligoterapia;Fitoterapia;Ayurveda;Expert;L'apiterapia suggerisce l'uso delle presunte proprietà di miele, propoli, veleno d'api, pappa reale e polline.;https://it.wikipedia.org/wiki/Reload this page
29;it;Quale shock può provocare a volte una puntura d'ape sull'uomo ?;Anafilattico;Perforina;Antigene;Macrofagi;Expert;È una manifestazione di ipersensibilità immediata dovuta al rilascio di mediatori vasoattivi in \u200b\u200bun soggetto sensibilizzato.;
30;it;Cosa hanno sostituito le api imperiali di Napoleone Bonaparte ?;Fiore di giglio;Miosotis;Mirtillo;Trifoglio;Expert;Il giglio d'oro sul campo azzurro divenne le armi della Francia e l'emblema specifico dei re di Francia.;https://it.wikipedia.org/wiki/Giglio_(araldica)
1;nl;Hoe heet een persoon die honingbijen grootbrengt ?;Imker;Oesterboer;Pluimveehouder;Raniculteur;Débutant;Geoefend op alle continenten, deze activiteit verschilt afhankelijk van bijen rassen, klimaat en economische ontwikkeling.;https://nl.wikipedia.org/wiki/Imker
2;nl;Welk uitgescheiden sap eten de meeste bijen ?;Nectar;Cirkels;Knop;Lodge;Débutant;Deze stof heeft door zijn smaak of geur een aantrekkingskracht op zowel insecten als bepaalde vogels.;https://nl.wikipedia.org/wiki/Nectar_(plant)
3;nl;Met welk ander agressiever insect wordt de bij vaak verward ?;Wesp;Horzel;Paardevlieg;Hommel;Débutant;De wesp is een insect met over het algemeen een gele buik gestreept met zwart en het vrouwtje draagt een giftige angel.;https://nl.wikipedia.org/wiki/Reload this page
4;nl;Wat vliegen bijen van bloem tot bloem op zoek naar voedsel ?;Ze foerageren;Ze herkauwen;Ze schaatsen;Ze tekenen;Débutant;De bij oogst in de natuur nectar, propolis, honingdauw en stuifmeel.;https://nl.wikipedia.org/wiki/Bijen
5;nl;Welk belangrijk fenomeen levert de bij door te foerageren ?;Bestuiving;Kieming;Sporulatie;Introgressie;Débutant;Planten dragen bij aan het dieet van bestuivers door ze te voorzien van overtollig stuifmeel of nectar.;https://nl.wikipedia.org/wiki/Bestuiving
6;nl;Welke hiervan is geen bijenproduct ?;Boter;Honing;Was;Gelei;Débutant;Deze producten worden opgeslagen in galerijen voor solitaire soorten, complexe samenstellingen voor sociale soorten.;https://nl.wikipedia.org/wiki/Bijen
7;nl;Wie is de enige vruchtbare vrouw in een bijenkolonie ?;Koningin;Werknemer;Wesp;Horzel;Débutant;De koningin, met een meer langwerpige buik, is meestal de moeder van de meeste, zo niet alle, bijen in de korf.;
8;nl;Welke honingbij is het product van het uitkomen van een onbevrucht ei ?;Valse drone;Stick insect;Vink;Kever;Débutant;In tegenstelling tot de vrouwelijke werkbij heeft de drone geen angel en oogst hij geen nectar of stuifmeel.;https://nl.wikipedia.org/wiki/Dar
9;nl;Welke kleine bij was dol op kinderen op televisie in de jaren tachtig ?;Maya;Heidi;Tao Tao;Zigby;Débutant;Maya ontdekt de wereld in het gezelschap van haar vrienden Willy de bij, Flip de sprinkhaan, Max de regenworm en Alexander de muis.;
10;nl;Hoeveel soorten bijen worden er tot nu toe op de planeet vermeld ?;20.000;15.000;10.000;5.000;Débutant;Bijen kunnen worden ingedeeld volgens hun manier van leven: tamme, wilde, solitaire of sociale bijen.;https://nl.wikipedia.org/wiki/Bijen
11;nl;Welke naam wordt gegeven aan een groep bijen die in de samenleving leven ?;Kolonie;Ecotype;Niche;Gilde;Confirmé;In de biologie is een kolonie een groep levende organismen van dezelfde soort die samenkomen volgens een bepaalde manier van leven.;https://nl.wikipedia.org/wiki/Kolonie_(biologie)
12;nl;Welke bijensoort is waarschijnlijk de bekendste in Europa ?;Apis mellifera;Apis cerana;Apis florea;Apis dorsata;Confirmé;Semi-huiselijk, de geslachtsnaam Apis is de Latijnse term voor bij, en mellifera betekent dat het honing geeft.;https://nl.wikipedia.org/wiki/Bijen
13;nl;Wat is de gemiddelde levensduur van een bij tijdens de zomermaanden ?;Een maand;Twee maanden;Drie maanden;Vier maanden;Confirmé;Zich voedend met de nectar van bloemen, kan een bij in de winter tot tien maanden leven en in de zomer slechts één maand.;https://nl.wikipedia.org/wiki/Bijen
14;nl;Welke uitdrukking duidt een bijensoort aan die in een kolonie leeft ?;Sociale bij;Parasitaire bij;Eenzame bij;Honingbij;Confirmé;Andere soorten zijn parasitaire bijen of koekoeksbijen die cleptoparasitisme beoefenen.;https://nl.wikipedia.org/wiki/Bijen
15;nl;Wat is de larve van een toekomstige bijenkoningin die uitsluitend wordt gevoed ?;Koninklijke gelei;Insecten;Zout;Sedimenten;Confirmé;Koninginnegelei is het uitscheidingsproduct van werkbijen, tussen de vijfde en veertiende dag van hun bestaan.;
16;nl;Hoe noem je een grote verzameling bijen ?;Zwerm;Cluster;Vacht;Zak;Confirmé;Het fenomeen dat bekend staat als wolkenloos heeft geen directe meteorologische oorsprong, maar is seizoensgebonden en houdt verband met droogteperiodes.;
17;nl;Welke bij is de grote bijenteeltfavoriet in Europa ?;Zwarte bij;Rode bij;Blauwe bij;Witte bij;Confirmé;Het oorspronkelijke verspreidingsgebied strekte zich uit van West-Rusland tot Noord-Europa en waarschijnlijk tot aan het Iberisch schiereiland.;https://nl.wikipedia.org/wiki/Europese_donkere_bij
18;nl;Wat gebeurt er als een bij zijn gekerfde angel gebruikt om te steken ?;Ze sterft;Ze slaapt;Het zwelt;Ze drinkt;Confirmé;De angel heeft betrekking op een deel van de inwendige organen van de bij, inclusief de gifzak, die bijna altijd dodelijk is voor de bij.;https://nl.wikipedia.org/wiki/Bijen
19;nl;Hoe noem je alle bijenkasten van een imker ?;Bijenstal;Kolonie;Zwerm;Cluster;Confirmé;De locatie van de bijenstallen wordt met name gemaakt op basis van de omgeving en de belichting (bij voorkeur zuid of zuidoost).;https://nl.wikipedia.org/wiki/Bijenschans
20;nl;Welke animatiefilm vertelt het leven van een pas afgestudeerde bij ?;« Bee Movie »;« Rosa »;« Happy Feet »;« Le Lorax »;Confirmé;Deze in 2007 uitgebrachte animatiefilm in computergraphics is geschreven en geproduceerd door Jerry Seinfeld voor DreamWorks SKG.;
21;nl;In welke hars zijn de oudste bijenfossielen gevonden ?;Amber;Turkoois;Jet;Opaal;Expert;Het oudste fossiel tot nu toe is Melittosphex burmensis, 100 miljoen jaar geleden gedateerd en in 2006 ontdekt in Birma.;https://nl.wikipedia.org/wiki/Barnsteen
22;nl;Uit hoeveel kasten bestaat een bijenkolonie ?;Drie;Vier;Vijf;Zes;Expert;De koningin, de enige vruchtbare vrouw in de groep, een meerderheid van de arbeiders en mannen (of drones) die toekomstige koninginnen bevruchten.;https://nl.wikipedia.org/wiki/Bijen
23;nl;Welke bijen gebruiken galerijen die in het hout zijn gegraven ?;Xylicolen;Rubicoles;Tuinbouw;Wijnhuizen;Expert;Een xylofaag is een levend organisme waarvan het dieet voornamelijk uit spinthout bestaat, maar ook uit perfect hout.;https://nl.wikipedia.org/wiki/Xylofaag
24;nl;Hoeveel eieren kan de bijenkoningin ongeveer in een jaar leggen ?;400.000;300.000;200.000;100.000;Expert;Als haar spermatheca begint te legen, kan ze geen werkereieren meer leggen en verandert haar diffusie van feromonen.;
25;nl;Welk proces levert een nieuwe koningin-moeder op voor de korf ?;Remage;Reinage;Zitstokken;Restauratie;Expert;De kolonie begint dan met het gevaarlijke proces van het voeden van verschillende nimfen van koninginnengelei, het voortbestaan \u200b\u200bvan de kolonie hangt ervan af.;
26;nl;In welk moederschap van de korf ontwikkelen de toekomstige bijen zich ?;Couvain;Bekerglas;Slaapzaal;Levant;Expert;Het bevindt zich over het algemeen in het midden van de korf en is omgeven door honingraten en stuifmeel (bijenbrood) om het te voeden.;
27;nl;Hoe voorkomen bijen dat ze een verstikkend organisme creëren ?;Zwermen;Remage;Bestuiving;Zitstokken;Expert;Dit fenomeen doet zich voor wanneer een deel van de bijen de korf verlaat met een koningin (de zwerm) om een \u200b\u200bnieuwe kolonie te vormen.;
28;nl;Hoe wordt behandeld met bijenproducten ?;Apitherapie;Oligotherapie;Fytotherapie;Ayurveda;Expert;Apitherapie suggereert het gebruik van de veronderstelde eigenschappen van honing, propolis, bijengif, koninginnengelei en stuifmeel.;https://nl.wikipedia.org/wiki/Reload this page
29;nl;Welke schok kan een bijensteek soms bij mensen veroorzaken ?;Anafylactisch;Perforine;Antigeen;Macrofaag;Expert;Het is een uiting van onmiddellijke overgevoeligheid als gevolg van het vrijkomen van vasoactieve mediatoren bij een gevoelig persoon.;
30;nl;Wat heeft de keizerlijke bijen van Napoleon Bonaparte vervangen ?;Lily bloem;Myosotis;Bosbes;Klaver;Expert;De gouden fleur-de-lis op het azuurblauwe veld werd het wapen van Frankrijk en het specifieke embleem van de koningen van Frankrijk.;https://nl.wikipedia.org/wiki/Fleur_de_lis
